XP_008600297.1 nucleoporin nup107 _Beauveria bassiana ARSEF 2860_	OTHER	1.000000	0.000000	0.000000	0.000000	0.000000	0.000000	
XP_008600299.1 LIM domain-containing protein _Beauveria bassiana ARSEF 2860_	OTHER	1.000000	0.000000	0.000000	0.000000	0.000000	0.000000	
XP_008600302.1 fungal specific transcription factor _Beauveria bassiana ARSEF 2860_	OTHER	1.000000	0.000001	0.000000	0.000000	0.000000	0.000000	
XP_008600304.1 SH3 domain-containing protein _Beauveria bassiana ARSEF 2860_	OTHER	1.000000	0.000000	0.000000	0.000000	0.000000	0.000000	
XP_008600305.1 uncharacterized protein BBA_06986 _Beauveria bassiana ARSEF 2860_	OTHER	1.000000	0.000000	0.000000	0.000000	0.000000	0.000000	
XP_008600307.1 BZIP-type transcription factor _Beauveria bassiana ARSEF 2860_	OTHER	1.000000	0.000000	0.000000	0.000000	0.000000	0.000000	
XP_008600308.1 uncharacterized protein BBA_06989 _Beauveria bassiana ARSEF 2860_	SP	0.000325	0.999017	0.000162	0.000171	0.000149	0.000143	CS pos: 20-21. Pr: 0.9304
XP_008600309.1 putative response regulator receiver RIM15p _Beauveria bassiana ARSEF 2860_	OTHER	1.000000	0.000000	0.000000	0.000000	0.000000	0.000000	
XP_008600311.1 short chain dehydrogenase _Beauveria bassiana ARSEF 2860_	OTHER	1.000000	0.000000	0.000000	0.000000	0.000000	0.000000	
XP_008600312.1 ABC transporter _Beauveria bassiana ARSEF 2860_	OTHER	1.000000	0.000005	0.000000	0.000000	0.000000	0.000000	
XP_008600313.1 putative apoptosis-inducing factor _AIF_ _Beauveria bassiana ARSEF 2860_	OTHER	1.000000	0.000000	0.000000	0.000000	0.000000	0.000000	
XP_008600314.1 aerobactin siderophore biosynthesis protein iucB _Beauveria bassiana ARSEF 2860_	OTHER	1.000000	0.000000	0.000000	0.000000	0.000000	0.000000	
XP_008600316.1 AMP-binding enzyme _Beauveria bassiana ARSEF 2860_	OTHER	1.000000	0.000003	0.000000	0.000000	0.000000	0.000000	
XP_008600317.1 ATROPHIN-1 protein _Beauveria bassiana ARSEF 2860_	OTHER	1.000000	0.000003	0.000000	0.000000	0.000000	0.000000	
XP_008600318.1 uncharacterized protein BBA_06999 _Beauveria bassiana ARSEF 2860_	OTHER	1.000000	0.000009	0.000000	0.000000	0.000000	0.000000	
XP_008600319.1 PAPA-1-like region family protein _Beauveria bassiana ARSEF 2860_	OTHER	1.000000	0.000000	0.000000	0.000000	0.000000	0.000000	
XP_008600320.1 peroxin 14_17 _Beauveria bassiana ARSEF 2860_	OTHER	1.000000	0.000000	0.000000	0.000000	0.000000	0.000000	
XP_008600323.1 37S ribosomal protein S12 _Beauveria bassiana ARSEF 2860_	OTHER	1.000000	0.000001	0.000000	0.000000	0.000000	0.000000	
XP_008600324.1 acyl-CoA dehydrogenase _Beauveria bassiana ARSEF 2860_	OTHER	1.000000	0.000000	0.000000	0.000000	0.000000	0.000000	
XP_008600325.1 protein kinase C _Beauveria bassiana ARSEF 2860_	OTHER	1.000000	0.000000	0.000000	0.000000	0.000000	0.000000	
XP_008600326.1 She9_Mdm33 family protein _Beauveria bassiana ARSEF 2860_	OTHER	1.000000	0.000000	0.000000	0.000000	0.000000	0.000000	
XP_008600328.1 alkaline foam protein B precursor _Beauveria bassiana ARSEF 2860_	SP	0.000294	0.999001	0.000163	0.000184	0.000169	0.000149	CS pos: 17-18. Pr: 0.9490
XP_008600329.1 major facilitator superfamily transporter _Beauveria bassiana ARSEF 2860_	OTHER	1.000000	0.000000	0.000000	0.000000	0.000000	0.000000	
XP_008600331.1 uncharacterized protein BBA_07012 _Beauveria bassiana ARSEF 2860_	OTHER	1.000000	0.000000	0.000000	0.000000	0.000000	0.000000	
XP_008600332.1 SET domain-containing protein _Beauveria bassiana ARSEF 2860_	OTHER	1.000000	0.000000	0.000000	0.000000	0.000000	0.000000	
XP_008600333.1 uncharacterized protein BBA_07014 _Beauveria bassiana ARSEF 2860_	OTHER	1.000000	0.000000	0.000000	0.000000	0.000000	0.000000	
XP_008600334.1 4-aminobutyrate transaminase GatA _Beauveria bassiana ARSEF 2860_	OTHER	1.000000	0.000000	0.000000	0.000000	0.000000	0.000000	
XP_008600335.1 voltage gated chloride channel _Beauveria bassiana ARSEF 2860_	OTHER	1.000000	0.000000	0.000000	0.000000	0.000000	0.000000	
XP_008600338.1 uncharacterized protein BBA_07019 _Beauveria bassiana ARSEF 2860_	OTHER	1.000000	0.000000	0.000000	0.000000	0.000000	0.000000	
XP_008600339.1 sphingolipid C9-methyltransferase _Beauveria bassiana ARSEF 2860_	OTHER	1.000000	0.000000	0.000000	0.000000	0.000000	0.000000	
XP_008600340.1 enoyl-CoA hydratase_isomerase _Beauveria bassiana ARSEF 2860_	OTHER	1.000000	0.000000	0.000000	0.000000	0.000000	0.000000	
XP_008600343.1 zeta toxin _Beauveria bassiana ARSEF 2860_	OTHER	1.000000	0.000000	0.000000	0.000000	0.000000	0.000000	
XP_008600344.1 ATG1 protein _Beauveria bassiana ARSEF 2860_	OTHER	1.000000	0.000000	0.000000	0.000000	0.000000	0.000000	
XP_008600346.1 glycosyltransferase family 22 _Beauveria bassiana ARSEF 2860_	OTHER	1.000000	0.000001	0.000000	0.000000	0.000000	0.000000	
XP_008600347.1 succinate dehydrogenase and fumarate reductase iron-sulfur protein _Beauveria bassiana ARSEF 2860_	OTHER	1.000000	0.000000	0.000000	0.000000	0.000000	0.000000	
XP_008600348.1 RhoGAP domain-containing protein _Beauveria bassiana ARSEF 2860_	OTHER	1.000000	0.000019	0.000000	0.000000	0.000000	0.000000	
XP_008600349.1 Zn_II_2Cys6 transcription factor _Beauveria bassiana ARSEF 2860_	OTHER	1.000000	0.000000	0.000000	0.000000	0.000000	0.000000	
XP_008600350.1 MFS multidrug transporter _Beauveria bassiana ARSEF 2860_	OTHER	1.000000	0.000001	0.000000	0.000000	0.000000	0.000000	
XP_008600352.1 Hypothetical protein BBA_07033 _Beauveria bassiana ARSEF 2860_	OTHER	1.000000	0.000000	0.000000	0.000000	0.000000	0.000000	
XP_008600353.1 dipeptidyl aminopeptidase _Beauveria bassiana ARSEF 2860_	OTHER	1.000000	0.000000	0.000000	0.000000	0.000000	0.000000	
XP_008600354.1 glycosyltransferase family 57 _Beauveria bassiana ARSEF 2860_	OTHER	0.999957	0.000047	0.000000	0.000000	0.000000	0.000001	
XP_008600355.1 uncharacterized protein BBA_07036 _Beauveria bassiana ARSEF 2860_	OTHER	1.000000	0.000000	0.000000	0.000000	0.000000	0.000000	
XP_008600356.1 60S acidic ribosomal protein P2, putative _Beauveria bassiana ARSEF 2860_	OTHER	0.999849	0.000164	0.000000	0.000000	0.000000	0.000000	
XP_008600357.1 Chromatin SPT2 _Beauveria bassiana ARSEF 2860_	OTHER	1.000000	0.000000	0.000000	0.000000	0.000000	0.000000	
XP_008600358.1 nuclear fragile X mental retardation-interacting protein 1 _Beauveria bassiana ARSEF 2860_	OTHER	1.000000	0.000000	0.000000	0.000000	0.000000	0.000000	
XP_008600360.1 protein UCP010045, transmembrane _Beauveria bassiana ARSEF 2860_	OTHER	1.000000	0.000002	0.000000	0.000000	0.000000	0.000000	
XP_008600362.1 HEAT repeat containing protein _Beauveria bassiana ARSEF 2860_	OTHER	1.000000	0.000000	0.000000	0.000000	0.000000	0.000000	
XP_008600363.1 ATP11 protein _Beauveria bassiana ARSEF 2860_	OTHER	1.000000	0.000000	0.000000	0.000000	0.000000	0.000000	
XP_008600364.1 sterol esterase _Beauveria bassiana ARSEF 2860_	OTHER	1.000000	0.000000	0.000000	0.000000	0.000000	0.000000	
XP_008600365.1 ATPase protein _Beauveria bassiana ARSEF 2860_	OTHER	1.000000	0.000000	0.000000	0.000000	0.000000	0.000000	
XP_008600366.1 Thioredoxin-like protein _Beauveria bassiana ARSEF 2860_	OTHER	1.000000	0.000000	0.000000	0.000000	0.000000	0.000000	
XP_008600367.1 uncharacterized protein BBA_07048 _Beauveria bassiana ARSEF 2860_	SP	0.000221	0.999145	0.000157	0.000155	0.000140	0.000133	CS pos: 16-17. Pr: 0.9768
XP_008600368.1 itaconyl-CoA hydratase _Beauveria bassiana ARSEF 2860_	OTHER	1.000000	0.000000	0.000000	0.000000	0.000000	0.000000	
XP_008600370.1 heterokaryon incompatibility protein _Beauveria bassiana ARSEF 2860_	OTHER	1.000000	0.000000	0.000000	0.000000	0.000000	0.000000	
XP_008600371.1 uncharacterized protein BBA_07052 _Beauveria bassiana ARSEF 2860_	OTHER	1.000000	0.000010	0.000000	0.000000	0.000000	0.000000	
XP_008600372.1 sugar porter family MFS transporter _Beauveria bassiana ARSEF 2860_	OTHER	0.999889	0.000181	0.000000	0.000000	0.000000	0.000000	
XP_008600373.1 C6 zinc finger domain-containing protein _Beauveria bassiana ARSEF 2860_	OTHER	1.000000	0.000000	0.000000	0.000000	0.000000	0.000000	
XP_008600375.1 WD domain-containing protein _Beauveria bassiana ARSEF 2860_	OTHER	1.000000	0.000000	0.000000	0.000000	0.000000	0.000000	
XP_008600376.1 putative histidine phosphotransferase HPT1p _Beauveria bassiana ARSEF 2860_	OTHER	1.000000	0.000001	0.000000	0.000000	0.000000	0.000000	
XP_008600377.1 Activating signal cointegrator 1 complex subunit 1 _Beauveria bassiana ARSEF 2860_	OTHER	1.000000	0.000001	0.000000	0.000000	0.000000	0.000000	
XP_008600378.1 uncharacterized protein BBA_07059 _Beauveria bassiana ARSEF 2860_	OTHER	1.000000	0.000006	0.000000	0.000000	0.000000	0.000000	
XP_008600380.1 RING finger protein _Beauveria bassiana ARSEF 2860_	OTHER	0.999370	0.000626	0.000018	0.000003	0.000002	0.000006	
XP_008600381.1 insulinase-like protein _Beauveria bassiana ARSEF 2860_	OTHER	1.000000	0.000001	0.000000	0.000000	0.000000	0.000000	
XP_008600382.1 uncharacterized protein BBA_07063 _Beauveria bassiana ARSEF 2860_	OTHER	1.000000	0.000000	0.000000	0.000000	0.000000	0.000000	
XP_008600383.1 S1 RNA binding domain-containing protein _Beauveria bassiana ARSEF 2860_	OTHER	1.000000	0.000002	0.000000	0.000000	0.000000	0.000000	
XP_008600384.1 uncharacterized protein BBA_07065 _Beauveria bassiana ARSEF 2860_	OTHER	1.000000	0.000000	0.000000	0.000000	0.000000	0.000000	
XP_008600385.1 Putative Zn_II_2Cys6 transcription factor _Beauveria bassiana ARSEF 2860_	OTHER	1.000000	0.000000	0.000000	0.000000	0.000000	0.000000	
XP_008600386.1 uncharacterized protein BBA_07067 _Beauveria bassiana ARSEF 2860_	OTHER	1.000000	0.000000	0.000000	0.000000	0.000000	0.000000	
XP_008600387.1 pyridoxal-dependent decarboxylase _Beauveria bassiana ARSEF 2860_	OTHER	1.000000	0.000000	0.000000	0.000000	0.000000	0.000000	
XP_008600388.1 C6 transcription factor _Beauveria bassiana ARSEF 2860_	OTHER	1.000000	0.000002	0.000000	0.000000	0.000000	0.000000	
XP_008600389.1 C6 zinc finger domain-containing protein _Beauveria bassiana ARSEF 2860_	OTHER	0.999995	0.000036	0.000000	0.000000	0.000000	0.000000	
XP_008600392.1 peptidase family M48 _Beauveria bassiana ARSEF 2860_	OTHER	1.000000	0.000000	0.000000	0.000000	0.000000	0.000000	
XP_008600394.1 kinesin heavy chain _Beauveria bassiana ARSEF 2860_	OTHER	1.000000	0.000000	0.000000	0.000000	0.000000	0.000000	
XP_008600396.1 mll5682 protein _Beauveria bassiana ARSEF 2860_	OTHER	1.000000	0.000000	0.000000	0.000000	0.000000	0.000000	
XP_008600397.1 leukotriene A-4 hydrolase_aminopeptidase _Beauveria bassiana ARSEF 2860_	OTHER	1.000000	0.000000	0.000000	0.000000	0.000000	0.000000	
XP_008600398.1 uncharacterized protein BBA_07079 _Beauveria bassiana ARSEF 2860_	OTHER	1.000000	0.000000	0.000000	0.000000	0.000000	0.000000	
XP_008600399.1 PX domain-containing protein _Beauveria bassiana ARSEF 2860_	OTHER	1.000000	0.000000	0.000000	0.000000	0.000000	0.000000	
XP_008600402.1 HMG CoA reductase _Beauveria bassiana ARSEF 2860_	OTHER	1.000000	0.000001	0.000000	0.000000	0.000000	0.000000	
XP_008600403.1 Isochorismatase-like protein _Beauveria bassiana ARSEF 2860_	OTHER	1.000000	0.000001	0.000000	0.000000	0.000000	0.000000	
XP_008600405.1 uncharacterized protein BBA_07086 _Beauveria bassiana ARSEF 2860_	OTHER	1.000000	0.000000	0.000000	0.000000	0.000000	0.000000	
XP_008600406.1 serine_threonine kinase protein _Beauveria bassiana ARSEF 2860_	OTHER	1.000000	0.000000	0.000000	0.000000	0.000000	0.000000	
XP_008600407.1 xylose isomerase-like TIM barrel _Beauveria bassiana ARSEF 2860_	OTHER	1.000000	0.000000	0.000000	0.000000	0.000000	0.000000	
XP_008600413.1 mitochondrial phosphate carrier protein _Beauveria bassiana ARSEF 2860_	OTHER	0.778833	0.202548	0.010688	0.003722	0.002185	0.002030	
XP_008600414.1 glucose transporter _Beauveria bassiana ARSEF 2860_	OTHER	0.999992	0.000018	0.000000	0.000000	0.000000	0.000000	
XP_008600416.1 succinyl-CoA ligase alpha-chain _Beauveria bassiana ARSEF 2860_	OTHER	1.000000	0.000000	0.000000	0.000000	0.000000	0.000000	
XP_008600417.1 uncharacterized protein BBA_07098 _Beauveria bassiana ARSEF 2860_	OTHER	1.000000	0.000000	0.000000	0.000000	0.000000	0.000000	
XP_008600419.1 ELP3 family histone acetyltransferase _Beauveria bassiana ARSEF 2860_	OTHER	1.000000	0.000001	0.000000	0.000000	0.000000	0.000000	
XP_008600420.1 uncharacterized protein BBA_07101 _Beauveria bassiana ARSEF 2860_	OTHER	1.000000	0.000000	0.000000	0.000000	0.000000	0.000000	
XP_008600421.1 methyltransferase domain-containing protein _Beauveria bassiana ARSEF 2860_	OTHER	1.000000	0.000000	0.000000	0.000000	0.000000	0.000000	
XP_008600422.1 phospholipid-translocating P-type ATPase _Beauveria bassiana ARSEF 2860_	OTHER	1.000000	0.000000	0.000000	0.000000	0.000000	0.000000	
XP_008600423.1 transcription factor TFIIB _Beauveria bassiana ARSEF 2860_	OTHER	1.000000	0.000002	0.000000	0.000000	0.000000	0.000000	
XP_008600426.1 PHD-finger domain-containing protein _Beauveria bassiana ARSEF 2860_	OTHER	0.999931	0.000062	0.000016	0.000001	0.000000	0.000010	
XP_008600427.1 uncharacterized protein BBA_07108 _Beauveria bassiana ARSEF 2860_	SP	0.000279	0.999051	0.000181	0.000161	0.000166	0.000154	CS pos: 21-22. Pr: 0.7716
XP_008600428.1 LipA and NB-ARC domain-containing protein _Beauveria bassiana ARSEF 2860_	OTHER	1.000000	0.000004	0.000000	0.000000	0.000000	0.000000	
XP_008600429.1 smad nuclear-interacting protein _Beauveria bassiana ARSEF 2860_	OTHER	1.000000	0.000000	0.000000	0.000000	0.000000	0.000000	
XP_008600430.1 uncharacterized protein BBA_07111 _Beauveria bassiana ARSEF 2860_	OTHER	0.987352	0.012344	0.000224	0.000026	0.000017	0.000044	
XP_008600431.1 HNH endonuclease _Beauveria bassiana ARSEF 2860_	OTHER	1.000000	0.000000	0.000000	0.000000	0.000000	0.000000	
XP_008600433.1 aldo_keto reductase _Beauveria bassiana ARSEF 2860_	OTHER	1.000000	0.000000	0.000000	0.000000	0.000000	0.000000	
XP_008600435.1 Sec7 domain-containing protein _Beauveria bassiana ARSEF 2860_	OTHER	1.000000	0.000000	0.000000	0.000000	0.000000	0.000000	
XP_008600438.1 C6 zinc finger domain-containing protein _Beauveria bassiana ARSEF 2860_	OTHER	1.000000	0.000011	0.000000	0.000000	0.000000	0.000000	
XP_008600440.1 Pfs, NACHT and Ankyrin domain protein _Beauveria bassiana ARSEF 2860_	OTHER	1.000000	0.000000	0.000000	0.000000	0.000000	0.000000	
XP_008600441.1 hydantoinase-like protein _Beauveria bassiana ARSEF 2860_	OTHER	1.000000	0.000000	0.000000	0.000000	0.000000	0.000000	
XP_008600443.1 ubiquitin carboxyl-terminal hydrolase _Beauveria bassiana ARSEF 2860_	OTHER	1.000000	0.000000	0.000000	0.000000	0.000000	0.000000	
XP_008600444.1 enoyl-CoA hydratase_isomerase _Beauveria bassiana ARSEF 2860_	OTHER	1.000000	0.000000	0.000000	0.000000	0.000000	0.000000	
XP_008600446.1 histone acetyltransferase SAS2 _Beauveria bassiana ARSEF 2860_	OTHER	1.000000	0.000001	0.000000	0.000000	0.000000	0.000000	
XP_008600447.1 26S proteasome non-ATPase regulatory subunit 3 _Beauveria bassiana ARSEF 2860_	OTHER	1.000000	0.000000	0.000000	0.000000	0.000000	0.000000	
XP_008600448.1 Cytochrome P450 CYP526H1 _Beauveria bassiana ARSEF 2860_	OTHER	1.000000	0.000001	0.000000	0.000000	0.000000	0.000000	
XP_008600449.1 kinesin light chain 1 and _Beauveria bassiana ARSEF 2860_	OTHER	0.999901	0.000120	0.000001	0.000000	0.000000	0.000000	
XP_008600450.1 C3HC4 type _RING finger_ zinc finger containing protein _Beauveria bassiana ARSEF 2860_	OTHER	1.000000	0.000002	0.000000	0.000000	0.000000	0.000000	
XP_008600451.1 DASH complex subunit Spc34 _Beauveria bassiana ARSEF 2860_	OTHER	1.000000	0.000000	0.000000	0.000000	0.000000	0.000000	
XP_008600452.1 uncharacterized protein BBA_07133 _Beauveria bassiana ARSEF 2860_	OTHER	1.000000	0.000000	0.000000	0.000000	0.000000	0.000000	
XP_008600453.1 transcription initiation factor TFIID subunit 12 _Beauveria bassiana ARSEF 2860_	OTHER	1.000000	0.000001	0.000000	0.000000	0.000000	0.000000	
XP_008600454.1 fungal specific transcription factor _Beauveria bassiana ARSEF 2860_	OTHER	1.000000	0.000000	0.000000	0.000000	0.000000	0.000000	
XP_008600455.1 major facilitator superfamily transporter _Beauveria bassiana ARSEF 2860_	OTHER	1.000000	0.000031	0.000000	0.000000	0.000000	0.000000	
XP_008600458.1 uncharacterized protein BBA_07139 _Beauveria bassiana ARSEF 2860_	OTHER	1.000000	0.000000	0.000000	0.000000	0.000000	0.000000	
XP_008600459.1 major facilitator superfamily transporter _Beauveria bassiana ARSEF 2860_	OTHER	0.989895	0.009747	0.000153	0.000066	0.000036	0.000099	
XP_008600461.1 uncharacterized protein BBA_07142 _Beauveria bassiana ARSEF 2860_	OTHER	1.000000	0.000000	0.000000	0.000000	0.000000	0.000000	
XP_008600463.1 deuterolysin metalloprotease _Beauveria bassiana ARSEF 2860_	OTHER	0.995906	0.003990	0.000071	0.000007	0.000004	0.000008	
XP_008600464.1 uncharacterized protein BBA_07145 _Beauveria bassiana ARSEF 2860_	OTHER	1.000000	0.000008	0.000000	0.000000	0.000000	0.000000	
XP_008600465.1 LysM domain-containing protein _Beauveria bassiana ARSEF 2860_	OTHER	1.000000	0.000007	0.000000	0.000000	0.000000	0.000000	
XP_008600466.1 uncharacterized protein BBA_07147 _Beauveria bassiana ARSEF 2860_	OTHER	0.999509	0.000486	0.000011	0.000001	0.000001	0.000002	
XP_008600467.1 uncharacterized protein BBA_07148 _Beauveria bassiana ARSEF 2860_	SP	0.000332	0.999041	0.000159	0.000165	0.000149	0.000143	CS pos: 17-18. Pr: 0.8012
XP_008600468.1 major facilitator superfamily transporter _Beauveria bassiana ARSEF 2860_	OTHER	1.000000	0.000003	0.000000	0.000000	0.000000	0.000000	
XP_008600469.1 sedoheptulose-1,7-bisphosphatase _Beauveria bassiana ARSEF 2860_	OTHER	1.000000	0.000001	0.000000	0.000000	0.000000	0.000000	
XP_008600470.1 asparaginase-like protein _Beauveria bassiana ARSEF 2860_	OTHER	0.999850	0.000220	0.000001	0.000000	0.000000	0.000000	
XP_008600472.1 uncharacterized protein BBA_07153 _Beauveria bassiana ARSEF 2860_	OTHER	0.999213	0.000746	0.000008	0.000001	0.000001	0.000016	
XP_008600473.1 5_-AMP-activated protein kinase _Beauveria bassiana ARSEF 2860_	OTHER	1.000000	0.000004	0.000000	0.000000	0.000000	0.000000	
XP_008601033.1 uncharacterized protein BBA_07714 _Beauveria bassiana ARSEF 2860_	OTHER	0.952418	0.045937	0.000933	0.000356	0.000152	0.000211	
XP_008601034.1 major facilitator superfamily transporter _Beauveria bassiana ARSEF 2860_	OTHER	0.999924	0.000049	0.000031	0.000001	0.000000	0.000014	
XP_008601035.1 serine_threonine kinase _Beauveria bassiana ARSEF 2860_	OTHER	1.000000	0.000001	0.000000	0.000000	0.000000	0.000000	
XP_008601037.1 beta transducin-like protein HET-E2C_4 _Beauveria bassiana ARSEF 2860_	OTHER	1.000000	0.000000	0.000000	0.000000	0.000000	0.000000	
XP_008601038.1 autophagy-related protein 3 _Beauveria bassiana ARSEF 2860_	OTHER	1.000000	0.000000	0.000000	0.000000	0.000000	0.000000	
XP_008601039.1 uncharacterized protein BBA_07720 _Beauveria bassiana ARSEF 2860_	OTHER	1.000000	0.000000	0.000000	0.000000	0.000000	0.000000	
XP_008601040.1 phosphotransferase enzyme family protein _Beauveria bassiana ARSEF 2860_	OTHER	1.000000	0.000000	0.000000	0.000000	0.000000	0.000000	
XP_008601041.1 serine_threonine-protein kinase ppk24 _Beauveria bassiana ARSEF 2860_	OTHER	1.000000	0.000008	0.000001	0.000000	0.000000	0.000000	
XP_008601042.1 uncharacterized protein BBA_07723 _Beauveria bassiana ARSEF 2860_	OTHER	1.000000	0.000000	0.000000	0.000000	0.000000	0.000000	
XP_008601043.1 pre-mRNA-splicing factor cwc24 _Beauveria bassiana ARSEF 2860_	OTHER	1.000000	0.000000	0.000000	0.000000	0.000000	0.000000	
XP_008601044.1 AMI1 protein _Beauveria bassiana ARSEF 2860_	OTHER	1.000000	0.000001	0.000000	0.000000	0.000000	0.000000	
XP_008601045.1 PH domain-containing protein _Beauveria bassiana ARSEF 2860_	OTHER	1.000000	0.000000	0.000000	0.000000	0.000000	0.000000	
XP_008601046.1 DNA polymerase family B _Beauveria bassiana ARSEF 2860_	OTHER	1.000000	0.000000	0.000000	0.000000	0.000000	0.000000	
XP_008601047.1 pre-mRNA-splicing factor SLU7 _Beauveria bassiana ARSEF 2860_	OTHER	1.000000	0.000000	0.000000	0.000000	0.000000	0.000000	
XP_008601049.1 ribosomal protein L21e _Beauveria bassiana ARSEF 2860_	OTHER	1.000000	0.000000	0.000000	0.000000	0.000000	0.000000	
XP_008601050.1 ankyrin repeat domain protein _Beauveria bassiana ARSEF 2860_	OTHER	1.000000	0.000005	0.000000	0.000000	0.000000	0.000000	
XP_008601051.1 ANTH domain-containing protein _Beauveria bassiana ARSEF 2860_	OTHER	1.000000	0.000001	0.000000	0.000000	0.000000	0.000000	
XP_008601052.1 Mating-type protein MAT1-1-1 _Beauveria bassiana ARSEF 2860_	OTHER	1.000000	0.000000	0.000000	0.000000	0.000000	0.000000	
XP_008601053.1 DNA lyase _Beauveria bassiana ARSEF 2860_	OTHER	1.000000	0.000000	0.000000	0.000000	0.000000	0.000000	
XP_008601055.1 anaphase-promoting complex protein _Beauveria bassiana ARSEF 2860_	OTHER	0.999944	0.000088	0.000004	0.000000	0.000000	0.000001	
XP_008601058.1 urea transporter _Beauveria bassiana ARSEF 2860_	OTHER	1.000000	0.000000	0.000000	0.000000	0.000000	0.000000	
XP_008601059.1 RNA recognition domain-containing protein _Beauveria bassiana ARSEF 2860_	OTHER	1.000000	0.000000	0.000000	0.000000	0.000000	0.000000	
XP_008601061.1 anaphase-promoting complex subunit Apc5 _Beauveria bassiana ARSEF 2860_	OTHER	1.000000	0.000000	0.000000	0.000000	0.000000	0.000000	
XP_008601062.1 serine peptidase, putative _Beauveria bassiana ARSEF 2860_	SP	0.000500	0.998817	0.000168	0.000175	0.000166	0.000161	CS pos: 18-19. Pr: 0.9597
XP_008601063.1 FAD dependent oxidoreductase _Beauveria bassiana ARSEF 2860_	OTHER	1.000000	0.000018	0.000001	0.000000	0.000000	0.000000	
XP_008601064.1 Glycoside hydrolase, catalytic core _Beauveria bassiana ARSEF 2860_	SP	0.000295	0.999050	0.000157	0.000185	0.000156	0.000145	CS pos: 18-19. Pr: 0.9777
XP_008601065.1 uncharacterized protein BBA_07746 _Beauveria bassiana ARSEF 2860_	OTHER	1.000000	0.000000	0.000000	0.000000	0.000000	0.000000	
XP_008601066.1 CorA-like Mg2_ transporter _Beauveria bassiana ARSEF 2860_	OTHER	1.000000	0.000000	0.000000	0.000000	0.000000	0.000000	
XP_008601067.1 ABC transporter _Beauveria bassiana ARSEF 2860_	OTHER	1.000000	0.000000	0.000000	0.000000	0.000000	0.000000	
XP_008601068.1 DNA repair protein _Beauveria bassiana ARSEF 2860_	OTHER	1.000000	0.000000	0.000000	0.000000	0.000000	0.000000	
XP_008601069.1 uncharacterized protein BBA_07750 _Beauveria bassiana ARSEF 2860_	OTHER	0.999630	0.000399	0.000004	0.000001	0.000001	0.000002	
XP_008601071.1 WH1 domain-containing protein _Beauveria bassiana ARSEF 2860_	OTHER	1.000000	0.000000	0.000000	0.000000	0.000000	0.000000	
XP_008601072.1 eukaryotic translation initiation factor eIF-1A _Beauveria bassiana ARSEF 2860_	OTHER	1.000000	0.000000	0.000000	0.000000	0.000000	0.000000	
XP_008601073.1 glutathione S-transferase _Beauveria bassiana ARSEF 2860_	OTHER	1.000000	0.000000	0.000000	0.000000	0.000000	0.000000	
XP_008601074.1 TPR domain-containing protein _Beauveria bassiana ARSEF 2860_	OTHER	1.000000	0.000005	0.000000	0.000000	0.000000	0.000000	
XP_008601076.1 maleylacetoacetate isomerase _Beauveria bassiana ARSEF 2860_	OTHER	1.000000	0.000000	0.000000	0.000000	0.000000	0.000000	
XP_008601077.1 GPI anchored CFEM domain protein _Beauveria bassiana ARSEF 2860_	SP	0.000232	0.999153	0.000157	0.000160	0.000139	0.000137	CS pos: 15-16. Pr: 0.9815
XP_008601079.1 uncharacterized protein BBA_07760 _Beauveria bassiana ARSEF 2860_	OTHER	1.000000	0.000000	0.000000	0.000000	0.000000	0.000000	
XP_008601080.1 pre-mRNA splicing factor, putative _Beauveria bassiana ARSEF 2860_	OTHER	1.000000	0.000000	0.000000	0.000000	0.000000	0.000000	
XP_008601081.1 glycosyltransferase family 39 _Beauveria bassiana ARSEF 2860_	OTHER	0.999842	0.000148	0.000000	0.000000	0.000000	0.000000	
XP_008601082.1 GDP_GTP exchange factor Sec2p _Beauveria bassiana ARSEF 2860_	OTHER	1.000000	0.000000	0.000000	0.000000	0.000000	0.000000	
XP_008601083.1 thioesterase family protein _Beauveria bassiana ARSEF 2860_	OTHER	1.000000	0.000003	0.000000	0.000000	0.000000	0.000000	
XP_008601084.1 Pfs, NACHT and WD domain protein _Beauveria bassiana ARSEF 2860_	OTHER	1.000000	0.000005	0.000000	0.000000	0.000000	0.000000	
XP_008601085.1 endothiapepsin-like protein _Beauveria bassiana ARSEF 2860_	SP	0.005494	0.993407	0.000273	0.000291	0.000256	0.000238	CS pos: 16-17. Pr: 0.9444
XP_008601086.1 uncharacterized protein BBA_07767 _Beauveria bassiana ARSEF 2860_	OTHER	1.000000	0.000000	0.000000	0.000000	0.000000	0.000000	
XP_008601088.1 SNARE domain-containing protein _Beauveria bassiana ARSEF 2860_	OTHER	1.000000	0.000000	0.000000	0.000000	0.000000	0.000000	
XP_008601089.1 uncharacterized protein BBA_07770 _Beauveria bassiana ARSEF 2860_	OTHER	1.000000	0.000000	0.000000	0.000000	0.000000	0.000000	
XP_008601092.1 uncharacterized protein BBA_07773 _Beauveria bassiana ARSEF 2860_	OTHER	0.991475	0.008470	0.000021	0.000016	0.000008	0.000013	
XP_008601094.1 uncharacterized protein BBA_07775 _Beauveria bassiana ARSEF 2860_	OTHER	1.000000	0.000001	0.000000	0.000000	0.000000	0.000000	
XP_008601095.1 uncharacterized protein BBA_07776 _Beauveria bassiana ARSEF 2860_	OTHER	1.000000	0.000014	0.000000	0.000000	0.000000	0.000000	
XP_008601097.1 oxidoreductase, 2OG-Fe_II_ oxygenase family protein _Beauveria bassiana ARSEF 2860_	OTHER	1.000000	0.000001	0.000000	0.000000	0.000000	0.000000	
XP_008601098.1 serine-threonine protein kinase _Beauveria bassiana ARSEF 2860_	OTHER	1.000000	0.000000	0.000000	0.000000	0.000000	0.000000	
XP_008601099.1 alpha-N-acetylglucosaminidase _Beauveria bassiana ARSEF 2860_	SP	0.000223	0.999159	0.000161	0.000163	0.000155	0.000135	CS pos: 20-21. Pr: 0.9787
XP_008601100.1 F-box and wd40 domain protein _Beauveria bassiana ARSEF 2860_	OTHER	1.000000	0.000000	0.000000	0.000000	0.000000	0.000000	
XP_008601101.1 uncharacterized protein BBA_07782 _Beauveria bassiana ARSEF 2860_	SP	0.000293	0.999020	0.000155	0.000181	0.000165	0.000147	CS pos: 20-21. Pr: 0.9873
XP_008601103.1 C6 zinc finger domain-containing protein _Beauveria bassiana ARSEF 2860_	OTHER	1.000000	0.000001	0.000000	0.000000	0.000000	0.000000	
XP_008601104.1 fumarylacetoacetate hydrolase family protein _Beauveria bassiana ARSEF 2860_	OTHER	1.000000	0.000014	0.000000	0.000000	0.000000	0.000000	
