XP_008594771.1 NMD3 family protein _Beauveria bassiana ARSEF 2860_	OTHER	1.000000	0.000003	0.000000	0.000000	0.000000	0.000000	
XP_008594772.1 RNA recognition domain-containing protein _Beauveria bassiana ARSEF 2860_	OTHER	1.000000	0.000000	0.000000	0.000000	0.000000	0.000000	
XP_008594774.1 uncharacterized protein BBA_01455 _Beauveria bassiana ARSEF 2860_	OTHER	1.000000	0.000000	0.000000	0.000000	0.000000	0.000000	
XP_008594775.1 uncharacterized protein BBA_01456 _Beauveria bassiana ARSEF 2860_	OTHER	1.000000	0.000000	0.000000	0.000000	0.000000	0.000000	
XP_008594776.1 phosphomevalonate kinase _Beauveria bassiana ARSEF 2860_	OTHER	1.000000	0.000001	0.000000	0.000000	0.000000	0.000000	
XP_008594778.1 DEAD_DEAH box helicase _Beauveria bassiana ARSEF 2860_	OTHER	1.000000	0.000000	0.000000	0.000000	0.000000	0.000000	
XP_008594780.1 COPI associated protein _Beauveria bassiana ARSEF 2860_	OTHER	1.000000	0.000000	0.000000	0.000000	0.000000	0.000000	
XP_008594783.1 Actin-like protein _Beauveria bassiana ARSEF 2860_	OTHER	1.000000	0.000000	0.000000	0.000000	0.000000	0.000000	
XP_008594784.1 uncharacterized protein BBA_01465 _Beauveria bassiana ARSEF 2860_	OTHER	1.000000	0.000006	0.000000	0.000000	0.000000	0.000000	
XP_008594785.1 beta-glucosidase _Beauveria bassiana ARSEF 2860_	SP	0.001058	0.998127	0.000233	0.000223	0.000176	0.000167	CS pos: 23-24. Pr: 0.9481
XP_008594786.1 PCI domain-containing protein _Beauveria bassiana ARSEF 2860_	OTHER	1.000000	0.000000	0.000000	0.000000	0.000000	0.000000	
XP_008594789.1 uncharacterized protein BBA_01470 _Beauveria bassiana ARSEF 2860_	OTHER	1.000000	0.000000	0.000000	0.000000	0.000000	0.000000	
XP_008594790.1 uncharacterized protein BBA_01471 _Beauveria bassiana ARSEF 2860_	OTHER	1.000000	0.000000	0.000000	0.000000	0.000000	0.000000	
XP_008594791.1 PDZ domain-containing protein _Beauveria bassiana ARSEF 2860_	OTHER	1.000000	0.000002	0.000000	0.000000	0.000000	0.000000	
XP_008594795.1 transcription initiation factor IID _Beauveria bassiana ARSEF 2860_	OTHER	1.000000	0.000000	0.000000	0.000000	0.000000	0.000000	
XP_008594800.1 ubiquitin carrier protein _Beauveria bassiana ARSEF 2860_	OTHER	1.000000	0.000021	0.000000	0.000000	0.000000	0.000000	
XP_008594802.1 DnaJ domain-containing protein _Beauveria bassiana ARSEF 2860_	OTHER	1.000000	0.000000	0.000000	0.000000	0.000000	0.000000	
XP_008594804.1 Mob1 family protein _Beauveria bassiana ARSEF 2860_	OTHER	1.000000	0.000001	0.000000	0.000000	0.000000	0.000000	
XP_008594805.1 C6 finger domain protein, putative _Beauveria bassiana ARSEF 2860_	OTHER	0.986216	0.013649	0.000073	0.000031	0.000017	0.000032	
XP_008594806.1 MOSC domain-containing protein _Beauveria bassiana ARSEF 2860_	OTHER	1.000000	0.000010	0.000000	0.000000	0.000000	0.000000	
XP_008594808.1 inner centromere protein _Beauveria bassiana ARSEF 2860_	OTHER	1.000000	0.000000	0.000000	0.000000	0.000000	0.000000	
XP_008594809.1 ATP-dependent RNA helicase mss116 _Beauveria bassiana ARSEF 2860_	OTHER	1.000000	0.000000	0.000000	0.000000	0.000000	0.000000	
XP_008594811.1 GRF zinc finger domain-containing protein _Beauveria bassiana ARSEF 2860_	OTHER	1.000000	0.000001	0.000000	0.000000	0.000000	0.000000	
XP_008594813.1 lipase 1 precursor _Beauveria bassiana ARSEF 2860_	SP	0.000216	0.999197	0.000158	0.000147	0.000133	0.000128	CS pos: 21-22. Pr: 0.9809
XP_008594814.1 uncharacterized protein BBA_01495 _Beauveria bassiana ARSEF 2860_	OTHER	1.000000	0.000019	0.000000	0.000000	0.000000	0.000000	
XP_008594817.1 ubiquitin-conjugating enzyme _Beauveria bassiana ARSEF 2860_	OTHER	1.000000	0.000001	0.000000	0.000000	0.000000	0.000000	
XP_008594818.1 nitrate assimilation regulatory protein nirA _Beauveria bassiana ARSEF 2860_	OTHER	1.000000	0.000000	0.000000	0.000000	0.000000	0.000000	
XP_008594819.1 DUF1014 domain protein _Beauveria bassiana ARSEF 2860_	OTHER	1.000000	0.000000	0.000000	0.000000	0.000000	0.000000	
XP_008594820.1 major facilitator superfamily transporter _Beauveria bassiana ARSEF 2860_	OTHER	1.000000	0.000018	0.000000	0.000000	0.000000	0.000000	
XP_008594821.1 fungal specific transcription factor _Beauveria bassiana ARSEF 2860_	OTHER	1.000000	0.000000	0.000000	0.000000	0.000000	0.000000	
XP_008594822.1 uncharacterized protein BBA_01503 _Beauveria bassiana ARSEF 2860_	OTHER	0.998266	0.001738	0.000000	0.000000	0.000000	0.000000	
XP_008594823.1 Intradiol ring-cleavage dioxygenase, core _Beauveria bassiana ARSEF 2860_	OTHER	1.000000	0.000030	0.000000	0.000000	0.000000	0.000000	
XP_008594824.1 peptidase family M20_M25_M40 protein _Beauveria bassiana ARSEF 2860_	OTHER	1.000000	0.000000	0.000000	0.000000	0.000000	0.000000	
XP_008594825.1 FAD dependent oxidoreductase _Beauveria bassiana ARSEF 2860_	OTHER	1.000000	0.000001	0.000000	0.000000	0.000000	0.000000	
XP_008594826.1 WD domain containing protein _Beauveria bassiana ARSEF 2860_	OTHER	1.000000	0.000021	0.000003	0.000000	0.000000	0.000001	
XP_008594828.1 uncharacterized protein BBA_01509 _Beauveria bassiana ARSEF 2860_	OTHER	1.000000	0.000007	0.000000	0.000000	0.000000	0.000000	
XP_008594831.1 Spc97_Spc98 family protein _Beauveria bassiana ARSEF 2860_	OTHER	1.000000	0.000000	0.000000	0.000000	0.000000	0.000000	
XP_008594832.1 proteasome A-type and B-type _Beauveria bassiana ARSEF 2860_	OTHER	1.000000	0.000005	0.000000	0.000000	0.000000	0.000000	
XP_008594833.1 C6 finger domain protein _Beauveria bassiana ARSEF 2860_	OTHER	1.000000	0.000000	0.000000	0.000000	0.000000	0.000000	
XP_008594834.1 Cytochrome P450 CYP548A5 _Beauveria bassiana ARSEF 2860_	OTHER	1.000000	0.000000	0.000000	0.000000	0.000000	0.000000	
XP_008594835.1 Frag1_DRAM_Sfk1 family protein _Beauveria bassiana ARSEF 2860_	OTHER	1.000000	0.000011	0.000000	0.000000	0.000000	0.000000	
XP_008594836.1 U3 small nucleolar RNA-associated protein 6 _Beauveria bassiana ARSEF 2860_	OTHER	1.000000	0.000000	0.000000	0.000000	0.000000	0.000000	
XP_008594837.1 DNA polymerase family B _Beauveria bassiana ARSEF 2860_	OTHER	1.000000	0.000000	0.000000	0.000000	0.000000	0.000000	
XP_008594839.1 uncharacterized protein BBA_01520 _Beauveria bassiana ARSEF 2860_	OTHER	1.000000	0.000000	0.000000	0.000000	0.000000	0.000000	
XP_008594843.1 tubulin binding cofactor C _Beauveria bassiana ARSEF 2860_	OTHER	1.000000	0.000000	0.000000	0.000000	0.000000	0.000000	
XP_008594845.1 putative phosphoglyceromutase _Beauveria bassiana ARSEF 2860_	OTHER	0.999980	0.000054	0.000000	0.000000	0.000000	0.000000	
XP_008594846.1 uncharacterized protein BBA_01527 _Beauveria bassiana ARSEF 2860_	OTHER	1.000000	0.000000	0.000000	0.000000	0.000000	0.000000	
XP_008594847.1 frequency clock protein _Beauveria bassiana ARSEF 2860_	OTHER	1.000000	0.000000	0.000000	0.000000	0.000000	0.000000	
XP_008594848.1 prenylcysteine oxidase _Beauveria bassiana ARSEF 2860_	SP	0.473242	0.525715	0.000310	0.000238	0.000223	0.000261	CS pos: 21-22. Pr: 0.4372
XP_008594849.1 VID27 cytoplasmic protein _Beauveria bassiana ARSEF 2860_	OTHER	1.000000	0.000000	0.000000	0.000000	0.000000	0.000000	
XP_008594850.1 heterokaryon incompatibility protein _Beauveria bassiana ARSEF 2860_	OTHER	1.000000	0.000000	0.000000	0.000000	0.000000	0.000000	
XP_008594851.1 trehalose-6-phosphate synthase _Beauveria bassiana ARSEF 2860_	OTHER	1.000000	0.000000	0.000000	0.000000	0.000000	0.000000	
XP_008594853.1 ATP synthase protein 9 _Beauveria bassiana ARSEF 2860_	OTHER	1.000000	0.000000	0.000000	0.000000	0.000000	0.000000	
XP_008594854.1 DnaJ domain-containing protein _Beauveria bassiana ARSEF 2860_	SP	0.002577	0.995129	0.001623	0.000199	0.000205	0.000222	CS pos: 18-19. Pr: 0.9519
XP_008594855.1 uncharacterized protein BBA_01536 _Beauveria bassiana ARSEF 2860_	OTHER	1.000000	0.000007	0.000000	0.000000	0.000000	0.000000	
XP_008594857.1 PET112 family protein _Beauveria bassiana ARSEF 2860_	OTHER	1.000000	0.000000	0.000000	0.000000	0.000000	0.000000	
XP_008594859.1 uncharacterized protein BBA_01540 _Beauveria bassiana ARSEF 2860_	SP	0.000211	0.999187	0.000153	0.000167	0.000144	0.000139	CS pos: 24-25. Pr: 0.8103
XP_008594860.1 WD domain-containing protein _Beauveria bassiana ARSEF 2860_	OTHER	1.000000	0.000001	0.000000	0.000000	0.000000	0.000000	
XP_008594861.1 putative APC1 protein _Beauveria bassiana ARSEF 2860_	OTHER	1.000000	0.000002	0.000000	0.000000	0.000000	0.000000	
XP_008594862.1 eIF3 subunit 6 N terminal domain-containing protein _Beauveria bassiana ARSEF 2860_	OTHER	1.000000	0.000000	0.000000	0.000000	0.000000	0.000000	
XP_008594863.1 mitochondrial ribosomal protein subunit Img2 _Beauveria bassiana ARSEF 2860_	OTHER	1.000000	0.000000	0.000000	0.000000	0.000000	0.000000	
XP_008594864.1 arid_bright DNA binding domain-containing protein _Beauveria bassiana ARSEF 2860_	OTHER	1.000000	0.000000	0.000000	0.000000	0.000000	0.000000	
XP_008594865.1 uncharacterized protein BBA_01546 _Beauveria bassiana ARSEF 2860_	OTHER	1.000000	0.000000	0.000000	0.000000	0.000000	0.000000	
XP_008594866.1 uncharacterized protein BBA_01547 _Beauveria bassiana ARSEF 2860_	OTHER	1.000000	0.000020	0.000001	0.000000	0.000000	0.000000	
XP_008594868.1 NLI interacting factor-like phosphatase _Beauveria bassiana ARSEF 2860_	OTHER	1.000000	0.000000	0.000000	0.000000	0.000000	0.000000	
XP_008594869.1 Glycosyl transferase, family 28 _Beauveria bassiana ARSEF 2860_	OTHER	1.000000	0.000001	0.000000	0.000000	0.000000	0.000000	
XP_008594870.1 rhodopsin family protein _Beauveria bassiana ARSEF 2860_	OTHER	0.999242	0.000738	0.000056	0.000001	0.000001	0.000002	
XP_008594871.1 RNase P subunit p30 _Beauveria bassiana ARSEF 2860_	OTHER	1.000000	0.000000	0.000000	0.000000	0.000000	0.000000	
XP_008594872.1 uncharacterized protein BBA_01553 _Beauveria bassiana ARSEF 2860_	SP	0.000319	0.999006	0.000159	0.000183	0.000160	0.000141	CS pos: 25-26. Pr: 0.8300
XP_008594876.1 choline-sulfatase-like protein _Beauveria bassiana ARSEF 2860_	OTHER	1.000000	0.000000	0.000000	0.000000	0.000000	0.000000	
XP_008594879.1 triose-phosphate transporter _Beauveria bassiana ARSEF 2860_	OTHER	0.999925	0.000108	0.000000	0.000000	0.000000	0.000000	
XP_008594880.1 uncharacterized protein BBA_01561 _Beauveria bassiana ARSEF 2860_	OTHER	0.959286	0.039687	0.000239	0.000239	0.000157	0.000416	
XP_008594882.1 transcription initiation factor TFIID subunit 7 _Beauveria bassiana ARSEF 2860_	OTHER	1.000000	0.000000	0.000000	0.000000	0.000000	0.000000	
XP_008594883.1 uncharacterized protein BBA_01564 _Beauveria bassiana ARSEF 2860_	OTHER	1.000000	0.000000	0.000000	0.000000	0.000000	0.000000	
XP_008594884.1 kinesin motor domain-containing protein _Beauveria bassiana ARSEF 2860_	OTHER	1.000000	0.000003	0.000000	0.000000	0.000000	0.000000	
XP_008594885.1 uncharacterized protein BBA_01566 _Beauveria bassiana ARSEF 2860_	OTHER	1.000000	0.000000	0.000000	0.000000	0.000000	0.000000	
XP_008594889.1 adhesion regulating molecule _Beauveria bassiana ARSEF 2860_	OTHER	1.000000	0.000000	0.000000	0.000000	0.000000	0.000000	
XP_008594891.1 uncharacterized protein BBA_01572 _Beauveria bassiana ARSEF 2860_	OTHER	1.000000	0.000000	0.000000	0.000000	0.000000	0.000000	
XP_008594892.1 emp24_gp25L_p24 family_GOLD _Beauveria bassiana ARSEF 2860_	SP	0.000300	0.999029	0.000159	0.000180	0.000166	0.000150	CS pos: 22-23. Pr: 0.9699
XP_008594893.1 ADP-ribosylation factor family protein _Beauveria bassiana ARSEF 2860_	OTHER	1.000000	0.000000	0.000000	0.000000	0.000000	0.000000	
XP_008594894.1 ATPase protein _Beauveria bassiana ARSEF 2860_	OTHER	1.000000	0.000000	0.000000	0.000000	0.000000	0.000000	
XP_008594895.1 ribosomal protein L6e _Beauveria bassiana ARSEF 2860_	OTHER	1.000000	0.000000	0.000000	0.000000	0.000000	0.000000	
XP_008594897.1 thermoresistant glucokinase family carbohydrate kinase _Beauveria bassiana ARSEF 2860_	OTHER	1.000000	0.000000	0.000000	0.000000	0.000000	0.000000	
XP_008594898.1 2-oxoacid dehydrogenase acyltransferase _Beauveria bassiana ARSEF 2860_	OTHER	1.000000	0.000000	0.000000	0.000000	0.000000	0.000000	
XP_008594899.1 F1F0 ATPase complex assembly protein _Beauveria bassiana ARSEF 2860_	OTHER	1.000000	0.000000	0.000000	0.000000	0.000000	0.000000	
XP_008594901.1 putative ribosomal protein L35 _Beauveria bassiana ARSEF 2860_	OTHER	1.000000	0.000000	0.000000	0.000000	0.000000	0.000000	
XP_008594902.1 metalloregulatory protein _Beauveria bassiana ARSEF 2860_	OTHER	1.000000	0.000000	0.000000	0.000000	0.000000	0.000000	
XP_008594903.1 uncharacterized protein BBA_01584 _Beauveria bassiana ARSEF 2860_	OTHER	1.000000	0.000000	0.000000	0.000000	0.000000	0.000000	
XP_008594904.1 uncharacterized protein BBA_01585 _Beauveria bassiana ARSEF 2860_	OTHER	1.000000	0.000000	0.000000	0.000000	0.000000	0.000000	
XP_008594905.1 DEAD_DEAH box helicase _Beauveria bassiana ARSEF 2860_	OTHER	1.000000	0.000001	0.000000	0.000000	0.000000	0.000000	
XP_008594906.1 impB_mucB_samB family protein _Beauveria bassiana ARSEF 2860_	OTHER	1.000000	0.000004	0.000000	0.000000	0.000000	0.000000	
XP_008594908.1 xylose isomerase-like TIM barrel _Beauveria bassiana ARSEF 2860_	OTHER	1.000000	0.000000	0.000000	0.000000	0.000000	0.000000	
XP_008594910.1 quinate transporter _Beauveria bassiana ARSEF 2860_	OTHER	0.997961	0.001304	0.000619	0.000008	0.000003	0.000116	
XP_008594912.1 quinone oxidoreductase _Beauveria bassiana ARSEF 2860_	OTHER	1.000000	0.000001	0.000000	0.000000	0.000000	0.000000	
XP_008594913.1 uncharacterized protein BBA_01594 _Beauveria bassiana ARSEF 2860_	OTHER	1.000000	0.000001	0.000000	0.000000	0.000000	0.000000	
XP_008594914.1 uncharacterized protein BBA_01595 _Beauveria bassiana ARSEF 2860_	OTHER	1.000000	0.000000	0.000000	0.000000	0.000000	0.000000	
XP_008594915.1 uncharacterized protein BBA_01596 _Beauveria bassiana ARSEF 2860_	OTHER	1.000000	0.000001	0.000000	0.000000	0.000000	0.000000	
XP_008594917.1 proclavaminate amidinohydrolase _Beauveria bassiana ARSEF 2860_	SP	0.000353	0.998940	0.000160	0.000196	0.000160	0.000157	CS pos: 17-18. Pr: 0.9765
XP_008594919.1 cornichon protein _Beauveria bassiana ARSEF 2860_	OTHER	1.000000	0.000000	0.000000	0.000000	0.000000	0.000000	
XP_008594921.1 kynurenine 3-monooxygenase _Beauveria bassiana ARSEF 2860_	OTHER	1.000000	0.000000	0.000000	0.000000	0.000000	0.000000	
XP_008594922.1 mitochondrial 37S ribosomal protein S8 _Beauveria bassiana ARSEF 2860_	OTHER	1.000000	0.000000	0.000000	0.000000	0.000000	0.000000	
XP_008594923.1 uncharacterized protein BBA_01604 _Beauveria bassiana ARSEF 2860_	OTHER	0.999676	0.000311	0.000016	0.000002	0.000001	0.000004	
XP_008594924.1 uncharacterized protein BBA_01605 _Beauveria bassiana ARSEF 2860_	OTHER	0.750268	0.244356	0.001486	0.000537	0.000370	0.002985	
XP_008594925.1 isocitrate_isopropylmalate dehydrogenase _Beauveria bassiana ARSEF 2860_	OTHER	1.000000	0.000000	0.000000	0.000000	0.000000	0.000000	
XP_008594926.1 translation elongation factor G _Beauveria bassiana ARSEF 2860_	OTHER	1.000000	0.000000	0.000000	0.000000	0.000000	0.000000	
XP_008595572.1 cation efflux family protein _Beauveria bassiana ARSEF 2860_	SP	0.455682	0.539433	0.003663	0.000529	0.000300	0.000383	CS pos: 27-28. Pr: 0.3536
XP_008595574.1 uncharacterized protein BBA_02255 _Beauveria bassiana ARSEF 2860_	OTHER	1.000000	0.000000	0.000000	0.000000	0.000000	0.000000	
XP_008595576.1 uncharacterized protein BBA_02257 _Beauveria bassiana ARSEF 2860_	OTHER	1.000000	0.000001	0.000000	0.000000	0.000000	0.000000	
XP_008595577.1 fungal specific transcription factor _Beauveria bassiana ARSEF 2860_	OTHER	1.000000	0.000000	0.000000	0.000000	0.000000	0.000000	
XP_008595578.1 KRI1-like family protein _Beauveria bassiana ARSEF 2860_	OTHER	1.000000	0.000000	0.000000	0.000000	0.000000	0.000000	
XP_008595580.1 pre-mRNA-splicing factor 38B _Beauveria bassiana ARSEF 2860_	OTHER	1.000000	0.000001	0.000000	0.000000	0.000000	0.000000	
XP_008595581.1 phosphatidylinositol 3 _Beauveria bassiana ARSEF 2860_	OTHER	1.000000	0.000000	0.000000	0.000000	0.000000	0.000000	
XP_008595582.1 DNA polymerase epsilon subunit C _Beauveria bassiana ARSEF 2860_	OTHER	1.000000	0.000000	0.000000	0.000000	0.000000	0.000000	
XP_008595587.1 histone H4.1 _Beauveria bassiana ARSEF 2860_	OTHER	1.000000	0.000000	0.000000	0.000000	0.000000	0.000000	
XP_008595590.1 nuclear cap-binding protein subunit 2 _Beauveria bassiana ARSEF 2860_	OTHER	1.000000	0.000002	0.000000	0.000000	0.000000	0.000000	
XP_008595591.1 nuclear pore complex protein An-Nup82 _Beauveria bassiana ARSEF 2860_	OTHER	1.000000	0.000000	0.000000	0.000000	0.000000	0.000000	
XP_008595592.1 EBDP2-like protein _Beauveria bassiana ARSEF 2860_	OTHER	1.000000	0.000001	0.000000	0.000000	0.000000	0.000000	
XP_008595596.1 Ser_Thr protein phosphatase family protein _Beauveria bassiana ARSEF 2860_	SP	0.005276	0.583145	0.410775	0.000327	0.000231	0.000221	CS pos: 22-23. Pr: 0.5347
XP_008595598.1 AIG2-like family protein _Beauveria bassiana ARSEF 2860_	OTHER	0.999892	0.000064	0.000026	0.000001	0.000000	0.000013	
XP_008595599.1 mitogen-activated protein kinase kinase kinase _Beauveria bassiana ARSEF 2860_	OTHER	1.000000	0.000002	0.000000	0.000000	0.000000	0.000000	
XP_008595600.1 Zn-dependent alcohol dehydrogenases _ISS_ _Beauveria bassiana ARSEF 2860_	OTHER	1.000000	0.000000	0.000000	0.000000	0.000000	0.000000	
XP_008595601.1 uncharacterized protein BBA_02282 _Beauveria bassiana ARSEF 2860_	OTHER	1.000000	0.000000	0.000000	0.000000	0.000000	0.000000	
XP_008595603.1 Zn_II_2Cys6 transcriptional activator _Beauveria bassiana ARSEF 2860_	OTHER	1.000000	0.000000	0.000000	0.000000	0.000000	0.000000	
XP_008595605.1 protein tyrosine phosphatase _Pyp1_, putative _Beauveria bassiana ARSEF 2860_	OTHER	1.000000	0.000000	0.000000	0.000000	0.000000	0.000000	
XP_008595606.1 uncharacterized protein BBA_02287 _Beauveria bassiana ARSEF 2860_	OTHER	0.978542	0.021303	0.000075	0.000044	0.000021	0.000038	
XP_008595607.1 homeobox domain-containing protein _Beauveria bassiana ARSEF 2860_	OTHER	1.000000	0.000001	0.000000	0.000000	0.000000	0.000000	
XP_008595609.1 eukaryotic aspartyl protease _Beauveria bassiana ARSEF 2860_	SP	0.111472	0.886723	0.001084	0.000251	0.000225	0.000232	CS pos: 20-21. Pr: 0.8546
XP_008595610.1 V-type ATPase _Beauveria bassiana ARSEF 2860_	OTHER	1.000000	0.000000	0.000000	0.000000	0.000000	0.000000	
XP_008595611.1 vacuolar membrane protein pep3 _Beauveria bassiana ARSEF 2860_	OTHER	1.000000	0.000000	0.000000	0.000000	0.000000	0.000000	
XP_008595614.1 DnaJ-like protein _Beauveria bassiana ARSEF 2860_	OTHER	1.000000	0.000000	0.000000	0.000000	0.000000	0.000000	
XP_008595615.1 sugar porter family MFS transporter _Beauveria bassiana ARSEF 2860_	OTHER	0.999913	0.000060	0.000010	0.000000	0.000000	0.000014	
XP_008595616.1 putative aspartate aminotransferase _Beauveria bassiana ARSEF 2860_	OTHER	1.000000	0.000000	0.000000	0.000000	0.000000	0.000000	
XP_008595617.1 uncharacterized protein BBA_02298 _Beauveria bassiana ARSEF 2860_	OTHER	1.000000	0.000000	0.000000	0.000000	0.000000	0.000000	
XP_008595618.1 ribosomal L28 family protein _Beauveria bassiana ARSEF 2860_	OTHER	1.000000	0.000000	0.000000	0.000000	0.000000	0.000000	
XP_008595621.1 autophagy-related protein 8 _Beauveria bassiana ARSEF 2860_	OTHER	1.000000	0.000000	0.000000	0.000000	0.000000	0.000000	
XP_008595622.1 coproporphyrinogen III oxidase _Beauveria bassiana ARSEF 2860_	OTHER	0.999951	0.000056	0.000000	0.000000	0.000000	0.000000	
XP_008595624.1 proteasome regulatory subunit 12 _Beauveria bassiana ARSEF 2860_	OTHER	1.000000	0.000000	0.000000	0.000000	0.000000	0.000000	
XP_008595626.1 putative adenylate kinase _Beauveria bassiana ARSEF 2860_	OTHER	1.000000	0.000005	0.000000	0.000000	0.000000	0.000000	
XP_008595627.1 hook3 protein _Beauveria bassiana ARSEF 2860_	OTHER	1.000000	0.000000	0.000000	0.000000	0.000000	0.000000	
XP_008595628.1 serine proteinase inhibitor IA-2 _Beauveria bassiana ARSEF 2860_	SP	0.000285	0.998975	0.000185	0.000180	0.000178	0.000161	CS pos: 19-20. Pr: 0.9771
XP_008595629.1 Cytochrome P450 CYP621A2 _Beauveria bassiana ARSEF 2860_	OTHER	1.000000	0.000000	0.000000	0.000000	0.000000	0.000000	
XP_008595630.1 Cu_Zn superoxide dismutase _Beauveria bassiana ARSEF 2860_	OTHER	1.000000	0.000001	0.000000	0.000000	0.000000	0.000000	
XP_008595631.1 eukaryotic aspartyl protease _Beauveria bassiana ARSEF 2860_	OTHER	0.888299	0.110593	0.000573	0.000187	0.000129	0.000235	
XP_008595632.1 tudor domain-containing protein _Beauveria bassiana ARSEF 2860_	OTHER	1.000000	0.000000	0.000000	0.000000	0.000000	0.000000	
XP_008595633.1 integral membrane protein, putative _Beauveria bassiana ARSEF 2860_	OTHER	1.000000	0.000000	0.000000	0.000000	0.000000	0.000000	
XP_008595635.1 transaldolase-like protein _Beauveria bassiana ARSEF 2860_	OTHER	1.000000	0.000000	0.000000	0.000000	0.000000	0.000000	
XP_008595636.1 serine_threonine-protein kinase nak1 _Beauveria bassiana ARSEF 2860_	OTHER	1.000000	0.000000	0.000000	0.000000	0.000000	0.000000	
XP_008595637.1 Ser_Thr protein phosphatase family protein _Beauveria bassiana ARSEF 2860_	OTHER	1.000000	0.000002	0.000000	0.000000	0.000000	0.000000	
XP_008595639.1 ab-hydrolase associated lipase region _Beauveria bassiana ARSEF 2860_	OTHER	1.000000	0.000002	0.000000	0.000000	0.000000	0.000000	
XP_008595640.1 uncharacterized protein BBA_02321 _Beauveria bassiana ARSEF 2860_	OTHER	1.000000	0.000001	0.000000	0.000000	0.000000	0.000000	
XP_008595641.1 Myosin _Beauveria bassiana ARSEF 2860_	OTHER	1.000000	0.000001	0.000000	0.000000	0.000000	0.000000	
XP_008595642.1 ubiquitin carboxyl-terminal hydrolase, family 1 _Beauveria bassiana ARSEF 2860_	OTHER	0.999541	0.000440	0.000009	0.000002	0.000002	0.000012	
XP_008595643.1 protein kinase rad3 _Beauveria bassiana ARSEF 2860_	OTHER	1.000000	0.000000	0.000000	0.000000	0.000000	0.000000	
XP_008595644.1 sugar 1,4-lactone oxidase _Beauveria bassiana ARSEF 2860_	OTHER	1.000000	0.000043	0.000012	0.000000	0.000000	0.000000	
XP_008595645.1 sodium symporter family protein _Beauveria bassiana ARSEF 2860_	OTHER	1.000000	0.000000	0.000000	0.000000	0.000000	0.000000	
XP_008595646.1 uncharacterized protein BBA_02327 _Beauveria bassiana ARSEF 2860_	OTHER	1.000000	0.000000	0.000000	0.000000	0.000000	0.000000	
XP_008595647.1 octanoyltransferase-like protein _Beauveria bassiana ARSEF 2860_	OTHER	1.000000	0.000000	0.000000	0.000000	0.000000	0.000000	
XP_008595648.1 SUR7 protein _Beauveria bassiana ARSEF 2860_	OTHER	0.761732	0.231219	0.000931	0.000862	0.000506	0.004756	
XP_008595651.1 pyridoxamine 5_-phosphate oxidase _Beauveria bassiana ARSEF 2860_	OTHER	1.000000	0.000007	0.000000	0.000000	0.000000	0.000000	
XP_008596111.1 uncharacterized protein BBA_02792 _Beauveria bassiana ARSEF 2860_	OTHER	1.000000	0.000000	0.000000	0.000000	0.000000	0.000000	
XP_008596112.1 ankyrin repeat domain-containing protein 28 _Beauveria bassiana ARSEF 2860_	SP	0.287924	0.698414	0.007463	0.001141	0.000729	0.004311	CS pos: 16-17. Pr: 0.7688
XP_008596115.1 GNAT family acetyltransferase, putative _Beauveria bassiana ARSEF 2860_	OTHER	0.999954	0.000101	0.000001	0.000000	0.000000	0.000000	
XP_008596120.1 glutamine-dependent NAD___ synthetase synthase _Beauveria bassiana ARSEF 2860_	OTHER	1.000000	0.000000	0.000000	0.000000	0.000000	0.000000	
XP_008596121.1 fungal specific transcription factor _Beauveria bassiana ARSEF 2860_	OTHER	1.000000	0.000000	0.000000	0.000000	0.000000	0.000000	
XP_008596122.1 fumarylacetoacetase-like protein _Beauveria bassiana ARSEF 2860_	OTHER	1.000000	0.000000	0.000000	0.000000	0.000000	0.000000	
XP_008596125.1 splicing factor Spf30 _Beauveria bassiana ARSEF 2860_	OTHER	1.000000	0.000000	0.000000	0.000000	0.000000	0.000000	
XP_008596126.1 uncharacterized protein BBA_02807 _Beauveria bassiana ARSEF 2860_	OTHER	1.000000	0.000000	0.000000	0.000000	0.000000	0.000000	
XP_008596127.1 ABC1 family protein _Beauveria bassiana ARSEF 2860_	OTHER	1.000000	0.000000	0.000000	0.000000	0.000000	0.000000	
XP_008596129.1 suppressor protein SRP40 _Beauveria bassiana ARSEF 2860_	OTHER	1.000000	0.000000	0.000000	0.000000	0.000000	0.000000	
XP_008596130.1 penicillin-binding protein _Beauveria bassiana ARSEF 2860_	OTHER	1.000000	0.000003	0.000000	0.000000	0.000000	0.000000	
XP_008596131.1 NADH-ubiquinone oxidoreductase 30.4 kDa subunit _Beauveria bassiana ARSEF 2860_	OTHER	1.000000	0.000000	0.000000	0.000000	0.000000	0.000000	
XP_008596132.1 putative 2-oxoglutarate_malate translocator _Beauveria bassiana ARSEF 2860_	OTHER	0.999957	0.000088	0.000000	0.000000	0.000000	0.000000	
XP_008596133.1 Rad4 transglutaminase-like domain-containing protein _Beauveria bassiana ARSEF 2860_	OTHER	1.000000	0.000000	0.000000	0.000000	0.000000	0.000000	
XP_008596134.1 ABC transporter _Beauveria bassiana ARSEF 2860_	OTHER	1.000000	0.000010	0.000000	0.000000	0.000000	0.000000	
XP_008596135.1 putative phytochrome-like histidine kinase PHY1p _Beauveria bassiana ARSEF 2860_	OTHER	1.000000	0.000001	0.000000	0.000000	0.000000	0.000000	
XP_008596136.1 copper fist DNA binding domain-containing protein _Beauveria bassiana ARSEF 2860_	OTHER	0.999914	0.000137	0.000000	0.000000	0.000000	0.000000	
XP_008596137.1 uncharacterized protein BBA_02818 _Beauveria bassiana ARSEF 2860_	OTHER	1.000000	0.000000	0.000000	0.000000	0.000000	0.000000	
XP_008596140.1 amidase-like protein _Beauveria bassiana ARSEF 2860_	OTHER	1.000000	0.000001	0.000000	0.000000	0.000000	0.000000	
XP_008596144.1 proline transporter _Beauveria bassiana ARSEF 2860_	OTHER	0.999995	0.000021	0.000000	0.000000	0.000000	0.000000	
XP_008596146.1 methyltransferase domain-containing protein _Beauveria bassiana ARSEF 2860_	OTHER	1.000000	0.000000	0.000000	0.000000	0.000000	0.000000	
XP_008596148.1 casein kinase II regulatory subunit _Beauveria bassiana ARSEF 2860_	OTHER	1.000000	0.000000	0.000000	0.000000	0.000000	0.000000	
XP_008596149.1 JmjC domain-containing protein _Beauveria bassiana ARSEF 2860_	OTHER	1.000000	0.000000	0.000000	0.000000	0.000000	0.000000	
XP_008596151.1 elongation factor Tu GTP binding domain-containing protein _Beauveria bassiana ARSEF 2860_	OTHER	1.000000	0.000000	0.000000	0.000000	0.000000	0.000000	
