XP_008602148.1 uncharacterized protein BBA_08829 _Beauveria bassiana ARSEF 2860_	OTHER	1.000000	0.000000	0.000000	0.000000	0.000000	0.000000	
XP_008602149.1 uncharacterized protein BBA_08830 _Beauveria bassiana ARSEF 2860_	SP	0.178396	0.820104	0.000382	0.000451	0.000305	0.000336	CS pos: 22-23. Pr: 0.4443
XP_008602151.1 Alcohol dehydrogenase zinc-binding domain protein _Beauveria bassiana ARSEF 2860_	OTHER	1.000000	0.000000	0.000000	0.000000	0.000000	0.000000	
XP_008602152.1 uncharacterized protein BBA_08833 _Beauveria bassiana ARSEF 2860_	OTHER	1.000000	0.000000	0.000000	0.000000	0.000000	0.000000	
XP_008602154.1 SPFH domain_Band 7 family protein _Beauveria bassiana ARSEF 2860_	OTHER	1.000000	0.000000	0.000000	0.000000	0.000000	0.000000	
XP_008602156.1 glutathione S-transferase domain-containing protein _Beauveria bassiana ARSEF 2860_	OTHER	1.000000	0.000000	0.000000	0.000000	0.000000	0.000000	
XP_008602158.1 uncharacterized protein BBA_08839 _Beauveria bassiana ARSEF 2860_	OTHER	0.999982	0.000011	0.000000	0.000000	0.000000	0.000000	
XP_008602159.1 DUF218 domain-containing protein _Beauveria bassiana ARSEF 2860_	OTHER	1.000000	0.000000	0.000000	0.000000	0.000000	0.000000	
XP_008602160.1 DUF890 domain-containing protein _Beauveria bassiana ARSEF 2860_	OTHER	1.000000	0.000000	0.000000	0.000000	0.000000	0.000000	
XP_008602161.1 mucoidy inhibitor A _Beauveria bassiana ARSEF 2860_	OTHER	1.000000	0.000000	0.000000	0.000000	0.000000	0.000000	
XP_008602162.1 fungal specific transcription factor _Beauveria bassiana ARSEF 2860_	OTHER	1.000000	0.000000	0.000000	0.000000	0.000000	0.000000	
XP_008602163.1 eukaryotic aspartyl protease _Beauveria bassiana ARSEF 2860_	OTHER	0.999686	0.000373	0.000001	0.000001	0.000000	0.000000	
XP_008602164.1 H_ symporter family protein _Beauveria bassiana ARSEF 2860_	OTHER	0.999798	0.000192	0.000002	0.000000	0.000000	0.000009	
XP_008602165.1 uncharacterized protein BBA_08846 _Beauveria bassiana ARSEF 2860_	OTHER	1.000000	0.000000	0.000000	0.000000	0.000000	0.000000	
XP_008602166.1 transcription regulator PAB1642 _Beauveria bassiana ARSEF 2860_	OTHER	1.000000	0.000014	0.000000	0.000000	0.000000	0.000000	
XP_008602167.1 Ankyrin repeat protein _Beauveria bassiana ARSEF 2860_	OTHER	1.000000	0.000000	0.000000	0.000000	0.000000	0.000000	
XP_008602170.1 uncharacterized protein BBA_08851 _Beauveria bassiana ARSEF 2860_	SP	0.000255	0.999125	0.000157	0.000148	0.000142	0.000139	CS pos: 17-18. Pr: 0.9077
XP_008602171.1 WD repeat-containing protein _Beauveria bassiana ARSEF 2860_	OTHER	1.000000	0.000000	0.000000	0.000000	0.000000	0.000000	
XP_008602173.1 major facilitator superfamily transporter _Beauveria bassiana ARSEF 2860_	OTHER	1.000000	0.000000	0.000000	0.000000	0.000000	0.000000	
XP_008602174.1 myo-inositol-1_or 4_-monophosphatase _Beauveria bassiana ARSEF 2860_	OTHER	1.000000	0.000001	0.000000	0.000000	0.000000	0.000000	
XP_008602177.1 ribonuclease P protein subunit p29 _Beauveria bassiana ARSEF 2860_	OTHER	1.000000	0.000000	0.000000	0.000000	0.000000	0.000000	
XP_008602178.1 GYF domain-containing protein _Beauveria bassiana ARSEF 2860_	OTHER	0.999976	0.000066	0.000000	0.000000	0.000000	0.000000	
XP_008602181.1 xylose isomerase-like TIM barrel _Beauveria bassiana ARSEF 2860_	OTHER	1.000000	0.000000	0.000000	0.000000	0.000000	0.000000	
XP_008602182.1 metalloprotease 1 _Beauveria bassiana ARSEF 2860_	SP	0.000762	0.998457	0.000175	0.000214	0.000179	0.000182	CS pos: 18-19. Pr: 0.9591
XP_008602183.1 uncharacterized protein BBA_08864 _Beauveria bassiana ARSEF 2860_	OTHER	1.000000	0.000000	0.000000	0.000000	0.000000	0.000000	
XP_008602185.1 DHHC zinc finger domain-containing protein _Beauveria bassiana ARSEF 2860_	OTHER	1.000000	0.000000	0.000000	0.000000	0.000000	0.000000	
XP_008602186.1 uncharacterized protein BBA_08867 _Beauveria bassiana ARSEF 2860_	OTHER	0.999786	0.000213	0.000002	0.000001	0.000000	0.000001	
XP_008602187.1 phosphoserine phosphatase _Beauveria bassiana ARSEF 2860_	OTHER	1.000000	0.000016	0.000000	0.000000	0.000000	0.000000	
XP_008602189.1 uncharacterized protein BBA_08870 _Beauveria bassiana ARSEF 2860_	OTHER	1.000000	0.000000	0.000000	0.000000	0.000000	0.000000	
XP_008602191.1 uncharacterized protein BBA_08872 _Beauveria bassiana ARSEF 2860_	OTHER	1.000000	0.000000	0.000000	0.000000	0.000000	0.000000	
XP_008602192.1 tRNA wybutosine-synthesizing protein _Beauveria bassiana ARSEF 2860_	OTHER	1.000000	0.000002	0.000000	0.000000	0.000000	0.000000	
XP_008602193.1 ochre suppressor tyr-tRNA _Beauveria bassiana ARSEF 2860_	OTHER	1.000000	0.000000	0.000000	0.000000	0.000000	0.000000	
XP_008602194.1 ferric reductase like transmembrane component _Beauveria bassiana ARSEF 2860_	OTHER	0.999887	0.000134	0.000000	0.000000	0.000000	0.000000	
XP_008602195.1 siroheme synthase _Beauveria bassiana ARSEF 2860_	OTHER	1.000000	0.000000	0.000000	0.000000	0.000000	0.000000	
XP_008602197.1 transmembrane amino acid transporter _Beauveria bassiana ARSEF 2860_	OTHER	1.000000	0.000000	0.000000	0.000000	0.000000	0.000000	
XP_008602198.1 mitochondrial ribosomal protein S16 _Beauveria bassiana ARSEF 2860_	OTHER	1.000000	0.000000	0.000000	0.000000	0.000000	0.000000	
XP_008602199.1 apolipoprotein A-I binding protein _Beauveria bassiana ARSEF 2860_	OTHER	1.000000	0.000000	0.000000	0.000000	0.000000	0.000000	
XP_008602200.1 triacylglycerol lipase _Beauveria bassiana ARSEF 2860_	SP	0.001125	0.997856	0.000268	0.000239	0.000235	0.000250	CS pos: 21-22. Pr: 0.5384
XP_008602201.1 proline-specific permease _Beauveria bassiana ARSEF 2860_	OTHER	0.999916	0.000094	0.000000	0.000000	0.000000	0.000000	
XP_008602202.1 uncharacterized protein BBA_08883 _Beauveria bassiana ARSEF 2860_	SP	0.000213	0.999165	0.000158	0.000157	0.000141	0.000132	CS pos: 17-18. Pr: 0.9706
XP_008602204.1 deoxyribose-phosphate aldolase _Beauveria bassiana ARSEF 2860_	OTHER	1.000000	0.000002	0.000000	0.000000	0.000000	0.000000	
XP_008602205.1 thioredoxin-like protein _Beauveria bassiana ARSEF 2860_	OTHER	1.000000	0.000000	0.000000	0.000000	0.000000	0.000000	
XP_008602206.1 osmosensor protein MOS1 _Beauveria bassiana ARSEF 2860_	OTHER	1.000000	0.000019	0.000000	0.000000	0.000000	0.000000	
XP_008602208.1 uncharacterized protein BBA_08889 _Beauveria bassiana ARSEF 2860_	OTHER	1.000000	0.000001	0.000000	0.000000	0.000000	0.000000	
XP_008602213.1 NIPSNAP family protein _Beauveria bassiana ARSEF 2860_	OTHER	1.000000	0.000000	0.000000	0.000000	0.000000	0.000000	
XP_008602214.1 37S ribosomal protein Rsm22 _Beauveria bassiana ARSEF 2860_	OTHER	1.000000	0.000000	0.000000	0.000000	0.000000	0.000000	
XP_008602215.1 pyruvate dehydrogenase _Beauveria bassiana ARSEF 2860_	OTHER	0.999963	0.000038	0.000000	0.000000	0.000000	0.000000	
XP_008602216.1 longiborneol synthase _Beauveria bassiana ARSEF 2860_	OTHER	1.000000	0.000000	0.000000	0.000000	0.000000	0.000000	
XP_008602219.1 uncharacterized protein BBA_08900 _Beauveria bassiana ARSEF 2860_	OTHER	1.000000	0.000000	0.000000	0.000000	0.000000	0.000000	
XP_008602220.1 Peptidase S8_S53, subtilisin_kexin_sedolisin _Beauveria bassiana ARSEF 2860_	OTHER	1.000000	0.000000	0.000000	0.000000	0.000000	0.000000	
XP_008602223.1 uncharacterized protein BBA_08904 _Beauveria bassiana ARSEF 2860_	OTHER	1.000000	0.000000	0.000000	0.000000	0.000000	0.000000	
XP_008602225.1 NRD1 protein _Beauveria bassiana ARSEF 2860_	OTHER	1.000000	0.000000	0.000000	0.000000	0.000000	0.000000	
XP_008602226.1 Plasma membrane ATPase _Proton pump_ _Beauveria bassiana ARSEF 2860_	OTHER	1.000000	0.000000	0.000000	0.000000	0.000000	0.000000	
XP_008602228.1 BZIP transcription factor _Beauveria bassiana ARSEF 2860_	OTHER	1.000000	0.000013	0.000000	0.000000	0.000000	0.000000	
XP_008602229.1 acetate-CoA ligase _Beauveria bassiana ARSEF 2860_	OTHER	1.000000	0.000000	0.000000	0.000000	0.000000	0.000000	
XP_008602230.1 heterokaryon incompatibility protein _Beauveria bassiana ARSEF 2860_	OTHER	0.999767	0.000264	0.000003	0.000001	0.000000	0.000001	
XP_008602231.1 Blood coagulation inhibitor, Disintegrin _Beauveria bassiana ARSEF 2860_	SP	0.000269	0.999066	0.000164	0.000176	0.000156	0.000146	CS pos: 23-24. Pr: 0.9787
XP_008602232.1 uncharacterized protein BBA_08913 _Beauveria bassiana ARSEF 2860_	OTHER	1.000000	0.000000	0.000000	0.000000	0.000000	0.000000	
XP_008602233.1 eukaryotic integral membrane protein _Beauveria bassiana ARSEF 2860_	OTHER	1.000000	0.000000	0.000000	0.000000	0.000000	0.000000	
XP_008602234.1 LisH protein _Beauveria bassiana ARSEF 2860_	OTHER	1.000000	0.000000	0.000000	0.000000	0.000000	0.000000	
XP_008602235.1 carbonic anhydrase _Beauveria bassiana ARSEF 2860_	OTHER	1.000000	0.000000	0.000000	0.000000	0.000000	0.000000	
XP_008602236.1 uncharacterized protein BBA_08917 _Beauveria bassiana ARSEF 2860_	OTHER	1.000000	0.000000	0.000000	0.000000	0.000000	0.000000	
XP_008602239.1 60S ribosomal protein L3 _Beauveria bassiana ARSEF 2860_	OTHER	1.000000	0.000000	0.000000	0.000000	0.000000	0.000000	
XP_008602241.1 glucan 1, 4-alpha-glucosidase _Beauveria bassiana ARSEF 2860_	OTHER	1.000000	0.000000	0.000000	0.000000	0.000000	0.000000	
XP_008602242.1 anthranilate synthase component I _Beauveria bassiana ARSEF 2860_	OTHER	1.000000	0.000000	0.000000	0.000000	0.000000	0.000000	
XP_008602244.1 O-methyltransferase, family 3 _Beauveria bassiana ARSEF 2860_	OTHER	1.000000	0.000014	0.000000	0.000000	0.000000	0.000000	
XP_008602246.1 non-repetitive_WGA-negative nucleoporin _Beauveria bassiana ARSEF 2860_	OTHER	1.000000	0.000001	0.000000	0.000000	0.000000	0.000000	
XP_008602247.1 methyltransferase domain-containing protein _Beauveria bassiana ARSEF 2860_	OTHER	1.000000	0.000002	0.000000	0.000000	0.000000	0.000000	
XP_008602250.1 uncharacterized protein BBA_08931 _Beauveria bassiana ARSEF 2860_	OTHER	1.000000	0.000000	0.000000	0.000000	0.000000	0.000000	
XP_008602251.1 Putative Zn_II_2Cys6 transcription factor _Beauveria bassiana ARSEF 2860_	OTHER	1.000000	0.000011	0.000000	0.000000	0.000000	0.000000	
XP_008602252.1 uncharacterized protein BBA_08933 _Beauveria bassiana ARSEF 2860_	OTHER	1.000000	0.000000	0.000000	0.000000	0.000000	0.000000	
XP_008602253.1 proline dehydrogenase _Beauveria bassiana ARSEF 2860_	OTHER	1.000000	0.000000	0.000000	0.000000	0.000000	0.000000	
XP_008602254.1 methyltransferase domain-containing protein _Beauveria bassiana ARSEF 2860_	OTHER	1.000000	0.000000	0.000000	0.000000	0.000000	0.000000	
XP_008602255.1 pre-rRNA-processing protein ESF1 _Beauveria bassiana ARSEF 2860_	OTHER	1.000000	0.000008	0.000000	0.000000	0.000000	0.000000	
XP_008602256.1 lipase_thioesterase family protein _Beauveria bassiana ARSEF 2860_	OTHER	1.000000	0.000000	0.000000	0.000000	0.000000	0.000000	
XP_008602257.1 putative RNA helicase HCA4 _Beauveria bassiana ARSEF 2860_	OTHER	1.000000	0.000000	0.000000	0.000000	0.000000	0.000000	
XP_008602258.1 spindle pole body-associated protein sad1 _Beauveria bassiana ARSEF 2860_	OTHER	1.000000	0.000001	0.000000	0.000000	0.000000	0.000000	
XP_008602259.1 UDP-glucose 4-epimerase Gal10 _Beauveria bassiana ARSEF 2860_	OTHER	1.000000	0.000000	0.000000	0.000000	0.000000	0.000000	
XP_008602261.1 peptidase family M3 _Beauveria bassiana ARSEF 2860_	OTHER	1.000000	0.000003	0.000000	0.000000	0.000000	0.000000	
XP_008602262.1 uncharacterized protein BBA_08943 _Beauveria bassiana ARSEF 2860_	SP	0.000252	0.999093	0.000153	0.000174	0.000142	0.000136	CS pos: 23-24. Pr: 0.7208
XP_008602263.1 uncharacterized protein BBA_08944 _Beauveria bassiana ARSEF 2860_	OTHER	1.000000	0.000000	0.000000	0.000000	0.000000	0.000000	
XP_008602268.1 zinc-binding dehydrogenase _Beauveria bassiana ARSEF 2860_	OTHER	1.000000	0.000000	0.000000	0.000000	0.000000	0.000000	
XP_008602276.1 frequency clock protein _Beauveria bassiana ARSEF 2860_	OTHER	1.000000	0.000000	0.000000	0.000000	0.000000	0.000000	
XP_008602278.1 nitrate assimilation regulatory protein nirA _Beauveria bassiana ARSEF 2860_	OTHER	1.000000	0.000000	0.000000	0.000000	0.000000	0.000000	
XP_008602279.1 uncharacterized protein BBA_08960 _Beauveria bassiana ARSEF 2860_	OTHER	1.000000	0.000000	0.000000	0.000000	0.000000	0.000000	
XP_008602280.1 vegetative incompatibility protein HET-E-1 _Beauveria bassiana ARSEF 2860_	OTHER	1.000000	0.000000	0.000000	0.000000	0.000000	0.000000	
XP_008602281.1 FluG domain-containing protein _Beauveria bassiana ARSEF 2860_	OTHER	1.000000	0.000001	0.000000	0.000000	0.000000	0.000000	
XP_008602282.1 uncharacterized protein BBA_08963 _Beauveria bassiana ARSEF 2860_	OTHER	1.000000	0.000000	0.000000	0.000000	0.000000	0.000000	
XP_008602283.1 uncharacterized protein BBA_08964 _Beauveria bassiana ARSEF 2860_	OTHER	1.000000	0.000000	0.000000	0.000000	0.000000	0.000000	
XP_008602284.1 serine_threonine-protein kinase Sgk2 _Beauveria bassiana ARSEF 2860_	OTHER	1.000000	0.000001	0.000000	0.000000	0.000000	0.000000	
XP_008602285.1 uncharacterized protein BBA_08966 _Beauveria bassiana ARSEF 2860_	OTHER	1.000000	0.000001	0.000000	0.000000	0.000000	0.000000	
XP_008602286.1 fungal zinc cluster transcription factor _Beauveria bassiana ARSEF 2860_	OTHER	1.000000	0.000000	0.000000	0.000000	0.000000	0.000000	
XP_008602287.1 uncharacterized protein BBA_08968 _Beauveria bassiana ARSEF 2860_	OTHER	1.000000	0.000000	0.000000	0.000000	0.000000	0.000000	
XP_008602288.1 uncharacterized protein BBA_08969 _Beauveria bassiana ARSEF 2860_	OTHER	1.000000	0.000001	0.000000	0.000000	0.000000	0.000000	
XP_008602294.1 chaperone protein DnaJ _Beauveria bassiana ARSEF 2860_	OTHER	1.000000	0.000000	0.000000	0.000000	0.000000	0.000000	
XP_008602295.1 uncharacterized protein BBA_08976 _Beauveria bassiana ARSEF 2860_	OTHER	1.000000	0.000000	0.000000	0.000000	0.000000	0.000000	
XP_008602299.1 uncharacterized protein BBA_08980 _Beauveria bassiana ARSEF 2860_	SP	0.000445	0.998759	0.000173	0.000224	0.000202	0.000174	CS pos: 17-18. Pr: 0.9783
XP_008602300.1 uncharacterized protein BBA_08981 _Beauveria bassiana ARSEF 2860_	SP	0.144473	0.854374	0.000279	0.000325	0.000279	0.000257	CS pos: 15-16. Pr: 0.6664
XP_008602302.1 ABC transporter _Beauveria bassiana ARSEF 2860_	OTHER	1.000000	0.000000	0.000000	0.000000	0.000000	0.000000	
XP_008602303.1 ankyrin repeat-containing protein _Beauveria bassiana ARSEF 2860_	OTHER	1.000000	0.000000	0.000000	0.000000	0.000000	0.000000	
XP_008602305.1 general amidase-B _Beauveria bassiana ARSEF 2860_	OTHER	1.000000	0.000001	0.000000	0.000000	0.000000	0.000000	
XP_008602306.1 Protein kinase-like protein _Beauveria bassiana ARSEF 2860_	OTHER	0.999952	0.000064	0.000003	0.000000	0.000000	0.000000	
XP_008602307.1 uncharacterized protein BBA_08988 _Beauveria bassiana ARSEF 2860_	OTHER	1.000000	0.000001	0.000000	0.000000	0.000000	0.000000	
XP_008602308.1 short-chain dehydrogenase _Beauveria bassiana ARSEF 2860_	OTHER	1.000000	0.000000	0.000000	0.000000	0.000000	0.000000	
XP_008602311.1 branched-chain-amino-acid aminotransferase _Beauveria bassiana ARSEF 2860_	OTHER	0.999744	0.000293	0.000006	0.000001	0.000001	0.000002	
XP_008602312.1 conidial pigment biosynthesis scytalone dehydratase Arp1 _Beauveria bassiana ARSEF 2860_	OTHER	1.000000	0.000000	0.000000	0.000000	0.000000	0.000000	
XP_008602314.1 uncharacterized protein BBA_08995 _Beauveria bassiana ARSEF 2860_	OTHER	1.000000	0.000001	0.000000	0.000000	0.000000	0.000000	
XP_008602315.1 NADH-cytochrome b5 reductase _Beauveria bassiana ARSEF 2860_	OTHER	0.977043	0.022554	0.000155	0.000127	0.000053	0.000090	
XP_008602316.1 high-affinity methionine permease _Beauveria bassiana ARSEF 2860_	OTHER	1.000000	0.000000	0.000000	0.000000	0.000000	0.000000	
XP_008602318.1 cytochrome b5-like Heme_Steroid binding domain-containing protein _Beauveria bassiana ARSEF 2860_	OTHER	1.000000	0.000000	0.000000	0.000000	0.000000	0.000000	
XP_008602320.1 prenyltransferase, UbiA family protein _Beauveria bassiana ARSEF 2860_	OTHER	0.996866	0.003019	0.000075	0.000018	0.000009	0.000026	
XP_008602321.1 Glyoxalase domain-containing protein 5 _Beauveria bassiana ARSEF 2860_	OTHER	1.000000	0.000000	0.000000	0.000000	0.000000	0.000000	
XP_008602322.1 uncharacterized protein BBA_09003 _Beauveria bassiana ARSEF 2860_	OTHER	1.000000	0.000002	0.000000	0.000000	0.000000	0.000000	
XP_008602325.1 TBC domain-containing protein _Beauveria bassiana ARSEF 2860_	OTHER	1.000000	0.000001	0.000000	0.000000	0.000000	0.000000	
XP_008602326.1 ubiquitin-conjugating enzyme _Beauveria bassiana ARSEF 2860_	OTHER	1.000000	0.000003	0.000000	0.000000	0.000000	0.000000	
XP_008602327.1 nucleolar protein,Nop52 _Beauveria bassiana ARSEF 2860_	OTHER	1.000000	0.000000	0.000000	0.000000	0.000000	0.000000	
XP_008602331.1 Cytochrome P450 CYP617A1 _Beauveria bassiana ARSEF 2860_	OTHER	1.000000	0.000001	0.000000	0.000000	0.000000	0.000000	
XP_008602332.1 uncharacterized protein BBA_09013 _Beauveria bassiana ARSEF 2860_	OTHER	1.000000	0.000000	0.000000	0.000000	0.000000	0.000000	
XP_008602333.1 protein kinase domain protein _Beauveria bassiana ARSEF 2860_	OTHER	1.000000	0.000000	0.000000	0.000000	0.000000	0.000000	
XP_008602334.1 lipase_esterase, putative _Beauveria bassiana ARSEF 2860_	OTHER	0.999142	0.000516	0.000016	0.000004	0.000003	0.000353	
XP_008602339.1 uncharacterized protein BBA_09020 _Beauveria bassiana ARSEF 2860_	OTHER	0.999760	0.000213	0.000008	0.000002	0.000000	0.000003	
XP_008602346.1 putative transposase _Beauveria bassiana ARSEF 2860_	OTHER	1.000000	0.000000	0.000000	0.000000	0.000000	0.000000	
XP_008602347.1 Pfs, NACHT and Ankyrin domain protein _Beauveria bassiana ARSEF 2860_	OTHER	1.000000	0.000000	0.000000	0.000000	0.000000	0.000000	
XP_008602348.1 uncharacterized protein BBA_09029 _Beauveria bassiana ARSEF 2860_	OTHER	1.000000	0.000001	0.000000	0.000000	0.000000	0.000000	
XP_008602351.1 uncharacterized protein BBA_09032 _Beauveria bassiana ARSEF 2860_	OTHER	1.000000	0.000000	0.000000	0.000000	0.000000	0.000000	
XP_008602352.1 uncharacterized protein BBA_09033 _Beauveria bassiana ARSEF 2860_	SP	0.000308	0.999024	0.000157	0.000176	0.000157	0.000153	CS pos: 21-22. Pr: 0.6949
XP_008602353.1 FAD binding domain-containing protein _Beauveria bassiana ARSEF 2860_	OTHER	1.000000	0.000005	0.000000	0.000000	0.000000	0.000000	
XP_008602355.1 F-box domain-containing protein _Beauveria bassiana ARSEF 2860_	OTHER	1.000000	0.000015	0.000000	0.000000	0.000000	0.000000	
XP_008602356.1 C-x8-C-x5-C-x3-H type zinc finger protein _Beauveria bassiana ARSEF 2860_	OTHER	1.000000	0.000000	0.000000	0.000000	0.000000	0.000000	
XP_008602359.1 uncharacterized protein BBA_09040 _Beauveria bassiana ARSEF 2860_	OTHER	1.000000	0.000000	0.000000	0.000000	0.000000	0.000000	
XP_008602360.1 transposase-like protein _Beauveria bassiana ARSEF 2860_	OTHER	1.000000	0.000005	0.000000	0.000000	0.000000	0.000000	
XP_008602361.1 uncharacterized protein BBA_09042 _Beauveria bassiana ARSEF 2860_	OTHER	1.000000	0.000000	0.000000	0.000000	0.000000	0.000000	
XP_008602364.1 uncharacterized protein BBA_09045 _Beauveria bassiana ARSEF 2860_	OTHER	1.000000	0.000000	0.000000	0.000000	0.000000	0.000000	
XP_008602365.1 Cytochrome P450 CYP542B1 _Beauveria bassiana ARSEF 2860_	OTHER	1.000000	0.000000	0.000000	0.000000	0.000000	0.000000	
XP_008602366.1 uncharacterized protein BBA_09047 _Beauveria bassiana ARSEF 2860_	OTHER	0.755488	0.079562	0.157006	0.003473	0.003975	0.000491	
XP_008602367.1 uncharacterized protein BBA_09048 _Beauveria bassiana ARSEF 2860_	OTHER	1.000000	0.000000	0.000000	0.000000	0.000000	0.000000	
XP_008602368.1 RING finger domain protein _Beauveria bassiana ARSEF 2860_	OTHER	1.000000	0.000000	0.000000	0.000000	0.000000	0.000000	
XP_008602369.1 potassium_sodium efflux P-type ATPase _Beauveria bassiana ARSEF 2860_	OTHER	1.000000	0.000000	0.000000	0.000000	0.000000	0.000000	
XP_008602372.1 uncharacterized protein BBA_09053 _Beauveria bassiana ARSEF 2860_	OTHER	0.999750	0.000263	0.000005	0.000001	0.000001	0.000002	
XP_008602373.1 putative MEI5 protein _Beauveria bassiana ARSEF 2860_	OTHER	1.000000	0.000000	0.000000	0.000000	0.000000	0.000000	
XP_008602375.1 FluG domain-containing protein _Beauveria bassiana ARSEF 2860_	OTHER	1.000000	0.000000	0.000000	0.000000	0.000000	0.000000	
XP_008602376.1 nitrate assimilation regulatory protein nirA _Beauveria bassiana ARSEF 2860_	OTHER	1.000000	0.000000	0.000000	0.000000	0.000000	0.000000	
XP_008602377.1 fungal specific transcription factor _Beauveria bassiana ARSEF 2860_	OTHER	1.000000	0.000000	0.000000	0.000000	0.000000	0.000000	
XP_008602385.1 metalloprotease-like protein _Beauveria bassiana ARSEF 2860_	OTHER	1.000000	0.000000	0.000000	0.000000	0.000000	0.000000	
XP_008602386.1 uncharacterized protein BBA_09067 _Beauveria bassiana ARSEF 2860_	OTHER	0.999817	0.000157	0.000007	0.000001	0.000001	0.000002	
XP_008602387.1 ankyrin repeat protein _Beauveria bassiana ARSEF 2860_	OTHER	0.999712	0.000307	0.000005	0.000001	0.000001	0.000003	
XP_008602389.1 uncharacterized protein BBA_09070 _Beauveria bassiana ARSEF 2860_	SP	0.000216	0.999212	0.000146	0.000141	0.000132	0.000130	CS pos: 21-22. Pr: 0.7403
XP_008602391.1 uncharacterized protein BBA_09072 _Beauveria bassiana ARSEF 2860_	OTHER	1.000000	0.000000	0.000000	0.000000	0.000000	0.000000	
XP_008602392.1 transposase-like protein _Beauveria bassiana ARSEF 2860_	OTHER	1.000000	0.000000	0.000000	0.000000	0.000000	0.000000	
XP_008602394.1 uncharacterized protein BBA_09075 _Beauveria bassiana ARSEF 2860_	OTHER	1.000000	0.000012	0.000000	0.000000	0.000000	0.000000	
XP_008602397.1 beta-hexosaminidase _Beauveria bassiana ARSEF 2860_	OTHER	1.000000	0.000000	0.000000	0.000000	0.000000	0.000000	
XP_008602399.1 uncharacterized protein BBA_09080 _Beauveria bassiana ARSEF 2860_	SP	0.000353	0.998943	0.000176	0.000185	0.000159	0.000157	CS pos: 27-28. Pr: 0.7221
XP_008602402.1 uncharacterized protein BBA_09083 _Beauveria bassiana ARSEF 2860_	OTHER	1.000000	0.000001	0.000000	0.000000	0.000000	0.000000	
XP_008602403.1 actin filament organization protein _Beauveria bassiana ARSEF 2860_	OTHER	0.990620	0.009212	0.000077	0.000031	0.000027	0.000026	
XP_008602404.1 amidohydrolase-like protein _Beauveria bassiana ARSEF 2860_	OTHER	1.000000	0.000000	0.000000	0.000000	0.000000	0.000000	
XP_008602405.1 C6 transcription factor _Beauveria bassiana ARSEF 2860_	OTHER	1.000000	0.000000	0.000000	0.000000	0.000000	0.000000	
XP_008602406.1 beta-N-acetylglucosaminidase, putative _Beauveria bassiana ARSEF 2860_	OTHER	1.000000	0.000000	0.000000	0.000000	0.000000	0.000000	
XP_008602407.1 LPS glycosyltransferase, putative _Beauveria bassiana ARSEF 2860_	OTHER	1.000000	0.000007	0.000000	0.000000	0.000000	0.000000	
XP_008602411.1 putative dis1-suppressing protein kinase dsk1 _Beauveria bassiana ARSEF 2860_	OTHER	1.000000	0.000001	0.000000	0.000000	0.000000	0.000000	
XP_008602415.1 fungal specific transcription factor _Beauveria bassiana ARSEF 2860_	OTHER	1.000000	0.000006	0.000000	0.000000	0.000000	0.000000	
XP_008602416.1 uncharacterized protein BBA_09097 _Beauveria bassiana ARSEF 2860_	OTHER	1.000000	0.000000	0.000000	0.000000	0.000000	0.000000	
XP_008602417.1 homeobox and C2H2 transcription factor, putative _Beauveria bassiana ARSEF 2860_	OTHER	1.000000	0.000000	0.000000	0.000000	0.000000	0.000000	
XP_008602419.1 uncharacterized protein BBA_09100 _Beauveria bassiana ARSEF 2860_	OTHER	1.000000	0.000029	0.000001	0.000000	0.000000	0.000000	
XP_008602420.1 uncharacterized protein BBA_09101 _Beauveria bassiana ARSEF 2860_	OTHER	1.000000	0.000000	0.000000	0.000000	0.000000	0.000000	
XP_008602423.1 quercetin 2,3-dioxygenase _Beauveria bassiana ARSEF 2860_	SP	0.128307	0.812411	0.057814	0.000659	0.000382	0.000395	CS pos: 19-20. Pr: 0.6886
XP_008602424.1 uncharacterized protein BBA_09105 _Beauveria bassiana ARSEF 2860_	OTHER	1.000000	0.000000	0.000000	0.000000	0.000000	0.000000	
XP_008602426.1 uncharacterized protein BBA_09107 _Beauveria bassiana ARSEF 2860_	OTHER	1.000000	0.000000	0.000000	0.000000	0.000000	0.000000	
XP_008602427.1 uncharacterized protein BBA_09108 _Beauveria bassiana ARSEF 2860_	OTHER	1.000000	0.000000	0.000000	0.000000	0.000000	0.000000	
XP_008602428.1 Catalase-like domain, heme-dependent _Beauveria bassiana ARSEF 2860_	OTHER	0.886180	0.113077	0.000273	0.000184	0.000104	0.000192	
XP_008602429.1 tachykinin family protein _Beauveria bassiana ARSEF 2860_	OTHER	1.000000	0.000000	0.000000	0.000000	0.000000	0.000000	
XP_008602430.1 glucose-methanol-choline oxidoreductase _Beauveria bassiana ARSEF 2860_	OTHER	1.000000	0.000009	0.000000	0.000000	0.000000	0.000000	
XP_008602431.1 protein kinase subdomain-containing protein _Beauveria bassiana ARSEF 2860_	OTHER	1.000000	0.000000	0.000000	0.000000	0.000000	0.000000	
XP_008602432.1 epoxide hydrolase _Beauveria bassiana ARSEF 2860_	OTHER	1.000000	0.000000	0.000000	0.000000	0.000000	0.000000	
XP_008602433.1 LPS-induced tumor necrosis factor alpha factor _Beauveria bassiana ARSEF 2860_	OTHER	1.000000	0.000000	0.000000	0.000000	0.000000	0.000000	
XP_008602434.1 Cupin family protein _Beauveria bassiana ARSEF 2860_	SP	0.000253	0.999126	0.000156	0.000163	0.000154	0.000132	CS pos: 23-24. Pr: 0.9741
XP_008602436.1 haloalkanoic acid dehalogenase, putative _Beauveria bassiana ARSEF 2860_	OTHER	1.000000	0.000000	0.000000	0.000000	0.000000	0.000000	
XP_008602437.1 flavonol synthase_flavanone 3-hydroxylase _Beauveria bassiana ARSEF 2860_	OTHER	1.000000	0.000000	0.000000	0.000000	0.000000	0.000000	
XP_008602438.1 phosphoesterase-like protein _Beauveria bassiana ARSEF 2860_	SP	0.000314	0.999045	0.000172	0.000148	0.000153	0.000151	CS pos: 17-18. Pr: 0.8633
XP_008602439.1 hydrolase-like protein _Beauveria bassiana ARSEF 2860_	OTHER	1.000000	0.000000	0.000000	0.000000	0.000000	0.000000	
XP_008602442.1 multidrug resistance protein MDR, putative _Beauveria bassiana ARSEF 2860_	OTHER	1.000000	0.000005	0.000000	0.000000	0.000000	0.000000	
XP_008602443.1 protein kinase domain protein _Beauveria bassiana ARSEF 2860_	OTHER	0.999811	0.000226	0.000001	0.000000	0.000000	0.000000	
XP_008602444.1 fungal specific transcription factor _Beauveria bassiana ARSEF 2860_	OTHER	1.000000	0.000000	0.000000	0.000000	0.000000	0.000000	
