XP_008594170.1 small oligopeptide transporter, OPT family _Beauveria bassiana ARSEF 2860_	OTHER	1.000000	0.000000	0.000000	0.000000	0.000000	0.000000	
XP_008594171.1 capsule-associated protein CAP1 _Beauveria bassiana ARSEF 2860_	OTHER	1.000000	0.000001	0.000000	0.000000	0.000000	0.000000	
XP_008594172.1 SPRY domain-containing protein _Beauveria bassiana ARSEF 2860_	OTHER	1.000000	0.000004	0.000000	0.000000	0.000000	0.000000	
XP_008594173.1 uncharacterized protein BBA_00854 _Beauveria bassiana ARSEF 2860_	OTHER	0.912660	0.086196	0.000467	0.000290	0.000168	0.000242	
XP_008594174.1 uncharacterized protein BBA_00855 _Beauveria bassiana ARSEF 2860_	OTHER	1.000000	0.000003	0.000000	0.000000	0.000000	0.000000	
XP_008594175.1 uncharacterized protein BBA_00856 _Beauveria bassiana ARSEF 2860_	OTHER	1.000000	0.000000	0.000000	0.000000	0.000000	0.000000	
XP_008594176.1 endonuclease_Exonuclease_phosphatase protein _Beauveria bassiana ARSEF 2860_	OTHER	1.000000	0.000003	0.000000	0.000000	0.000000	0.000000	
XP_008594177.1 uncharacterized protein BBA_00858 _Beauveria bassiana ARSEF 2860_	OTHER	1.000000	0.000000	0.000000	0.000000	0.000000	0.000000	
XP_008594178.1 Putative Zn_II_2Cys6 transcription factor _Beauveria bassiana ARSEF 2860_	OTHER	1.000000	0.000000	0.000000	0.000000	0.000000	0.000000	
XP_008594179.1 uncharacterized protein BBA_00860 _Beauveria bassiana ARSEF 2860_	OTHER	1.000000	0.000000	0.000000	0.000000	0.000000	0.000000	
XP_008594180.1 C6 transcription factor _Beauveria bassiana ARSEF 2860_	OTHER	1.000000	0.000000	0.000000	0.000000	0.000000	0.000000	
XP_008594181.1 uncharacterized protein BBA_00862 _Beauveria bassiana ARSEF 2860_	OTHER	1.000000	0.000004	0.000000	0.000000	0.000000	0.000000	
XP_008594182.1 Importin beta-2 subunit _Beauveria bassiana ARSEF 2860_	OTHER	1.000000	0.000000	0.000000	0.000000	0.000000	0.000000	
XP_008594185.1 putative NADPH-dependent beta-ketoacyl reductase _rhlG_ _Beauveria bassiana ARSEF 2860_	OTHER	1.000000	0.000000	0.000000	0.000000	0.000000	0.000000	
XP_008594186.1 uncharacterized protein BBA_00867 _Beauveria bassiana ARSEF 2860_	OTHER	1.000000	0.000000	0.000000	0.000000	0.000000	0.000000	
XP_008594187.1 G-protein coupled receptor _Beauveria bassiana ARSEF 2860_	OTHER	1.000000	0.000001	0.000000	0.000000	0.000000	0.000000	
XP_008594188.1 uncharacterized protein BBA_00869 _Beauveria bassiana ARSEF 2860_	OTHER	1.000000	0.000000	0.000000	0.000000	0.000000	0.000000	
XP_008594189.1 permease-like protein _Beauveria bassiana ARSEF 2860_	OTHER	1.000000	0.000000	0.000000	0.000000	0.000000	0.000000	
XP_008594190.1 26S proteasome-associated ubiquitin carboxyl-terminal hydrolase _Beauveria bassiana ARSEF 2860_	OTHER	1.000000	0.000000	0.000000	0.000000	0.000000	0.000000	
XP_008594191.1 ubiquitin family protein _Beauveria bassiana ARSEF 2860_	OTHER	1.000000	0.000000	0.000000	0.000000	0.000000	0.000000	
XP_008594192.1 phosphatidylserine decarboxylase _Beauveria bassiana ARSEF 2860_	OTHER	1.000000	0.000000	0.000000	0.000000	0.000000	0.000000	
XP_008594193.1 FAD binding domain-containing protein _Beauveria bassiana ARSEF 2860_	OTHER	1.000000	0.000001	0.000000	0.000000	0.000000	0.000000	
XP_008594194.1 ATPase protein _Beauveria bassiana ARSEF 2860_	OTHER	1.000000	0.000000	0.000000	0.000000	0.000000	0.000000	
XP_008594198.1 Kinase binding protein CGI-121 _Beauveria bassiana ARSEF 2860_	OTHER	1.000000	0.000000	0.000000	0.000000	0.000000	0.000000	
XP_008594200.1 Cytochrome P450 CYP541A2 _Beauveria bassiana ARSEF 2860_	OTHER	1.000000	0.000000	0.000000	0.000000	0.000000	0.000000	
XP_008594201.1 RING-6 protein _Beauveria bassiana ARSEF 2860_	OTHER	1.000000	0.000000	0.000000	0.000000	0.000000	0.000000	
XP_008594202.1 cyclopropane-fatty-acyl-phospholipid synthase _Beauveria bassiana ARSEF 2860_	OTHER	0.999510	0.000500	0.000000	0.000000	0.000000	0.000000	
XP_008594203.1 uncharacterized protein BBA_00884 _Beauveria bassiana ARSEF 2860_	OTHER	1.000000	0.000012	0.000000	0.000000	0.000000	0.000000	
XP_008594204.1 kinesin-like protein _Beauveria bassiana ARSEF 2860_	OTHER	1.000000	0.000000	0.000000	0.000000	0.000000	0.000000	
XP_008594205.1 fungal specific transcription factor _Beauveria bassiana ARSEF 2860_	OTHER	1.000000	0.000003	0.000000	0.000000	0.000000	0.000000	
XP_008594206.1 kynureninase-like protein _Beauveria bassiana ARSEF 2860_	OTHER	1.000000	0.000000	0.000000	0.000000	0.000000	0.000000	
XP_008594207.1 indoleamine 2,3-dioxygenase _Beauveria bassiana ARSEF 2860_	OTHER	1.000000	0.000001	0.000000	0.000000	0.000000	0.000000	
XP_008594208.1 5_-nucleotidase domain-containing protein _Beauveria bassiana ARSEF 2860_	SP	0.000317	0.999090	0.000151	0.000155	0.000127	0.000127	CS pos: 18-19. Pr: 0.9643
XP_008594598.1 eukaryotic translation initiation factor eIF2A _Beauveria bassiana ARSEF 2860_	OTHER	1.000000	0.000009	0.000000	0.000000	0.000000	0.000000	
XP_008594599.1 transcription factor Rba50 _Beauveria bassiana ARSEF 2860_	OTHER	1.000000	0.000000	0.000000	0.000000	0.000000	0.000000	
XP_008594600.1 uncharacterized protein BBA_01281 _Beauveria bassiana ARSEF 2860_	SP	0.000319	0.998979	0.000162	0.000191	0.000168	0.000156	CS pos: 17-18. Pr: 0.9721
XP_008594602.1 major facilitator superfamily transporter _Beauveria bassiana ARSEF 2860_	OTHER	0.999740	0.000251	0.000006	0.000001	0.000000	0.000007	
XP_008594603.1 CP2 transcription factor _Beauveria bassiana ARSEF 2860_	OTHER	1.000000	0.000000	0.000000	0.000000	0.000000	0.000000	
XP_008594604.1 Acyl-CoA N-acyltransferase _Beauveria bassiana ARSEF 2860_	OTHER	1.000000	0.000000	0.000000	0.000000	0.000000	0.000000	
XP_008594605.1 tat pathway signal sequence _Beauveria bassiana ARSEF 2860_	OTHER	1.000000	0.000013	0.000000	0.000000	0.000000	0.000000	
XP_008594606.1 eIF4-gamma_eIF5_eIF2-epsilon _Beauveria bassiana ARSEF 2860_	OTHER	1.000000	0.000000	0.000000	0.000000	0.000000	0.000000	
XP_008594607.1 HSF-type DNA-binding protein _Beauveria bassiana ARSEF 2860_	OTHER	1.000000	0.000000	0.000000	0.000000	0.000000	0.000000	
XP_008594608.1 eukaryotic and archaeal DNA primase small subunit _Beauveria bassiana ARSEF 2860_	OTHER	1.000000	0.000001	0.000000	0.000000	0.000000	0.000000	
XP_008594609.1 tRNA m_1_G methyltransferase domain-containing protein _Beauveria bassiana ARSEF 2860_	OTHER	1.000000	0.000000	0.000000	0.000000	0.000000	0.000000	
XP_008594610.1 Tim17_Tim22_Tim23 family protein _Beauveria bassiana ARSEF 2860_	OTHER	0.999907	0.000098	0.000001	0.000000	0.000000	0.000000	
XP_008594611.1 DNA mismatch repair protein MSH2 _Beauveria bassiana ARSEF 2860_	OTHER	1.000000	0.000000	0.000000	0.000000	0.000000	0.000000	
XP_008594613.1 zinc_iron transporter protein _Beauveria bassiana ARSEF 2860_	SP	0.006341	0.992594	0.000258	0.000313	0.000242	0.000246	CS pos: 18-19. Pr: 0.9568
XP_008594614.1 uncharacterized protein BBA_01295 _Beauveria bassiana ARSEF 2860_	OTHER	1.000000	0.000000	0.000000	0.000000	0.000000	0.000000	
XP_008594615.1 kinesin heavy chain _Beauveria bassiana ARSEF 2860_	OTHER	1.000000	0.000001	0.000000	0.000000	0.000000	0.000000	
XP_008594616.1 mitochondrial protein Fmp26, putative _Beauveria bassiana ARSEF 2860_	OTHER	1.000000	0.000000	0.000000	0.000000	0.000000	0.000000	
XP_008594617.1 monocarboxylate permease-like protein _Beauveria bassiana ARSEF 2860_	OTHER	1.000000	0.000019	0.000000	0.000000	0.000000	0.000000	
XP_008594618.1 uncharacterized protein BBA_01299 _Beauveria bassiana ARSEF 2860_	OTHER	1.000000	0.000000	0.000000	0.000000	0.000000	0.000000	
XP_008594620.1 T-complex protein 1 _Beauveria bassiana ARSEF 2860_	OTHER	1.000000	0.000001	0.000000	0.000000	0.000000	0.000000	
XP_008594621.1 Zinc finger, H2C2-type, histone UAS binding protein _Beauveria bassiana ARSEF 2860_	OTHER	1.000000	0.000000	0.000000	0.000000	0.000000	0.000000	
XP_008594622.1 ribosomal protein S2 _Beauveria bassiana ARSEF 2860_	OTHER	1.000000	0.000000	0.000000	0.000000	0.000000	0.000000	
XP_008594623.1 metallothionein expression activator _Beauveria bassiana ARSEF 2860_	OTHER	1.000000	0.000000	0.000000	0.000000	0.000000	0.000000	
XP_008594625.1 Programmed cell death protein 2 _Beauveria bassiana ARSEF 2860_	OTHER	0.999925	0.000091	0.000007	0.000000	0.000000	0.000006	
XP_008594626.1 GANP_Nin1_mts3_eIF-3 p25 family protein _Beauveria bassiana ARSEF 2860_	OTHER	1.000000	0.000000	0.000000	0.000000	0.000000	0.000000	
XP_008594627.1 DNA ligase I _Beauveria bassiana ARSEF 2860_	OTHER	1.000000	0.000000	0.000000	0.000000	0.000000	0.000000	
XP_008594629.1 BolA domain-containing protein _Beauveria bassiana ARSEF 2860_	OTHER	1.000000	0.000000	0.000000	0.000000	0.000000	0.000000	
XP_008594631.1 uncharacterized protein BBA_01312 _Beauveria bassiana ARSEF 2860_	OTHER	1.000000	0.000000	0.000000	0.000000	0.000000	0.000000	
XP_008594634.1 RecQ mediated genome instability protein Rmi1 _Beauveria bassiana ARSEF 2860_	OTHER	1.000000	0.000000	0.000000	0.000000	0.000000	0.000000	
XP_008594636.1 glycoside hydrolase family 5 _Beauveria bassiana ARSEF 2860_	OTHER	1.000000	0.000000	0.000000	0.000000	0.000000	0.000000	
XP_008594637.1 MAP kinase kinase kinase _Beauveria bassiana ARSEF 2860_	OTHER	1.000000	0.000000	0.000000	0.000000	0.000000	0.000000	
XP_008594638.1 mannosyl-oligosaccharide 1,2-alpha-mannosidase IB _Beauveria bassiana ARSEF 2860_	OTHER	1.000000	0.000003	0.000000	0.000000	0.000000	0.000000	
XP_008594639.1 uncharacterized protein BBA_01320 _Beauveria bassiana ARSEF 2860_	LIPO	0.003228	0.025854	0.970911	0.000010	0.000005	0.000002	CS pos: 38-39. Pr: 0.9472
XP_008594640.1 RINT-1 family protein _Beauveria bassiana ARSEF 2860_	OTHER	1.000000	0.000002	0.000000	0.000000	0.000000	0.000000	
XP_008594641.1 carrier protein YMC1, mitochondrial _Beauveria bassiana ARSEF 2860_	OTHER	1.000000	0.000000	0.000000	0.000000	0.000000	0.000000	
XP_008594642.1 Sec34-like family protein _Beauveria bassiana ARSEF 2860_	OTHER	1.000000	0.000000	0.000000	0.000000	0.000000	0.000000	
XP_008594643.1 uncharacterized protein BBA_01324 _Beauveria bassiana ARSEF 2860_	SP	0.000245	0.999096	0.000167	0.000171	0.000151	0.000144	CS pos: 17-18. Pr: 0.9848
XP_008594644.1 rRNA processing protein _Beauveria bassiana ARSEF 2860_	OTHER	0.999945	0.000073	0.000000	0.000000	0.000000	0.000000	
XP_008594645.1 protein-tyrosine phosphatase _Beauveria bassiana ARSEF 2860_	OTHER	1.000000	0.000000	0.000000	0.000000	0.000000	0.000000	
XP_008594646.1 uncharacterized protein BBA_01327 _Beauveria bassiana ARSEF 2860_	OTHER	1.000000	0.000000	0.000000	0.000000	0.000000	0.000000	
XP_008594647.1 uncharacterized protein BBA_01328 _Beauveria bassiana ARSEF 2860_	OTHER	1.000000	0.000000	0.000000	0.000000	0.000000	0.000000	
XP_008594650.1 helix-turn-helix domain-containing protein _Beauveria bassiana ARSEF 2860_	OTHER	1.000000	0.000000	0.000000	0.000000	0.000000	0.000000	
XP_008594651.1 Amidase family protein _Beauveria bassiana ARSEF 2860_	OTHER	1.000000	0.000000	0.000000	0.000000	0.000000	0.000000	
XP_008594652.1 SAGA complex protein _Beauveria bassiana ARSEF 2860_	OTHER	1.000000	0.000000	0.000000	0.000000	0.000000	0.000000	
XP_008594653.1 large conductance mechanosensitive channel protein _Beauveria bassiana ARSEF 2860_	OTHER	0.999888	0.000110	0.000001	0.000001	0.000001	0.000001	
XP_008594654.1 GPI anchored glycoprotein, putative _Beauveria bassiana ARSEF 2860_	SP	0.000244	0.999184	0.000145	0.000151	0.000137	0.000130	CS pos: 20-21. Pr: 0.9638
XP_008594655.1 bicyclomycin resistance protein _Beauveria bassiana ARSEF 2860_	OTHER	1.000000	0.000000	0.000000	0.000000	0.000000	0.000000	
XP_008594656.1 uncharacterized protein BBA_01337 _Beauveria bassiana ARSEF 2860_	SP	0.002436	0.978139	0.018743	0.000260	0.000210	0.000177	CS pos: 22-23. Pr: 0.7862
XP_008594657.1 glycosyl hydrolase family 76 _Beauveria bassiana ARSEF 2860_	SP	0.000706	0.998421	0.000196	0.000251	0.000216	0.000199	CS pos: 15-16. Pr: 0.9635
XP_008594658.1 histidinol-phosphate aminotransferase _Beauveria bassiana ARSEF 2860_	OTHER	0.999966	0.000068	0.000001	0.000000	0.000000	0.000000	
XP_008594659.1 uncharacterized protein BBA_01340 _Beauveria bassiana ARSEF 2860_	OTHER	1.000000	0.000002	0.000000	0.000000	0.000000	0.000000	
XP_008594660.1 uncharacterized protein BBA_01341 _Beauveria bassiana ARSEF 2860_	OTHER	1.000000	0.000002	0.000000	0.000000	0.000000	0.000000	
XP_008594662.1 pyridoxamine 5_-phosphate oxidase _Beauveria bassiana ARSEF 2860_	OTHER	1.000000	0.000000	0.000000	0.000000	0.000000	0.000000	
XP_008594747.1 ASF1 like histone chaperone _Beauveria bassiana ARSEF 2860_	OTHER	1.000000	0.000001	0.000000	0.000000	0.000000	0.000000	
XP_008594749.1 AhpC_TSA family protein _Beauveria bassiana ARSEF 2860_	OTHER	1.000000	0.000000	0.000000	0.000000	0.000000	0.000000	
XP_008594751.1 putative EXO1 protein _Beauveria bassiana ARSEF 2860_	OTHER	1.000000	0.000005	0.000000	0.000000	0.000000	0.000000	
XP_008594753.1 rhomboid family protein _Beauveria bassiana ARSEF 2860_	OTHER	1.000000	0.000000	0.000000	0.000000	0.000000	0.000000	
XP_008594756.1 methyl transferase _Beauveria bassiana ARSEF 2860_	OTHER	1.000000	0.000001	0.000000	0.000000	0.000000	0.000000	
XP_008594757.1 transcription factor IIA _Beauveria bassiana ARSEF 2860_	OTHER	1.000000	0.000000	0.000000	0.000000	0.000000	0.000000	
XP_008594758.1 WD domain-containing protein _Beauveria bassiana ARSEF 2860_	OTHER	1.000000	0.000000	0.000000	0.000000	0.000000	0.000000	
XP_008594759.1 kelch domain-containing protein _Beauveria bassiana ARSEF 2860_	OTHER	1.000000	0.000000	0.000000	0.000000	0.000000	0.000000	
XP_008594760.1 zinc finger protein SFP1 _Beauveria bassiana ARSEF 2860_	OTHER	1.000000	0.000006	0.000000	0.000000	0.000000	0.000000	
XP_008594762.1 kelch domain-containing protein _Beauveria bassiana ARSEF 2860_	OTHER	1.000000	0.000000	0.000000	0.000000	0.000000	0.000000	
XP_008594763.1 dihydrouridine synthase _Beauveria bassiana ARSEF 2860_	OTHER	1.000000	0.000000	0.000000	0.000000	0.000000	0.000000	
XP_008594764.1 peroxin 13 _Beauveria bassiana ARSEF 2860_	OTHER	1.000000	0.000026	0.000000	0.000000	0.000000	0.000000	
XP_008594765.1 uncharacterized protein BBA_01446 _Beauveria bassiana ARSEF 2860_	OTHER	1.000000	0.000000	0.000000	0.000000	0.000000	0.000000	
XP_008594766.1 SNARE-complex protein Syntaxin-18 _Beauveria bassiana ARSEF 2860_	OTHER	1.000000	0.000000	0.000000	0.000000	0.000000	0.000000	
XP_008594767.1 uncharacterized protein BBA_01448 _Beauveria bassiana ARSEF 2860_	SP	0.237719	0.547946	0.211336	0.001709	0.000707	0.000577	CS pos: 41-42. Pr: 0.3647
XP_008594768.1 aminotransferase class I and II _Beauveria bassiana ARSEF 2860_	OTHER	1.000000	0.000000	0.000000	0.000000	0.000000	0.000000	
XP_008594770.1 uncharacterized protein BBA_01451 _Beauveria bassiana ARSEF 2860_	OTHER	1.000000	0.000000	0.000000	0.000000	0.000000	0.000000	
XP_008594771.1 NMD3 family protein _Beauveria bassiana ARSEF 2860_	OTHER	1.000000	0.000003	0.000000	0.000000	0.000000	0.000000	
XP_008594774.1 uncharacterized protein BBA_01455 _Beauveria bassiana ARSEF 2860_	OTHER	1.000000	0.000000	0.000000	0.000000	0.000000	0.000000	
XP_008594775.1 uncharacterized protein BBA_01456 _Beauveria bassiana ARSEF 2860_	OTHER	1.000000	0.000000	0.000000	0.000000	0.000000	0.000000	
XP_008594776.1 phosphomevalonate kinase _Beauveria bassiana ARSEF 2860_	OTHER	1.000000	0.000001	0.000000	0.000000	0.000000	0.000000	
XP_008594777.1 pentatricopeptide repeat domain-containing protein _Beauveria bassiana ARSEF 2860_	OTHER	1.000000	0.000000	0.000000	0.000000	0.000000	0.000000	
XP_008594781.1 translation elongation factor G _Beauveria bassiana ARSEF 2860_	OTHER	1.000000	0.000000	0.000000	0.000000	0.000000	0.000000	
XP_008594782.1 uncharacterized protein BBA_01463 _Beauveria bassiana ARSEF 2860_	OTHER	1.000000	0.000000	0.000000	0.000000	0.000000	0.000000	
XP_008594783.1 Actin-like protein _Beauveria bassiana ARSEF 2860_	OTHER	1.000000	0.000000	0.000000	0.000000	0.000000	0.000000	
XP_008594784.1 uncharacterized protein BBA_01465 _Beauveria bassiana ARSEF 2860_	OTHER	1.000000	0.000006	0.000000	0.000000	0.000000	0.000000	
XP_008594785.1 beta-glucosidase _Beauveria bassiana ARSEF 2860_	SP	0.001058	0.998127	0.000233	0.000223	0.000176	0.000167	CS pos: 23-24. Pr: 0.9481
XP_008594786.1 PCI domain-containing protein _Beauveria bassiana ARSEF 2860_	OTHER	1.000000	0.000000	0.000000	0.000000	0.000000	0.000000	
XP_008594787.1 acetyl-CoA acetyltransferase _Beauveria bassiana ARSEF 2860_	OTHER	1.000000	0.000000	0.000000	0.000000	0.000000	0.000000	
XP_008594790.1 uncharacterized protein BBA_01471 _Beauveria bassiana ARSEF 2860_	OTHER	1.000000	0.000000	0.000000	0.000000	0.000000	0.000000	
XP_008594792.1 DUF292 domain-containing protein _Beauveria bassiana ARSEF 2860_	OTHER	1.000000	0.000000	0.000000	0.000000	0.000000	0.000000	
XP_008594793.1 AP-2 complex subunit sigma _Beauveria bassiana ARSEF 2860_	OTHER	1.000000	0.000000	0.000000	0.000000	0.000000	0.000000	
XP_008594794.1 protein of unknown function DUF2422 _Beauveria bassiana ARSEF 2860_	OTHER	0.999997	0.000004	0.000000	0.000000	0.000000	0.000000	
XP_008594795.1 transcription initiation factor IID _Beauveria bassiana ARSEF 2860_	OTHER	1.000000	0.000000	0.000000	0.000000	0.000000	0.000000	
XP_008594796.1 leucine carboxyl methyltransferase _Beauveria bassiana ARSEF 2860_	OTHER	0.998861	0.001157	0.000003	0.000002	0.000001	0.000003	
XP_008594797.1 hydantoinase B_oxoprolinase _Beauveria bassiana ARSEF 2860_	OTHER	1.000000	0.000000	0.000000	0.000000	0.000000	0.000000	
XP_008594800.1 ubiquitin carrier protein _Beauveria bassiana ARSEF 2860_	OTHER	1.000000	0.000021	0.000000	0.000000	0.000000	0.000000	
XP_008594801.1 kinesin-like protein _Beauveria bassiana ARSEF 2860_	OTHER	1.000000	0.000000	0.000000	0.000000	0.000000	0.000000	
XP_008594802.1 DnaJ domain-containing protein _Beauveria bassiana ARSEF 2860_	OTHER	1.000000	0.000000	0.000000	0.000000	0.000000	0.000000	
XP_008594803.1 Cobalamin _vitamin B12_ biosynthesis CobW _Beauveria bassiana ARSEF 2860_	OTHER	1.000000	0.000000	0.000000	0.000000	0.000000	0.000000	
XP_008594805.1 C6 finger domain protein, putative _Beauveria bassiana ARSEF 2860_	OTHER	0.986216	0.013649	0.000073	0.000031	0.000017	0.000032	
XP_008594806.1 MOSC domain-containing protein _Beauveria bassiana ARSEF 2860_	OTHER	1.000000	0.000010	0.000000	0.000000	0.000000	0.000000	
XP_008594808.1 inner centromere protein _Beauveria bassiana ARSEF 2860_	OTHER	1.000000	0.000000	0.000000	0.000000	0.000000	0.000000	
XP_008594809.1 ATP-dependent RNA helicase mss116 _Beauveria bassiana ARSEF 2860_	OTHER	1.000000	0.000000	0.000000	0.000000	0.000000	0.000000	
XP_008594810.1 WD domain-containing protein _Beauveria bassiana ARSEF 2860_	OTHER	1.000000	0.000000	0.000000	0.000000	0.000000	0.000000	
XP_008594812.1 riboflavin-specific deaminase domain-containing protein _Beauveria bassiana ARSEF 2860_	OTHER	1.000000	0.000002	0.000000	0.000000	0.000000	0.000000	
XP_008594813.1 lipase 1 precursor _Beauveria bassiana ARSEF 2860_	SP	0.000216	0.999197	0.000158	0.000147	0.000133	0.000128	CS pos: 21-22. Pr: 0.9809
XP_008594814.1 uncharacterized protein BBA_01495 _Beauveria bassiana ARSEF 2860_	OTHER	1.000000	0.000019	0.000000	0.000000	0.000000	0.000000	
XP_008594815.1 Ribokinase, bacterial _Beauveria bassiana ARSEF 2860_	OTHER	1.000000	0.000000	0.000000	0.000000	0.000000	0.000000	
XP_008594816.1 uncharacterized protein BBA_01497 _Beauveria bassiana ARSEF 2860_	OTHER	1.000000	0.000000	0.000000	0.000000	0.000000	0.000000	
XP_008594817.1 ubiquitin-conjugating enzyme _Beauveria bassiana ARSEF 2860_	OTHER	1.000000	0.000001	0.000000	0.000000	0.000000	0.000000	
XP_008594818.1 nitrate assimilation regulatory protein nirA _Beauveria bassiana ARSEF 2860_	OTHER	1.000000	0.000000	0.000000	0.000000	0.000000	0.000000	
XP_008594819.1 DUF1014 domain protein _Beauveria bassiana ARSEF 2860_	OTHER	1.000000	0.000000	0.000000	0.000000	0.000000	0.000000	
XP_008594820.1 major facilitator superfamily transporter _Beauveria bassiana ARSEF 2860_	OTHER	1.000000	0.000018	0.000000	0.000000	0.000000	0.000000	
XP_008594821.1 fungal specific transcription factor _Beauveria bassiana ARSEF 2860_	OTHER	1.000000	0.000000	0.000000	0.000000	0.000000	0.000000	
XP_008594822.1 uncharacterized protein BBA_01503 _Beauveria bassiana ARSEF 2860_	OTHER	0.998266	0.001738	0.000000	0.000000	0.000000	0.000000	
XP_008594823.1 Intradiol ring-cleavage dioxygenase, core _Beauveria bassiana ARSEF 2860_	OTHER	1.000000	0.000030	0.000000	0.000000	0.000000	0.000000	
XP_008594824.1 peptidase family M20_M25_M40 protein _Beauveria bassiana ARSEF 2860_	OTHER	1.000000	0.000000	0.000000	0.000000	0.000000	0.000000	
XP_008594825.1 FAD dependent oxidoreductase _Beauveria bassiana ARSEF 2860_	OTHER	1.000000	0.000001	0.000000	0.000000	0.000000	0.000000	
XP_008594828.1 uncharacterized protein BBA_01509 _Beauveria bassiana ARSEF 2860_	OTHER	1.000000	0.000007	0.000000	0.000000	0.000000	0.000000	
XP_008594830.1 SNF2 family DNA-dependent ATPase _Beauveria bassiana ARSEF 2860_	OTHER	1.000000	0.000000	0.000000	0.000000	0.000000	0.000000	
XP_008594831.1 Spc97_Spc98 family protein _Beauveria bassiana ARSEF 2860_	OTHER	1.000000	0.000000	0.000000	0.000000	0.000000	0.000000	
XP_008594833.1 C6 finger domain protein _Beauveria bassiana ARSEF 2860_	OTHER	1.000000	0.000000	0.000000	0.000000	0.000000	0.000000	
XP_008594834.1 Cytochrome P450 CYP548A5 _Beauveria bassiana ARSEF 2860_	OTHER	1.000000	0.000000	0.000000	0.000000	0.000000	0.000000	
XP_008594835.1 Frag1_DRAM_Sfk1 family protein _Beauveria bassiana ARSEF 2860_	OTHER	1.000000	0.000011	0.000000	0.000000	0.000000	0.000000	
XP_008594836.1 U3 small nucleolar RNA-associated protein 6 _Beauveria bassiana ARSEF 2860_	OTHER	1.000000	0.000000	0.000000	0.000000	0.000000	0.000000	
XP_008594837.1 DNA polymerase family B _Beauveria bassiana ARSEF 2860_	OTHER	1.000000	0.000000	0.000000	0.000000	0.000000	0.000000	
XP_008594838.1 uncharacterized protein BBA_01519 _Beauveria bassiana ARSEF 2860_	OTHER	1.000000	0.000000	0.000000	0.000000	0.000000	0.000000	
XP_008594840.1 aldose 1-epimerase _Beauveria bassiana ARSEF 2860_	OTHER	1.000000	0.000009	0.000000	0.000000	0.000000	0.000000	
XP_008594841.1 transcriptional regulator, putative _Beauveria bassiana ARSEF 2860_	OTHER	1.000000	0.000000	0.000000	0.000000	0.000000	0.000000	
XP_008594844.1 microtubule-associated protein _Beauveria bassiana ARSEF 2860_	OTHER	1.000000	0.000000	0.000000	0.000000	0.000000	0.000000	
XP_008594846.1 uncharacterized protein BBA_01527 _Beauveria bassiana ARSEF 2860_	OTHER	1.000000	0.000000	0.000000	0.000000	0.000000	0.000000	
XP_008594847.1 frequency clock protein _Beauveria bassiana ARSEF 2860_	OTHER	1.000000	0.000000	0.000000	0.000000	0.000000	0.000000	
XP_008594848.1 prenylcysteine oxidase _Beauveria bassiana ARSEF 2860_	SP	0.473242	0.525715	0.000310	0.000238	0.000223	0.000261	CS pos: 21-22. Pr: 0.4372
XP_008594849.1 VID27 cytoplasmic protein _Beauveria bassiana ARSEF 2860_	OTHER	1.000000	0.000000	0.000000	0.000000	0.000000	0.000000	
XP_008594850.1 heterokaryon incompatibility protein _Beauveria bassiana ARSEF 2860_	OTHER	1.000000	0.000000	0.000000	0.000000	0.000000	0.000000	
XP_008594851.1 trehalose-6-phosphate synthase _Beauveria bassiana ARSEF 2860_	OTHER	1.000000	0.000000	0.000000	0.000000	0.000000	0.000000	
XP_008594852.1 3_-5_ exonuclease _Beauveria bassiana ARSEF 2860_	OTHER	1.000000	0.000000	0.000000	0.000000	0.000000	0.000000	
XP_008594853.1 ATP synthase protein 9 _Beauveria bassiana ARSEF 2860_	OTHER	1.000000	0.000000	0.000000	0.000000	0.000000	0.000000	
XP_008594854.1 DnaJ domain-containing protein _Beauveria bassiana ARSEF 2860_	SP	0.002577	0.995129	0.001623	0.000199	0.000205	0.000222	CS pos: 18-19. Pr: 0.9519
XP_008594855.1 uncharacterized protein BBA_01536 _Beauveria bassiana ARSEF 2860_	OTHER	1.000000	0.000007	0.000000	0.000000	0.000000	0.000000	
XP_008594856.1 uncharacterized protein BBA_01537 _Beauveria bassiana ARSEF 2860_	OTHER	1.000000	0.000000	0.000000	0.000000	0.000000	0.000000	
XP_008594857.1 PET112 family protein _Beauveria bassiana ARSEF 2860_	OTHER	1.000000	0.000000	0.000000	0.000000	0.000000	0.000000	
XP_008594858.1 uncharacterized protein BBA_01539 _Beauveria bassiana ARSEF 2860_	OTHER	1.000000	0.000000	0.000000	0.000000	0.000000	0.000000	
XP_008594859.1 uncharacterized protein BBA_01540 _Beauveria bassiana ARSEF 2860_	SP	0.000211	0.999187	0.000153	0.000167	0.000144	0.000139	CS pos: 24-25. Pr: 0.8103
XP_008594861.1 putative APC1 protein _Beauveria bassiana ARSEF 2860_	OTHER	1.000000	0.000002	0.000000	0.000000	0.000000	0.000000	
XP_008594862.1 eIF3 subunit 6 N terminal domain-containing protein _Beauveria bassiana ARSEF 2860_	OTHER	1.000000	0.000000	0.000000	0.000000	0.000000	0.000000	
XP_008594864.1 arid_bright DNA binding domain-containing protein _Beauveria bassiana ARSEF 2860_	OTHER	1.000000	0.000000	0.000000	0.000000	0.000000	0.000000	
XP_008594866.1 uncharacterized protein BBA_01547 _Beauveria bassiana ARSEF 2860_	OTHER	1.000000	0.000020	0.000001	0.000000	0.000000	0.000000	
XP_008594867.1 peroxisomal half ABC transporter _Beauveria bassiana ARSEF 2860_	OTHER	0.998256	0.001666	0.000021	0.000004	0.000003	0.000032	
XP_008594868.1 NLI interacting factor-like phosphatase _Beauveria bassiana ARSEF 2860_	OTHER	1.000000	0.000000	0.000000	0.000000	0.000000	0.000000	
XP_008594869.1 Glycosyl transferase, family 28 _Beauveria bassiana ARSEF 2860_	OTHER	1.000000	0.000001	0.000000	0.000000	0.000000	0.000000	
XP_008594870.1 rhodopsin family protein _Beauveria bassiana ARSEF 2860_	OTHER	0.999242	0.000738	0.000056	0.000001	0.000001	0.000002	
XP_008594871.1 RNase P subunit p30 _Beauveria bassiana ARSEF 2860_	OTHER	1.000000	0.000000	0.000000	0.000000	0.000000	0.000000	
XP_008594872.1 uncharacterized protein BBA_01553 _Beauveria bassiana ARSEF 2860_	SP	0.000319	0.999006	0.000159	0.000183	0.000160	0.000141	CS pos: 25-26. Pr: 0.8300
XP_008594873.1 oxidoreductase-like protein _Beauveria bassiana ARSEF 2860_	OTHER	1.000000	0.000000	0.000000	0.000000	0.000000	0.000000	
XP_008594875.1 RNA polymerase II mediator complex component Med8 _Beauveria bassiana ARSEF 2860_	OTHER	1.000000	0.000000	0.000000	0.000000	0.000000	0.000000	
