XP_008596466.1 Di-trans-poly-cis-decaprenylcistransferase-like protein _Beauveria bassiana ARSEF 2860_	OTHER	1.000000	0.000000	0.000000	0.000000	0.000000	0.000000	
XP_008596467.1 glycoside hydrolase family 63 _Beauveria bassiana ARSEF 2860_	OTHER	1.000000	0.000001	0.000000	0.000000	0.000000	0.000000	
XP_008596468.1 putative oligomycin sensitivity conferring protein _ATP5_ _Beauveria bassiana ARSEF 2860_	OTHER	1.000000	0.000001	0.000000	0.000000	0.000000	0.000000	
XP_008596469.1 putative MOB1 protein _Beauveria bassiana ARSEF 2860_	OTHER	1.000000	0.000001	0.000000	0.000000	0.000000	0.000000	
XP_008596472.1 methyltransferase domain-containing protein _Beauveria bassiana ARSEF 2860_	OTHER	1.000000	0.000001	0.000000	0.000000	0.000000	0.000000	
XP_008596474.1 Ras family protein _Beauveria bassiana ARSEF 2860_	OTHER	1.000000	0.000000	0.000000	0.000000	0.000000	0.000000	
XP_008596475.1 DASH complex subunit Dad1 _Beauveria bassiana ARSEF 2860_	OTHER	1.000000	0.000001	0.000000	0.000000	0.000000	0.000000	
XP_008596476.1 myb-like DNA-binding domain-containing protein _Beauveria bassiana ARSEF 2860_	OTHER	1.000000	0.000000	0.000000	0.000000	0.000000	0.000000	
XP_008596477.1 Deoxyhypusine synthase _DHS_ _Beauveria bassiana ARSEF 2860_	OTHER	1.000000	0.000000	0.000000	0.000000	0.000000	0.000000	
XP_008596478.1 aldo-keto reductase _AKR_, putative _Beauveria bassiana ARSEF 2860_	OTHER	1.000000	0.000000	0.000000	0.000000	0.000000	0.000000	
XP_008596479.1 dimeric dihydrodiol dehydrogenase _Beauveria bassiana ARSEF 2860_	OTHER	1.000000	0.000000	0.000000	0.000000	0.000000	0.000000	
XP_008596481.1 myb-like DNA-binding domain-containing protein _Beauveria bassiana ARSEF 2860_	OTHER	1.000000	0.000000	0.000000	0.000000	0.000000	0.000000	
XP_008596482.1 uncharacterized protein BBA_03163 _Beauveria bassiana ARSEF 2860_	OTHER	0.999977	0.000005	0.000020	0.000000	0.000000	0.000002	
XP_008596483.1 CAP-Gly domain-containing protein _Beauveria bassiana ARSEF 2860_	OTHER	1.000000	0.000000	0.000000	0.000000	0.000000	0.000000	
XP_008596484.1 RING-7 protein _Beauveria bassiana ARSEF 2860_	SP	0.001493	0.997398	0.000311	0.000301	0.000250	0.000221	CS pos: 25-26. Pr: 0.8583
XP_008596485.1 uncharacterized protein BBA_03166 _Beauveria bassiana ARSEF 2860_	OTHER	1.000000	0.000000	0.000000	0.000000	0.000000	0.000000	
XP_008596486.1 glycosyl hydrolase 53 domain-containing protein _Beauveria bassiana ARSEF 2860_	SP	0.000351	0.998990	0.000170	0.000152	0.000145	0.000136	CS pos: 21-22. Pr: 0.9750
XP_008596487.1 uncharacterized protein BBA_03168 _Beauveria bassiana ARSEF 2860_	OTHER	1.000000	0.000000	0.000000	0.000000	0.000000	0.000000	
XP_008596488.1 Putative Gal4-like transcriptional regulator _Beauveria bassiana ARSEF 2860_	OTHER	1.000000	0.000000	0.000000	0.000000	0.000000	0.000000	
XP_008596490.1 mitochondrial ATP synthase _Beauveria bassiana ARSEF 2860_	OTHER	1.000000	0.000000	0.000000	0.000000	0.000000	0.000000	
XP_008596491.1 Mak10 subunit _Beauveria bassiana ARSEF 2860_	OTHER	1.000000	0.000000	0.000000	0.000000	0.000000	0.000000	
XP_008596492.1 peroxisomal membrane protein PMP47B _Beauveria bassiana ARSEF 2860_	OTHER	0.997090	0.002871	0.000009	0.000010	0.000007	0.000061	
XP_008596493.1 uncharacterized protein BBA_03174 _Beauveria bassiana ARSEF 2860_	OTHER	1.000000	0.000002	0.000000	0.000000	0.000000	0.000000	
XP_008596494.1 RhoGEF domain-containing protein _Beauveria bassiana ARSEF 2860_	OTHER	1.000000	0.000001	0.000000	0.000000	0.000000	0.000000	
XP_008596495.1 NAD dependent epimerase_dehydratase _Beauveria bassiana ARSEF 2860_	OTHER	1.000000	0.000001	0.000000	0.000000	0.000000	0.000000	
XP_008596497.1 uncharacterized protein BBA_03178 _Beauveria bassiana ARSEF 2860_	OTHER	1.000000	0.000010	0.000000	0.000000	0.000000	0.000000	
XP_008596498.1 calcium-transporting ATPase _Beauveria bassiana ARSEF 2860_	OTHER	1.000000	0.000000	0.000000	0.000000	0.000000	0.000000	
XP_008596499.1 acriflavine sensitivity control protein acr-2 _Beauveria bassiana ARSEF 2860_	OTHER	1.000000	0.000000	0.000000	0.000000	0.000000	0.000000	
XP_008596500.1 putative zinc finger protein _Beauveria bassiana ARSEF 2860_	OTHER	1.000000	0.000000	0.000000	0.000000	0.000000	0.000000	
XP_008596501.1 uncharacterized protein BBA_03182 _Beauveria bassiana ARSEF 2860_	OTHER	1.000000	0.000000	0.000000	0.000000	0.000000	0.000000	
XP_008596502.1 uncharacterized protein BBA_03183 _Beauveria bassiana ARSEF 2860_	OTHER	1.000000	0.000000	0.000000	0.000000	0.000000	0.000000	
XP_008596503.1 uncharacterized protein BBA_03184 _Beauveria bassiana ARSEF 2860_	OTHER	1.000000	0.000000	0.000000	0.000000	0.000000	0.000000	
XP_008596507.1 uncharacterized protein BBA_03188 _Beauveria bassiana ARSEF 2860_	OTHER	1.000000	0.000000	0.000000	0.000000	0.000000	0.000000	
XP_008596509.1 HORMA domain-containing protein _Beauveria bassiana ARSEF 2860_	OTHER	0.999967	0.000031	0.000000	0.000000	0.000000	0.000000	
XP_008596510.1 argininosuccinate lyase _Beauveria bassiana ARSEF 2860_	OTHER	1.000000	0.000001	0.000000	0.000000	0.000000	0.000000	
XP_008596511.1 uncharacterized protein BBA_03192 _Beauveria bassiana ARSEF 2860_	OTHER	1.000000	0.000010	0.000001	0.000000	0.000000	0.000000	
XP_008596512.1 uncharacterized protein BBA_03193 _Beauveria bassiana ARSEF 2860_	OTHER	1.000000	0.000007	0.000000	0.000000	0.000000	0.000000	
XP_008596513.1 RasGEF domain-containing protein _Beauveria bassiana ARSEF 2860_	OTHER	1.000000	0.000000	0.000000	0.000000	0.000000	0.000000	
XP_008596514.1 uncharacterized protein BBA_03195 _Beauveria bassiana ARSEF 2860_	OTHER	1.000000	0.000000	0.000000	0.000000	0.000000	0.000000	
XP_008596516.1 HIRA-interacting protein _Beauveria bassiana ARSEF 2860_	OTHER	1.000000	0.000000	0.000000	0.000000	0.000000	0.000000	
XP_008596517.1 suppressor protein PSP1 _Beauveria bassiana ARSEF 2860_	OTHER	1.000000	0.000001	0.000000	0.000000	0.000000	0.000000	
XP_008596519.1 60S ribosomal protein L15 _Beauveria bassiana ARSEF 2860_	OTHER	1.000000	0.000000	0.000000	0.000000	0.000000	0.000000	
XP_008596521.1 phospholipase C PLC-C _Beauveria bassiana ARSEF 2860_	SP	0.000215	0.999160	0.000146	0.000172	0.000153	0.000137	CS pos: 23-24. Pr: 0.9645
XP_008596523.1 X-Pro dipeptidyl-peptidase, putative _Beauveria bassiana ARSEF 2860_	OTHER	1.000000	0.000000	0.000000	0.000000	0.000000	0.000000	
XP_008596524.1 uncharacterized protein BBA_03205 _Beauveria bassiana ARSEF 2860_	OTHER	1.000000	0.000000	0.000000	0.000000	0.000000	0.000000	
XP_008596525.1 acid phosphatase _Beauveria bassiana ARSEF 2860_	SP	0.000190	0.999197	0.000160	0.000149	0.000151	0.000130	CS pos: 21-22. Pr: 0.9772
XP_008596526.1 amidase-like protein _Beauveria bassiana ARSEF 2860_	SP	0.000254	0.999132	0.000204	0.000138	0.000133	0.000127	CS pos: 24-25. Pr: 0.9718
XP_008596527.1 fungal specific transcription factor _Beauveria bassiana ARSEF 2860_	OTHER	1.000000	0.000000	0.000000	0.000000	0.000000	0.000000	
XP_008596528.1 sodium_hydrogen exchanger family protein _Beauveria bassiana ARSEF 2860_	OTHER	1.000000	0.000000	0.000000	0.000000	0.000000	0.000000	
XP_008596529.1 uncharacterized protein BBA_03210 _Beauveria bassiana ARSEF 2860_	OTHER	1.000000	0.000000	0.000000	0.000000	0.000000	0.000000	
XP_008596531.1 phthalate transporter _Beauveria bassiana ARSEF 2860_	OTHER	0.999803	0.000199	0.000000	0.000000	0.000000	0.000001	
XP_008596533.1 uncharacterized protein BBA_03214 _Beauveria bassiana ARSEF 2860_	OTHER	1.000000	0.000000	0.000000	0.000000	0.000000	0.000000	
XP_008596536.1 DUF1479 domain protein _Beauveria bassiana ARSEF 2860_	OTHER	1.000000	0.000000	0.000000	0.000000	0.000000	0.000000	
XP_008596537.1 microtubule associated protein _Beauveria bassiana ARSEF 2860_	OTHER	1.000000	0.000006	0.000000	0.000000	0.000000	0.000000	
XP_008596538.1 uncharacterized protein BBA_03219 _Beauveria bassiana ARSEF 2860_	OTHER	1.000000	0.000003	0.000000	0.000000	0.000000	0.000000	
XP_008596539.1 uncharacterized protein BBA_03220 _Beauveria bassiana ARSEF 2860_	OTHER	1.000000	0.000013	0.000000	0.000000	0.000000	0.000000	
XP_008596541.1 serine_threonine protein kinase _Beauveria bassiana ARSEF 2860_	OTHER	1.000000	0.000000	0.000000	0.000000	0.000000	0.000000	
XP_008596542.1 capsular associated protein _Beauveria bassiana ARSEF 2860_	OTHER	0.771718	0.226243	0.001549	0.000127	0.000124	0.000241	
XP_008596543.1 Ribosomal RNA adenine methylase transferase _Beauveria bassiana ARSEF 2860_	OTHER	1.000000	0.000000	0.000000	0.000000	0.000000	0.000000	
XP_008596544.1 transaldolase-like protein _Beauveria bassiana ARSEF 2860_	OTHER	1.000000	0.000000	0.000000	0.000000	0.000000	0.000000	
XP_008596547.1 STAM-binding protein _Beauveria bassiana ARSEF 2860_	OTHER	1.000000	0.000026	0.000000	0.000000	0.000000	0.000000	
XP_008596548.1 uncharacterized protein BBA_03229 _Beauveria bassiana ARSEF 2860_	SP	0.000243	0.999114	0.000149	0.000163	0.000136	0.000132	CS pos: 19-20. Pr: 0.9783
XP_008596550.1 chorismate synthase _Beauveria bassiana ARSEF 2860_	OTHER	1.000000	0.000000	0.000000	0.000000	0.000000	0.000000	
XP_008596551.1 OPT oligopeptide transporter _Beauveria bassiana ARSEF 2860_	OTHER	1.000000	0.000000	0.000000	0.000000	0.000000	0.000000	
XP_008596553.1 uncharacterized protein BBA_03234 _Beauveria bassiana ARSEF 2860_	OTHER	1.000000	0.000000	0.000000	0.000000	0.000000	0.000000	
XP_008596555.1 class 2 chitin synthase _Beauveria bassiana ARSEF 2860_	OTHER	1.000000	0.000000	0.000000	0.000000	0.000000	0.000000	
XP_008596556.1 sulfite reductase hemoprotein _Beauveria bassiana ARSEF 2860_	OTHER	1.000000	0.000000	0.000000	0.000000	0.000000	0.000000	
XP_008596557.1 DUF1753 domain-containing protein _Beauveria bassiana ARSEF 2860_	OTHER	0.997811	0.002027	0.000128	0.000002	0.000002	0.000007	
XP_008596559.1 Ras family protein _Beauveria bassiana ARSEF 2860_	OTHER	1.000000	0.000000	0.000000	0.000000	0.000000	0.000000	
XP_008596560.1 p60 domain-containing protein _Beauveria bassiana ARSEF 2860_	OTHER	1.000000	0.000000	0.000000	0.000000	0.000000	0.000000	
XP_008596561.1 putative alternative NADH dehydrogenase _Beauveria bassiana ARSEF 2860_	OTHER	1.000000	0.000000	0.000000	0.000000	0.000000	0.000000	
XP_008596563.1 HLH transcription factor _Beauveria bassiana ARSEF 2860_	OTHER	1.000000	0.000000	0.000000	0.000000	0.000000	0.000000	
XP_008596564.1 cell wall protein _Beauveria bassiana ARSEF 2860_	SP	0.000234	0.999157	0.000138	0.000154	0.000139	0.000131	CS pos: 18-19. Pr: 0.9803
XP_008596566.1 cell wall protein _Beauveria bassiana ARSEF 2860_	SP	0.000242	0.999130	0.000149	0.000158	0.000149	0.000137	CS pos: 16-17. Pr: 0.9773
XP_008596569.1 Mis12 domain-containing protein _Beauveria bassiana ARSEF 2860_	OTHER	1.000000	0.000001	0.000000	0.000000	0.000000	0.000000	
XP_008596570.1 pentatricopeptide repeat domain-containing protein _Beauveria bassiana ARSEF 2860_	OTHER	1.000000	0.000000	0.000000	0.000000	0.000000	0.000000	
XP_008596571.1 glutathione S-transferase I _Beauveria bassiana ARSEF 2860_	OTHER	1.000000	0.000000	0.000000	0.000000	0.000000	0.000000	
XP_008596572.1 uncharacterized protein BBA_03253 _Beauveria bassiana ARSEF 2860_	OTHER	0.999784	0.000236	0.000000	0.000000	0.000000	0.000000	
XP_008596574.1 uncharacterized protein BBA_03255 _Beauveria bassiana ARSEF 2860_	OTHER	1.000000	0.000000	0.000000	0.000000	0.000000	0.000000	
XP_008596575.1 eukaryotic translation initiation factor 3 subunit 8 _Beauveria bassiana ARSEF 2860_	OTHER	1.000000	0.000005	0.000000	0.000000	0.000000	0.000000	
XP_008596578.1 40S ribosomal protein S14 _CRP2_ _Beauveria bassiana ARSEF 2860_	OTHER	1.000000	0.000000	0.000000	0.000000	0.000000	0.000000	
XP_008596579.1 transcription-coupled repair protein CSB_RAD26 _Beauveria bassiana ARSEF 2860_	OTHER	1.000000	0.000001	0.000000	0.000000	0.000000	0.000000	
XP_008596580.1 2-dehydropantoate 2-reductase, putative _Beauveria bassiana ARSEF 2860_	OTHER	1.000000	0.000001	0.000000	0.000000	0.000000	0.000000	
XP_008596581.1 MYB DNA-binding domain-containing protein _Beauveria bassiana ARSEF 2860_	OTHER	1.000000	0.000004	0.000000	0.000000	0.000000	0.000000	
XP_008596582.1 pre-mRNA processing splicing factor 8 _Beauveria bassiana ARSEF 2860_	OTHER	1.000000	0.000000	0.000000	0.000000	0.000000	0.000000	
XP_008596585.1 Prp18 domain-containing protein _Beauveria bassiana ARSEF 2860_	OTHER	1.000000	0.000000	0.000000	0.000000	0.000000	0.000000	
XP_008596586.1 26S proteasome subunit RPN7 _Beauveria bassiana ARSEF 2860_	OTHER	1.000000	0.000001	0.000000	0.000000	0.000000	0.000000	
XP_008596587.1 uncharacterized protein BBA_03268 _Beauveria bassiana ARSEF 2860_	SP	0.000923	0.998345	0.000187	0.000186	0.000170	0.000155	CS pos: 17-18. Pr: 0.9686
XP_008596588.1 fungal specific transcription factor _Beauveria bassiana ARSEF 2860_	OTHER	1.000000	0.000000	0.000000	0.000000	0.000000	0.000000	
XP_008596589.1 uncharacterized protein BBA_03270 _Beauveria bassiana ARSEF 2860_	SP	0.000230	0.999199	0.000140	0.000153	0.000132	0.000124	CS pos: 30-31. Pr: 0.3372
XP_008596591.1 Hsp70 family chaperone _Beauveria bassiana ARSEF 2860_	OTHER	1.000000	0.000000	0.000000	0.000000	0.000000	0.000000	
XP_008596592.1 uncharacterized protein BBA_03273 _Beauveria bassiana ARSEF 2860_	OTHER	0.997139	0.002886	0.000007	0.000005	0.000002	0.000004	
XP_008596593.1 uncharacterized protein BBA_03274 _Beauveria bassiana ARSEF 2860_	OTHER	1.000000	0.000000	0.000000	0.000000	0.000000	0.000000	
XP_008596594.1 metallopeptidase family M24 _Beauveria bassiana ARSEF 2860_	OTHER	1.000000	0.000000	0.000000	0.000000	0.000000	0.000000	
XP_008596595.1 legume-like lectin family protein _Beauveria bassiana ARSEF 2860_	SP	0.000236	0.999155	0.000157	0.000145	0.000137	0.000131	CS pos: 18-19. Pr: 0.9765
XP_008596598.1 chromatin assembly protein _Beauveria bassiana ARSEF 2860_	OTHER	1.000000	0.000000	0.000000	0.000000	0.000000	0.000000	
XP_008596599.1 peroxin 11C _Beauveria bassiana ARSEF 2860_	OTHER	1.000000	0.000012	0.000000	0.000000	0.000000	0.000000	
XP_008596600.1 hemerythrin HHE cation binding domain-containing protein _Beauveria bassiana ARSEF 2860_	OTHER	1.000000	0.000001	0.000000	0.000000	0.000000	0.000000	
XP_008596601.1 KOW domain-containing protein domain-containing protein _Beauveria bassiana ARSEF 2860_	OTHER	1.000000	0.000000	0.000000	0.000000	0.000000	0.000000	
XP_008596602.1 taurine catabolism dioxygenase TauD _Beauveria bassiana ARSEF 2860_	OTHER	1.000000	0.000015	0.000000	0.000000	0.000000	0.000000	
XP_008596605.1 uncharacterized protein BBA_03286 _Beauveria bassiana ARSEF 2860_	OTHER	1.000000	0.000005	0.000000	0.000000	0.000000	0.000000	
XP_008596606.1 Pfs, NACHT and Ankyrin domain protein _Beauveria bassiana ARSEF 2860_	OTHER	1.000000	0.000003	0.000000	0.000000	0.000000	0.000000	
XP_008596610.1 MFS monocarboxylate transporter _Beauveria bassiana ARSEF 2860_	OTHER	0.999916	0.000103	0.000000	0.000000	0.000000	0.000000	
XP_008596615.1 Actin-related protein, ARP2 class _Beauveria bassiana ARSEF 2860_	OTHER	1.000000	0.000000	0.000000	0.000000	0.000000	0.000000	
XP_008596617.1 ADP-ribosylation factor 6 _Beauveria bassiana ARSEF 2860_	OTHER	1.000000	0.000000	0.000000	0.000000	0.000000	0.000000	
XP_008596620.1 homocitrate synthase _Beauveria bassiana ARSEF 2860_	OTHER	1.000000	0.000000	0.000000	0.000000	0.000000	0.000000	
XP_008596621.1 histidinolphosphatase-like protein _Beauveria bassiana ARSEF 2860_	OTHER	0.999695	0.000333	0.000003	0.000001	0.000000	0.000001	
XP_008596622.1 FAD binding domain-containing protein _Beauveria bassiana ARSEF 2860_	LIPO	0.421298	0.152475	0.423697	0.000936	0.000691	0.000910	CS pos: 26-27. Pr: 0.3550
XP_008596624.1 tRNA isopentenyltransferase _Beauveria bassiana ARSEF 2860_	OTHER	1.000000	0.000000	0.000000	0.000000	0.000000	0.000000	
XP_008596625.1 protein kinase subdomain-containing protein _Beauveria bassiana ARSEF 2860_	OTHER	1.000000	0.000000	0.000000	0.000000	0.000000	0.000000	
XP_008596626.1 fungal specific transcription factor _Beauveria bassiana ARSEF 2860_	OTHER	1.000000	0.000000	0.000000	0.000000	0.000000	0.000000	
XP_008596628.1 glycoside hydrolase family 76 _Beauveria bassiana ARSEF 2860_	SP	0.000506	0.998679	0.000196	0.000214	0.000186	0.000180	CS pos: 19-20. Pr: 0.9711
XP_008596629.1 uncharacterized protein BBA_03310 _Beauveria bassiana ARSEF 2860_	OTHER	1.000000	0.000001	0.000000	0.000000	0.000000	0.000000	
XP_008596630.1 Actin-related protein, ARP1 class _Beauveria bassiana ARSEF 2860_	OTHER	1.000000	0.000000	0.000000	0.000000	0.000000	0.000000	
XP_008596631.1 transcription factor MBP1 _Beauveria bassiana ARSEF 2860_	OTHER	1.000000	0.000000	0.000000	0.000000	0.000000	0.000000	
XP_008596632.1 uncharacterized protein BBA_03313 _Beauveria bassiana ARSEF 2860_	OTHER	1.000000	0.000001	0.000000	0.000000	0.000000	0.000000	
XP_008596633.1 uncharacterized protein BBA_03314 _Beauveria bassiana ARSEF 2860_	OTHER	1.000000	0.000037	0.000003	0.000000	0.000000	0.000000	
XP_008596634.1 cell division control protein _Beauveria bassiana ARSEF 2860_	OTHER	1.000000	0.000000	0.000000	0.000000	0.000000	0.000000	
XP_008596635.1 uncharacterized protein BBA_03316 _Beauveria bassiana ARSEF 2860_	OTHER	1.000000	0.000000	0.000000	0.000000	0.000000	0.000000	
XP_008596636.1 folylpolyglutamate synthase _Beauveria bassiana ARSEF 2860_	OTHER	1.000000	0.000000	0.000000	0.000000	0.000000	0.000000	
XP_008596638.1 ICE2 family protein _Beauveria bassiana ARSEF 2860_	OTHER	1.000000	0.000000	0.000000	0.000000	0.000000	0.000000	
XP_008596639.1 uncharacterized protein BBA_03320 _Beauveria bassiana ARSEF 2860_	OTHER	1.000000	0.000000	0.000000	0.000000	0.000000	0.000000	
XP_008596640.1 transmembrane amino acid transporter _Beauveria bassiana ARSEF 2860_	OTHER	1.000000	0.000000	0.000000	0.000000	0.000000	0.000000	
XP_008596641.1 dihydroceramide delta_4_-desaturase _Beauveria bassiana ARSEF 2860_	OTHER	1.000000	0.000000	0.000000	0.000000	0.000000	0.000000	
XP_008596642.1 MSP domain-containing protein _Beauveria bassiana ARSEF 2860_	OTHER	0.999944	0.000066	0.000002	0.000000	0.000000	0.000001	
XP_008596643.1 DNA-binding protein _Beauveria bassiana ARSEF 2860_	OTHER	1.000000	0.000000	0.000000	0.000000	0.000000	0.000000	
XP_008596644.1 60S acidic ribosomal protein P1 _Beauveria bassiana ARSEF 2860_	OTHER	1.000000	0.000000	0.000000	0.000000	0.000000	0.000000	
XP_008596646.1 YCII-related domain protein _Beauveria bassiana ARSEF 2860_	OTHER	1.000000	0.000002	0.000000	0.000000	0.000000	0.000000	
XP_008596647.1 Zn_II_2Cys6 transcription factor _Beauveria bassiana ARSEF 2860_	OTHER	1.000000	0.000000	0.000000	0.000000	0.000000	0.000000	
XP_008596653.1 putative MAP kinase _Beauveria bassiana ARSEF 2860_	OTHER	1.000000	0.000000	0.000000	0.000000	0.000000	0.000000	
XP_008596654.1 malate dehydrogenase _Beauveria bassiana ARSEF 2860_	SP	0.000251	0.999144	0.000157	0.000155	0.000141	0.000134	CS pos: 22-23. Pr: 0.4654
XP_008596655.1 uncharacterized protein BBA_03336 _Beauveria bassiana ARSEF 2860_	OTHER	0.999988	0.000002	0.000010	0.000000	0.000000	0.000000	
XP_008596656.1 dynactin Arp1 p25 subunit _Beauveria bassiana ARSEF 2860_	OTHER	1.000000	0.000002	0.000000	0.000000	0.000000	0.000000	
XP_008596657.1 Bys1 family protein _Beauveria bassiana ARSEF 2860_	SP	0.000226	0.999187	0.000151	0.000163	0.000147	0.000134	CS pos: 17-18. Pr: 0.9718
XP_008596659.1 phosphomannose isomerase type I _Beauveria bassiana ARSEF 2860_	OTHER	1.000000	0.000000	0.000000	0.000000	0.000000	0.000000	
XP_008596660.1 uncharacterized protein BBA_03341 _Beauveria bassiana ARSEF 2860_	OTHER	1.000000	0.000000	0.000000	0.000000	0.000000	0.000000	
XP_008596661.1 peptidyl-prolyl cis-trans isomerase cyp6 _Beauveria bassiana ARSEF 2860_	OTHER	1.000000	0.000000	0.000000	0.000000	0.000000	0.000000	
XP_008596662.1 uncharacterized protein BBA_03343 _Beauveria bassiana ARSEF 2860_	OTHER	1.000000	0.000000	0.000000	0.000000	0.000000	0.000000	
XP_008596663.1 Nicotinamide N-methyltransferase, putative _Beauveria bassiana ARSEF 2860_	OTHER	1.000000	0.000000	0.000000	0.000000	0.000000	0.000000	
XP_008596665.1 uncharacterized protein BBA_03346 _Beauveria bassiana ARSEF 2860_	SP	0.002139	0.997175	0.000184	0.000175	0.000150	0.000146	CS pos: 35-36. Pr: 0.9675
XP_008596666.1 clumping factor B _Beauveria bassiana ARSEF 2860_	OTHER	1.000000	0.000000	0.000000	0.000000	0.000000	0.000000	
XP_008596667.1 GTP cyclohydrolase II _Beauveria bassiana ARSEF 2860_	OTHER	1.000000	0.000000	0.000000	0.000000	0.000000	0.000000	
XP_008596668.1 RNA polymerase Rpb7-like domain-containing protein _Beauveria bassiana ARSEF 2860_	OTHER	1.000000	0.000000	0.000000	0.000000	0.000000	0.000000	
XP_008596671.1 amino acid transporter _Beauveria bassiana ARSEF 2860_	OTHER	1.000000	0.000001	0.000000	0.000000	0.000000	0.000000	
XP_008596672.1 uncharacterized protein BBA_03353 _Beauveria bassiana ARSEF 2860_	OTHER	1.000000	0.000000	0.000000	0.000000	0.000000	0.000000	
XP_008596673.1 uncharacterized protein BBA_03354 _Beauveria bassiana ARSEF 2860_	SP	0.081162	0.916750	0.000788	0.000525	0.000327	0.000429	CS pos: 21-22. Pr: 0.9001
XP_008596674.1 ankyrin repeat protein _Beauveria bassiana ARSEF 2860_	OTHER	1.000000	0.000000	0.000000	0.000000	0.000000	0.000000	
XP_008596675.1 NUDIX domain protein _Beauveria bassiana ARSEF 2860_	OTHER	1.000000	0.000000	0.000000	0.000000	0.000000	0.000000	
XP_008596676.1 uncharacterized protein BBA_03357 _Beauveria bassiana ARSEF 2860_	OTHER	1.000000	0.000002	0.000000	0.000000	0.000000	0.000000	
XP_008596677.1 pre-mRNA-splicing factor ATP-dependent RNA helicase PRP16 _Beauveria bassiana ARSEF 2860_	OTHER	1.000000	0.000000	0.000000	0.000000	0.000000	0.000000	
XP_008596678.1 nuclear envelope protein NEM1 _Beauveria bassiana ARSEF 2860_	OTHER	1.000000	0.000001	0.000000	0.000000	0.000000	0.000000	
XP_008596679.1 DDHD domain-containing protein _Beauveria bassiana ARSEF 2860_	OTHER	0.998885	0.001110	0.000005	0.000004	0.000002	0.000007	
XP_008596680.1 ribosomal protein L7Ae _Beauveria bassiana ARSEF 2860_	OTHER	1.000000	0.000000	0.000000	0.000000	0.000000	0.000000	
XP_008596682.1 SPFH domain_Band 7 family protein _Beauveria bassiana ARSEF 2860_	OTHER	1.000000	0.000023	0.000002	0.000000	0.000000	0.000000	
XP_008596683.1 exonuclease-like protein _Beauveria bassiana ARSEF 2860_	OTHER	1.000000	0.000002	0.000000	0.000000	0.000000	0.000000	
XP_008596684.1 casein kinase I isoform delta-A _Beauveria bassiana ARSEF 2860_	OTHER	1.000000	0.000000	0.000000	0.000000	0.000000	0.000000	
XP_008596685.1 periplasmic binding protein _Beauveria bassiana ARSEF 2860_	SP	0.000282	0.999054	0.000173	0.000175	0.000155	0.000141	CS pos: 19-20. Pr: 0.9677
XP_008596686.1 dihydroorotase, homodimeric type _Beauveria bassiana ARSEF 2860_	OTHER	1.000000	0.000000	0.000000	0.000000	0.000000	0.000000	
XP_008596687.1 amino acid permease _Beauveria bassiana ARSEF 2860_	OTHER	0.999951	0.000046	0.000000	0.000000	0.000000	0.000000	
XP_008596688.1 transient receptor potential ion channel _Beauveria bassiana ARSEF 2860_	SP	0.000254	0.999074	0.000160	0.000190	0.000161	0.000144	CS pos: 24-25. Pr: 0.9751
XP_008596689.1 BZZ1-like protein _Beauveria bassiana ARSEF 2860_	OTHER	1.000000	0.000000	0.000000	0.000000	0.000000	0.000000	
XP_008596690.1 C2H2 transcription factor _Beauveria bassiana ARSEF 2860_	OTHER	1.000000	0.000000	0.000000	0.000000	0.000000	0.000000	
XP_008596691.1 dynamin family protein _Beauveria bassiana ARSEF 2860_	OTHER	1.000000	0.000000	0.000000	0.000000	0.000000	0.000000	
XP_008596693.1 major facilitator superfamily transporter _Beauveria bassiana ARSEF 2860_	OTHER	0.999839	0.000124	0.000006	0.000000	0.000000	0.000028	
XP_008596694.1 Glycerophosphoryl diester phosphodiesterase family protein _Beauveria bassiana ARSEF 2860_	OTHER	1.000000	0.000000	0.000000	0.000000	0.000000	0.000000	
XP_008596695.1 glutaminase GtaA _Beauveria bassiana ARSEF 2860_	SP	0.000229	0.999134	0.000156	0.000166	0.000147	0.000136	CS pos: 20-21. Pr: 0.9817
XP_008596697.1 serine_threonine protein kinase _Beauveria bassiana ARSEF 2860_	OTHER	1.000000	0.000000	0.000000	0.000000	0.000000	0.000000	
XP_008596698.1 uncharacterized protein BBA_03379 _Beauveria bassiana ARSEF 2860_	OTHER	1.000000	0.000001	0.000000	0.000000	0.000000	0.000000	
XP_008596699.1 ribosomal protein YmL20 precursor _Beauveria bassiana ARSEF 2860_	OTHER	1.000000	0.000000	0.000000	0.000000	0.000000	0.000000	
XP_008596702.1 transferase hexapeptide domain-containing protein _Beauveria bassiana ARSEF 2860_	OTHER	1.000000	0.000001	0.000000	0.000000	0.000000	0.000000	
XP_008596703.1 NADH-ubiquinone oxidoreductase 51 kDa subunit _Beauveria bassiana ARSEF 2860_	OTHER	1.000000	0.000000	0.000000	0.000000	0.000000	0.000000	
XP_008596704.1 AoPex11B-like protein _Beauveria bassiana ARSEF 2860_	OTHER	0.973847	0.025983	0.000052	0.000042	0.000035	0.000045	
XP_008596705.1 smr domain containing protein _Beauveria bassiana ARSEF 2860_	OTHER	1.000000	0.000000	0.000000	0.000000	0.000000	0.000000	
XP_008596706.1 patched sphingolipid transporter _Beauveria bassiana ARSEF 2860_	SP	0.000284	0.999036	0.000189	0.000169	0.000163	0.000148	CS pos: 23-24. Pr: 0.9736
XP_008596707.1 GPI mannosyltransferase _Beauveria bassiana ARSEF 2860_	OTHER	0.995927	0.004014	0.000018	0.000024	0.000009	0.000021	
XP_008596708.1 DUF1604 domain protein _Beauveria bassiana ARSEF 2860_	OTHER	1.000000	0.000006	0.000000	0.000000	0.000000	0.000000	
XP_008596711.1 uncharacterized protein BBA_03392 _Beauveria bassiana ARSEF 2860_	OTHER	0.999999	0.000014	0.000000	0.000000	0.000000	0.000000	
XP_008596712.1 uncharacterized protein BBA_03393 _Beauveria bassiana ARSEF 2860_	OTHER	1.000000	0.000000	0.000000	0.000000	0.000000	0.000000	
XP_008596713.1 fructose-1-6-bisphosphatase _Beauveria bassiana ARSEF 2860_	OTHER	1.000000	0.000000	0.000000	0.000000	0.000000	0.000000	
XP_008596714.1 peroxisomal biogenesis factor 11 _Beauveria bassiana ARSEF 2860_	OTHER	1.000000	0.000001	0.000000	0.000000	0.000000	0.000000	
XP_008596717.1 pyridoxal-dependent decarboxylase domain protein _Beauveria bassiana ARSEF 2860_	OTHER	1.000000	0.000000	0.000000	0.000000	0.000000	0.000000	
