XP_008601451.1 DUF803 domain membrane protein _Beauveria bassiana ARSEF 2860_	OTHER	1.000000	0.000027	0.000000	0.000000	0.000000	0.000000	
XP_008601452.1 U-box domain-containing protein _Beauveria bassiana ARSEF 2860_	OTHER	0.999790	0.000247	0.000004	0.000001	0.000001	0.000001	
XP_008601453.1 uncharacterized protein BBA_08134 _Beauveria bassiana ARSEF 2860_	OTHER	1.000000	0.000000	0.000000	0.000000	0.000000	0.000000	
XP_008601455.1 Cytochrome P450 CYP52T1 _Beauveria bassiana ARSEF 2860_	OTHER	1.000000	0.000001	0.000000	0.000000	0.000000	0.000000	
XP_008601456.1 thioesterase-like protein _Beauveria bassiana ARSEF 2860_	OTHER	1.000000	0.000000	0.000000	0.000000	0.000000	0.000000	
XP_008601458.1 dephospho-CoA kinase _Beauveria bassiana ARSEF 2860_	OTHER	0.835000	0.162009	0.002022	0.000291	0.000207	0.000479	
XP_008601459.1 uncharacterized protein BBA_08140 _Beauveria bassiana ARSEF 2860_	OTHER	1.000000	0.000000	0.000000	0.000000	0.000000	0.000000	
XP_008601461.1 regulator of chromosome condensation _RCC1_-like protein _Beauveria bassiana ARSEF 2860_	OTHER	1.000000	0.000000	0.000000	0.000000	0.000000	0.000000	
XP_008601463.1 uncharacterized protein BBA_08144 _Beauveria bassiana ARSEF 2860_	OTHER	0.930835	0.068634	0.000181	0.000171	0.000077	0.000121	
XP_008601464.1 NADH-ubiquinone oxidoreductase B12 subunit family protein _Beauveria bassiana ARSEF 2860_	OTHER	1.000000	0.000000	0.000000	0.000000	0.000000	0.000000	
XP_008601465.1 CAF1 family ribonuclease _Beauveria bassiana ARSEF 2860_	OTHER	1.000000	0.000000	0.000000	0.000000	0.000000	0.000000	
XP_008601466.1 Protein fyv10 _Beauveria bassiana ARSEF 2860_	OTHER	1.000000	0.000000	0.000000	0.000000	0.000000	0.000000	
XP_008601467.1 helix-loop-helix DNA-binding domain-containing protein _Beauveria bassiana ARSEF 2860_	OTHER	0.999060	0.000867	0.000048	0.000003	0.000002	0.000020	
XP_008601468.1 uncharacterized protein BBA_08149 _Beauveria bassiana ARSEF 2860_	OTHER	1.000000	0.000000	0.000000	0.000000	0.000000	0.000000	
XP_008601469.1 uncharacterized protein BBA_08150 _Beauveria bassiana ARSEF 2860_	OTHER	1.000000	0.000004	0.000000	0.000000	0.000000	0.000000	
XP_008601470.1 ABC transporter transmembrane region _Beauveria bassiana ARSEF 2860_	OTHER	0.999619	0.000407	0.000002	0.000000	0.000000	0.000002	
XP_008601472.1 HEAT repeat protein _Beauveria bassiana ARSEF 2860_	OTHER	1.000000	0.000000	0.000000	0.000000	0.000000	0.000000	
XP_008601473.1 NUDIX domain-containing protein _Beauveria bassiana ARSEF 2860_	OTHER	1.000000	0.000006	0.000000	0.000000	0.000000	0.000000	
XP_008601474.1 PQ loop repeat family protein _Beauveria bassiana ARSEF 2860_	OTHER	1.000000	0.000000	0.000000	0.000000	0.000000	0.000000	
XP_008601476.1 uncharacterized protein BBA_08157 _Beauveria bassiana ARSEF 2860_	OTHER	1.000000	0.000000	0.000000	0.000000	0.000000	0.000000	
XP_008601477.1 ATP-dependent protease La domain-containing protein _Beauveria bassiana ARSEF 2860_	OTHER	1.000000	0.000000	0.000000	0.000000	0.000000	0.000000	
XP_008601478.1 insulin-induced protein _Beauveria bassiana ARSEF 2860_	OTHER	1.000000	0.000000	0.000000	0.000000	0.000000	0.000000	
XP_008601479.1 ABC transporter _Beauveria bassiana ARSEF 2860_	OTHER	0.999967	0.000046	0.000000	0.000000	0.000000	0.000000	
XP_008601480.1 NACHT and WD domain protein _Beauveria bassiana ARSEF 2860_	OTHER	1.000000	0.000000	0.000000	0.000000	0.000000	0.000000	
XP_008601481.1 fructosamine kinase _Beauveria bassiana ARSEF 2860_	OTHER	0.999639	0.000306	0.000037	0.000002	0.000001	0.000019	
XP_008601483.1 feruloyl esterase A precursor _Beauveria bassiana ARSEF 2860_	SP	0.000306	0.999080	0.000154	0.000171	0.000150	0.000143	CS pos: 17-18. Pr: 0.9146
XP_008601487.1 amidase-like protein _Beauveria bassiana ARSEF 2860_	OTHER	1.000000	0.000000	0.000000	0.000000	0.000000	0.000000	
XP_008601488.1 ABC transporter _Beauveria bassiana ARSEF 2860_	OTHER	1.000000	0.000004	0.000000	0.000000	0.000000	0.000000	
XP_008601489.1 major facilitator superfamily transporter _Beauveria bassiana ARSEF 2860_	OTHER	1.000000	0.000000	0.000000	0.000000	0.000000	0.000000	
XP_008601493.1 putative Heat-labile enterotoxin IIB, A chain _Beauveria bassiana ARSEF 2860_	SP	0.014086	0.984748	0.000454	0.000219	0.000219	0.000233	CS pos: 31-32. Pr: 0.9597
XP_008601495.1 mitochondrial CorA family metal ion transporter _Beauveria bassiana ARSEF 2860_	OTHER	1.000000	0.000000	0.000000	0.000000	0.000000	0.000000	
XP_008601496.1 cation transporter _Beauveria bassiana ARSEF 2860_	OTHER	1.000000	0.000000	0.000000	0.000000	0.000000	0.000000	
XP_008601497.1 hydantoinase B_oxoprolinase _Beauveria bassiana ARSEF 2860_	OTHER	1.000000	0.000000	0.000000	0.000000	0.000000	0.000000	
XP_008601498.1 polyketide synthase _Beauveria bassiana ARSEF 2860_	OTHER	1.000000	0.000000	0.000000	0.000000	0.000000	0.000000	
XP_008601499.1 MFS multidrug resistance transporter, putative _Beauveria bassiana ARSEF 2860_	OTHER	1.000000	0.000000	0.000000	0.000000	0.000000	0.000000	
XP_008601501.1 FAD binding domain-containing protein _Beauveria bassiana ARSEF 2860_	OTHER	0.999885	0.000104	0.000046	0.000000	0.000000	0.000000	
XP_008601502.1 laccase 2 _Beauveria bassiana ARSEF 2860_	SP	0.000436	0.998849	0.000226	0.000161	0.000142	0.000137	CS pos: 23-24. Pr: 0.6006
XP_008601504.1 uncharacterized protein BBA_08185 _Beauveria bassiana ARSEF 2860_	OTHER	1.000000	0.000003	0.000000	0.000000	0.000000	0.000000	
XP_008601505.1 uncharacterized protein BBA_08186 _Beauveria bassiana ARSEF 2860_	OTHER	1.000000	0.000000	0.000000	0.000000	0.000000	0.000000	
XP_008601507.1 autophagy protein 5 _Beauveria bassiana ARSEF 2860_	OTHER	0.999823	0.000178	0.000014	0.000001	0.000000	0.000003	
XP_008601509.1 uncharacterized protein BBA_08190 _Beauveria bassiana ARSEF 2860_	OTHER	1.000000	0.000018	0.000000	0.000000	0.000000	0.000000	
XP_008601511.1 WD domain-containing protein _Beauveria bassiana ARSEF 2860_	OTHER	1.000000	0.000011	0.000000	0.000000	0.000000	0.000000	
XP_008601513.1 GAF domain-containing protein _Beauveria bassiana ARSEF 2860_	OTHER	1.000000	0.000001	0.000000	0.000000	0.000000	0.000000	
XP_008601514.1 uncharacterized protein BBA_08195 _Beauveria bassiana ARSEF 2860_	OTHER	1.000000	0.000000	0.000000	0.000000	0.000000	0.000000	
XP_008601520.1 SWR1-complex protein 4 _Beauveria bassiana ARSEF 2860_	OTHER	1.000000	0.000000	0.000000	0.000000	0.000000	0.000000	
XP_008601522.1 bacterial transferase hexapeptide _Beauveria bassiana ARSEF 2860_	OTHER	1.000000	0.000000	0.000000	0.000000	0.000000	0.000000	
XP_008601523.1 uncharacterized protein BBA_08204 _Beauveria bassiana ARSEF 2860_	OTHER	1.000000	0.000000	0.000000	0.000000	0.000000	0.000000	
XP_008601525.1 cwf18 pre-mRNA splicing factor _Beauveria bassiana ARSEF 2860_	OTHER	1.000000	0.000000	0.000000	0.000000	0.000000	0.000000	
XP_008601526.1 uncharacterized protein BBA_08207 _Beauveria bassiana ARSEF 2860_	OTHER	1.000000	0.000000	0.000000	0.000000	0.000000	0.000000	
XP_008601527.1 R3H domain-containing protein _Beauveria bassiana ARSEF 2860_	OTHER	1.000000	0.000000	0.000000	0.000000	0.000000	0.000000	
XP_008601528.1 Mov34_MPN_PAD-1 family protein _Beauveria bassiana ARSEF 2860_	OTHER	1.000000	0.000001	0.000000	0.000000	0.000000	0.000000	
XP_008601533.1 cell wall glucanosyltransferase Mwg1 _Beauveria bassiana ARSEF 2860_	SP	0.000202	0.999183	0.000171	0.000164	0.000145	0.000137	CS pos: 21-22. Pr: 0.9761
XP_008601534.1 uncharacterized protein BBA_08215 _Beauveria bassiana ARSEF 2860_	SP	0.000212	0.999162	0.000161	0.000160	0.000145	0.000141	CS pos: 19-20. Pr: 0.9747
XP_008601536.1 2OG-Fe_II_ oxygenase family oxidoreductase _Beauveria bassiana ARSEF 2860_	OTHER	1.000000	0.000001	0.000000	0.000000	0.000000	0.000000	
XP_008601538.1 polyketide synthase, putative _Beauveria bassiana ARSEF 2860_	OTHER	1.000000	0.000008	0.000000	0.000000	0.000000	0.000000	
XP_008601542.1 thermolabile L-asparaginase _Beauveria bassiana ARSEF 2860_	OTHER	1.000000	0.000000	0.000000	0.000000	0.000000	0.000000	
XP_008601544.1 SET domain protein _Beauveria bassiana ARSEF 2860_	OTHER	1.000000	0.000004	0.000000	0.000000	0.000000	0.000000	
XP_008601547.1 oxysterol-binding protein _Beauveria bassiana ARSEF 2860_	OTHER	1.000000	0.000000	0.000000	0.000000	0.000000	0.000000	
XP_008601550.1 diacylglycerol kinase catalytic domain-containing protein _Beauveria bassiana ARSEF 2860_	OTHER	0.999959	0.000088	0.000001	0.000000	0.000000	0.000000	
XP_008601552.1 amino acid permease _Beauveria bassiana ARSEF 2860_	OTHER	0.999698	0.000269	0.000028	0.000002	0.000001	0.000017	
XP_008601553.1 VPS9 domain-containing protein _Beauveria bassiana ARSEF 2860_	OTHER	1.000000	0.000001	0.000000	0.000000	0.000000	0.000000	
XP_008601555.1 GTP-binding protein YchF _Beauveria bassiana ARSEF 2860_	OTHER	1.000000	0.000000	0.000000	0.000000	0.000000	0.000000	
XP_008601560.1 general alpha-glucoside permease _Beauveria bassiana ARSEF 2860_	OTHER	0.999979	0.000020	0.000000	0.000000	0.000000	0.000000	
XP_008601562.1 calcineurin-like phosphoesterase _Beauveria bassiana ARSEF 2860_	SP	0.000216	0.999233	0.000143	0.000147	0.000135	0.000127	CS pos: 18-19. Pr: 0.9752
XP_008601564.1 uncharacterized protein BBA_08245 _Beauveria bassiana ARSEF 2860_	OTHER	1.000000	0.000003	0.000000	0.000000	0.000000	0.000000	
XP_008601568.1 2OG-Fe_II_ oxygenase superfamily protein _Beauveria bassiana ARSEF 2860_	OTHER	1.000000	0.000000	0.000000	0.000000	0.000000	0.000000	
XP_008601572.1 2,3-cyclic-nucleotide 2-phosphodiesterase _Beauveria bassiana ARSEF 2860_	OTHER	1.000000	0.000000	0.000000	0.000000	0.000000	0.000000	
XP_008601575.1 C6 finger domain protein _Beauveria bassiana ARSEF 2860_	OTHER	1.000000	0.000000	0.000000	0.000000	0.000000	0.000000	
XP_008601576.1 choline transport protein _Beauveria bassiana ARSEF 2860_	OTHER	0.999923	0.000076	0.000000	0.000000	0.000000	0.000000	
XP_008601579.1 uncharacterized protein BBA_08260 _Beauveria bassiana ARSEF 2860_	SP	0.000252	0.999152	0.000143	0.000156	0.000133	0.000132	CS pos: 19-20. Pr: 0.9756
XP_008601583.1 2-amino-3-carboxymuconate-6-semialdehyde decarboxylase _Beauveria bassiana ARSEF 2860_	OTHER	1.000000	0.000001	0.000000	0.000000	0.000000	0.000000	
XP_008601584.1 membrane-associated progesterone receptor component 1 _Beauveria bassiana ARSEF 2860_	OTHER	1.000000	0.000000	0.000000	0.000000	0.000000	0.000000	
XP_008601586.1 ATP phosphoribosyltransferase _Beauveria bassiana ARSEF 2860_	OTHER	1.000000	0.000004	0.000000	0.000000	0.000000	0.000000	
XP_008601588.1 SH3 domain-containing protein _Beauveria bassiana ARSEF 2860_	OTHER	1.000000	0.000006	0.000000	0.000000	0.000000	0.000000	
XP_008601589.1 TLC domain-containing protein _Beauveria bassiana ARSEF 2860_	OTHER	1.000000	0.000009	0.000000	0.000000	0.000000	0.000000	
XP_008601594.1 GTP-binding protein LepA _Beauveria bassiana ARSEF 2860_	OTHER	1.000000	0.000001	0.000000	0.000000	0.000000	0.000000	
XP_008601597.1 histone acetylase complex subunit _Beauveria bassiana ARSEF 2860_	OTHER	1.000000	0.000000	0.000000	0.000000	0.000000	0.000000	
XP_008601601.1 uncharacterized protein BBA_08282 _Beauveria bassiana ARSEF 2860_	SP	0.000293	0.999002	0.000162	0.000194	0.000179	0.000155	CS pos: 18-19. Pr: 0.9807
XP_008601602.1 uncharacterized protein BBA_08283 _Beauveria bassiana ARSEF 2860_	SP	0.000278	0.999089	0.000151	0.000167	0.000146	0.000134	CS pos: 17-18. Pr: 0.9525
XP_008601603.1 protein required for cell viability, putative _Beauveria bassiana ARSEF 2860_	OTHER	1.000000	0.000000	0.000000	0.000000	0.000000	0.000000	
XP_008601605.1 helicase associated domain-containing protein _Beauveria bassiana ARSEF 2860_	OTHER	1.000000	0.000000	0.000000	0.000000	0.000000	0.000000	
XP_008601606.1 protein arginine N-methyltransferase _Beauveria bassiana ARSEF 2860_	OTHER	1.000000	0.000000	0.000000	0.000000	0.000000	0.000000	
XP_008601607.1 alanine-glyoxylate aminotransferase _Beauveria bassiana ARSEF 2860_	OTHER	1.000000	0.000000	0.000000	0.000000	0.000000	0.000000	
XP_008601608.1 exportin-1-like protein _Beauveria bassiana ARSEF 2860_	OTHER	1.000000	0.000000	0.000000	0.000000	0.000000	0.000000	
XP_008601611.1 DEAD_DEAH box helicase _Beauveria bassiana ARSEF 2860_	OTHER	1.000000	0.000000	0.000000	0.000000	0.000000	0.000000	
XP_008601612.1 cytidylyltransferase-like protein _Beauveria bassiana ARSEF 2860_	OTHER	0.999844	0.000148	0.000025	0.000000	0.000000	0.000002	
XP_008601613.1 uncharacterized protein BBA_08294 _Beauveria bassiana ARSEF 2860_	OTHER	1.000000	0.000002	0.000000	0.000000	0.000000	0.000000	
XP_008601615.1 uncharacterized protein BBA_08296 _Beauveria bassiana ARSEF 2860_	OTHER	1.000000	0.000000	0.000000	0.000000	0.000000	0.000000	
XP_008601617.1 maleylacetoacetate isomerase _Beauveria bassiana ARSEF 2860_	OTHER	1.000000	0.000000	0.000000	0.000000	0.000000	0.000000	
XP_008601618.1 acetyltransferase, gnat family _Beauveria bassiana ARSEF 2860_	OTHER	0.999624	0.000372	0.000017	0.000002	0.000001	0.000007	
XP_008601621.1 NupC family nucleoside transporter _Beauveria bassiana ARSEF 2860_	OTHER	1.000000	0.000001	0.000000	0.000000	0.000000	0.000000	
XP_008601622.1 vacuolar protein sorting-associated protein vps13 _Beauveria bassiana ARSEF 2860_	OTHER	1.000000	0.000000	0.000000	0.000000	0.000000	0.000000	
XP_008601623.1 C6 zinc finger domain-containing protein _Beauveria bassiana ARSEF 2860_	OTHER	1.000000	0.000001	0.000000	0.000000	0.000000	0.000000	
XP_008601626.1 SIT4-associating protein SAP190 _Beauveria bassiana ARSEF 2860_	OTHER	1.000000	0.000001	0.000000	0.000000	0.000000	0.000000	
XP_008601627.1 OPT oligopeptide transporter _Beauveria bassiana ARSEF 2860_	OTHER	1.000000	0.000001	0.000000	0.000000	0.000000	0.000000	
XP_008601629.1 histone chaperone Rttp106-like protein _Beauveria bassiana ARSEF 2860_	OTHER	1.000000	0.000000	0.000000	0.000000	0.000000	0.000000	
XP_008601632.1 phosphoribosylformylglycinamidine synthase _Beauveria bassiana ARSEF 2860_	OTHER	1.000000	0.000000	0.000000	0.000000	0.000000	0.000000	
XP_008601633.1 C2H2 finger domain protein, putative _Beauveria bassiana ARSEF 2860_	OTHER	1.000000	0.000000	0.000000	0.000000	0.000000	0.000000	
XP_008601634.1 CHCH domain-containing protein _Beauveria bassiana ARSEF 2860_	OTHER	0.980417	0.017502	0.001889	0.000067	0.000041	0.000099	
XP_008601635.1 guanine-nucleotide exchange factor Cdc24 _Beauveria bassiana ARSEF 2860_	OTHER	1.000000	0.000001	0.000000	0.000000	0.000000	0.000000	
XP_008601637.1 Snf7 family protein _Beauveria bassiana ARSEF 2860_	OTHER	1.000000	0.000000	0.000000	0.000000	0.000000	0.000000	
XP_008601638.1 uncharacterized protein BBA_08319 _Beauveria bassiana ARSEF 2860_	OTHER	1.000000	0.000001	0.000000	0.000000	0.000000	0.000000	
XP_008601639.1 uncharacterized protein BBA_08320 _Beauveria bassiana ARSEF 2860_	OTHER	0.998009	0.001957	0.000011	0.000005	0.000002	0.000009	
XP_008601644.1 uncharacterized protein BBA_08325 _Beauveria bassiana ARSEF 2860_	OTHER	1.000000	0.000000	0.000000	0.000000	0.000000	0.000000	
XP_008601646.1 CFEM domain-containing protein _Beauveria bassiana ARSEF 2860_	SP	0.004543	0.993979	0.000746	0.000270	0.000217	0.000213	CS pos: 28-29. Pr: 0.9633
XP_008601647.1 Pectin lyase fold_virulence factor _Beauveria bassiana ARSEF 2860_	SP	0.000230	0.999114	0.000146	0.000172	0.000145	0.000144	CS pos: 24-25. Pr: 0.9768
XP_008601649.1 TPR repeat protein _Beauveria bassiana ARSEF 2860_	OTHER	1.000000	0.000000	0.000000	0.000000	0.000000	0.000000	
XP_008602093.1 kinesin-like protein _Beauveria bassiana ARSEF 2860_	OTHER	0.999383	0.000569	0.000022	0.000011	0.000003	0.000013	
XP_008602094.1 6-O-methylguanine DNA methyltransferase _Beauveria bassiana ARSEF 2860_	OTHER	1.000000	0.000000	0.000000	0.000000	0.000000	0.000000	
XP_008602095.1 uncharacterized protein BBA_08776 _Beauveria bassiana ARSEF 2860_	SP	0.000179	0.999224	0.000154	0.000150	0.000143	0.000132	CS pos: 17-18. Pr: 0.9859
XP_008602096.1 glucoamylase-like protein _Beauveria bassiana ARSEF 2860_	OTHER	1.000000	0.000000	0.000000	0.000000	0.000000	0.000000	
XP_008602097.1 sex-determining protein fem-1 _Beauveria bassiana ARSEF 2860_	OTHER	1.000000	0.000002	0.000000	0.000000	0.000000	0.000000	
XP_008602098.1 multidrug resistance ABC transporter, putative _Beauveria bassiana ARSEF 2860_	OTHER	1.000000	0.000001	0.000000	0.000000	0.000000	0.000000	
XP_008602099.1 FAD dependent oxidoreductase, putative _Beauveria bassiana ARSEF 2860_	SP	0.009430	0.989447	0.000238	0.000315	0.000264	0.000250	CS pos: 22-23. Pr: 0.9567
XP_008602104.1 Fungal Zn binuclear cluster domain containing protein _Beauveria bassiana ARSEF 2860_	OTHER	1.000000	0.000005	0.000000	0.000000	0.000000	0.000000	
XP_008602106.1 ATP-binding cassette sub-family G member 5 _Beauveria bassiana ARSEF 2860_	OTHER	1.000000	0.000014	0.000000	0.000000	0.000000	0.000000	
XP_008602109.1 zinc-binding dehydrogenase _Beauveria bassiana ARSEF 2860_	OTHER	1.000000	0.000011	0.000000	0.000000	0.000000	0.000000	
XP_008602111.1 DUF300 domain protein, putative _Beauveria bassiana ARSEF 2860_	OTHER	1.000000	0.000008	0.000000	0.000000	0.000000	0.000000	
XP_008602115.1 glycosyl hydrolase family 92 _Beauveria bassiana ARSEF 2860_	SP	0.000524	0.998691	0.000187	0.000214	0.000182	0.000181	CS pos: 18-19. Pr: 0.8911
XP_008602117.1 Aquaporin-like protein _Beauveria bassiana ARSEF 2860_	OTHER	0.999822	0.000145	0.000009	0.000001	0.000001	0.000014	
XP_008602119.1 peptidase C14 _Beauveria bassiana ARSEF 2860_	OTHER	1.000000	0.000000	0.000000	0.000000	0.000000	0.000000	
XP_008602120.1 beta-1,6-glucanase precursor _Beauveria bassiana ARSEF 2860_	SP	0.000507	0.998605	0.000234	0.000227	0.000202	0.000186	CS pos: 17-18. Pr: 0.9675
XP_008602126.1 RNA recognition domain-containing protein _Beauveria bassiana ARSEF 2860_	OTHER	1.000000	0.000000	0.000000	0.000000	0.000000	0.000000	
XP_008602128.1 carboxypeptidase Y _Beauveria bassiana ARSEF 2860_	OTHER	0.999814	0.000153	0.000012	0.000001	0.000000	0.000012	
XP_008602129.1 histone H4 variant _Beauveria bassiana ARSEF 2860_	OTHER	1.000000	0.000005	0.000000	0.000000	0.000000	0.000000	
XP_008602130.1 SURF1 family protein _Beauveria bassiana ARSEF 2860_	OTHER	1.000000	0.000000	0.000000	0.000000	0.000000	0.000000	
XP_008602134.1 CHCH domain-containing protein _Beauveria bassiana ARSEF 2860_	OTHER	0.992477	0.007514	0.000012	0.000011	0.000007	0.000009	
XP_008602138.1 double-stranded DNA-binding domain-containing protein _Beauveria bassiana ARSEF 2860_	OTHER	1.000000	0.000000	0.000000	0.000000	0.000000	0.000000	
XP_008602140.1 SET domain-containing protein _Beauveria bassiana ARSEF 2860_	OTHER	1.000000	0.000001	0.000000	0.000000	0.000000	0.000000	
XP_008602143.1 transmembrane protein PFT27 _Beauveria bassiana ARSEF 2860_	OTHER	0.606273	0.369010	0.023594	0.000499	0.000267	0.000341	
XP_008602144.1 uncharacterized protein BBA_08825 _Beauveria bassiana ARSEF 2860_	OTHER	1.000000	0.000001	0.000000	0.000000	0.000000	0.000000	
XP_008602146.1 nacht and ankyrin domain containing protein _Beauveria bassiana ARSEF 2860_	OTHER	1.000000	0.000000	0.000000	0.000000	0.000000	0.000000	
XP_008602147.1 uncharacterized protein BBA_08828 _Beauveria bassiana ARSEF 2860_	OTHER	1.000000	0.000001	0.000000	0.000000	0.000000	0.000000	
XP_008602149.1 uncharacterized protein BBA_08830 _Beauveria bassiana ARSEF 2860_	SP	0.178396	0.820104	0.000382	0.000451	0.000305	0.000336	CS pos: 22-23. Pr: 0.4443
XP_008602152.1 uncharacterized protein BBA_08833 _Beauveria bassiana ARSEF 2860_	OTHER	1.000000	0.000000	0.000000	0.000000	0.000000	0.000000	
XP_008602155.1 ubiquitin-conjugating enzyme _Beauveria bassiana ARSEF 2860_	OTHER	1.000000	0.000000	0.000000	0.000000	0.000000	0.000000	
XP_008602156.1 glutathione S-transferase domain-containing protein _Beauveria bassiana ARSEF 2860_	OTHER	1.000000	0.000000	0.000000	0.000000	0.000000	0.000000	
XP_008602159.1 DUF218 domain-containing protein _Beauveria bassiana ARSEF 2860_	OTHER	1.000000	0.000000	0.000000	0.000000	0.000000	0.000000	
XP_008602160.1 DUF890 domain-containing protein _Beauveria bassiana ARSEF 2860_	OTHER	1.000000	0.000000	0.000000	0.000000	0.000000	0.000000	
XP_008602161.1 mucoidy inhibitor A _Beauveria bassiana ARSEF 2860_	OTHER	1.000000	0.000000	0.000000	0.000000	0.000000	0.000000	
XP_008602162.1 fungal specific transcription factor _Beauveria bassiana ARSEF 2860_	OTHER	1.000000	0.000000	0.000000	0.000000	0.000000	0.000000	
XP_008602163.1 eukaryotic aspartyl protease _Beauveria bassiana ARSEF 2860_	OTHER	0.999686	0.000373	0.000001	0.000001	0.000000	0.000000	
XP_008602164.1 H_ symporter family protein _Beauveria bassiana ARSEF 2860_	OTHER	0.999798	0.000192	0.000002	0.000000	0.000000	0.000009	
XP_008602165.1 uncharacterized protein BBA_08846 _Beauveria bassiana ARSEF 2860_	OTHER	1.000000	0.000000	0.000000	0.000000	0.000000	0.000000	
XP_008602168.1 haloacid dehalogenase-like hydrolase _Beauveria bassiana ARSEF 2860_	OTHER	1.000000	0.000000	0.000000	0.000000	0.000000	0.000000	
XP_008602170.1 uncharacterized protein BBA_08851 _Beauveria bassiana ARSEF 2860_	SP	0.000255	0.999125	0.000157	0.000148	0.000142	0.000139	CS pos: 17-18. Pr: 0.9077
XP_008602172.1 transcriptional regulator _Beauveria bassiana ARSEF 2860_	SP	0.000624	0.997952	0.000793	0.000218	0.000204	0.000174	CS pos: 24-25. Pr: 0.9517
XP_008602175.1 fusarium oxysporum panthotenate synthetase _Beauveria bassiana ARSEF 2860_	OTHER	1.000000	0.000000	0.000000	0.000000	0.000000	0.000000	
XP_008602176.1 acyltransferase-like protein _Beauveria bassiana ARSEF 2860_	OTHER	0.999989	0.000048	0.000001	0.000000	0.000000	0.000000	
XP_008602177.1 ribonuclease P protein subunit p29 _Beauveria bassiana ARSEF 2860_	OTHER	1.000000	0.000000	0.000000	0.000000	0.000000	0.000000	
XP_008602179.1 TPR repeat-containing protein _Beauveria bassiana ARSEF 2860_	OTHER	1.000000	0.000006	0.000000	0.000000	0.000000	0.000000	
XP_008602182.1 metalloprotease 1 _Beauveria bassiana ARSEF 2860_	SP	0.000762	0.998457	0.000175	0.000214	0.000179	0.000182	CS pos: 18-19. Pr: 0.9591
XP_008602183.1 uncharacterized protein BBA_08864 _Beauveria bassiana ARSEF 2860_	OTHER	1.000000	0.000000	0.000000	0.000000	0.000000	0.000000	
XP_008602184.1 ABC transporter _Beauveria bassiana ARSEF 2860_	OTHER	0.999875	0.000169	0.000000	0.000000	0.000000	0.000000	
XP_008602187.1 phosphoserine phosphatase _Beauveria bassiana ARSEF 2860_	OTHER	1.000000	0.000016	0.000000	0.000000	0.000000	0.000000	
XP_008602188.1 uncharacterized protein BBA_08869 _Beauveria bassiana ARSEF 2860_	OTHER	1.000000	0.000000	0.000000	0.000000	0.000000	0.000000	
XP_008602189.1 uncharacterized protein BBA_08870 _Beauveria bassiana ARSEF 2860_	OTHER	1.000000	0.000000	0.000000	0.000000	0.000000	0.000000	
XP_008602191.1 uncharacterized protein BBA_08872 _Beauveria bassiana ARSEF 2860_	OTHER	1.000000	0.000000	0.000000	0.000000	0.000000	0.000000	
XP_008602192.1 tRNA wybutosine-synthesizing protein _Beauveria bassiana ARSEF 2860_	OTHER	1.000000	0.000002	0.000000	0.000000	0.000000	0.000000	
XP_008602193.1 ochre suppressor tyr-tRNA _Beauveria bassiana ARSEF 2860_	OTHER	1.000000	0.000000	0.000000	0.000000	0.000000	0.000000	
XP_008602194.1 ferric reductase like transmembrane component _Beauveria bassiana ARSEF 2860_	OTHER	0.999887	0.000134	0.000000	0.000000	0.000000	0.000000	
XP_008602195.1 siroheme synthase _Beauveria bassiana ARSEF 2860_	OTHER	1.000000	0.000000	0.000000	0.000000	0.000000	0.000000	
XP_008602199.1 apolipoprotein A-I binding protein _Beauveria bassiana ARSEF 2860_	OTHER	1.000000	0.000000	0.000000	0.000000	0.000000	0.000000	
XP_008602200.1 triacylglycerol lipase _Beauveria bassiana ARSEF 2860_	SP	0.001125	0.997856	0.000268	0.000239	0.000235	0.000250	CS pos: 21-22. Pr: 0.5384
XP_008602203.1 lipoyl synthase _Beauveria bassiana ARSEF 2860_	OTHER	1.000000	0.000000	0.000000	0.000000	0.000000	0.000000	
XP_008602204.1 deoxyribose-phosphate aldolase _Beauveria bassiana ARSEF 2860_	OTHER	1.000000	0.000002	0.000000	0.000000	0.000000	0.000000	
XP_008602205.1 thioredoxin-like protein _Beauveria bassiana ARSEF 2860_	OTHER	1.000000	0.000000	0.000000	0.000000	0.000000	0.000000	
XP_008602206.1 osmosensor protein MOS1 _Beauveria bassiana ARSEF 2860_	OTHER	1.000000	0.000019	0.000000	0.000000	0.000000	0.000000	
XP_008602207.1 mitotic spindle biogenesis protein Spc19, putative _Beauveria bassiana ARSEF 2860_	OTHER	1.000000	0.000000	0.000000	0.000000	0.000000	0.000000	
XP_008602210.1 26S proteasome regulatory subunit RPN5 _Beauveria bassiana ARSEF 2860_	OTHER	1.000000	0.000001	0.000000	0.000000	0.000000	0.000000	
XP_008602213.1 NIPSNAP family protein _Beauveria bassiana ARSEF 2860_	OTHER	1.000000	0.000000	0.000000	0.000000	0.000000	0.000000	
XP_008602215.1 pyruvate dehydrogenase _Beauveria bassiana ARSEF 2860_	OTHER	0.999963	0.000038	0.000000	0.000000	0.000000	0.000000	
XP_008602218.1 spindle assembly checkpoint kinase _Beauveria bassiana ARSEF 2860_	OTHER	1.000000	0.000004	0.000000	0.000000	0.000000	0.000000	
XP_008602222.1 uncharacterized protein BBA_08903 _Beauveria bassiana ARSEF 2860_	OTHER	1.000000	0.000000	0.000000	0.000000	0.000000	0.000000	
XP_008602225.1 NRD1 protein _Beauveria bassiana ARSEF 2860_	OTHER	1.000000	0.000000	0.000000	0.000000	0.000000	0.000000	
XP_008602226.1 Plasma membrane ATPase _Proton pump_ _Beauveria bassiana ARSEF 2860_	OTHER	1.000000	0.000000	0.000000	0.000000	0.000000	0.000000	
XP_008602228.1 BZIP transcription factor _Beauveria bassiana ARSEF 2860_	OTHER	1.000000	0.000013	0.000000	0.000000	0.000000	0.000000	
XP_008602229.1 acetate-CoA ligase _Beauveria bassiana ARSEF 2860_	OTHER	1.000000	0.000000	0.000000	0.000000	0.000000	0.000000	
XP_008602230.1 heterokaryon incompatibility protein _Beauveria bassiana ARSEF 2860_	OTHER	0.999767	0.000264	0.000003	0.000001	0.000000	0.000001	
XP_008602232.1 uncharacterized protein BBA_08913 _Beauveria bassiana ARSEF 2860_	OTHER	1.000000	0.000000	0.000000	0.000000	0.000000	0.000000	
XP_008602233.1 eukaryotic integral membrane protein _Beauveria bassiana ARSEF 2860_	OTHER	1.000000	0.000000	0.000000	0.000000	0.000000	0.000000	
XP_008602238.1 NRPS-like enzyme _Beauveria bassiana ARSEF 2860_	OTHER	1.000000	0.000000	0.000000	0.000000	0.000000	0.000000	
