# SignalP-6.0	Organism: Other	Timestamp: 20250304050133
# ID	Prediction	OTHER	SP(Sec/SPI)	LIPO(Sec/SPII)	TAT(Tat/SPI)	TATLIPO(Tat/SPII)	PILIN(Sec/SPIII)	CS Position
XP_008593320.1 uncharacterized protein BBA_00001 _Beauveria bassiana ARSEF 2860_	OTHER	1.000000	0.000000	0.000000	0.000000	0.000000	0.000000	
XP_008593324.1 ABC transporter transmembrane region _Beauveria bassiana ARSEF 2860_	OTHER	0.999665	0.000326	0.000003	0.000001	0.000001	0.000003	
XP_008593325.1 uncharacterized protein BBA_00006 _Beauveria bassiana ARSEF 2860_	OTHER	1.000000	0.000002	0.000000	0.000000	0.000000	0.000000	
XP_008593329.1 uncharacterized protein BBA_00010 _Beauveria bassiana ARSEF 2860_	OTHER	1.000000	0.000000	0.000000	0.000000	0.000000	0.000000	
XP_008593331.1 ATP synthase H chain _Beauveria bassiana ARSEF 2860_	OTHER	1.000000	0.000000	0.000000	0.000000	0.000000	0.000000	
XP_008593334.1 Transcription regulator cyclin _Beauveria bassiana ARSEF 2860_	OTHER	1.000000	0.000000	0.000000	0.000000	0.000000	0.000000	
XP_008593336.1 ABC transporter _Beauveria bassiana ARSEF 2860_	OTHER	0.999985	0.000000	0.000000	0.000000	0.000000	0.000000	
XP_008593337.1 2OG-Fe_II_ oxygenase family Oxidoreductase _Beauveria bassiana ARSEF 2860_	OTHER	0.810179	0.182792	0.002923	0.001225	0.000734	0.002162	
XP_008593342.1 uncharacterized protein BBA_00023 _Beauveria bassiana ARSEF 2860_	OTHER	1.000000	0.000006	0.000000	0.000000	0.000000	0.000000	
XP_008593343.1 uncharacterized protein BBA_00024 _Beauveria bassiana ARSEF 2860_	OTHER	0.999646	0.000370	0.000013	0.000001	0.000000	0.000001	
XP_008593351.1 uncharacterized protein BBA_00032 _Beauveria bassiana ARSEF 2860_	OTHER	1.000000	0.000000	0.000000	0.000000	0.000000	0.000000	
XP_008593353.1 group II pyridoxal-5-phosphate decarboxylase _Beauveria bassiana ARSEF 2860_	OTHER	1.000000	0.000003	0.000000	0.000000	0.000000	0.000000	
XP_008593355.1 Ras family protein _Beauveria bassiana ARSEF 2860_	OTHER	1.000000	0.000000	0.000000	0.000000	0.000000	0.000000	
XP_008593359.1 uncharacterized protein BBA_00040 _Beauveria bassiana ARSEF 2860_	OTHER	1.000000	0.000007	0.000000	0.000000	0.000000	0.000000	
XP_008593362.1 uncharacterized protein BBA_00043 _Beauveria bassiana ARSEF 2860_	OTHER	0.999454	0.000543	0.000001	0.000001	0.000000	0.000001	
XP_008593368.1 transporter-like protein _Beauveria bassiana ARSEF 2860_	OTHER	1.000000	0.000000	0.000000	0.000000	0.000000	0.000000	
XP_008593379.1 MutS domain V _Beauveria bassiana ARSEF 2860_	OTHER	1.000000	0.000000	0.000000	0.000000	0.000000	0.000000	
XP_008593380.1 3-hydroxyacyl-CoA dehydrogenase, NAD binding domain, putative _Beauveria bassiana ARSEF 2860_	OTHER	1.000000	0.000001	0.000000	0.000000	0.000000	0.000000	
XP_008593383.1 uncharacterized protein BBA_00064 _Beauveria bassiana ARSEF 2860_	OTHER	1.000000	0.000000	0.000000	0.000000	0.000000	0.000000	
XP_008593386.1 2-nitropropane dioxygenase _Beauveria bassiana ARSEF 2860_	OTHER	1.000000	0.000000	0.000000	0.000000	0.000000	0.000000	
XP_008593387.1 vitamin H transporter _Beauveria bassiana ARSEF 2860_	OTHER	1.000000	0.000000	0.000000	0.000000	0.000000	0.000000	
XP_008593389.1 uncharacterized protein BBA_00070 _Beauveria bassiana ARSEF 2860_	OTHER	0.971814	0.006608	0.002971	0.000060	0.000028	0.018521	
XP_008593390.1 nitrate assimilation regulatory protein nirA _Beauveria bassiana ARSEF 2860_	OTHER	1.000000	0.000000	0.000000	0.000000	0.000000	0.000000	
XP_008593397.1 uncharacterized protein BBA_00078 _Beauveria bassiana ARSEF 2860_	OTHER	0.999975	0.000055	0.000000	0.000000	0.000000	0.000000	
XP_008593399.1 uncharacterized protein BBA_00080 _Beauveria bassiana ARSEF 2860_	SP	0.000256	0.999176	0.000155	0.000144	0.000133	0.000128	CS pos: 17-18. Pr: 0.6439
XP_008593405.1 uncharacterized protein BBA_00086 _Beauveria bassiana ARSEF 2860_	OTHER	1.000000	0.000000	0.000000	0.000000	0.000000	0.000000	
XP_008593406.1 uncharacterized protein BBA_00087 _Beauveria bassiana ARSEF 2860_	SP	0.000307	0.999109	0.000171	0.000143	0.000135	0.000128	CS pos: 23-24. Pr: 0.9700
XP_008593407.1 C6 finger domain protein _Beauveria bassiana ARSEF 2860_	OTHER	1.000000	0.000001	0.000000	0.000000	0.000000	0.000000	
XP_008593409.1 aryl-alcohol oxidase_vanillyl-alcohol oxidase _Beauveria bassiana ARSEF 2860_	OTHER	1.000000	0.000000	0.000000	0.000000	0.000000	0.000000	
XP_008593415.1 uncharacterized protein BBA_00096 _Beauveria bassiana ARSEF 2860_	OTHER	1.000000	0.000000	0.000000	0.000000	0.000000	0.000000	
XP_008593416.1 3-hydroxyacyl-CoA dehyrogenase _Beauveria bassiana ARSEF 2860_	OTHER	0.995672	0.003407	0.000915	0.000012	0.000005	0.000009	
XP_008593417.1 major facilitator superfamily transporter _Beauveria bassiana ARSEF 2860_	OTHER	1.000000	0.000000	0.000000	0.000000	0.000000	0.000000	
XP_008593422.1 uncharacterized protein BBA_00103 _Beauveria bassiana ARSEF 2860_	OTHER	0.996213	0.003730	0.000019	0.000017	0.000011	0.000024	
XP_008593423.1 uncharacterized protein BBA_00104 _Beauveria bassiana ARSEF 2860_	OTHER	1.000000	0.000000	0.000000	0.000000	0.000000	0.000000	
XP_008593424.1 Putative Zn_II_2Cys6 transcription factor _Beauveria bassiana ARSEF 2860_	OTHER	1.000000	0.000001	0.000001	0.000000	0.000000	0.000000	
XP_008593425.1 WD domain-containing protein _Beauveria bassiana ARSEF 2860_	OTHER	1.000000	0.000001	0.000000	0.000000	0.000000	0.000000	
XP_008593426.1 helicase associated domain-containing protein _Beauveria bassiana ARSEF 2860_	OTHER	1.000000	0.000000	0.000000	0.000000	0.000000	0.000000	
XP_008593432.1 uncharacterized protein BBA_00113 _Beauveria bassiana ARSEF 2860_	OTHER	1.000000	0.000000	0.000000	0.000000	0.000000	0.000000	
XP_008593435.1 ChaC-like protein _Beauveria bassiana ARSEF 2860_	OTHER	1.000000	0.000000	0.000000	0.000000	0.000000	0.000000	
XP_008593443.1 rRNA-processing protein UTP23 _Beauveria bassiana ARSEF 2860_	OTHER	1.000000	0.000002	0.000000	0.000000	0.000000	0.000000	
XP_008593446.1 uncharacterized protein BBA_00127 _Beauveria bassiana ARSEF 2860_	OTHER	1.000000	0.000000	0.000000	0.000000	0.000000	0.000000	
XP_008593451.1 uncharacterized protein BBA_00132 _Beauveria bassiana ARSEF 2860_	OTHER	1.000000	0.000002	0.000000	0.000000	0.000000	0.000000	
XP_008593455.1 TH14-3-3 protein _Beauveria bassiana ARSEF 2860_	OTHER	1.000000	0.000000	0.000000	0.000000	0.000000	0.000000	
XP_008593465.1 ELMO_CED-12 family protein _Beauveria bassiana ARSEF 2860_	OTHER	1.000000	0.000000	0.000000	0.000000	0.000000	0.000000	
XP_008593467.1 homeobox domain-containing protein _Beauveria bassiana ARSEF 2860_	OTHER	1.000000	0.000000	0.000000	0.000000	0.000000	0.000000	
XP_008593471.1 uncharacterized protein BBA_00152 _Beauveria bassiana ARSEF 2860_	OTHER	1.000000	0.000000	0.000000	0.000000	0.000000	0.000000	
XP_008593472.1 carbohydrate kinase _Beauveria bassiana ARSEF 2860_	OTHER	1.000000	0.000000	0.000000	0.000000	0.000000	0.000000	
XP_008593473.1 ATP synthase alpha chain _Beauveria bassiana ARSEF 2860_	OTHER	1.000000	0.000000	0.000000	0.000000	0.000000	0.000000	
XP_008593479.1 uncharacterized protein BBA_00160 _Beauveria bassiana ARSEF 2860_	OTHER	1.000000	0.000000	0.000000	0.000000	0.000000	0.000000	
XP_008593482.1 uncharacterized protein BBA_00163 _Beauveria bassiana ARSEF 2860_	OTHER	1.000000	0.000000	0.000000	0.000000	0.000000	0.000000	
XP_008593483.1 WLM domain-containing protein _Beauveria bassiana ARSEF 2860_	OTHER	1.000000	0.000000	0.000000	0.000000	0.000000	0.000000	
XP_008593486.1 hemolysin-III family protein _Beauveria bassiana ARSEF 2860_	OTHER	1.000000	0.000002	0.000000	0.000000	0.000000	0.000000	
XP_008593489.1 serine_threonine-protein kinase cbk1 _Beauveria bassiana ARSEF 2860_	OTHER	1.000000	0.000000	0.000000	0.000000	0.000000	0.000000	
XP_008593490.1 serine_threonine protein kinase, putative _Beauveria bassiana ARSEF 2860_	OTHER	1.000000	0.000000	0.000000	0.000000	0.000000	0.000000	
XP_008593493.1 60S acidic ribosomal protein P0 _Beauveria bassiana ARSEF 2860_	OTHER	1.000000	0.000000	0.000000	0.000000	0.000000	0.000000	
XP_008593500.1 BAH_PHD-containing protein _Beauveria bassiana ARSEF 2860_	OTHER	1.000000	0.000013	0.000000	0.000000	0.000000	0.000000	
XP_008593502.1 major facilitator superfamily transporter _Beauveria bassiana ARSEF 2860_	OTHER	1.000000	0.000003	0.000000	0.000000	0.000000	0.000000	
XP_008593509.1 COX17 protein _Beauveria bassiana ARSEF 2860_	OTHER	0.999988	0.000041	0.000000	0.000000	0.000000	0.000000	
XP_008593511.1 Ribonuclease H1 _Beauveria bassiana ARSEF 2860_	OTHER	1.000000	0.000000	0.000000	0.000000	0.000000	0.000000	
XP_008593523.1 cyclin domain-containing protein _Beauveria bassiana ARSEF 2860_	OTHER	1.000000	0.000000	0.000000	0.000000	0.000000	0.000000	
XP_008593524.1 uncharacterized protein BBA_00205 _Beauveria bassiana ARSEF 2860_	OTHER	1.000000	0.000010	0.000000	0.000000	0.000000	0.000000	
XP_008593527.1 40S ribosomal protein S2 _Beauveria bassiana ARSEF 2860_	OTHER	1.000000	0.000001	0.000000	0.000000	0.000000	0.000000	
XP_008593531.1 proline dehydrogenase _Beauveria bassiana ARSEF 2860_	OTHER	0.999978	0.000043	0.000003	0.000000	0.000000	0.000001	
XP_008593537.1 regulator of G-protein signaling domain-containing protein _Beauveria bassiana ARSEF 2860_	OTHER	1.000000	0.000000	0.000000	0.000000	0.000000	0.000000	
XP_008593539.1 CLAP1-like protein _Beauveria bassiana ARSEF 2860_	OTHER	0.999356	0.000649	0.000001	0.000001	0.000001	0.000001	
XP_008593543.1 fructosamine Kinase PKL_CAK_FruK _Beauveria bassiana ARSEF 2860_	OTHER	1.000000	0.000000	0.000000	0.000000	0.000000	0.000000	
XP_008593544.1 uncharacterized protein BBA_00225 _Beauveria bassiana ARSEF 2860_	OTHER	1.000000	0.000000	0.000000	0.000000	0.000000	0.000000	
XP_008593549.1 WASP-interacting protein-like protein vrp1p _Beauveria bassiana ARSEF 2860_	OTHER	1.000000	0.000000	0.000000	0.000000	0.000000	0.000000	
XP_008593550.1 uncharacterized protein BBA_00231 _Beauveria bassiana ARSEF 2860_	OTHER	1.000000	0.000000	0.000000	0.000000	0.000000	0.000000	
XP_008593552.1 uncharacterized protein BBA_00233 _Beauveria bassiana ARSEF 2860_	OTHER	1.000000	0.000000	0.000000	0.000000	0.000000	0.000000	
XP_008593554.1 peptidase A4 family protein _Beauveria bassiana ARSEF 2860_	SP	0.000231	0.999123	0.000153	0.000167	0.000151	0.000136	CS pos: 18-19. Pr: 0.9805
XP_008593557.1 chaperone protein hchA _Beauveria bassiana ARSEF 2860_	OTHER	1.000000	0.000000	0.000000	0.000000	0.000000	0.000000	
XP_008593559.1 Spa2-like protein _Beauveria bassiana ARSEF 2860_	OTHER	1.000000	0.000011	0.000000	0.000000	0.000000	0.000000	
XP_008593560.1 Ssu72-like protein _Beauveria bassiana ARSEF 2860_	OTHER	0.999894	0.000153	0.000000	0.000000	0.000000	0.000000	
XP_008593563.1 BOUP1-like protein _Beauveria bassiana ARSEF 2860_	OTHER	1.000000	0.000000	0.000000	0.000000	0.000000	0.000000	
XP_008593569.1 major facilitator superfamily transporter _Beauveria bassiana ARSEF 2860_	OTHER	1.000000	0.000010	0.000000	0.000000	0.000000	0.000000	
XP_008593572.1 uncharacterized protein BBA_00253 _Beauveria bassiana ARSEF 2860_	OTHER	1.000000	0.000020	0.000000	0.000000	0.000000	0.000000	
XP_008593574.1 putative aspartyl protease _Beauveria bassiana ARSEF 2860_	SP	0.000276	0.999063	0.000169	0.000156	0.000151	0.000142	CS pos: 18-19. Pr: 0.9720
XP_008593578.1 uncharacterized protein BBA_00259 _Beauveria bassiana ARSEF 2860_	OTHER	1.000000	0.000000	0.000000	0.000000	0.000000	0.000000	
XP_008593579.1 RNA polymerase Rpb1 _Beauveria bassiana ARSEF 2860_	OTHER	1.000000	0.000000	0.000000	0.000000	0.000000	0.000000	
XP_008593583.1 YSIRK family gram-positive signal peptide _Beauveria bassiana ARSEF 2860_	OTHER	1.000000	0.000000	0.000000	0.000000	0.000000	0.000000	
XP_008593584.1 morphogenesis protein _Beauveria bassiana ARSEF 2860_	OTHER	1.000000	0.000000	0.000000	0.000000	0.000000	0.000000	
XP_008593592.1 transcription elongation factor S-II _Beauveria bassiana ARSEF 2860_	OTHER	1.000000	0.000000	0.000000	0.000000	0.000000	0.000000	
XP_008593595.1 sphingolipid long chain base sensory protein, putative _Beauveria bassiana ARSEF 2860_	OTHER	1.000000	0.000000	0.000000	0.000000	0.000000	0.000000	
XP_008593604.1 uncharacterized protein BBA_00285 _Beauveria bassiana ARSEF 2860_	OTHER	1.000000	0.000004	0.000001	0.000000	0.000000	0.000000	
XP_008593607.1 RNA polymerase N_8 kDa subunit _Beauveria bassiana ARSEF 2860_	OTHER	1.000000	0.000000	0.000000	0.000000	0.000000	0.000000	
XP_008593608.1 uncharacterized protein BBA_00289 _Beauveria bassiana ARSEF 2860_	OTHER	1.000000	0.000000	0.000000	0.000000	0.000000	0.000000	
XP_008593609.1 uncharacterized protein BBA_00290 _Beauveria bassiana ARSEF 2860_	OTHER	1.000000	0.000000	0.000000	0.000000	0.000000	0.000000	
XP_008593612.1 PIG-P domain-containing protein _Beauveria bassiana ARSEF 2860_	OTHER	1.000000	0.000000	0.000000	0.000000	0.000000	0.000000	
XP_008593613.1 vacuolar assembly_sorting protein VPS8 _Beauveria bassiana ARSEF 2860_	OTHER	1.000000	0.000043	0.000000	0.000000	0.000000	0.000000	
XP_008593619.1 FoabaA-like protein _Beauveria bassiana ARSEF 2860_	OTHER	1.000000	0.000000	0.000000	0.000000	0.000000	0.000000	
XP_008593620.1 RNA recognition domain-containing protein _Beauveria bassiana ARSEF 2860_	OTHER	1.000000	0.000000	0.000000	0.000000	0.000000	0.000000	
XP_008593621.1 glycosyltransferase family 2 _Beauveria bassiana ARSEF 2860_	OTHER	1.000000	0.000000	0.000000	0.000000	0.000000	0.000000	
XP_008593626.1 Protein of unknown function DUF2401, secretory _Beauveria bassiana ARSEF 2860_	SP	0.001469	0.997524	0.000261	0.000238	0.000234	0.000240	CS pos: 20-21. Pr: 0.4174
XP_008593633.1 fibronectin type III domain-containing protein _Beauveria bassiana ARSEF 2860_	OTHER	1.000000	0.000000	0.000000	0.000000	0.000000	0.000000	
XP_008593635.1 histidinol dehydrogenase _Beauveria bassiana ARSEF 2860_	OTHER	1.000000	0.000000	0.000000	0.000000	0.000000	0.000000	
XP_008593640.1 thioredoxin-disulfide reductase _Beauveria bassiana ARSEF 2860_	OTHER	1.000000	0.000000	0.000000	0.000000	0.000000	0.000000	
XP_008593641.1 metalloprotease-like protein _Beauveria bassiana ARSEF 2860_	OTHER	0.999534	0.000465	0.000024	0.000001	0.000001	0.000002	
XP_008593787.1 pre-mRNA-splicing factor cef-1 _Beauveria bassiana ARSEF 2860_	OTHER	1.000000	0.000000	0.000000	0.000000	0.000000	0.000000	
XP_008593793.1 gamma interferon inducible lysosomal thiol reductase _GILT_ _Beauveria bassiana ARSEF 2860_	OTHER	0.999910	0.000110	0.000000	0.000000	0.000000	0.000000	
XP_008593795.1 SH3 domain-containing protein _Beauveria bassiana ARSEF 2860_	OTHER	1.000000	0.000005	0.000000	0.000000	0.000000	0.000000	
XP_008593797.1 calcineurin-like phosphoesterase _Beauveria bassiana ARSEF 2860_	OTHER	1.000000	0.000000	0.000000	0.000000	0.000000	0.000000	
XP_008593798.1 exocyst complex component EXO84 _Beauveria bassiana ARSEF 2860_	OTHER	1.000000	0.000000	0.000000	0.000000	0.000000	0.000000	
XP_008593799.1 uncharacterized protein BBA_00480 _Beauveria bassiana ARSEF 2860_	OTHER	1.000000	0.000000	0.000000	0.000000	0.000000	0.000000	
XP_008593800.1 MAS20 protein import receptor _Beauveria bassiana ARSEF 2860_	OTHER	0.977764	0.022123	0.000034	0.000039	0.000017	0.000026	
XP_008593801.1 wyosine base formation _Beauveria bassiana ARSEF 2860_	OTHER	1.000000	0.000004	0.000000	0.000000	0.000000	0.000000	
XP_008593813.1 uncharacterized protein BBA_00494 _Beauveria bassiana ARSEF 2860_	OTHER	1.000000	0.000000	0.000000	0.000000	0.000000	0.000000	
XP_008593814.1 SNARE protein, putative _Beauveria bassiana ARSEF 2860_	OTHER	1.000000	0.000000	0.000000	0.000000	0.000000	0.000000	
XP_008593816.1 Sec63 Brl domain-containing protein _Beauveria bassiana ARSEF 2860_	OTHER	1.000000	0.000001	0.000000	0.000000	0.000000	0.000000	
XP_008593818.1 C6 finger domain protein _Beauveria bassiana ARSEF 2860_	OTHER	1.000000	0.000001	0.000000	0.000000	0.000000	0.000000	
XP_008593821.1 Ras family protein _Beauveria bassiana ARSEF 2860_	OTHER	1.000000	0.000000	0.000000	0.000000	0.000000	0.000000	
XP_008593822.1 SUR7 protein _Beauveria bassiana ARSEF 2860_	OTHER	1.000000	0.000000	0.000000	0.000000	0.000000	0.000000	
XP_008593831.1 trascription factor _Beauveria bassiana ARSEF 2860_	OTHER	0.999843	0.000127	0.000028	0.000002	0.000001	0.000007	
XP_008593832.1 uncharacterized protein BBA_00513 _Beauveria bassiana ARSEF 2860_	OTHER	1.000000	0.000002	0.000000	0.000000	0.000000	0.000000	
XP_008593833.1 uncharacterized protein BBA_00514 _Beauveria bassiana ARSEF 2860_	OTHER	1.000000	0.000000	0.000000	0.000000	0.000000	0.000000	
XP_008593834.1 Concanavalin A-like lectin_glucanase _Beauveria bassiana ARSEF 2860_	SP	0.014652	0.984247	0.000295	0.000288	0.000234	0.000232	CS pos: 18-19. Pr: 0.5619
XP_008593835.1 Pex2_Pex12 amino terminal region _Beauveria bassiana ARSEF 2860_	OTHER	1.000000	0.000000	0.000000	0.000000	0.000000	0.000000	
XP_008593837.1 uncharacterized protein BBA_00518 _Beauveria bassiana ARSEF 2860_	OTHER	1.000000	0.000000	0.000000	0.000000	0.000000	0.000000	
XP_008593839.1 heterokaryon incompatibility protein Het-C _Beauveria bassiana ARSEF 2860_	SP	0.000200	0.999205	0.000143	0.000159	0.000141	0.000130	CS pos: 25-26. Pr: 0.9779
XP_008593840.1 nonhistone chromosomal protein _Beauveria bassiana ARSEF 2860_	OTHER	1.000000	0.000000	0.000000	0.000000	0.000000	0.000000	
XP_008593842.1 histone acetyltransferase subunit 3 _Beauveria bassiana ARSEF 2860_	OTHER	1.000000	0.000010	0.000000	0.000000	0.000000	0.000000	
XP_008593844.1 GPI anchored cell wall protein _Beauveria bassiana ARSEF 2860_	SP	0.002760	0.995948	0.000485	0.000252	0.000260	0.000265	CS pos: 20-21. Pr: 0.4676
XP_008593848.1 amino acid transporter _Beauveria bassiana ARSEF 2860_	OTHER	1.000000	0.000001	0.000000	0.000000	0.000000	0.000000	
XP_008593849.1 Hydrophobin 2 _Beauveria bassiana ARSEF 2860_	SP	0.000236	0.999166	0.000153	0.000157	0.000133	0.000129	CS pos: 17-18. Pr: 0.9793
XP_008593855.1 Alcohol dehydrogenase superfamily, zinc-containing _Beauveria bassiana ARSEF 2860_	OTHER	1.000000	0.000000	0.000000	0.000000	0.000000	0.000000	
XP_008593856.1 WD domain-containing protein _Beauveria bassiana ARSEF 2860_	OTHER	1.000000	0.000000	0.000000	0.000000	0.000000	0.000000	
XP_008593857.1 Atg28p-like protein _Beauveria bassiana ARSEF 2860_	OTHER	1.000000	0.000000	0.000000	0.000000	0.000000	0.000000	
XP_008593858.1 Protein of unknown function DUF1748 _Beauveria bassiana ARSEF 2860_	OTHER	0.995631	0.004199	0.000139	0.000017	0.000010	0.000018	
XP_008593860.1 phosphatidylserine decarboxylase family protein _Beauveria bassiana ARSEF 2860_	OTHER	1.000000	0.000000	0.000000	0.000000	0.000000	0.000000	
XP_008593862.1 pyruvate kinase _Beauveria bassiana ARSEF 2860_	OTHER	1.000000	0.000000	0.000000	0.000000	0.000000	0.000000	
XP_008593863.1 Major Facilitator Superfamily protein _Beauveria bassiana ARSEF 2860_	OTHER	0.999965	0.000084	0.000001	0.000000	0.000000	0.000000	
XP_008593865.1 calcium-dependent protein kinase _Beauveria bassiana ARSEF 2860_	OTHER	1.000000	0.000008	0.000000	0.000000	0.000000	0.000000	
XP_008593866.1 purine nucleoside permease _Beauveria bassiana ARSEF 2860_	SP	0.439258	0.557412	0.000764	0.000837	0.000670	0.001045	CS pos: 20-21. Pr: 0.3636
XP_008593867.1 calcium-translocating P-type ATPase _Beauveria bassiana ARSEF 2860_	OTHER	1.000000	0.000001	0.000000	0.000000	0.000000	0.000000	
XP_008593870.1 major facilitator superfamily transporter _Beauveria bassiana ARSEF 2860_	OTHER	1.000000	0.000000	0.000000	0.000000	0.000000	0.000000	
XP_008593873.1 cupin domain-containing protein _Beauveria bassiana ARSEF 2860_	OTHER	1.000000	0.000032	0.000000	0.000000	0.000000	0.000000	
XP_008593878.1 oxidoreductase molybdopterin binding domain-containing protein _Beauveria bassiana ARSEF 2860_	OTHER	0.982843	0.016915	0.000132	0.000049	0.000024	0.000047	
XP_008593880.1 mRNA capping enzyme _Beauveria bassiana ARSEF 2860_	OTHER	1.000000	0.000000	0.000000	0.000000	0.000000	0.000000	
XP_008593888.1 uncharacterized protein BBA_00569 _Beauveria bassiana ARSEF 2860_	OTHER	1.000000	0.000004	0.000000	0.000000	0.000000	0.000000	
XP_008593896.1 SNF2 family N-terminal domain containing protein _Beauveria bassiana ARSEF 2860_	OTHER	1.000000	0.000001	0.000000	0.000000	0.000000	0.000000	
XP_008593900.1 uncharacterized protein BBA_00581 _Beauveria bassiana ARSEF 2860_	OTHER	1.000000	0.000000	0.000000	0.000000	0.000000	0.000000	
XP_008593905.1 DNA polymerase POL4, putative _Beauveria bassiana ARSEF 2860_	OTHER	1.000000	0.000000	0.000000	0.000000	0.000000	0.000000	
XP_008593906.1 intracellular protein transport protein _Beauveria bassiana ARSEF 2860_	OTHER	1.000000	0.000000	0.000000	0.000000	0.000000	0.000000	
XP_008593907.1 RNA polymerase II Mediator complex subunit Sin4 _Beauveria bassiana ARSEF 2860_	OTHER	0.999902	0.000116	0.000014	0.000001	0.000000	0.000004	
XP_008593911.1 vacuolar protein sorting_targeting protein PEP1 _Beauveria bassiana ARSEF 2860_	SP	0.000225	0.999161	0.000172	0.000159	0.000143	0.000133	CS pos: 26-27. Pr: 0.9790
XP_008593912.1 uncharacterized protein BBA_00593 _Beauveria bassiana ARSEF 2860_	OTHER	1.000000	0.000000	0.000000	0.000000	0.000000	0.000000	
XP_008593914.1 glycosyl hydrolase family 47 _Beauveria bassiana ARSEF 2860_	OTHER	1.000000	0.000000	0.000000	0.000000	0.000000	0.000000	
XP_008593915.1 Autophagy-like protein 3 _Beauveria bassiana ARSEF 2860_	OTHER	1.000000	0.000000	0.000000	0.000000	0.000000	0.000000	
XP_008593919.1 uncharacterized protein BBA_00600 _Beauveria bassiana ARSEF 2860_	OTHER	1.000000	0.000000	0.000000	0.000000	0.000000	0.000000	
XP_008593921.1 kelch domain-containing protein _Beauveria bassiana ARSEF 2860_	OTHER	1.000000	0.000000	0.000000	0.000000	0.000000	0.000000	
XP_008593922.1 AMP-binding enzyme _Beauveria bassiana ARSEF 2860_	OTHER	1.000000	0.000027	0.000000	0.000000	0.000000	0.000000	
XP_008593923.1 phosphatidylinositol-glycan biosynthesis class S protein _Beauveria bassiana ARSEF 2860_	OTHER	1.000000	0.000000	0.000000	0.000000	0.000000	0.000000	
XP_008593927.1 amino acid permease family protein _Beauveria bassiana ARSEF 2860_	OTHER	0.999995	0.000023	0.000000	0.000000	0.000000	0.000000	
XP_008593930.1 patatin-like phospholipase _Beauveria bassiana ARSEF 2860_	OTHER	1.000000	0.000000	0.000000	0.000000	0.000000	0.000000	
XP_008593938.1 intracellular serine protease _Beauveria bassiana ARSEF 2860_	OTHER	1.000000	0.000000	0.000000	0.000000	0.000000	0.000000	
XP_008593940.1 ankyrin repeat domain-containing protein 52 _Beauveria bassiana ARSEF 2860_	OTHER	1.000000	0.000000	0.000000	0.000000	0.000000	0.000000	
XP_008593941.1 uncharacterized protein BBA_00622 _Beauveria bassiana ARSEF 2860_	OTHER	1.000000	0.000000	0.000000	0.000000	0.000000	0.000000	
XP_008593943.1 uncharacterized protein BBA_00624 _Beauveria bassiana ARSEF 2860_	SP	0.000276	0.999107	0.000142	0.000161	0.000145	0.000134	CS pos: 26-27. Pr: 0.7674
XP_008593950.1 D-alanine--D-alanine ligase _Beauveria bassiana ARSEF 2860_	OTHER	1.000000	0.000000	0.000000	0.000000	0.000000	0.000000	
XP_008593954.1 Secretory lipase family protein _Beauveria bassiana ARSEF 2860_	SP	0.001021	0.998103	0.000189	0.000263	0.000209	0.000197	CS pos: 21-22. Pr: 0.9673
XP_008593955.1 major facilitator superfamily transporter _Beauveria bassiana ARSEF 2860_	OTHER	1.000000	0.000000	0.000000	0.000000	0.000000	0.000000	
XP_008593957.1 putative tricarboxylate transporter mitochondrial carrier protein _Beauveria bassiana ARSEF 2860_	OTHER	1.000000	0.000000	0.000000	0.000000	0.000000	0.000000	
XP_008593961.1 protein-beta-aspartate methyltransferase _Beauveria bassiana ARSEF 2860_	OTHER	1.000000	0.000000	0.000000	0.000000	0.000000	0.000000	
XP_008593962.1 uncharacterized protein BBA_00643 _Beauveria bassiana ARSEF 2860_	SP	0.000234	0.999111	0.000174	0.000153	0.000146	0.000137	CS pos: 22-23. Pr: 0.5200
XP_008593969.1 NADH-ubiquinone oxidoreductase 23 kDa subunit _Beauveria bassiana ARSEF 2860_	OTHER	1.000000	0.000000	0.000000	0.000000	0.000000	0.000000	
XP_008593971.1 acyl carrier protein _Beauveria bassiana ARSEF 2860_	OTHER	1.000000	0.000000	0.000000	0.000000	0.000000	0.000000	
XP_008593972.1 spindle poison sensitivity protein Scp3, putative _Beauveria bassiana ARSEF 2860_	OTHER	0.998615	0.001419	0.000003	0.000002	0.000001	0.000002	
XP_008593973.1 uncharacterized protein BBA_00654 _Beauveria bassiana ARSEF 2860_	OTHER	1.000000	0.000003	0.000000	0.000000	0.000000	0.000000	
XP_008593974.1 amidohydrolase-like protein _Beauveria bassiana ARSEF 2860_	SP	0.000210	0.999179	0.000154	0.000158	0.000142	0.000132	CS pos: 21-22. Pr: 0.9756
XP_008593977.1 DNA repair helicase _Beauveria bassiana ARSEF 2860_	OTHER	1.000000	0.000000	0.000000	0.000000	0.000000	0.000000	
XP_008593978.1 60S ribosomal protein L28 _Beauveria bassiana ARSEF 2860_	OTHER	1.000000	0.000000	0.000000	0.000000	0.000000	0.000000	
XP_008593979.1 cell division control protein _Beauveria bassiana ARSEF 2860_	OTHER	1.000000	0.000004	0.000000	0.000000	0.000000	0.000000	
XP_008593998.1 uncharacterized protein BBA_00679 _Beauveria bassiana ARSEF 2860_	OTHER	0.996846	0.003042	0.000083	0.000013	0.000008	0.000049	
XP_008593999.1 oligomeric Golgi complex subunit 5 _Beauveria bassiana ARSEF 2860_	OTHER	1.000000	0.000001	0.000000	0.000000	0.000000	0.000000	
XP_008594012.1 metalloprotease-like protein _Beauveria bassiana ARSEF 2860_	OTHER	1.000000	0.000001	0.000000	0.000000	0.000000	0.000000	
XP_008594014.1 uncharacterized protein BBA_00695 _Beauveria bassiana ARSEF 2860_	OTHER	0.999992	0.000031	0.000000	0.000000	0.000000	0.000000	
XP_008594015.1 uncharacterized protein BBA_00696 _Beauveria bassiana ARSEF 2860_	OTHER	0.999231	0.000751	0.000014	0.000005	0.000001	0.000004	
XP_008594016.1 vegetative incompatibility protein HET-E-1 _Beauveria bassiana ARSEF 2860_	OTHER	1.000000	0.000000	0.000000	0.000000	0.000000	0.000000	
XP_008594020.1 uncharacterized protein BBA_00701 _Beauveria bassiana ARSEF 2860_	OTHER	1.000000	0.000000	0.000000	0.000000	0.000000	0.000000	
XP_008594023.1 ferric-chelate reductase _Beauveria bassiana ARSEF 2860_	OTHER	1.000000	0.000000	0.000000	0.000000	0.000000	0.000000	
