XP_008599119.1 choline_ethanolamine kinase _Beauveria bassiana ARSEF 2860_	OTHER	1.000000	0.000000	0.000000	0.000000	0.000000	0.000000	
XP_008599120.1 CPSF A subunit region _Beauveria bassiana ARSEF 2860_	OTHER	1.000000	0.000000	0.000000	0.000000	0.000000	0.000000	
XP_008599121.1 ankyrin repeat protein _Beauveria bassiana ARSEF 2860_	OTHER	1.000000	0.000000	0.000000	0.000000	0.000000	0.000000	
XP_008599122.1 polarized growth protein _Boi2_, putative _Beauveria bassiana ARSEF 2860_	OTHER	0.996415	0.002796	0.000628	0.000018	0.000010	0.000168	
XP_008599126.1 uncharacterized protein BBA_05807 _Beauveria bassiana ARSEF 2860_	OTHER	1.000000	0.000000	0.000000	0.000000	0.000000	0.000000	
XP_008599128.1 MFS allantoate transporter, putative _Beauveria bassiana ARSEF 2860_	OTHER	0.999989	0.000025	0.000000	0.000000	0.000000	0.000000	
XP_008599130.1 TATA-binding protein interacting _Beauveria bassiana ARSEF 2860_	OTHER	1.000000	0.000000	0.000000	0.000000	0.000000	0.000000	
XP_008599131.1 hexose transporter _Beauveria bassiana ARSEF 2860_	OTHER	1.000000	0.000000	0.000000	0.000000	0.000000	0.000000	
XP_008599132.1 acetylornithine deacetylase _Beauveria bassiana ARSEF 2860_	OTHER	1.000000	0.000000	0.000000	0.000000	0.000000	0.000000	
XP_008599133.1 homeobox and C2H2 transcription factor, putative _Beauveria bassiana ARSEF 2860_	OTHER	1.000000	0.000004	0.000000	0.000000	0.000000	0.000000	
XP_008599135.1 siderochrome-iron transporter MirC _Beauveria bassiana ARSEF 2860_	OTHER	1.000000	0.000000	0.000000	0.000000	0.000000	0.000000	
XP_008599137.1 Sodium_neurotransmitter symporter family protein _Beauveria bassiana ARSEF 2860_	OTHER	1.000000	0.000007	0.000000	0.000000	0.000000	0.000000	
XP_008599138.1 iron-sulfur cluster assembly accessory protein _Beauveria bassiana ARSEF 2860_	OTHER	1.000000	0.000000	0.000000	0.000000	0.000000	0.000000	
XP_008599139.1 C6 transcription factor, putative _Beauveria bassiana ARSEF 2860_	OTHER	0.999531	0.000502	0.000003	0.000002	0.000000	0.000001	
XP_008599140.1 oxidoreductase family protein _Beauveria bassiana ARSEF 2860_	OTHER	1.000000	0.000000	0.000000	0.000000	0.000000	0.000000	
XP_008599142.1 NAD-dependent epimerase_dehydratase _Beauveria bassiana ARSEF 2860_	OTHER	1.000000	0.000000	0.000000	0.000000	0.000000	0.000000	
XP_008599143.1 thioesterase superfamily protein _Beauveria bassiana ARSEF 2860_	OTHER	1.000000	0.000000	0.000000	0.000000	0.000000	0.000000	
XP_008599144.1 secreted glucosidase _Beauveria bassiana ARSEF 2860_	SP	0.000209	0.999136	0.000158	0.000173	0.000156	0.000145	CS pos: 19-20. Pr: 0.9765
XP_008599145.1 20beta-hydroxysteroid dehydrogenase _Beauveria bassiana ARSEF 2860_	OTHER	1.000000	0.000001	0.000000	0.000000	0.000000	0.000000	
XP_008599148.1 uncharacterized protein BBA_05829 _Beauveria bassiana ARSEF 2860_	OTHER	1.000000	0.000000	0.000000	0.000000	0.000000	0.000000	
XP_008599152.1 major facilitator superfamily transporter _Beauveria bassiana ARSEF 2860_	OTHER	0.985004	0.013020	0.000540	0.000987	0.000259	0.000188	
XP_008599153.1 Cytochrome P450 CYP528A4 _Beauveria bassiana ARSEF 2860_	OTHER	1.000000	0.000000	0.000000	0.000000	0.000000	0.000000	
XP_008599154.1 putative peptide transporter _Beauveria bassiana ARSEF 2860_	OTHER	1.000000	0.000001	0.000000	0.000000	0.000000	0.000000	
XP_008599155.1 dihydrofolate reductase-thymidylate synthase _Beauveria bassiana ARSEF 2860_	OTHER	1.000000	0.000000	0.000000	0.000000	0.000000	0.000000	
XP_008599156.1 WD domain-containing protein _Beauveria bassiana ARSEF 2860_	OTHER	1.000000	0.000035	0.000000	0.000000	0.000000	0.000000	
XP_008599157.1 glycosyl hydrolase family 2 _Beauveria bassiana ARSEF 2860_	OTHER	1.000000	0.000003	0.000000	0.000000	0.000000	0.000000	
XP_008599159.1 transposase-like protein _Beauveria bassiana ARSEF 2860_	OTHER	1.000000	0.000000	0.000000	0.000000	0.000000	0.000000	
XP_008599161.1 uncharacterized protein BBA_05842 _Beauveria bassiana ARSEF 2860_	OTHER	1.000000	0.000000	0.000000	0.000000	0.000000	0.000000	
XP_008599165.1 fungal specific transcription factor _Beauveria bassiana ARSEF 2860_	OTHER	0.999964	0.000047	0.000000	0.000000	0.000000	0.000000	
XP_008599166.1 putative glycosyl hydrolase _Beauveria bassiana ARSEF 2860_	OTHER	1.000000	0.000042	0.000000	0.000000	0.000000	0.000000	
XP_008599167.1 covalently-linked cell wall protein _Beauveria bassiana ARSEF 2860_	OTHER	1.000000	0.000008	0.000000	0.000000	0.000000	0.000000	
XP_008599168.1 U1 zinc finger protein _Beauveria bassiana ARSEF 2860_	OTHER	1.000000	0.000000	0.000000	0.000000	0.000000	0.000000	
XP_008599169.1 dienelactone hydrolase _Beauveria bassiana ARSEF 2860_	OTHER	1.000000	0.000000	0.000000	0.000000	0.000000	0.000000	
XP_008599170.1 transmembrane anterior posterior transformation 1 _Beauveria bassiana ARSEF 2860_	OTHER	1.000000	0.000007	0.000000	0.000000	0.000000	0.000000	
XP_008599171.1 karyopherin Kap123 _Beauveria bassiana ARSEF 2860_	OTHER	1.000000	0.000000	0.000000	0.000000	0.000000	0.000000	
XP_008599175.1 uncharacterized protein BBA_05856 _Beauveria bassiana ARSEF 2860_	OTHER	0.999719	0.000294	0.000000	0.000000	0.000000	0.000000	
XP_008599176.1 short chain dehydrogenase _Beauveria bassiana ARSEF 2860_	OTHER	0.999841	0.000146	0.000000	0.000000	0.000000	0.000000	
XP_008599177.1 glycosyl hydrolase family 47 protein _Beauveria bassiana ARSEF 2860_	OTHER	1.000000	0.000002	0.000000	0.000000	0.000000	0.000000	
XP_008599178.1 uncharacterized protein BBA_05859 _Beauveria bassiana ARSEF 2860_	SP	0.000265	0.999103	0.000149	0.000163	0.000142	0.000140	CS pos: 28-29. Pr: 0.9769
XP_008599180.1 zinc finger protein Yan _Beauveria bassiana ARSEF 2860_	OTHER	1.000000	0.000001	0.000000	0.000000	0.000000	0.000000	
XP_008599182.1 alkylated DNA repair protein AlkB _Beauveria bassiana ARSEF 2860_	OTHER	1.000000	0.000003	0.000000	0.000000	0.000000	0.000000	
XP_008599183.1 ribosome biogenesis GTP-binding protein YsxC _Beauveria bassiana ARSEF 2860_	OTHER	1.000000	0.000000	0.000000	0.000000	0.000000	0.000000	
XP_008599184.1 C3HC zinc finger domain-containing protein _Beauveria bassiana ARSEF 2860_	OTHER	1.000000	0.000000	0.000000	0.000000	0.000000	0.000000	
XP_008599185.1 SRP40 domain-containing protein _Beauveria bassiana ARSEF 2860_	OTHER	1.000000	0.000000	0.000000	0.000000	0.000000	0.000000	
XP_008599186.1 adenosine_AMP deaminase _Beauveria bassiana ARSEF 2860_	OTHER	1.000000	0.000000	0.000000	0.000000	0.000000	0.000000	
XP_008599189.1 uncharacterized protein BBA_05870 _Beauveria bassiana ARSEF 2860_	OTHER	1.000000	0.000001	0.000000	0.000000	0.000000	0.000000	
XP_008599190.1 uncharacterized protein BBA_05871 _Beauveria bassiana ARSEF 2860_	OTHER	1.000000	0.000000	0.000000	0.000000	0.000000	0.000000	
XP_008599191.1 BZIP family transcription factor _Beauveria bassiana ARSEF 2860_	OTHER	1.000000	0.000000	0.000000	0.000000	0.000000	0.000000	
XP_008599194.1 uncharacterized protein BBA_05875 _Beauveria bassiana ARSEF 2860_	OTHER	1.000000	0.000000	0.000000	0.000000	0.000000	0.000000	
XP_008599195.1 major facilitator superfamily transporter _Beauveria bassiana ARSEF 2860_	OTHER	0.999982	0.000019	0.000000	0.000000	0.000000	0.000000	
XP_008599196.1 2-nitropropane dioxygenase _Beauveria bassiana ARSEF 2860_	OTHER	1.000000	0.000001	0.000000	0.000000	0.000000	0.000000	
XP_008599197.1 metal dependent phosphohydrolase _Beauveria bassiana ARSEF 2860_	OTHER	1.000000	0.000000	0.000000	0.000000	0.000000	0.000000	
XP_008599200.1 MFS transporter _Beauveria bassiana ARSEF 2860_	OTHER	0.999983	0.000042	0.000000	0.000000	0.000000	0.000000	
XP_008599202.1 beta-eliminating lyase _Beauveria bassiana ARSEF 2860_	OTHER	1.000000	0.000000	0.000000	0.000000	0.000000	0.000000	
XP_008599206.1 gamma-glutamyltranspeptidase _Beauveria bassiana ARSEF 2860_	OTHER	1.000000	0.000002	0.000000	0.000000	0.000000	0.000000	
XP_008599209.1 branched-chain amino acid aminotransferase _Beauveria bassiana ARSEF 2860_	OTHER	0.999522	0.000508	0.000002	0.000001	0.000000	0.000001	
XP_008599210.1 uncharacterized protein BBA_05891 _Beauveria bassiana ARSEF 2860_	OTHER	0.870781	0.128842	0.000121	0.000109	0.000091	0.000096	
XP_008599211.1 Small GTPase, Rho type _Beauveria bassiana ARSEF 2860_	OTHER	1.000000	0.000000	0.000000	0.000000	0.000000	0.000000	
XP_008599212.1 transmembrane amino acid transporter _Beauveria bassiana ARSEF 2860_	OTHER	1.000000	0.000002	0.000000	0.000000	0.000000	0.000000	
XP_008599213.1 eukaryotic aspartyl protease _Beauveria bassiana ARSEF 2860_	SP	0.000347	0.998933	0.000178	0.000192	0.000175	0.000161	CS pos: 19-20. Pr: 0.9716
XP_008599214.1 uncharacterized protein BBA_05895 _Beauveria bassiana ARSEF 2860_	OTHER	1.000000	0.000000	0.000000	0.000000	0.000000	0.000000	
XP_008599216.1 P-loop ATPase protein family _Beauveria bassiana ARSEF 2860_	OTHER	1.000000	0.000000	0.000000	0.000000	0.000000	0.000000	
XP_008599217.1 Putative Zn_II_2Cys6 transcription factor _Beauveria bassiana ARSEF 2860_	OTHER	1.000000	0.000001	0.000000	0.000000	0.000000	0.000000	
XP_008599220.1 FAD binding domain containing protein _Beauveria bassiana ARSEF 2860_	OTHER	0.995732	0.004103	0.000079	0.000025	0.000012	0.000058	
XP_008599221.1 uncharacterized protein BBA_05902 _Beauveria bassiana ARSEF 2860_	OTHER	1.000000	0.000000	0.000000	0.000000	0.000000	0.000000	
XP_008599222.1 Golgi matrix protein, putative _Beauveria bassiana ARSEF 2860_	OTHER	1.000000	0.000001	0.000000	0.000000	0.000000	0.000000	
XP_008599226.1 4F5 domain protein _Beauveria bassiana ARSEF 2860_	OTHER	1.000000	0.000000	0.000000	0.000000	0.000000	0.000000	
XP_008599227.1 uncharacterized protein BBA_05908 _Beauveria bassiana ARSEF 2860_	OTHER	1.000000	0.000001	0.000000	0.000000	0.000000	0.000000	
XP_008599228.1 mRNA cleavage factor complex component Pcf11, putative _Beauveria bassiana ARSEF 2860_	OTHER	1.000000	0.000000	0.000000	0.000000	0.000000	0.000000	
XP_008599229.1 isoprenylcysteine carboxyl methyltransferase _Beauveria bassiana ARSEF 2860_	OTHER	0.999972	0.000000	0.000000	0.000000	0.000000	0.000000	
XP_008599230.1 ATPase protein _Beauveria bassiana ARSEF 2860_	OTHER	1.000000	0.000001	0.000000	0.000000	0.000000	0.000000	
XP_008599233.1 seryl-tRNA synthetase _Beauveria bassiana ARSEF 2860_	OTHER	1.000000	0.000000	0.000000	0.000000	0.000000	0.000000	
XP_008599234.1 uncharacterized protein BBA_05915 _Beauveria bassiana ARSEF 2860_	OTHER	1.000000	0.000000	0.000000	0.000000	0.000000	0.000000	
XP_008599235.1 cAMP-dependent protein kinase catalytic subunit _Beauveria bassiana ARSEF 2860_	OTHER	1.000000	0.000000	0.000000	0.000000	0.000000	0.000000	
XP_008599239.1 uncharacterized protein BBA_05920 _Beauveria bassiana ARSEF 2860_	OTHER	1.000000	0.000001	0.000000	0.000000	0.000000	0.000000	
XP_008599240.1 CPSF A subunit region _Beauveria bassiana ARSEF 2860_	OTHER	1.000000	0.000000	0.000000	0.000000	0.000000	0.000000	
XP_008599241.1 Mss51p-like protein _Beauveria bassiana ARSEF 2860_	OTHER	1.000000	0.000000	0.000000	0.000000	0.000000	0.000000	
XP_008599243.1 centromere binding protein B _Beauveria bassiana ARSEF 2860_	OTHER	1.000000	0.000000	0.000000	0.000000	0.000000	0.000000	
XP_008599244.1 GTP binding protein _Beauveria bassiana ARSEF 2860_	OTHER	1.000000	0.000000	0.000000	0.000000	0.000000	0.000000	
XP_008599246.1 Alkbh6 protein _Beauveria bassiana ARSEF 2860_	OTHER	1.000000	0.000000	0.000000	0.000000	0.000000	0.000000	
XP_008599247.1 3-oxo-5-alpha-steroid 4-dehydrogenase _Beauveria bassiana ARSEF 2860_	OTHER	0.991085	0.008685	0.000049	0.000035	0.000019	0.000126	
XP_008599249.1 eukaryotic translation initiation factor 3 subunit A _Beauveria bassiana ARSEF 2860_	OTHER	1.000000	0.000000	0.000000	0.000000	0.000000	0.000000	
XP_008599250.1 VHS domain protein _Beauveria bassiana ARSEF 2860_	OTHER	1.000000	0.000000	0.000000	0.000000	0.000000	0.000000	
XP_008599252.1 selT_selW_selH selenoprotein domain-containing protein _Beauveria bassiana ARSEF 2860_	OTHER	0.999503	0.000499	0.000016	0.000002	0.000001	0.000006	
XP_008599253.1 serine_threonine protein phosphatase type 1 _Beauveria bassiana ARSEF 2860_	OTHER	1.000000	0.000000	0.000000	0.000000	0.000000	0.000000	
XP_008599254.1 peregrin-like protein _Beauveria bassiana ARSEF 2860_	OTHER	1.000000	0.000000	0.000000	0.000000	0.000000	0.000000	
XP_008599255.1 leucine Rich Repeat domain-containing protein _Beauveria bassiana ARSEF 2860_	OTHER	1.000000	0.000000	0.000000	0.000000	0.000000	0.000000	
XP_008599256.1 uncharacterized protein BBA_05937 _Beauveria bassiana ARSEF 2860_	OTHER	1.000000	0.000000	0.000000	0.000000	0.000000	0.000000	
XP_008599257.1 biotin-requiring enzyme _Beauveria bassiana ARSEF 2860_	OTHER	1.000000	0.000000	0.000000	0.000000	0.000000	0.000000	
XP_008599258.1 fungal specific transcription factor _Beauveria bassiana ARSEF 2860_	OTHER	1.000000	0.000000	0.000000	0.000000	0.000000	0.000000	
XP_008599259.1 OPT family small oligopeptide transporter _Beauveria bassiana ARSEF 2860_	OTHER	1.000000	0.000003	0.000000	0.000000	0.000000	0.000000	
XP_008599262.1 dihydrofolate reductase _Beauveria bassiana ARSEF 2860_	OTHER	1.000000	0.000000	0.000000	0.000000	0.000000	0.000000	
XP_008599263.1 uncharacterized protein BBA_05944 _Beauveria bassiana ARSEF 2860_	OTHER	1.000000	0.000000	0.000000	0.000000	0.000000	0.000000	
XP_008599264.1 C6 finger domain protein _Beauveria bassiana ARSEF 2860_	OTHER	1.000000	0.000000	0.000000	0.000000	0.000000	0.000000	
XP_008599265.1 DSBA-like thioredoxin domain-containing protein _Beauveria bassiana ARSEF 2860_	OTHER	1.000000	0.000000	0.000000	0.000000	0.000000	0.000000	
XP_008599266.1 short chain dehydrogenase _Beauveria bassiana ARSEF 2860_	OTHER	1.000000	0.000001	0.000000	0.000000	0.000000	0.000000	
XP_008599267.1 ATPase protein _Beauveria bassiana ARSEF 2860_	OTHER	1.000000	0.000000	0.000000	0.000000	0.000000	0.000000	
XP_008599271.1 beta-mannosidase _Beauveria bassiana ARSEF 2860_	OTHER	1.000000	0.000000	0.000000	0.000000	0.000000	0.000000	
XP_008599274.1 dolichol phosphate-mannose biosynthesis regulatory protein _Beauveria bassiana ARSEF 2860_	OTHER	1.000000	0.000000	0.000000	0.000000	0.000000	0.000000	
XP_008599275.1 uncharacterized protein BBA_05956 _Beauveria bassiana ARSEF 2860_	OTHER	1.000000	0.000000	0.000000	0.000000	0.000000	0.000000	
XP_008599277.1 Fungal specific transcription factor, putative _Beauveria bassiana ARSEF 2860_	OTHER	1.000000	0.000004	0.000000	0.000000	0.000000	0.000000	
XP_008599281.1 fungal specific transcription factor, putative _Beauveria bassiana ARSEF 2860_	OTHER	1.000000	0.000000	0.000000	0.000000	0.000000	0.000000	
XP_008599282.1 major facilitator superfamily transporter _Beauveria bassiana ARSEF 2860_	OTHER	1.000000	0.000000	0.000000	0.000000	0.000000	0.000000	
XP_008599283.1 uncharacterized protein BBA_05964 _Beauveria bassiana ARSEF 2860_	OTHER	1.000000	0.000000	0.000000	0.000000	0.000000	0.000000	
XP_008599284.1 uncharacterized protein BBA_05965 _Beauveria bassiana ARSEF 2860_	OTHER	1.000000	0.000000	0.000000	0.000000	0.000000	0.000000	
XP_008599285.1 tat pathway signal sequence _Beauveria bassiana ARSEF 2860_	OTHER	1.000000	0.000000	0.000000	0.000000	0.000000	0.000000	
XP_008599286.1 uncharacterized protein BBA_05967 _Beauveria bassiana ARSEF 2860_	OTHER	0.999716	0.000315	0.000007	0.000001	0.000000	0.000001	
XP_008599290.1 Ku family DNA helicase, putative _Beauveria bassiana ARSEF 2860_	OTHER	1.000000	0.000000	0.000000	0.000000	0.000000	0.000000	
XP_008599293.1 uncharacterized protein BBA_05974 _Beauveria bassiana ARSEF 2860_	OTHER	1.000000	0.000010	0.000000	0.000000	0.000000	0.000000	
XP_008599294.1 lathosterol oxidase _Beauveria bassiana ARSEF 2860_	OTHER	1.000000	0.000000	0.000000	0.000000	0.000000	0.000000	
XP_008599295.1 Peptidase S33, tripeptidyl-peptidase _Beauveria bassiana ARSEF 2860_	SP	0.000547	0.998631	0.000215	0.000229	0.000188	0.000160	CS pos: 17-18. Pr: 0.9681
XP_008599296.1 4-nitrophenylphosphatase _Beauveria bassiana ARSEF 2860_	OTHER	1.000000	0.000000	0.000000	0.000000	0.000000	0.000000	
XP_008599300.1 mucin-like protein _Beauveria bassiana ARSEF 2860_	OTHER	1.000000	0.000000	0.000000	0.000000	0.000000	0.000000	
XP_008599301.1 glycosyltransferase family 25 _Beauveria bassiana ARSEF 2860_	OTHER	0.999989	0.000032	0.000000	0.000000	0.000000	0.000000	
XP_008599302.1 uncharacterized protein BBA_05983 _Beauveria bassiana ARSEF 2860_	OTHER	1.000000	0.000000	0.000000	0.000000	0.000000	0.000000	
XP_008599303.1 pH regulatory protein _Beauveria bassiana ARSEF 2860_	OTHER	1.000000	0.000000	0.000000	0.000000	0.000000	0.000000	
XP_008599304.1 nitrate assimilation regulatory protein nirA _Beauveria bassiana ARSEF 2860_	OTHER	1.000000	0.000002	0.000000	0.000000	0.000000	0.000000	
XP_008599305.1 uncharacterized protein BBA_05986 _Beauveria bassiana ARSEF 2860_	OTHER	1.000000	0.000001	0.000000	0.000000	0.000000	0.000000	
XP_008599307.1 pumilio domain-containing protein _Beauveria bassiana ARSEF 2860_	OTHER	1.000000	0.000040	0.000000	0.000000	0.000000	0.000000	
XP_008599308.1 mitochondrion protein, putative _Beauveria bassiana ARSEF 2860_	OTHER	1.000000	0.000000	0.000000	0.000000	0.000000	0.000000	
XP_008599309.1 MIND kinetochore complex component Nnf1 _Beauveria bassiana ARSEF 2860_	OTHER	1.000000	0.000033	0.000000	0.000000	0.000000	0.000000	
XP_008599310.1 PH domain-containing protein _Beauveria bassiana ARSEF 2860_	OTHER	1.000000	0.000000	0.000000	0.000000	0.000000	0.000000	
XP_008599311.1 NTF2 and RRM domain-containing protein _Beauveria bassiana ARSEF 2860_	OTHER	0.999911	0.000123	0.000001	0.000000	0.000000	0.000000	
XP_008599313.1 beta-1,3-glucanase precursor _Beauveria bassiana ARSEF 2860_	OTHER	1.000000	0.000024	0.000001	0.000000	0.000000	0.000000	
XP_008599314.1 ribosomal protein L10 _Beauveria bassiana ARSEF 2860_	OTHER	1.000000	0.000000	0.000000	0.000000	0.000000	0.000000	
XP_008599315.1 U1 small nuclear ribonucleoprotein _Beauveria bassiana ARSEF 2860_	OTHER	1.000000	0.000000	0.000000	0.000000	0.000000	0.000000	
XP_008599317.1 triosephosphate isomerase _Beauveria bassiana ARSEF 2860_	OTHER	1.000000	0.000000	0.000000	0.000000	0.000000	0.000000	
XP_008599321.1 uncharacterized protein BBA_06002 _Beauveria bassiana ARSEF 2860_	OTHER	1.000000	0.000000	0.000000	0.000000	0.000000	0.000000	
XP_008599323.1 Urb2_Npa2 family protein _Beauveria bassiana ARSEF 2860_	OTHER	1.000000	0.000000	0.000000	0.000000	0.000000	0.000000	
XP_008599324.1 short chain dehydrogenase _Beauveria bassiana ARSEF 2860_	OTHER	1.000000	0.000000	0.000000	0.000000	0.000000	0.000000	
XP_008599325.1 uncharacterized protein BBA_06006 _Beauveria bassiana ARSEF 2860_	OTHER	1.000000	0.000000	0.000000	0.000000	0.000000	0.000000	
XP_008599326.1 short-chain dehydrogenase _Beauveria bassiana ARSEF 2860_	OTHER	1.000000	0.000000	0.000000	0.000000	0.000000	0.000000	
XP_008599328.1 matrix metalloproteinase-11 _Beauveria bassiana ARSEF 2860_	OTHER	1.000000	0.000000	0.000000	0.000000	0.000000	0.000000	
XP_008599329.1 uncharacterized protein BBA_06010 _Beauveria bassiana ARSEF 2860_	OTHER	1.000000	0.000000	0.000000	0.000000	0.000000	0.000000	
XP_008599330.1 cell wall proline rich protein _Beauveria bassiana ARSEF 2860_	OTHER	1.000000	0.000002	0.000000	0.000000	0.000000	0.000000	
XP_008599331.1 nucleolar protein CgrA _Beauveria bassiana ARSEF 2860_	OTHER	1.000000	0.000000	0.000000	0.000000	0.000000	0.000000	
XP_008599332.1 uncharacterized protein BBA_06013 _Beauveria bassiana ARSEF 2860_	OTHER	1.000000	0.000000	0.000000	0.000000	0.000000	0.000000	
XP_008599334.1 PCI domain-containing protein _Beauveria bassiana ARSEF 2860_	OTHER	1.000000	0.000000	0.000000	0.000000	0.000000	0.000000	
XP_008599338.1 alpha-1,2-mannosidase, putative subfamily _Beauveria bassiana ARSEF 2860_	SP	0.000286	0.999065	0.000150	0.000184	0.000152	0.000151	CS pos: 19-20. Pr: 0.4732
XP_008599339.1 uncharacterized protein BBA_06020 _Beauveria bassiana ARSEF 2860_	OTHER	1.000000	0.000000	0.000000	0.000000	0.000000	0.000000	
XP_008599340.1 Ribosome-inactivating protein _Beauveria bassiana ARSEF 2860_	SP	0.000233	0.999184	0.000157	0.000147	0.000136	0.000124	CS pos: 16-17. Pr: 0.9682
XP_008599341.1 polyol transporter 5 _Beauveria bassiana ARSEF 2860_	OTHER	1.000000	0.000000	0.000000	0.000000	0.000000	0.000000	
XP_008599343.1 uncharacterized protein BBA_06024 _Beauveria bassiana ARSEF 2860_	OTHER	1.000000	0.000000	0.000000	0.000000	0.000000	0.000000	
XP_008599344.1 ankyrin repeat containing protein _Beauveria bassiana ARSEF 2860_	OTHER	1.000000	0.000003	0.000000	0.000000	0.000000	0.000000	
XP_008599345.1 uncharacterized protein BBA_06026 _Beauveria bassiana ARSEF 2860_	OTHER	1.000000	0.000000	0.000000	0.000000	0.000000	0.000000	
XP_008599346.1 fungal specific transcription factor _Beauveria bassiana ARSEF 2860_	OTHER	1.000000	0.000000	0.000000	0.000000	0.000000	0.000000	
XP_008599348.1 carboxymuconolactone decarboxylase _Beauveria bassiana ARSEF 2860_	OTHER	1.000000	0.000000	0.000000	0.000000	0.000000	0.000000	
XP_008599352.1 LamB_YcsF family protein _Beauveria bassiana ARSEF 2860_	OTHER	1.000000	0.000000	0.000000	0.000000	0.000000	0.000000	
XP_008599353.1 urea carboxylase _Beauveria bassiana ARSEF 2860_	OTHER	1.000000	0.000000	0.000000	0.000000	0.000000	0.000000	
XP_008599354.1 G protein alpha subunit _Beauveria bassiana ARSEF 2860_	OTHER	1.000000	0.000000	0.000000	0.000000	0.000000	0.000000	
XP_008599355.1 spermidine synthase _Beauveria bassiana ARSEF 2860_	OTHER	1.000000	0.000000	0.000000	0.000000	0.000000	0.000000	
XP_008599356.1 carbon-nitrogen hydrolase _Beauveria bassiana ARSEF 2860_	OTHER	1.000000	0.000007	0.000000	0.000000	0.000000	0.000000	
XP_008599357.1 WD domain-containing protein _Beauveria bassiana ARSEF 2860_	OTHER	1.000000	0.000000	0.000000	0.000000	0.000000	0.000000	
XP_008599358.1 uncharacterized protein BBA_06039 _Beauveria bassiana ARSEF 2860_	OTHER	1.000000	0.000001	0.000000	0.000000	0.000000	0.000000	
XP_008599363.1 phytanoyl-CoA dioxygenase _Beauveria bassiana ARSEF 2860_	OTHER	1.000000	0.000000	0.000000	0.000000	0.000000	0.000000	
XP_008599364.1 uncharacterized protein BBA_06045 _Beauveria bassiana ARSEF 2860_	OTHER	0.999660	0.000329	0.000034	0.000001	0.000001	0.000005	
XP_008599365.1 glutamate-cysteine ligase _Beauveria bassiana ARSEF 2860_	OTHER	1.000000	0.000015	0.000000	0.000000	0.000000	0.000000	
XP_008599368.1 Metal-dependent protein hydrolase _Beauveria bassiana ARSEF 2860_	OTHER	1.000000	0.000000	0.000000	0.000000	0.000000	0.000000	
XP_008599369.1 uncharacterized protein BBA_06050 _Beauveria bassiana ARSEF 2860_	OTHER	1.000000	0.000000	0.000000	0.000000	0.000000	0.000000	
XP_008599373.1 Alpha_beta hydrolase fold-1 _Beauveria bassiana ARSEF 2860_	OTHER	1.000000	0.000017	0.000000	0.000000	0.000000	0.000000	
XP_008599374.1 dihydroflavonal-4-reductase protein _Beauveria bassiana ARSEF 2860_	OTHER	1.000000	0.000000	0.000000	0.000000	0.000000	0.000000	
XP_008599375.1 allantoate permease _Beauveria bassiana ARSEF 2860_	OTHER	1.000000	0.000012	0.000000	0.000000	0.000000	0.000000	
XP_008599376.1 Fungal transcriptional regulatory protein _Beauveria bassiana ARSEF 2860_	OTHER	1.000000	0.000016	0.000002	0.000000	0.000000	0.000000	
XP_008599377.1 esterase-like protein _Beauveria bassiana ARSEF 2860_	OTHER	1.000000	0.000000	0.000000	0.000000	0.000000	0.000000	
XP_008599378.1 monooxygenase-like protein _Beauveria bassiana ARSEF 2860_	OTHER	1.000000	0.000016	0.000003	0.000000	0.000000	0.000000	
XP_008599379.1 Arylsulfotransferase-like protein _Beauveria bassiana ARSEF 2860_	OTHER	1.000000	0.000008	0.000000	0.000000	0.000000	0.000000	
XP_008599381.1 beta-glucosidase M _Beauveria bassiana ARSEF 2860_	SP	0.000379	0.998945	0.000158	0.000176	0.000156	0.000153	CS pos: 23-24. Pr: 0.9174
XP_008599382.1 uncharacterized protein BBA_06063 _Beauveria bassiana ARSEF 2860_	OTHER	0.999720	0.000258	0.000032	0.000002	0.000001	0.000007	
XP_008599383.1 GATA zinc finger protein _Beauveria bassiana ARSEF 2860_	OTHER	1.000000	0.000000	0.000000	0.000000	0.000000	0.000000	
XP_008599384.1 uncharacterized protein BBA_06065 _Beauveria bassiana ARSEF 2860_	OTHER	1.000000	0.000007	0.000000	0.000000	0.000000	0.000000	
XP_008599385.1 FHA domain-containing protein _Beauveria bassiana ARSEF 2860_	OTHER	1.000000	0.000000	0.000000	0.000000	0.000000	0.000000	
XP_008599386.1 IFRD domain-containing protein _Beauveria bassiana ARSEF 2860_	OTHER	1.000000	0.000000	0.000000	0.000000	0.000000	0.000000	
XP_008599388.1 RanBP1 domain-containing protein _Beauveria bassiana ARSEF 2860_	OTHER	1.000000	0.000000	0.000000	0.000000	0.000000	0.000000	
XP_008599390.1 ATP synthase F0 _Beauveria bassiana ARSEF 2860_	OTHER	0.999929	0.000092	0.000000	0.000000	0.000000	0.000000	
XP_008599391.1 ZZ type zinc finger domain-containing protein _Beauveria bassiana ARSEF 2860_	OTHER	1.000000	0.000000	0.000000	0.000000	0.000000	0.000000	
XP_008599392.1 uncharacterized protein BBA_06073 _Beauveria bassiana ARSEF 2860_	OTHER	0.998901	0.001090	0.000012	0.000006	0.000003	0.000007	
XP_008599393.1 extensin-like protein _Beauveria bassiana ARSEF 2860_	OTHER	1.000000	0.000002	0.000000	0.000000	0.000000	0.000000	
XP_008599394.1 uncharacterized protein BBA_06075 _Beauveria bassiana ARSEF 2860_	OTHER	1.000000	0.000000	0.000000	0.000000	0.000000	0.000000	
XP_008599396.1 Hypothetical protein BBA_06077 _Beauveria bassiana ARSEF 2860_	OTHER	1.000000	0.000000	0.000000	0.000000	0.000000	0.000000	
XP_008599398.1 vacuolar ATP synthase 16 kDa proteolipid subunit _Beauveria bassiana ARSEF 2860_	OTHER	0.999979	0.000030	0.000000	0.000000	0.000000	0.000000	
XP_008599399.1 ergosterol biosynthesis ERG4_ERG24 family protein _Beauveria bassiana ARSEF 2860_	OTHER	1.000000	0.000000	0.000000	0.000000	0.000000	0.000000	
XP_008599401.1 ATP synthase F0 _Beauveria bassiana ARSEF 2860_	OTHER	1.000000	0.000000	0.000000	0.000000	0.000000	0.000000	
XP_008599402.1 phospholipase D _Beauveria bassiana ARSEF 2860_	OTHER	1.000000	0.000000	0.000000	0.000000	0.000000	0.000000	
XP_008599403.1 ubiquinone biosynthesis protein CAT5 _Beauveria bassiana ARSEF 2860_	OTHER	1.000000	0.000000	0.000000	0.000000	0.000000	0.000000	
