XP_008596458.1 carbon-nitrogen hydrolase _Beauveria bassiana ARSEF 2860_	OTHER	1.000000	0.000003	0.000000	0.000000	0.000000	0.000000	
XP_008596460.1 metallo-beta-lactamase superfamily protein _Beauveria bassiana ARSEF 2860_	OTHER	1.000000	0.000000	0.000000	0.000000	0.000000	0.000000	
XP_008596461.1 vacuolar ATP synthase 98 kDa subunit _Beauveria bassiana ARSEF 2860_	OTHER	1.000000	0.000000	0.000000	0.000000	0.000000	0.000000	
XP_008596462.1 leucine Rich Repeat domain-containing protein _Beauveria bassiana ARSEF 2860_	OTHER	1.000000	0.000000	0.000000	0.000000	0.000000	0.000000	
XP_008596463.1 short chain dehydrogenase _Beauveria bassiana ARSEF 2860_	OTHER	1.000000	0.000000	0.000000	0.000000	0.000000	0.000000	
XP_008596464.1 ribosomal protein L24e _Beauveria bassiana ARSEF 2860_	OTHER	1.000000	0.000000	0.000000	0.000000	0.000000	0.000000	
XP_008596473.1 Skp1 family protein _Beauveria bassiana ARSEF 2860_	OTHER	1.000000	0.000000	0.000000	0.000000	0.000000	0.000000	
XP_008596475.1 DASH complex subunit Dad1 _Beauveria bassiana ARSEF 2860_	OTHER	1.000000	0.000001	0.000000	0.000000	0.000000	0.000000	
XP_008596476.1 myb-like DNA-binding domain-containing protein _Beauveria bassiana ARSEF 2860_	OTHER	1.000000	0.000000	0.000000	0.000000	0.000000	0.000000	
XP_008596477.1 Deoxyhypusine synthase _DHS_ _Beauveria bassiana ARSEF 2860_	OTHER	1.000000	0.000000	0.000000	0.000000	0.000000	0.000000	
XP_008596478.1 aldo-keto reductase _AKR_, putative _Beauveria bassiana ARSEF 2860_	OTHER	1.000000	0.000000	0.000000	0.000000	0.000000	0.000000	
XP_008596480.1 tRNA _uracil-5-_-methyltransferase TRM9 _Beauveria bassiana ARSEF 2860_	OTHER	1.000000	0.000000	0.000000	0.000000	0.000000	0.000000	
XP_008596481.1 myb-like DNA-binding domain-containing protein _Beauveria bassiana ARSEF 2860_	OTHER	1.000000	0.000000	0.000000	0.000000	0.000000	0.000000	
XP_008596482.1 uncharacterized protein BBA_03163 _Beauveria bassiana ARSEF 2860_	OTHER	0.999977	0.000005	0.000020	0.000000	0.000000	0.000002	
XP_008596483.1 CAP-Gly domain-containing protein _Beauveria bassiana ARSEF 2860_	OTHER	1.000000	0.000000	0.000000	0.000000	0.000000	0.000000	
XP_008596484.1 RING-7 protein _Beauveria bassiana ARSEF 2860_	SP	0.001493	0.997398	0.000311	0.000301	0.000250	0.000221	CS pos: 25-26. Pr: 0.8583
XP_008596485.1 uncharacterized protein BBA_03166 _Beauveria bassiana ARSEF 2860_	OTHER	1.000000	0.000000	0.000000	0.000000	0.000000	0.000000	
XP_008596486.1 glycosyl hydrolase 53 domain-containing protein _Beauveria bassiana ARSEF 2860_	SP	0.000351	0.998990	0.000170	0.000152	0.000145	0.000136	CS pos: 21-22. Pr: 0.9750
XP_008596487.1 uncharacterized protein BBA_03168 _Beauveria bassiana ARSEF 2860_	OTHER	1.000000	0.000000	0.000000	0.000000	0.000000	0.000000	
XP_008596488.1 Putative Gal4-like transcriptional regulator _Beauveria bassiana ARSEF 2860_	OTHER	1.000000	0.000000	0.000000	0.000000	0.000000	0.000000	
XP_008596489.1 uncharacterized protein BBA_03170 _Beauveria bassiana ARSEF 2860_	OTHER	1.000000	0.000000	0.000000	0.000000	0.000000	0.000000	
XP_008596492.1 peroxisomal membrane protein PMP47B _Beauveria bassiana ARSEF 2860_	OTHER	0.997090	0.002871	0.000009	0.000010	0.000007	0.000061	
XP_008596493.1 uncharacterized protein BBA_03174 _Beauveria bassiana ARSEF 2860_	OTHER	1.000000	0.000002	0.000000	0.000000	0.000000	0.000000	
XP_008596494.1 RhoGEF domain-containing protein _Beauveria bassiana ARSEF 2860_	OTHER	1.000000	0.000001	0.000000	0.000000	0.000000	0.000000	
XP_008596496.1 fungal specific transcription factor _Beauveria bassiana ARSEF 2860_	OTHER	1.000000	0.000000	0.000000	0.000000	0.000000	0.000000	
XP_008596498.1 calcium-transporting ATPase _Beauveria bassiana ARSEF 2860_	OTHER	1.000000	0.000000	0.000000	0.000000	0.000000	0.000000	
XP_008596499.1 acriflavine sensitivity control protein acr-2 _Beauveria bassiana ARSEF 2860_	OTHER	1.000000	0.000000	0.000000	0.000000	0.000000	0.000000	
XP_008596500.1 putative zinc finger protein _Beauveria bassiana ARSEF 2860_	OTHER	1.000000	0.000000	0.000000	0.000000	0.000000	0.000000	
XP_008596501.1 uncharacterized protein BBA_03182 _Beauveria bassiana ARSEF 2860_	OTHER	1.000000	0.000000	0.000000	0.000000	0.000000	0.000000	
XP_008596503.1 uncharacterized protein BBA_03184 _Beauveria bassiana ARSEF 2860_	OTHER	1.000000	0.000000	0.000000	0.000000	0.000000	0.000000	
XP_008596504.1 dihydroflavonol-4-reductase protein _Beauveria bassiana ARSEF 2860_	OTHER	1.000000	0.000000	0.000000	0.000000	0.000000	0.000000	
XP_008596506.1 40S ribosomal protein S27 _Beauveria bassiana ARSEF 2860_	OTHER	1.000000	0.000000	0.000000	0.000000	0.000000	0.000000	
XP_008596509.1 HORMA domain-containing protein _Beauveria bassiana ARSEF 2860_	OTHER	0.999967	0.000031	0.000000	0.000000	0.000000	0.000000	
XP_008596510.1 argininosuccinate lyase _Beauveria bassiana ARSEF 2860_	OTHER	1.000000	0.000001	0.000000	0.000000	0.000000	0.000000	
XP_008596512.1 uncharacterized protein BBA_03193 _Beauveria bassiana ARSEF 2860_	OTHER	1.000000	0.000007	0.000000	0.000000	0.000000	0.000000	
XP_008596513.1 RasGEF domain-containing protein _Beauveria bassiana ARSEF 2860_	OTHER	1.000000	0.000000	0.000000	0.000000	0.000000	0.000000	
XP_008596514.1 uncharacterized protein BBA_03195 _Beauveria bassiana ARSEF 2860_	OTHER	1.000000	0.000000	0.000000	0.000000	0.000000	0.000000	
XP_008596516.1 HIRA-interacting protein _Beauveria bassiana ARSEF 2860_	OTHER	1.000000	0.000000	0.000000	0.000000	0.000000	0.000000	
XP_008596517.1 suppressor protein PSP1 _Beauveria bassiana ARSEF 2860_	OTHER	1.000000	0.000001	0.000000	0.000000	0.000000	0.000000	
XP_008596519.1 60S ribosomal protein L15 _Beauveria bassiana ARSEF 2860_	OTHER	1.000000	0.000000	0.000000	0.000000	0.000000	0.000000	
XP_008596520.1 aminotransferase class-V _Beauveria bassiana ARSEF 2860_	OTHER	1.000000	0.000000	0.000000	0.000000	0.000000	0.000000	
XP_008596521.1 phospholipase C PLC-C _Beauveria bassiana ARSEF 2860_	SP	0.000215	0.999160	0.000146	0.000172	0.000153	0.000137	CS pos: 23-24. Pr: 0.9645
XP_008596522.1 trypsin-like protease _Beauveria bassiana ARSEF 2860_	SP	0.000405	0.998870	0.000190	0.000184	0.000165	0.000156	CS pos: 20-21. Pr: 0.7914
XP_008596523.1 X-Pro dipeptidyl-peptidase, putative _Beauveria bassiana ARSEF 2860_	OTHER	1.000000	0.000000	0.000000	0.000000	0.000000	0.000000	
XP_008596525.1 acid phosphatase _Beauveria bassiana ARSEF 2860_	SP	0.000190	0.999197	0.000160	0.000149	0.000151	0.000130	CS pos: 21-22. Pr: 0.9772
XP_008596528.1 sodium_hydrogen exchanger family protein _Beauveria bassiana ARSEF 2860_	OTHER	1.000000	0.000000	0.000000	0.000000	0.000000	0.000000	
XP_008596529.1 uncharacterized protein BBA_03210 _Beauveria bassiana ARSEF 2860_	OTHER	1.000000	0.000000	0.000000	0.000000	0.000000	0.000000	
XP_008596531.1 phthalate transporter _Beauveria bassiana ARSEF 2860_	OTHER	0.999803	0.000199	0.000000	0.000000	0.000000	0.000001	
XP_008596532.1 putative aspartic protease _Beauveria bassiana ARSEF 2860_	SP	0.000297	0.999035	0.000157	0.000158	0.000154	0.000140	CS pos: 22-23. Pr: 0.9730
XP_008596533.1 uncharacterized protein BBA_03214 _Beauveria bassiana ARSEF 2860_	OTHER	1.000000	0.000000	0.000000	0.000000	0.000000	0.000000	
XP_008596534.1 uncharacterized protein BBA_03215 _Beauveria bassiana ARSEF 2860_	OTHER	1.000000	0.000000	0.000000	0.000000	0.000000	0.000000	
XP_008596536.1 DUF1479 domain protein _Beauveria bassiana ARSEF 2860_	OTHER	1.000000	0.000000	0.000000	0.000000	0.000000	0.000000	
XP_008596537.1 microtubule associated protein _Beauveria bassiana ARSEF 2860_	OTHER	1.000000	0.000006	0.000000	0.000000	0.000000	0.000000	
XP_008596538.1 uncharacterized protein BBA_03219 _Beauveria bassiana ARSEF 2860_	OTHER	1.000000	0.000003	0.000000	0.000000	0.000000	0.000000	
XP_008596540.1 arginase-like protein _Beauveria bassiana ARSEF 2860_	OTHER	1.000000	0.000000	0.000000	0.000000	0.000000	0.000000	
XP_008596542.1 capsular associated protein _Beauveria bassiana ARSEF 2860_	OTHER	0.771718	0.226243	0.001549	0.000127	0.000124	0.000241	
XP_008596543.1 Ribosomal RNA adenine methylase transferase _Beauveria bassiana ARSEF 2860_	OTHER	1.000000	0.000000	0.000000	0.000000	0.000000	0.000000	
XP_008596545.1 ATPase protein _Beauveria bassiana ARSEF 2860_	OTHER	1.000000	0.000000	0.000000	0.000000	0.000000	0.000000	
XP_008596547.1 STAM-binding protein _Beauveria bassiana ARSEF 2860_	OTHER	1.000000	0.000026	0.000000	0.000000	0.000000	0.000000	
XP_008596548.1 uncharacterized protein BBA_03229 _Beauveria bassiana ARSEF 2860_	SP	0.000243	0.999114	0.000149	0.000163	0.000136	0.000132	CS pos: 19-20. Pr: 0.9783
XP_008596549.1 cholinesterase precursor _Beauveria bassiana ARSEF 2860_	SP	0.000215	0.999200	0.000157	0.000144	0.000137	0.000129	CS pos: 21-22. Pr: 0.9806
XP_008596550.1 chorismate synthase _Beauveria bassiana ARSEF 2860_	OTHER	1.000000	0.000000	0.000000	0.000000	0.000000	0.000000	
XP_008596555.1 class 2 chitin synthase _Beauveria bassiana ARSEF 2860_	OTHER	1.000000	0.000000	0.000000	0.000000	0.000000	0.000000	
XP_008596556.1 sulfite reductase hemoprotein _Beauveria bassiana ARSEF 2860_	OTHER	1.000000	0.000000	0.000000	0.000000	0.000000	0.000000	
XP_008596560.1 p60 domain-containing protein _Beauveria bassiana ARSEF 2860_	OTHER	1.000000	0.000000	0.000000	0.000000	0.000000	0.000000	
XP_008596561.1 putative alternative NADH dehydrogenase _Beauveria bassiana ARSEF 2860_	OTHER	1.000000	0.000000	0.000000	0.000000	0.000000	0.000000	
XP_008596563.1 HLH transcription factor _Beauveria bassiana ARSEF 2860_	OTHER	1.000000	0.000000	0.000000	0.000000	0.000000	0.000000	
XP_008596569.1 Mis12 domain-containing protein _Beauveria bassiana ARSEF 2860_	OTHER	1.000000	0.000001	0.000000	0.000000	0.000000	0.000000	
XP_008596572.1 uncharacterized protein BBA_03253 _Beauveria bassiana ARSEF 2860_	OTHER	0.999784	0.000236	0.000000	0.000000	0.000000	0.000000	
XP_008596575.1 eukaryotic translation initiation factor 3 subunit 8 _Beauveria bassiana ARSEF 2860_	OTHER	1.000000	0.000005	0.000000	0.000000	0.000000	0.000000	
XP_008596576.1 iron sulfur assembly protein _Beauveria bassiana ARSEF 2860_	OTHER	1.000000	0.000000	0.000000	0.000000	0.000000	0.000000	
XP_008596577.1 60S ribosomal protein L7 _Beauveria bassiana ARSEF 2860_	OTHER	1.000000	0.000021	0.000008	0.000000	0.000000	0.000001	
XP_008596578.1 40S ribosomal protein S14 _CRP2_ _Beauveria bassiana ARSEF 2860_	OTHER	1.000000	0.000000	0.000000	0.000000	0.000000	0.000000	
XP_008596581.1 MYB DNA-binding domain-containing protein _Beauveria bassiana ARSEF 2860_	OTHER	1.000000	0.000004	0.000000	0.000000	0.000000	0.000000	
XP_008596582.1 pre-mRNA processing splicing factor 8 _Beauveria bassiana ARSEF 2860_	OTHER	1.000000	0.000000	0.000000	0.000000	0.000000	0.000000	
XP_008596584.1 Sin3 associated polypeptide p18 _Beauveria bassiana ARSEF 2860_	OTHER	1.000000	0.000000	0.000000	0.000000	0.000000	0.000000	
XP_008596585.1 Prp18 domain-containing protein _Beauveria bassiana ARSEF 2860_	OTHER	1.000000	0.000000	0.000000	0.000000	0.000000	0.000000	
XP_008596587.1 uncharacterized protein BBA_03268 _Beauveria bassiana ARSEF 2860_	SP	0.000923	0.998345	0.000187	0.000186	0.000170	0.000155	CS pos: 17-18. Pr: 0.9686
XP_008596588.1 fungal specific transcription factor _Beauveria bassiana ARSEF 2860_	OTHER	1.000000	0.000000	0.000000	0.000000	0.000000	0.000000	
XP_008596589.1 uncharacterized protein BBA_03270 _Beauveria bassiana ARSEF 2860_	SP	0.000230	0.999199	0.000140	0.000153	0.000132	0.000124	CS pos: 30-31. Pr: 0.3372
XP_008596593.1 uncharacterized protein BBA_03274 _Beauveria bassiana ARSEF 2860_	OTHER	1.000000	0.000000	0.000000	0.000000	0.000000	0.000000	
XP_008596595.1 legume-like lectin family protein _Beauveria bassiana ARSEF 2860_	SP	0.000236	0.999155	0.000157	0.000145	0.000137	0.000131	CS pos: 18-19. Pr: 0.9765
XP_008596597.1 NAD dependent epimerase_dehydratase _Beauveria bassiana ARSEF 2860_	OTHER	1.000000	0.000000	0.000000	0.000000	0.000000	0.000000	
XP_008596598.1 chromatin assembly protein _Beauveria bassiana ARSEF 2860_	OTHER	1.000000	0.000000	0.000000	0.000000	0.000000	0.000000	
XP_008596602.1 taurine catabolism dioxygenase TauD _Beauveria bassiana ARSEF 2860_	OTHER	1.000000	0.000015	0.000000	0.000000	0.000000	0.000000	
XP_008596606.1 Pfs, NACHT and Ankyrin domain protein _Beauveria bassiana ARSEF 2860_	OTHER	1.000000	0.000003	0.000000	0.000000	0.000000	0.000000	
XP_008596607.1 uncharacterized protein BBA_03288 _Beauveria bassiana ARSEF 2860_	OTHER	1.000000	0.000000	0.000000	0.000000	0.000000	0.000000	
XP_008596610.1 MFS monocarboxylate transporter _Beauveria bassiana ARSEF 2860_	OTHER	0.999916	0.000103	0.000000	0.000000	0.000000	0.000000	
XP_008596615.1 Actin-related protein, ARP2 class _Beauveria bassiana ARSEF 2860_	OTHER	1.000000	0.000000	0.000000	0.000000	0.000000	0.000000	
XP_008596617.1 ADP-ribosylation factor 6 _Beauveria bassiana ARSEF 2860_	OTHER	1.000000	0.000000	0.000000	0.000000	0.000000	0.000000	
XP_008596621.1 histidinolphosphatase-like protein _Beauveria bassiana ARSEF 2860_	OTHER	0.999695	0.000333	0.000003	0.000001	0.000000	0.000001	
XP_008596627.1 fatty acid hydroxylase superfamily protein _Beauveria bassiana ARSEF 2860_	OTHER	0.999991	0.000040	0.000005	0.000000	0.000000	0.000002	
XP_008596630.1 Actin-related protein, ARP1 class _Beauveria bassiana ARSEF 2860_	OTHER	1.000000	0.000000	0.000000	0.000000	0.000000	0.000000	
XP_008596631.1 transcription factor MBP1 _Beauveria bassiana ARSEF 2860_	OTHER	1.000000	0.000000	0.000000	0.000000	0.000000	0.000000	
XP_008596633.1 uncharacterized protein BBA_03314 _Beauveria bassiana ARSEF 2860_	OTHER	1.000000	0.000037	0.000003	0.000000	0.000000	0.000000	
XP_008596634.1 cell division control protein _Beauveria bassiana ARSEF 2860_	OTHER	1.000000	0.000000	0.000000	0.000000	0.000000	0.000000	
XP_008596635.1 uncharacterized protein BBA_03316 _Beauveria bassiana ARSEF 2860_	OTHER	1.000000	0.000000	0.000000	0.000000	0.000000	0.000000	
XP_008596637.1 uncharacterized protein BBA_03318 _Beauveria bassiana ARSEF 2860_	OTHER	1.000000	0.000000	0.000000	0.000000	0.000000	0.000000	
XP_008596640.1 transmembrane amino acid transporter _Beauveria bassiana ARSEF 2860_	OTHER	1.000000	0.000000	0.000000	0.000000	0.000000	0.000000	
XP_008596646.1 YCII-related domain protein _Beauveria bassiana ARSEF 2860_	OTHER	1.000000	0.000002	0.000000	0.000000	0.000000	0.000000	
XP_008596648.1 nucleoside-diphosphate-sugar epimerase _Beauveria bassiana ARSEF 2860_	OTHER	1.000000	0.000011	0.000001	0.000000	0.000000	0.000000	
XP_008596649.1 mannose-6-phosphate isomerase _Beauveria bassiana ARSEF 2860_	OTHER	1.000000	0.000000	0.000000	0.000000	0.000000	0.000000	
XP_008596650.1 lipase_serine esterase _Beauveria bassiana ARSEF 2860_	OTHER	1.000000	0.000000	0.000000	0.000000	0.000000	0.000000	
XP_008596653.1 putative MAP kinase _Beauveria bassiana ARSEF 2860_	OTHER	1.000000	0.000000	0.000000	0.000000	0.000000	0.000000	
XP_008596656.1 dynactin Arp1 p25 subunit _Beauveria bassiana ARSEF 2860_	OTHER	1.000000	0.000002	0.000000	0.000000	0.000000	0.000000	
XP_008596658.1 glutathione S-transferase, putative _Beauveria bassiana ARSEF 2860_	OTHER	1.000000	0.000000	0.000000	0.000000	0.000000	0.000000	
XP_008596659.1 phosphomannose isomerase type I _Beauveria bassiana ARSEF 2860_	OTHER	1.000000	0.000000	0.000000	0.000000	0.000000	0.000000	
XP_008596660.1 uncharacterized protein BBA_03341 _Beauveria bassiana ARSEF 2860_	OTHER	1.000000	0.000000	0.000000	0.000000	0.000000	0.000000	
XP_008596661.1 peptidyl-prolyl cis-trans isomerase cyp6 _Beauveria bassiana ARSEF 2860_	OTHER	1.000000	0.000000	0.000000	0.000000	0.000000	0.000000	
XP_008596663.1 Nicotinamide N-methyltransferase, putative _Beauveria bassiana ARSEF 2860_	OTHER	1.000000	0.000000	0.000000	0.000000	0.000000	0.000000	
XP_008596664.1 40S ribosomal protein S24 _Beauveria bassiana ARSEF 2860_	OTHER	1.000000	0.000000	0.000000	0.000000	0.000000	0.000000	
XP_008596665.1 uncharacterized protein BBA_03346 _Beauveria bassiana ARSEF 2860_	SP	0.002139	0.997175	0.000184	0.000175	0.000150	0.000146	CS pos: 35-36. Pr: 0.9675
XP_008596666.1 clumping factor B _Beauveria bassiana ARSEF 2860_	OTHER	1.000000	0.000000	0.000000	0.000000	0.000000	0.000000	
XP_008596667.1 GTP cyclohydrolase II _Beauveria bassiana ARSEF 2860_	OTHER	1.000000	0.000000	0.000000	0.000000	0.000000	0.000000	
XP_008596670.1 NADH-ubiquinone oxidoreductase B18 subunit _Beauveria bassiana ARSEF 2860_	OTHER	1.000000	0.000010	0.000000	0.000000	0.000000	0.000000	
XP_008596671.1 amino acid transporter _Beauveria bassiana ARSEF 2860_	OTHER	1.000000	0.000001	0.000000	0.000000	0.000000	0.000000	
XP_008596672.1 uncharacterized protein BBA_03353 _Beauveria bassiana ARSEF 2860_	OTHER	1.000000	0.000000	0.000000	0.000000	0.000000	0.000000	
XP_008596676.1 uncharacterized protein BBA_03357 _Beauveria bassiana ARSEF 2860_	OTHER	1.000000	0.000002	0.000000	0.000000	0.000000	0.000000	
XP_008596677.1 pre-mRNA-splicing factor ATP-dependent RNA helicase PRP16 _Beauveria bassiana ARSEF 2860_	OTHER	1.000000	0.000000	0.000000	0.000000	0.000000	0.000000	
XP_008596678.1 nuclear envelope protein NEM1 _Beauveria bassiana ARSEF 2860_	OTHER	1.000000	0.000001	0.000000	0.000000	0.000000	0.000000	
XP_008596679.1 DDHD domain-containing protein _Beauveria bassiana ARSEF 2860_	OTHER	0.998885	0.001110	0.000005	0.000004	0.000002	0.000007	
XP_008596683.1 exonuclease-like protein _Beauveria bassiana ARSEF 2860_	OTHER	1.000000	0.000002	0.000000	0.000000	0.000000	0.000000	
XP_008596685.1 periplasmic binding protein _Beauveria bassiana ARSEF 2860_	SP	0.000282	0.999054	0.000173	0.000175	0.000155	0.000141	CS pos: 19-20. Pr: 0.9677
XP_008596686.1 dihydroorotase, homodimeric type _Beauveria bassiana ARSEF 2860_	OTHER	1.000000	0.000000	0.000000	0.000000	0.000000	0.000000	
XP_008596690.1 C2H2 transcription factor _Beauveria bassiana ARSEF 2860_	OTHER	1.000000	0.000000	0.000000	0.000000	0.000000	0.000000	
XP_008596694.1 Glycerophosphoryl diester phosphodiesterase family protein _Beauveria bassiana ARSEF 2860_	OTHER	1.000000	0.000000	0.000000	0.000000	0.000000	0.000000	
XP_008596695.1 glutaminase GtaA _Beauveria bassiana ARSEF 2860_	SP	0.000229	0.999134	0.000156	0.000166	0.000147	0.000136	CS pos: 20-21. Pr: 0.9817
XP_008596696.1 uncharacterized protein BBA_03377 _Beauveria bassiana ARSEF 2860_	OTHER	1.000000	0.000000	0.000000	0.000000	0.000000	0.000000	
XP_008596697.1 serine_threonine protein kinase _Beauveria bassiana ARSEF 2860_	OTHER	1.000000	0.000000	0.000000	0.000000	0.000000	0.000000	
XP_008596698.1 uncharacterized protein BBA_03379 _Beauveria bassiana ARSEF 2860_	OTHER	1.000000	0.000001	0.000000	0.000000	0.000000	0.000000	
XP_008596703.1 NADH-ubiquinone oxidoreductase 51 kDa subunit _Beauveria bassiana ARSEF 2860_	OTHER	1.000000	0.000000	0.000000	0.000000	0.000000	0.000000	
XP_008596706.1 patched sphingolipid transporter _Beauveria bassiana ARSEF 2860_	SP	0.000284	0.999036	0.000189	0.000169	0.000163	0.000148	CS pos: 23-24. Pr: 0.9736
XP_008596707.1 GPI mannosyltransferase _Beauveria bassiana ARSEF 2860_	OTHER	0.995927	0.004014	0.000018	0.000024	0.000009	0.000021	
XP_008596711.1 uncharacterized protein BBA_03392 _Beauveria bassiana ARSEF 2860_	OTHER	0.999999	0.000014	0.000000	0.000000	0.000000	0.000000	
XP_008596712.1 uncharacterized protein BBA_03393 _Beauveria bassiana ARSEF 2860_	OTHER	1.000000	0.000000	0.000000	0.000000	0.000000	0.000000	
XP_008596713.1 fructose-1-6-bisphosphatase _Beauveria bassiana ARSEF 2860_	OTHER	1.000000	0.000000	0.000000	0.000000	0.000000	0.000000	
XP_008596715.1 intermediate filament protein MDM1 _Beauveria bassiana ARSEF 2860_	OTHER	1.000000	0.000000	0.000000	0.000000	0.000000	0.000000	
XP_008596718.1 C6 zinc finger domain-containing protein _Beauveria bassiana ARSEF 2860_	OTHER	1.000000	0.000001	0.000000	0.000000	0.000000	0.000000	
XP_008596719.1 Cytochrome P450 CYP503B1 _Beauveria bassiana ARSEF 2860_	OTHER	1.000000	0.000001	0.000000	0.000000	0.000000	0.000000	
XP_008596721.1 homoserine dehydrogenase _Beauveria bassiana ARSEF 2860_	OTHER	1.000000	0.000000	0.000000	0.000000	0.000000	0.000000	
XP_008596722.1 thioredoxin-like protein _Beauveria bassiana ARSEF 2860_	OTHER	1.000000	0.000000	0.000000	0.000000	0.000000	0.000000	
XP_008596727.1 ABC multidrug transporter, putative _Beauveria bassiana ARSEF 2860_	OTHER	1.000000	0.000000	0.000000	0.000000	0.000000	0.000000	
XP_008596730.1 uncharacterized protein BBA_03411 _Beauveria bassiana ARSEF 2860_	SP	0.000510	0.998786	0.000173	0.000176	0.000162	0.000156	CS pos: 19-20. Pr: 0.9160
XP_008596732.1 dimethyladenosine transferase _Beauveria bassiana ARSEF 2860_	OTHER	1.000000	0.000000	0.000000	0.000000	0.000000	0.000000	
XP_008596734.1 calcofluor white hypersensitive protein _Beauveria bassiana ARSEF 2860_	OTHER	0.981988	0.012880	0.004750	0.000064	0.000037	0.000281	
XP_008596737.1 L-galactonate dehydratase _Beauveria bassiana ARSEF 2860_	OTHER	1.000000	0.000000	0.000000	0.000000	0.000000	0.000000	
XP_008596738.1 uncharacterized protein BBA_03419 _Beauveria bassiana ARSEF 2860_	SP	0.000293	0.999032	0.000169	0.000163	0.000150	0.000150	CS pos: 20-21. Pr: 0.9695
XP_008596740.1 glucose sorbosone dehydrogenase _Beauveria bassiana ARSEF 2860_	SP	0.013512	0.939724	0.045427	0.000649	0.000354	0.000306	CS pos: 19-20. Pr: 0.9062
XP_008596741.1 WD domain-containing protein _Beauveria bassiana ARSEF 2860_	OTHER	1.000000	0.000000	0.000000	0.000000	0.000000	0.000000	
XP_008596742.1 uncharacterized protein BBA_03423 _Beauveria bassiana ARSEF 2860_	OTHER	1.000000	0.000000	0.000000	0.000000	0.000000	0.000000	
XP_008596743.1 glucan 1, 4-alpha-glucosidase _Beauveria bassiana ARSEF 2860_	OTHER	1.000000	0.000004	0.000000	0.000000	0.000000	0.000000	
XP_008596744.1 uncharacterized protein BBA_03425 _Beauveria bassiana ARSEF 2860_	OTHER	1.000000	0.000000	0.000000	0.000000	0.000000	0.000000	
XP_008596748.1 FAD binding domain-containing protein _Beauveria bassiana ARSEF 2860_	OTHER	1.000000	0.000000	0.000000	0.000000	0.000000	0.000000	
XP_008596750.1 acetyl-hydrolase-like protein _Beauveria bassiana ARSEF 2860_	OTHER	0.999769	0.000220	0.000004	0.000001	0.000000	0.000001	
XP_008596754.1 NAPE-hydrolyzing phospholipase D _Beauveria bassiana ARSEF 2860_	OTHER	1.000000	0.000001	0.000000	0.000000	0.000000	0.000000	
XP_008596759.1 uncharacterized protein BBA_03440 _Beauveria bassiana ARSEF 2860_	SP	0.000268	0.999048	0.000186	0.000161	0.000151	0.000147	CS pos: 16-17. Pr: 0.9802
XP_008596760.1 pathway-specific nitrogen regulator _Beauveria bassiana ARSEF 2860_	OTHER	0.999847	0.000167	0.000009	0.000001	0.000000	0.000002	
XP_008596762.1 ABC transporter _Beauveria bassiana ARSEF 2860_	OTHER	0.999970	0.000022	0.000000	0.000000	0.000000	0.000000	
XP_008596763.1 POT family protein _Beauveria bassiana ARSEF 2860_	OTHER	1.000000	0.000000	0.000000	0.000000	0.000000	0.000000	
XP_008596764.1 amino acid transporter _Beauveria bassiana ARSEF 2860_	OTHER	1.000000	0.000000	0.000000	0.000000	0.000000	0.000000	
XP_008596767.1 PLC-like phosphodiesterase _Beauveria bassiana ARSEF 2860_	SP	0.000274	0.999145	0.000140	0.000165	0.000135	0.000136	CS pos: 20-21. Pr: 0.9842
XP_008596768.1 C6 zinc finger domain-containing protein _Beauveria bassiana ARSEF 2860_	OTHER	1.000000	0.000000	0.000000	0.000000	0.000000	0.000000	
XP_008596770.1 Protein kinase-like protein _Beauveria bassiana ARSEF 2860_	OTHER	1.000000	0.000001	0.000000	0.000000	0.000000	0.000000	
XP_008596771.1 pathway-specific nitrogen regulator _Beauveria bassiana ARSEF 2860_	OTHER	1.000000	0.000000	0.000000	0.000000	0.000000	0.000000	
XP_008596774.1 phosphate transporter _Beauveria bassiana ARSEF 2860_	OTHER	1.000000	0.000000	0.000000	0.000000	0.000000	0.000000	
XP_008596778.1 NAD dependent epimerase_dehydratase _Beauveria bassiana ARSEF 2860_	OTHER	1.000000	0.000000	0.000000	0.000000	0.000000	0.000000	
XP_008596779.1 phosphatidylinositol transfer protein CSR1 _Beauveria bassiana ARSEF 2860_	OTHER	1.000000	0.000015	0.000000	0.000000	0.000000	0.000000	
XP_008596781.1 ATP-dependent RNA helicase MSS116 _Beauveria bassiana ARSEF 2860_	OTHER	1.000000	0.000001	0.000000	0.000000	0.000000	0.000000	
XP_008596782.1 acid phosphatase _Beauveria bassiana ARSEF 2860_	SP	0.000895	0.998201	0.000224	0.000245	0.000203	0.000207	CS pos: 22-23. Pr: 0.5665
XP_008596783.1 C6 finger domain protein _Beauveria bassiana ARSEF 2860_	OTHER	1.000000	0.000000	0.000000	0.000000	0.000000	0.000000	
XP_008596784.1 uncharacterized protein BBA_03465 _Beauveria bassiana ARSEF 2860_	OTHER	1.000000	0.000000	0.000000	0.000000	0.000000	0.000000	
XP_008596785.1 FAD binding domain protein _Beauveria bassiana ARSEF 2860_	OTHER	1.000000	0.000001	0.000000	0.000000	0.000000	0.000000	
XP_008596788.1 uncharacterized protein BBA_03469 _Beauveria bassiana ARSEF 2860_	OTHER	1.000000	0.000001	0.000000	0.000000	0.000000	0.000000	
XP_008596795.1 NmrA-like family protein _Beauveria bassiana ARSEF 2860_	OTHER	1.000000	0.000000	0.000000	0.000000	0.000000	0.000000	
XP_008596797.1 DUF829 domain protein _PaxU_ _Beauveria bassiana ARSEF 2860_	OTHER	1.000000	0.000000	0.000000	0.000000	0.000000	0.000000	
XP_008596798.1 Beta-lactamase-type transpeptidase _Beauveria bassiana ARSEF 2860_	OTHER	1.000000	0.000010	0.000000	0.000000	0.000000	0.000000	
XP_008596801.1 DSHCT domain-containing protein _Beauveria bassiana ARSEF 2860_	OTHER	1.000000	0.000000	0.000000	0.000000	0.000000	0.000000	
XP_008596802.1 transaldolase-like protein _Beauveria bassiana ARSEF 2860_	OTHER	1.000000	0.000001	0.000000	0.000000	0.000000	0.000000	
XP_008596803.1 CgERG6-2 protein _Beauveria bassiana ARSEF 2860_	OTHER	1.000000	0.000000	0.000000	0.000000	0.000000	0.000000	
XP_008596805.1 uncharacterized protein BBA_03486 _Beauveria bassiana ARSEF 2860_	OTHER	1.000000	0.000000	0.000000	0.000000	0.000000	0.000000	
XP_008596807.1 translationally controlled tumor protein-like variant I _Beauveria bassiana ARSEF 2860_	OTHER	1.000000	0.000011	0.000000	0.000000	0.000000	0.000000	
XP_008596808.1 GMP synthase _Beauveria bassiana ARSEF 2860_	OTHER	1.000000	0.000000	0.000000	0.000000	0.000000	0.000000	
