XP_008596727.1 ABC multidrug transporter, putative _Beauveria bassiana ARSEF 2860_	OTHER	1.000000	0.000000	0.000000	0.000000	0.000000	0.000000	
XP_008596729.1 7-dehydrocholesterol reductase _Beauveria bassiana ARSEF 2860_	OTHER	0.999913	0.000046	0.000023	0.000001	0.000000	0.000033	
XP_008596730.1 uncharacterized protein BBA_03411 _Beauveria bassiana ARSEF 2860_	SP	0.000510	0.998786	0.000173	0.000176	0.000162	0.000156	CS pos: 19-20. Pr: 0.9160
XP_008596731.1 putative cell wall glycoprotein _Beauveria bassiana ARSEF 2860_	SP	0.000414	0.998835	0.000165	0.000212	0.000170	0.000169	CS pos: 17-18. Pr: 0.9599
XP_008596734.1 calcofluor white hypersensitive protein _Beauveria bassiana ARSEF 2860_	OTHER	0.981988	0.012880	0.004750	0.000064	0.000037	0.000281	
XP_008596738.1 uncharacterized protein BBA_03419 _Beauveria bassiana ARSEF 2860_	SP	0.000293	0.999032	0.000169	0.000163	0.000150	0.000150	CS pos: 20-21. Pr: 0.9695
XP_008596740.1 glucose sorbosone dehydrogenase _Beauveria bassiana ARSEF 2860_	SP	0.013512	0.939724	0.045427	0.000649	0.000354	0.000306	CS pos: 19-20. Pr: 0.9062
XP_008596741.1 WD domain-containing protein _Beauveria bassiana ARSEF 2860_	OTHER	1.000000	0.000000	0.000000	0.000000	0.000000	0.000000	
XP_008596742.1 uncharacterized protein BBA_03423 _Beauveria bassiana ARSEF 2860_	OTHER	1.000000	0.000000	0.000000	0.000000	0.000000	0.000000	
XP_008596743.1 glucan 1, 4-alpha-glucosidase _Beauveria bassiana ARSEF 2860_	OTHER	1.000000	0.000004	0.000000	0.000000	0.000000	0.000000	
XP_008596744.1 uncharacterized protein BBA_03425 _Beauveria bassiana ARSEF 2860_	OTHER	1.000000	0.000000	0.000000	0.000000	0.000000	0.000000	
XP_008596745.1 BCS1 protein precursor _Beauveria bassiana ARSEF 2860_	OTHER	1.000000	0.000015	0.000000	0.000000	0.000000	0.000000	
XP_008596746.1 tricarballylate dehydrogenase _Beauveria bassiana ARSEF 2860_	OTHER	1.000000	0.000000	0.000000	0.000000	0.000000	0.000000	
XP_008596748.1 FAD binding domain-containing protein _Beauveria bassiana ARSEF 2860_	OTHER	1.000000	0.000000	0.000000	0.000000	0.000000	0.000000	
XP_008596749.1 uncharacterized protein BBA_03430 _Beauveria bassiana ARSEF 2860_	OTHER	1.000000	0.000000	0.000000	0.000000	0.000000	0.000000	
XP_008596754.1 NAPE-hydrolyzing phospholipase D _Beauveria bassiana ARSEF 2860_	OTHER	1.000000	0.000001	0.000000	0.000000	0.000000	0.000000	
XP_008596755.1 uncharacterized protein BBA_03436 _Beauveria bassiana ARSEF 2860_	SP	0.000218	0.999233	0.000144	0.000142	0.000130	0.000125	CS pos: 19-20. Pr: 0.9796
XP_008596756.1 meiotically up-regulated 65 protein _Beauveria bassiana ARSEF 2860_	OTHER	1.000000	0.000003	0.000000	0.000000	0.000000	0.000000	
XP_008596758.1 phosphopantothenoylcysteine decarboxylase _Beauveria bassiana ARSEF 2860_	OTHER	1.000000	0.000000	0.000000	0.000000	0.000000	0.000000	
XP_008596760.1 pathway-specific nitrogen regulator _Beauveria bassiana ARSEF 2860_	OTHER	0.999847	0.000167	0.000009	0.000001	0.000000	0.000002	
XP_008596761.1 uncharacterized protein BBA_03442 _Beauveria bassiana ARSEF 2860_	OTHER	1.000000	0.000000	0.000000	0.000000	0.000000	0.000000	
XP_008596762.1 ABC transporter _Beauveria bassiana ARSEF 2860_	OTHER	0.999970	0.000022	0.000000	0.000000	0.000000	0.000000	
XP_008596763.1 POT family protein _Beauveria bassiana ARSEF 2860_	OTHER	1.000000	0.000000	0.000000	0.000000	0.000000	0.000000	
XP_008596764.1 amino acid transporter _Beauveria bassiana ARSEF 2860_	OTHER	1.000000	0.000000	0.000000	0.000000	0.000000	0.000000	
XP_008596765.1 MFS transporter _Beauveria bassiana ARSEF 2860_	OTHER	1.000000	0.000000	0.000000	0.000000	0.000000	0.000000	
XP_008596766.1 extracellular protein _Beauveria bassiana ARSEF 2860_	SP	0.000193	0.999203	0.000142	0.000153	0.000133	0.000128	CS pos: 20-21. Pr: 0.9616
XP_008596769.1 C6 finger domain-containing protein _Beauveria bassiana ARSEF 2860_	OTHER	1.000000	0.000000	0.000000	0.000000	0.000000	0.000000	
XP_008596772.1 lipoyltransferase-like protein _Beauveria bassiana ARSEF 2860_	OTHER	1.000000	0.000004	0.000000	0.000000	0.000000	0.000000	
XP_008596773.1 DNA repair protein RAD14 _Beauveria bassiana ARSEF 2860_	OTHER	1.000000	0.000000	0.000000	0.000000	0.000000	0.000000	
XP_008596776.1 phthalate transporter _Beauveria bassiana ARSEF 2860_	OTHER	1.000000	0.000000	0.000000	0.000000	0.000000	0.000000	
XP_008596779.1 phosphatidylinositol transfer protein CSR1 _Beauveria bassiana ARSEF 2860_	OTHER	1.000000	0.000015	0.000000	0.000000	0.000000	0.000000	
XP_008596780.1 fatty acid desaturase _Beauveria bassiana ARSEF 2860_	OTHER	1.000000	0.000000	0.000000	0.000000	0.000000	0.000000	
XP_008596781.1 ATP-dependent RNA helicase MSS116 _Beauveria bassiana ARSEF 2860_	OTHER	1.000000	0.000001	0.000000	0.000000	0.000000	0.000000	
XP_008596783.1 C6 finger domain protein _Beauveria bassiana ARSEF 2860_	OTHER	1.000000	0.000000	0.000000	0.000000	0.000000	0.000000	
XP_008596784.1 uncharacterized protein BBA_03465 _Beauveria bassiana ARSEF 2860_	OTHER	1.000000	0.000000	0.000000	0.000000	0.000000	0.000000	
XP_008596786.1 C6 zinc finger domain protein _Beauveria bassiana ARSEF 2860_	OTHER	1.000000	0.000000	0.000000	0.000000	0.000000	0.000000	
XP_008596787.1 uncharacterized protein BBA_03468 _Beauveria bassiana ARSEF 2860_	OTHER	1.000000	0.000000	0.000000	0.000000	0.000000	0.000000	
XP_008596788.1 uncharacterized protein BBA_03469 _Beauveria bassiana ARSEF 2860_	OTHER	1.000000	0.000001	0.000000	0.000000	0.000000	0.000000	
XP_008596789.1 extracellular protein _Beauveria bassiana ARSEF 2860_	SP	0.000258	0.999130	0.000154	0.000155	0.000142	0.000134	CS pos: 19-20. Pr: 0.9694
XP_008596790.1 FAD dependent oxidoreductase domain containing protein _Beauveria bassiana ARSEF 2860_	OTHER	0.994532	0.004747	0.000688	0.000018	0.000007	0.000018	
XP_008596791.1 Ankyrin repeat protein _Beauveria bassiana ARSEF 2860_	OTHER	1.000000	0.000000	0.000000	0.000000	0.000000	0.000000	
XP_008596793.1 uncharacterized protein BBA_03474 _Beauveria bassiana ARSEF 2860_	OTHER	1.000000	0.000000	0.000000	0.000000	0.000000	0.000000	
XP_008596798.1 Beta-lactamase-type transpeptidase _Beauveria bassiana ARSEF 2860_	OTHER	1.000000	0.000010	0.000000	0.000000	0.000000	0.000000	
XP_008596800.1 Snf7 family protein _Beauveria bassiana ARSEF 2860_	OTHER	1.000000	0.000000	0.000000	0.000000	0.000000	0.000000	
XP_008596801.1 DSHCT domain-containing protein _Beauveria bassiana ARSEF 2860_	OTHER	1.000000	0.000000	0.000000	0.000000	0.000000	0.000000	
XP_008596802.1 transaldolase-like protein _Beauveria bassiana ARSEF 2860_	OTHER	1.000000	0.000001	0.000000	0.000000	0.000000	0.000000	
XP_008596807.1 translationally controlled tumor protein-like variant I _Beauveria bassiana ARSEF 2860_	OTHER	1.000000	0.000011	0.000000	0.000000	0.000000	0.000000	
XP_008596810.1 tousled-like kinase _Beauveria bassiana ARSEF 2860_	OTHER	1.000000	0.000000	0.000000	0.000000	0.000000	0.000000	
XP_008596811.1 uncharacterized protein BBA_03492 _Beauveria bassiana ARSEF 2860_	SP	0.003020	0.995894	0.000278	0.000275	0.000263	0.000258	CS pos: 18-19. Pr: 0.8663
XP_008596816.1 NADH-ubiquinone oxidoreductase 21kDa subunit _Beauveria bassiana ARSEF 2860_	OTHER	1.000000	0.000000	0.000000	0.000000	0.000000	0.000000	
XP_008596817.1 mitochondrial F1F0 ATP synthase subunit F Atp17 _Beauveria bassiana ARSEF 2860_	OTHER	1.000000	0.000000	0.000000	0.000000	0.000000	0.000000	
XP_008596818.1 uncharacterized protein BBA_03499 _Beauveria bassiana ARSEF 2860_	OTHER	1.000000	0.000000	0.000000	0.000000	0.000000	0.000000	
XP_008596819.1 MCM2_3_5 family protein _Beauveria bassiana ARSEF 2860_	OTHER	1.000000	0.000001	0.000000	0.000000	0.000000	0.000000	
XP_008596820.1 cyclopropane-fatty-acyl-phospholipid synthase _Beauveria bassiana ARSEF 2860_	OTHER	0.999605	0.000412	0.000001	0.000001	0.000000	0.000000	
XP_008596821.1 exonuclease-like protein _Beauveria bassiana ARSEF 2860_	OTHER	1.000000	0.000000	0.000000	0.000000	0.000000	0.000000	
XP_008596822.1 histone acetyltransferase _Beauveria bassiana ARSEF 2860_	OTHER	1.000000	0.000000	0.000000	0.000000	0.000000	0.000000	
XP_008596823.1 DUF1237 domain protein _Beauveria bassiana ARSEF 2860_	SP	0.000451	0.998795	0.000173	0.000205	0.000180	0.000169	CS pos: 18-19. Pr: 0.9452
XP_008596824.1 Beta-lactamase-type transpeptidase _Beauveria bassiana ARSEF 2860_	OTHER	1.000000	0.000000	0.000000	0.000000	0.000000	0.000000	
XP_008596826.1 DNA polymerase subunit Cdc27 _Beauveria bassiana ARSEF 2860_	OTHER	1.000000	0.000000	0.000000	0.000000	0.000000	0.000000	
XP_008596830.1 Pre-mRNA-splicing factor cwc26 _Beauveria bassiana ARSEF 2860_	OTHER	1.000000	0.000000	0.000000	0.000000	0.000000	0.000000	
XP_008596831.1 transcription initiation factor IIF subunit alpha _Beauveria bassiana ARSEF 2860_	OTHER	1.000000	0.000000	0.000000	0.000000	0.000000	0.000000	
XP_008596832.1 caffeine-induced death protein _Beauveria bassiana ARSEF 2860_	OTHER	1.000000	0.000000	0.000000	0.000000	0.000000	0.000000	
XP_008596834.1 ribose-phosphate diphosphokinase _Beauveria bassiana ARSEF 2860_	OTHER	1.000000	0.000000	0.000000	0.000000	0.000000	0.000000	
XP_008596835.1 short chain dehydrogenase _Beauveria bassiana ARSEF 2860_	OTHER	1.000000	0.000000	0.000000	0.000000	0.000000	0.000000	
XP_008596837.1 major facilitator superfamily transporter _Beauveria bassiana ARSEF 2860_	OTHER	0.999919	0.000091	0.000000	0.000000	0.000000	0.000000	
XP_008596838.1 ThiF family protein _Beauveria bassiana ARSEF 2860_	OTHER	1.000000	0.000000	0.000000	0.000000	0.000000	0.000000	
XP_008596839.1 protein kinase, putative _Beauveria bassiana ARSEF 2860_	OTHER	1.000000	0.000002	0.000000	0.000000	0.000000	0.000000	
XP_008596840.1 GDA1_CD39 family protein _Beauveria bassiana ARSEF 2860_	OTHER	1.000000	0.000000	0.000000	0.000000	0.000000	0.000000	
XP_008596841.1 DUF775 domain-containing protein _Beauveria bassiana ARSEF 2860_	OTHER	0.997428	0.002467	0.000033	0.000042	0.000010	0.000013	
XP_008596844.1 DNA-directed RNA polymerases I _Beauveria bassiana ARSEF 2860_	OTHER	0.999601	0.000426	0.000004	0.000001	0.000001	0.000001	
XP_008596845.1 paxneb protein _Beauveria bassiana ARSEF 2860_	OTHER	1.000000	0.000001	0.000000	0.000000	0.000000	0.000000	
XP_008596846.1 tRNA intron endonuclease _Beauveria bassiana ARSEF 2860_	OTHER	1.000000	0.000000	0.000000	0.000000	0.000000	0.000000	
XP_008596847.1 ubiquitin-protein ligase _Asi3_ _Beauveria bassiana ARSEF 2860_	OTHER	1.000000	0.000001	0.000000	0.000000	0.000000	0.000000	
XP_008597490.1 uncharacterized protein BBA_04171 _Beauveria bassiana ARSEF 2860_	OTHER	1.000000	0.000000	0.000000	0.000000	0.000000	0.000000	
XP_008597491.1 Mov34_MPN_PAD-1 family protein _Beauveria bassiana ARSEF 2860_	OTHER	0.999829	0.000186	0.000014	0.000001	0.000000	0.000003	
XP_008597492.1 amidase-like protein _Beauveria bassiana ARSEF 2860_	OTHER	1.000000	0.000000	0.000000	0.000000	0.000000	0.000000	
XP_008597493.1 uncharacterized protein BBA_04174 _Beauveria bassiana ARSEF 2860_	OTHER	0.999970	0.000071	0.000000	0.000000	0.000000	0.000000	
XP_008597495.1 puromycin resistance protein pur8 _Beauveria bassiana ARSEF 2860_	OTHER	1.000000	0.000002	0.000000	0.000000	0.000000	0.000000	
XP_008597496.1 uncharacterized protein BBA_04177 _Beauveria bassiana ARSEF 2860_	OTHER	1.000000	0.000000	0.000000	0.000000	0.000000	0.000000	
XP_008597498.1 Cytochrome P450 CYP584E7 _Beauveria bassiana ARSEF 2860_	OTHER	0.998692	0.001312	0.000014	0.000004	0.000002	0.000004	
XP_008597500.1 S1_P1 nuclease _Beauveria bassiana ARSEF 2860_	SP	0.000313	0.999068	0.000159	0.000162	0.000145	0.000134	CS pos: 20-21. Pr: 0.9758
XP_008597501.1 major facilitator superfamily transporter _Beauveria bassiana ARSEF 2860_	OTHER	0.999120	0.000900	0.000000	0.000000	0.000000	0.000000	
XP_008597503.1 uncharacterized protein BBA_04184 _Beauveria bassiana ARSEF 2860_	OTHER	0.999853	0.000166	0.000000	0.000000	0.000000	0.000000	
XP_008597504.1 uncharacterized protein BBA_04185 _Beauveria bassiana ARSEF 2860_	OTHER	1.000000	0.000003	0.000000	0.000000	0.000000	0.000000	
XP_008597505.1 cellobiose dehydrogenase _Beauveria bassiana ARSEF 2860_	SP	0.000214	0.999207	0.000158	0.000144	0.000135	0.000130	CS pos: 26-27. Pr: 0.9757
XP_008597506.1 Peptidase S8_S53, subtilisin_kexin_sedolisin _Beauveria bassiana ARSEF 2860_	SP	0.000226	0.999127	0.000148	0.000171	0.000153	0.000145	CS pos: 21-22. Pr: 0.7990
XP_008597507.1 tat pathway signal sequence _Beauveria bassiana ARSEF 2860_	OTHER	0.999927	0.000094	0.000000	0.000000	0.000000	0.000000	
XP_008597508.1 Peptidase S8_S53, subtilisin_kexin_sedolisin _Beauveria bassiana ARSEF 2860_	OTHER	1.000000	0.000050	0.000000	0.000000	0.000000	0.000000	
XP_008597509.1 tat pathway signal sequence _Beauveria bassiana ARSEF 2860_	OTHER	1.000000	0.000000	0.000000	0.000000	0.000000	0.000000	
XP_008597510.1 oligopeptide transporter _Beauveria bassiana ARSEF 2860_	OTHER	0.999823	0.000186	0.000000	0.000000	0.000000	0.000000	
XP_008597511.1 RING-2 protein _Beauveria bassiana ARSEF 2860_	OTHER	1.000000	0.000000	0.000000	0.000000	0.000000	0.000000	
XP_008597512.1 protein of unknown function FMP27 _Beauveria bassiana ARSEF 2860_	OTHER	1.000000	0.000000	0.000000	0.000000	0.000000	0.000000	
XP_008597513.1 uncharacterized protein BBA_04194 _Beauveria bassiana ARSEF 2860_	OTHER	0.997983	0.001997	0.000007	0.000005	0.000004	0.000008	
XP_008597514.1 RNA recognition domain-containing protein _Beauveria bassiana ARSEF 2860_	OTHER	1.000000	0.000017	0.000000	0.000000	0.000000	0.000000	
XP_008597518.1 mitosis protein DIM1 _Beauveria bassiana ARSEF 2860_	OTHER	1.000000	0.000000	0.000000	0.000000	0.000000	0.000000	
XP_008597521.1 uncharacterized protein BBA_04202 _Beauveria bassiana ARSEF 2860_	OTHER	1.000000	0.000000	0.000000	0.000000	0.000000	0.000000	
XP_008597522.1 ATP-dependent protease La _Beauveria bassiana ARSEF 2860_	OTHER	1.000000	0.000012	0.000000	0.000000	0.000000	0.000000	
XP_008597523.1 protein kinase domain-containing protein _Beauveria bassiana ARSEF 2860_	OTHER	1.000000	0.000000	0.000000	0.000000	0.000000	0.000000	
XP_008597524.1 major facilitator superfamily transporter _Beauveria bassiana ARSEF 2860_	OTHER	1.000000	0.000000	0.000000	0.000000	0.000000	0.000000	
XP_008597525.1 homeobox and C2H2 transcription factor _Beauveria bassiana ARSEF 2860_	OTHER	1.000000	0.000001	0.000000	0.000000	0.000000	0.000000	
XP_008597527.1 uncharacterized protein BBA_04208 _Beauveria bassiana ARSEF 2860_	OTHER	1.000000	0.000000	0.000000	0.000000	0.000000	0.000000	
XP_008597531.1 small GTP-binding protein YPTI _Beauveria bassiana ARSEF 2860_	OTHER	1.000000	0.000000	0.000000	0.000000	0.000000	0.000000	
XP_008597532.1 gastric mucin _Beauveria bassiana ARSEF 2860_	OTHER	1.000000	0.000000	0.000000	0.000000	0.000000	0.000000	
XP_008597533.1 Transcriptional repressor _Beauveria bassiana ARSEF 2860_	OTHER	1.000000	0.000000	0.000000	0.000000	0.000000	0.000000	
XP_008597534.1 WD domain-containing protein _Beauveria bassiana ARSEF 2860_	OTHER	1.000000	0.000018	0.000000	0.000000	0.000000	0.000000	
XP_008597535.1 HSF-type DNA-binding protein _Beauveria bassiana ARSEF 2860_	OTHER	1.000000	0.000000	0.000000	0.000000	0.000000	0.000000	
XP_008597536.1 uncharacterized protein BBA_04217 _Beauveria bassiana ARSEF 2860_	OTHER	1.000000	0.000000	0.000000	0.000000	0.000000	0.000000	
XP_008597537.1 sucrase_ferredoxin domain-containing protein _Beauveria bassiana ARSEF 2860_	OTHER	1.000000	0.000000	0.000000	0.000000	0.000000	0.000000	
XP_008597538.1 nucleoporin protein Ndc1-Nup _Beauveria bassiana ARSEF 2860_	OTHER	1.000000	0.000004	0.000000	0.000000	0.000000	0.000000	
XP_008597544.1 alpha-tubulin _Beauveria bassiana ARSEF 2860_	OTHER	1.000000	0.000000	0.000000	0.000000	0.000000	0.000000	
XP_008597547.1 NADH-ubiquinone oxidoreductase 17.8 kDa subunit _Beauveria bassiana ARSEF 2860_	OTHER	0.999821	0.000182	0.000000	0.000000	0.000000	0.000000	
XP_008597548.1 thiamine pyrophosphokinase _Beauveria bassiana ARSEF 2860_	OTHER	1.000000	0.000000	0.000000	0.000000	0.000000	0.000000	
XP_008597551.1 Alpha-D-phosphohexomutase, alpha_beta_alpha I_II_III _Beauveria bassiana ARSEF 2860_	OTHER	1.000000	0.000000	0.000000	0.000000	0.000000	0.000000	
XP_008597552.1 uncharacterized protein BBA_04233 _Beauveria bassiana ARSEF 2860_	OTHER	1.000000	0.000004	0.000000	0.000000	0.000000	0.000000	
XP_008597553.1 HMG box protein _Beauveria bassiana ARSEF 2860_	OTHER	1.000000	0.000000	0.000000	0.000000	0.000000	0.000000	
XP_008597554.1 uncharacterized protein BBA_04235 _Beauveria bassiana ARSEF 2860_	OTHER	1.000000	0.000000	0.000000	0.000000	0.000000	0.000000	
XP_008597555.1 Autophagy-related protein 11 _Beauveria bassiana ARSEF 2860_	OTHER	1.000000	0.000000	0.000000	0.000000	0.000000	0.000000	
XP_008597557.1 glycosyltransferase family 31 _Beauveria bassiana ARSEF 2860_	OTHER	1.000000	0.000001	0.000000	0.000000	0.000000	0.000000	
XP_008597558.1 negative acting factor _Beauveria bassiana ARSEF 2860_	OTHER	0.999991	0.000047	0.000000	0.000000	0.000000	0.000000	
XP_008597559.1 multicopper oxidase _Beauveria bassiana ARSEF 2860_	OTHER	1.000000	0.000029	0.000000	0.000000	0.000000	0.000000	
XP_008597560.1 phosphoesterase-like protein _Beauveria bassiana ARSEF 2860_	SP	0.000253	0.999089	0.000161	0.000170	0.000154	0.000145	CS pos: 18-19. Pr: 0.9778
XP_008597561.1 vacuolar iron transporter Ccc1 _Beauveria bassiana ARSEF 2860_	OTHER	1.000000	0.000000	0.000000	0.000000	0.000000	0.000000	
XP_008597563.1 NADH-ubiquinone oxidoreductase 49 kDa subunit _Beauveria bassiana ARSEF 2860_	OTHER	1.000000	0.000000	0.000000	0.000000	0.000000	0.000000	
XP_008597565.1 ATP synthase _Beauveria bassiana ARSEF 2860_	OTHER	1.000000	0.000000	0.000000	0.000000	0.000000	0.000000	
XP_008597566.1 CBF_Mak21 family protein _Beauveria bassiana ARSEF 2860_	OTHER	1.000000	0.000000	0.000000	0.000000	0.000000	0.000000	
XP_008597568.1 CorA-like Mg2_ transporter _Beauveria bassiana ARSEF 2860_	OTHER	1.000000	0.000000	0.000000	0.000000	0.000000	0.000000	
XP_008597569.1 RNA recognition domain-containing protein _Beauveria bassiana ARSEF 2860_	OTHER	1.000000	0.000000	0.000000	0.000000	0.000000	0.000000	
XP_008597571.1 F1F0-ATP synthase regulatory factor Stf2 _Beauveria bassiana ARSEF 2860_	OTHER	1.000000	0.000000	0.000000	0.000000	0.000000	0.000000	
XP_008597573.1 MAP kinase kinase _Beauveria bassiana ARSEF 2860_	OTHER	1.000000	0.000000	0.000000	0.000000	0.000000	0.000000	
XP_008597575.1 fungal specific transcription factor _Beauveria bassiana ARSEF 2860_	OTHER	0.999952	0.000065	0.000003	0.000001	0.000000	0.000003	
XP_008597576.1 ribosomal protein L19 _Beauveria bassiana ARSEF 2860_	OTHER	1.000000	0.000027	0.000000	0.000000	0.000000	0.000000	
XP_008597577.1 DNA polymerase alpha_epsilon subunit B _Beauveria bassiana ARSEF 2860_	OTHER	1.000000	0.000000	0.000000	0.000000	0.000000	0.000000	
XP_008597580.1 protein kinase SNF1 _Beauveria bassiana ARSEF 2860_	OTHER	1.000000	0.000001	0.000000	0.000000	0.000000	0.000000	
XP_008597582.1 Bys1 family protein _Beauveria bassiana ARSEF 2860_	SP	0.000294	0.999019	0.000165	0.000175	0.000163	0.000144	CS pos: 21-22. Pr: 0.4734
XP_008597583.1 Golgin subfamily A member _Beauveria bassiana ARSEF 2860_	OTHER	1.000000	0.000001	0.000000	0.000000	0.000000	0.000000	
XP_008597586.1 GABA permease _Beauveria bassiana ARSEF 2860_	OTHER	0.999969	0.000054	0.000001	0.000000	0.000000	0.000000	
XP_008597587.1 uncharacterized protein BBA_04268 _Beauveria bassiana ARSEF 2860_	OTHER	0.999995	0.000001	0.000000	0.000000	0.000000	0.000000	
XP_008597588.1 uncharacterized protein BBA_04269 _Beauveria bassiana ARSEF 2860_	OTHER	1.000000	0.000000	0.000000	0.000000	0.000000	0.000000	
XP_008597589.1 uncharacterized protein BBA_04270 _Beauveria bassiana ARSEF 2860_	SP	0.000308	0.999085	0.000176	0.000135	0.000130	0.000131	CS pos: 23-24. Pr: 0.9784
XP_008597590.1 pheromone receptor _Beauveria bassiana ARSEF 2860_	OTHER	1.000000	0.000001	0.000000	0.000000	0.000000	0.000000	
XP_008597591.1 single-strand binding protein family _Beauveria bassiana ARSEF 2860_	OTHER	1.000000	0.000006	0.000000	0.000000	0.000000	0.000000	
XP_008597593.1 SNF2 family domain-containing protein _Beauveria bassiana ARSEF 2860_	OTHER	1.000000	0.000001	0.000000	0.000000	0.000000	0.000000	
XP_008597594.1 5-aminolevulinic acid synthase _Beauveria bassiana ARSEF 2860_	OTHER	1.000000	0.000000	0.000000	0.000000	0.000000	0.000000	
XP_008597595.1 Putative Zn_II_2Cys6 transcription factor _Beauveria bassiana ARSEF 2860_	OTHER	1.000000	0.000000	0.000000	0.000000	0.000000	0.000000	
XP_008597596.1 hydroxyethylthiazole kinase _Beauveria bassiana ARSEF 2860_	OTHER	1.000000	0.000002	0.000000	0.000000	0.000000	0.000000	
XP_008597597.1 pyridine nucleotide-disulfide oxidoreductase, putative _Beauveria bassiana ARSEF 2860_	OTHER	1.000000	0.000000	0.000000	0.000000	0.000000	0.000000	
XP_008597601.1 isochorismatase domain-containing protein _Beauveria bassiana ARSEF 2860_	OTHER	1.000000	0.000000	0.000000	0.000000	0.000000	0.000000	
XP_008597602.1 ATPase protein _Beauveria bassiana ARSEF 2860_	OTHER	1.000000	0.000000	0.000000	0.000000	0.000000	0.000000	
XP_008597607.1 uncharacterized protein BBA_04288 _Beauveria bassiana ARSEF 2860_	OTHER	0.999686	0.000229	0.000037	0.000002	0.000001	0.000045	
XP_008597609.1 uncharacterized protein BBA_04290 _Beauveria bassiana ARSEF 2860_	OTHER	1.000000	0.000000	0.000000	0.000000	0.000000	0.000000	
XP_008597610.1 protein kinase NRC-2 _Beauveria bassiana ARSEF 2860_	OTHER	1.000000	0.000000	0.000000	0.000000	0.000000	0.000000	
XP_008597614.1 C2 domain-containing protein _Beauveria bassiana ARSEF 2860_	OTHER	1.000000	0.000000	0.000000	0.000000	0.000000	0.000000	
XP_008597615.1 secretory phospholipase A2 _Beauveria bassiana ARSEF 2860_	OTHER	0.999969	0.000081	0.000002	0.000000	0.000000	0.000000	
XP_008597616.1 uncharacterized protein BBA_04297 _Beauveria bassiana ARSEF 2860_	OTHER	1.000000	0.000000	0.000000	0.000000	0.000000	0.000000	
XP_008597617.1 mitogen-activated protein kinase MAF1 _Beauveria bassiana ARSEF 2860_	OTHER	1.000000	0.000000	0.000000	0.000000	0.000000	0.000000	
XP_008597618.1 clathrin adaptor complex small chain _Beauveria bassiana ARSEF 2860_	OTHER	0.999725	0.000269	0.000014	0.000001	0.000001	0.000009	
XP_008597619.1 glutamate-cysteine ligase modifier subunit _Beauveria bassiana ARSEF 2860_	OTHER	1.000000	0.000000	0.000000	0.000000	0.000000	0.000000	
XP_008597620.1 protein kinase _Beauveria bassiana ARSEF 2860_	OTHER	1.000000	0.000000	0.000000	0.000000	0.000000	0.000000	
XP_008597621.1 RING-1 protein _Beauveria bassiana ARSEF 2860_	OTHER	1.000000	0.000002	0.000000	0.000000	0.000000	0.000000	
XP_008597622.1 LYAR-type C2HC zinc finger protein _Beauveria bassiana ARSEF 2860_	OTHER	1.000000	0.000001	0.000000	0.000000	0.000000	0.000000	
XP_008597623.1 bem46-like protein _Beauveria bassiana ARSEF 2860_	OTHER	1.000000	0.000005	0.000000	0.000000	0.000000	0.000000	
XP_008597624.1 NF-X1 type zinc finger protein _Beauveria bassiana ARSEF 2860_	OTHER	1.000000	0.000001	0.000000	0.000000	0.000000	0.000000	
XP_008597625.1 WSC domain-containing protein _Beauveria bassiana ARSEF 2860_	SP	0.000399	0.998883	0.000181	0.000198	0.000158	0.000152	CS pos: 29-30. Pr: 0.6097
XP_008597626.1 para-nitrobenzyl esterase _Beauveria bassiana ARSEF 2860_	OTHER	0.543577	0.453653	0.001701	0.000429	0.000266	0.000361	
XP_008597627.1 UPF0041 domain-containing protein _Beauveria bassiana ARSEF 2860_	OTHER	0.999897	0.000094	0.000003	0.000002	0.000000	0.000001	
XP_008597628.1 pyruvate carboxylase _Beauveria bassiana ARSEF 2860_	OTHER	1.000000	0.000022	0.000000	0.000000	0.000000	0.000000	
XP_008597629.1 uncharacterized protein BBA_04310 _Beauveria bassiana ARSEF 2860_	OTHER	1.000000	0.000000	0.000000	0.000000	0.000000	0.000000	
XP_008597630.1 aldehyde dehydrogenase _Beauveria bassiana ARSEF 2860_	OTHER	1.000000	0.000012	0.000000	0.000000	0.000000	0.000000	
XP_008597631.1 Fungal specific transcription factor, putative _Beauveria bassiana ARSEF 2860_	OTHER	1.000000	0.000001	0.000000	0.000000	0.000000	0.000000	
XP_008597634.1 fibroin-3 related protein _Beauveria bassiana ARSEF 2860_	OTHER	0.999986	0.000070	0.000001	0.000000	0.000000	0.000000	
XP_008597635.1 vacuolar membrane protein _Beauveria bassiana ARSEF 2860_	OTHER	1.000000	0.000001	0.000000	0.000000	0.000000	0.000000	
XP_008597636.1 superoxide dismutase _Beauveria bassiana ARSEF 2860_	OTHER	0.996935	0.002934	0.000092	0.000017	0.000009	0.000032	
XP_008597637.1 PH domain-containing protein _Beauveria bassiana ARSEF 2860_	OTHER	1.000000	0.000001	0.000000	0.000000	0.000000	0.000000	
XP_008597638.1 transcriptional regulatory protein pro-1 _Beauveria bassiana ARSEF 2860_	OTHER	1.000000	0.000000	0.000000	0.000000	0.000000	0.000000	
XP_008597639.1 uncharacterized protein BBA_04320 _Beauveria bassiana ARSEF 2860_	SP	0.000299	0.999049	0.000164	0.000182	0.000160	0.000148	CS pos: 21-22. Pr: 0.9709
XP_008597640.1 F-box domain-containing protein _Beauveria bassiana ARSEF 2860_	OTHER	1.000000	0.000001	0.000000	0.000000	0.000000	0.000000	
XP_008597643.1 uncharacterized protein BBA_04324 _Beauveria bassiana ARSEF 2860_	OTHER	1.000000	0.000000	0.000000	0.000000	0.000000	0.000000	
XP_008597644.1 uncharacterized protein BBA_04325 _Beauveria bassiana ARSEF 2860_	OTHER	1.000000	0.000001	0.000000	0.000000	0.000000	0.000000	
XP_008597646.1 amino acid adenylation domain protein _Beauveria bassiana ARSEF 2860_	OTHER	1.000000	0.000005	0.000000	0.000000	0.000000	0.000000	
XP_008597647.1 aminotriazole resistance protein _Beauveria bassiana ARSEF 2860_	OTHER	1.000000	0.000000	0.000000	0.000000	0.000000	0.000000	
XP_008597648.1 cellular morphogenesis regulator DopA _Beauveria bassiana ARSEF 2860_	OTHER	0.999889	0.000150	0.000001	0.000000	0.000000	0.000000	
XP_008597649.1 BZIP-type transcription factor _Beauveria bassiana ARSEF 2860_	OTHER	1.000000	0.000000	0.000000	0.000000	0.000000	0.000000	
XP_008597650.1 adiponectin receptor protein _Beauveria bassiana ARSEF 2860_	OTHER	0.999848	0.000182	0.000001	0.000000	0.000000	0.000000	
XP_008597652.1 DnaJ domain-containing protein _Beauveria bassiana ARSEF 2860_	SP	0.000426	0.998723	0.000310	0.000178	0.000176	0.000168	CS pos: 20-21. Pr: 0.9674
