# SignalP-6.0	Organism: Other	Timestamp: 20250304230330
# ID	Prediction	OTHER	SP(Sec/SPI)	LIPO(Sec/SPII)	TAT(Tat/SPI)	TATLIPO(Tat/SPII)	PILIN(Sec/SPIII)	CS Position
XP_008593320.1 uncharacterized protein BBA_00001 _Beauveria bassiana ARSEF 2860_	OTHER	1.000000	0.000000	0.000000	0.000000	0.000000	0.000000	
XP_008593323.1 cell wall associated protein _Beauveria bassiana ARSEF 2860_	OTHER	1.000000	0.000001	0.000000	0.000000	0.000000	0.000000	
XP_008593324.1 ABC transporter transmembrane region _Beauveria bassiana ARSEF 2860_	OTHER	0.999665	0.000326	0.000003	0.000001	0.000001	0.000003	
XP_008593325.1 uncharacterized protein BBA_00006 _Beauveria bassiana ARSEF 2860_	OTHER	1.000000	0.000002	0.000000	0.000000	0.000000	0.000000	
XP_008593326.1 iron only hydrogenase large subunit domain-containing protein _Beauveria bassiana ARSEF 2860_	OTHER	1.000000	0.000001	0.000000	0.000000	0.000000	0.000000	
XP_008593327.1 uncharacterized protein BBA_00008 _Beauveria bassiana ARSEF 2860_	OTHER	1.000000	0.000001	0.000000	0.000000	0.000000	0.000000	
XP_008593330.1 serine_threonine-protein kinase sck1 _Beauveria bassiana ARSEF 2860_	OTHER	1.000000	0.000004	0.000000	0.000000	0.000000	0.000000	
XP_008593331.1 ATP synthase H chain _Beauveria bassiana ARSEF 2860_	OTHER	1.000000	0.000000	0.000000	0.000000	0.000000	0.000000	
XP_008593332.1 cellobiose dehydrogenase, putative _Beauveria bassiana ARSEF 2860_	OTHER	0.587828	0.411372	0.000164	0.000306	0.000168	0.000169	
XP_008593333.1 serine_threonine-protein kinase psk1 _Beauveria bassiana ARSEF 2860_	OTHER	1.000000	0.000001	0.000000	0.000000	0.000000	0.000000	
XP_008593334.1 Transcription regulator cyclin _Beauveria bassiana ARSEF 2860_	OTHER	1.000000	0.000000	0.000000	0.000000	0.000000	0.000000	
XP_008593336.1 ABC transporter _Beauveria bassiana ARSEF 2860_	OTHER	1.000000	0.000000	0.000000	0.000000	0.000000	0.000000	
XP_008593338.1 tat pathway signal sequence _Beauveria bassiana ARSEF 2860_	OTHER	1.000000	0.000000	0.000000	0.000000	0.000000	0.000000	
XP_008593340.1 LSM domain-containing protein _Beauveria bassiana ARSEF 2860_	OTHER	0.999773	0.000259	0.000006	0.000001	0.000000	0.000001	
XP_008593341.1 inosine-uridine preferring nucleoside hydrolase _Beauveria bassiana ARSEF 2860_	OTHER	1.000000	0.000000	0.000000	0.000000	0.000000	0.000000	
XP_008593344.1 uncharacterized protein BBA_00025 _Beauveria bassiana ARSEF 2860_	OTHER	1.000000	0.000000	0.000000	0.000000	0.000000	0.000000	
XP_008593346.1 Mitochondrial glycoprotein _Beauveria bassiana ARSEF 2860_	OTHER	1.000000	0.000000	0.000000	0.000000	0.000000	0.000000	
XP_008593348.1 pumilio-family RNA binding repeat domain-containing protein _Beauveria bassiana ARSEF 2860_	OTHER	1.000000	0.000000	0.000000	0.000000	0.000000	0.000000	
XP_008593349.1 AMP-binding enzyme, putative _Beauveria bassiana ARSEF 2860_	OTHER	1.000000	0.000001	0.000000	0.000000	0.000000	0.000000	
XP_008593351.1 uncharacterized protein BBA_00032 _Beauveria bassiana ARSEF 2860_	OTHER	1.000000	0.000000	0.000000	0.000000	0.000000	0.000000	
XP_008593352.1 uncharacterized protein BBA_00033 _Beauveria bassiana ARSEF 2860_	OTHER	1.000000	0.000000	0.000000	0.000000	0.000000	0.000000	
XP_008593353.1 group II pyridoxal-5-phosphate decarboxylase _Beauveria bassiana ARSEF 2860_	OTHER	1.000000	0.000003	0.000000	0.000000	0.000000	0.000000	
XP_008593356.1 gp24-like protein _Beauveria bassiana ARSEF 2860_	SP	0.000305	0.999033	0.000166	0.000178	0.000156	0.000146	CS pos: 18-19. Pr: 0.9708
XP_008593357.1 AMME syndrome protein _Beauveria bassiana ARSEF 2860_	OTHER	1.000000	0.000000	0.000000	0.000000	0.000000	0.000000	
XP_008593360.1 WD domain-containing protein _Beauveria bassiana ARSEF 2860_	OTHER	1.000000	0.000000	0.000000	0.000000	0.000000	0.000000	
XP_008593361.1 homoserine acetyltransferase family protein _Beauveria bassiana ARSEF 2860_	OTHER	1.000000	0.000008	0.000000	0.000000	0.000000	0.000000	
XP_008593362.1 uncharacterized protein BBA_00043 _Beauveria bassiana ARSEF 2860_	OTHER	0.999454	0.000543	0.000001	0.000001	0.000000	0.000001	
XP_008593366.1 Cel5b-like protein _Beauveria bassiana ARSEF 2860_	OTHER	0.692389	0.307012	0.000193	0.000150	0.000129	0.000146	
XP_008593367.1 uncharacterized protein BBA_00048 _Beauveria bassiana ARSEF 2860_	OTHER	1.000000	0.000001	0.000000	0.000000	0.000000	0.000000	
XP_008593369.1 Cys2-His2 zinc finger transcription factor ACEI _Beauveria bassiana ARSEF 2860_	OTHER	1.000000	0.000000	0.000000	0.000000	0.000000	0.000000	
XP_008593370.1 uncharacterized protein BBA_00051 _Beauveria bassiana ARSEF 2860_	OTHER	1.000000	0.000000	0.000000	0.000000	0.000000	0.000000	
XP_008593371.1 polysaccharide export protein _CAP59_ _Beauveria bassiana ARSEF 2860_	OTHER	0.999955	0.000040	0.000000	0.000000	0.000000	0.000000	
XP_008593374.1 ARP2_3 actin-organizing complex subunit Sop2 _Beauveria bassiana ARSEF 2860_	OTHER	1.000000	0.000007	0.000000	0.000000	0.000000	0.000000	
XP_008593376.1 uncharacterized protein BBA_00057 _Beauveria bassiana ARSEF 2860_	SP	0.000326	0.999040	0.000152	0.000166	0.000147	0.000147	CS pos: 17-18. Pr: 0.9776
XP_008593378.1 FAD binding domain containing protein _Beauveria bassiana ARSEF 2860_	OTHER	1.000000	0.000000	0.000000	0.000000	0.000000	0.000000	
XP_008593379.1 MutS domain V _Beauveria bassiana ARSEF 2860_	OTHER	1.000000	0.000000	0.000000	0.000000	0.000000	0.000000	
XP_008593380.1 3-hydroxyacyl-CoA dehydrogenase, NAD binding domain, putative _Beauveria bassiana ARSEF 2860_	OTHER	1.000000	0.000001	0.000000	0.000000	0.000000	0.000000	
XP_008593381.1 cellobiose dehydrogenase _Beauveria bassiana ARSEF 2860_	SP	0.093723	0.845524	0.059722	0.000356	0.000329	0.000355	CS pos: 15-16. Pr: 0.8116
XP_008593382.1 AMP-binding enzyme, putative _Beauveria bassiana ARSEF 2860_	OTHER	1.000000	0.000001	0.000000	0.000000	0.000000	0.000000	
XP_008593383.1 uncharacterized protein BBA_00064 _Beauveria bassiana ARSEF 2860_	OTHER	1.000000	0.000000	0.000000	0.000000	0.000000	0.000000	
XP_008593384.1 major facilitator superfamily transporter _Beauveria bassiana ARSEF 2860_	OTHER	0.998311	0.001553	0.000077	0.000009	0.000006	0.000042	
XP_008593387.1 vitamin H transporter _Beauveria bassiana ARSEF 2860_	OTHER	1.000000	0.000000	0.000000	0.000000	0.000000	0.000000	
XP_008593390.1 nitrate assimilation regulatory protein nirA _Beauveria bassiana ARSEF 2860_	OTHER	1.000000	0.000000	0.000000	0.000000	0.000000	0.000000	
XP_008593391.1 C6 transcription factor _Beauveria bassiana ARSEF 2860_	OTHER	1.000000	0.000000	0.000000	0.000000	0.000000	0.000000	
XP_008593392.1 methylitaconate delta2-delta3-isomerase _Beauveria bassiana ARSEF 2860_	OTHER	1.000000	0.000000	0.000000	0.000000	0.000000	0.000000	
XP_008593393.1 von Willebrand domain-containing protein _Beauveria bassiana ARSEF 2860_	OTHER	1.000000	0.000000	0.000000	0.000000	0.000000	0.000000	
XP_008593395.1 thiamine biosynthesis protein _Thi-4_ _Beauveria bassiana ARSEF 2860_	SP	0.000659	0.998483	0.000205	0.000233	0.000206	0.000190	CS pos: 18-19. Pr: 0.9748
XP_008593398.1 LysR family regulatory protein _Beauveria bassiana ARSEF 2860_	OTHER	1.000000	0.000000	0.000000	0.000000	0.000000	0.000000	
XP_008593400.1 uncharacterized protein BBA_00081 _Beauveria bassiana ARSEF 2860_	OTHER	1.000000	0.000000	0.000000	0.000000	0.000000	0.000000	
XP_008593407.1 C6 finger domain protein _Beauveria bassiana ARSEF 2860_	OTHER	1.000000	0.000001	0.000000	0.000000	0.000000	0.000000	
XP_008593409.1 aryl-alcohol oxidase_vanillyl-alcohol oxidase _Beauveria bassiana ARSEF 2860_	OTHER	1.000000	0.000000	0.000000	0.000000	0.000000	0.000000	
XP_008593410.1 15-hydroxyprostaglandin dehydrogenase _NAD____ _Beauveria bassiana ARSEF 2860_	OTHER	1.000000	0.000001	0.000000	0.000000	0.000000	0.000000	
XP_008593411.1 uncharacterized protein BBA_00092 _Beauveria bassiana ARSEF 2860_	OTHER	1.000000	0.000000	0.000000	0.000000	0.000000	0.000000	
XP_008593415.1 uncharacterized protein BBA_00096 _Beauveria bassiana ARSEF 2860_	OTHER	1.000000	0.000000	0.000000	0.000000	0.000000	0.000000	
XP_008593419.1 uncharacterized protein BBA_00100 _Beauveria bassiana ARSEF 2860_	OTHER	1.000000	0.000000	0.000000	0.000000	0.000000	0.000000	
XP_008593420.1 carbohydrate esterase family 4 _Beauveria bassiana ARSEF 2860_	OTHER	0.999157	0.000865	0.000009	0.000005	0.000003	0.000011	
XP_008593421.1 ATP-binding protein _Beauveria bassiana ARSEF 2860_	OTHER	1.000000	0.000000	0.000000	0.000000	0.000000	0.000000	
XP_008593424.1 Putative Zn_II_2Cys6 transcription factor _Beauveria bassiana ARSEF 2860_	OTHER	1.000000	0.000001	0.000001	0.000000	0.000000	0.000000	
XP_008593426.1 helicase associated domain-containing protein _Beauveria bassiana ARSEF 2860_	OTHER	1.000000	0.000000	0.000000	0.000000	0.000000	0.000000	
XP_008593427.1 uncharacterized protein BBA_00108 _Beauveria bassiana ARSEF 2860_	OTHER	1.000000	0.000001	0.000000	0.000000	0.000000	0.000000	
XP_008593428.1 RfeD protein _Beauveria bassiana ARSEF 2860_	OTHER	1.000000	0.000001	0.000000	0.000000	0.000000	0.000000	
XP_008593433.1 uncharacterized protein BBA_00114 _Beauveria bassiana ARSEF 2860_	OTHER	1.000000	0.000001	0.000000	0.000000	0.000000	0.000000	
XP_008593434.1 peflin-like protein _Beauveria bassiana ARSEF 2860_	OTHER	1.000000	0.000000	0.000000	0.000000	0.000000	0.000000	
XP_008593435.1 ChaC-like protein _Beauveria bassiana ARSEF 2860_	OTHER	1.000000	0.000000	0.000000	0.000000	0.000000	0.000000	
XP_008593436.1 RNA recognition domain-containing protein _Beauveria bassiana ARSEF 2860_	OTHER	1.000000	0.000000	0.000000	0.000000	0.000000	0.000000	
XP_008593439.1 uncharacterized protein BBA_00120 _Beauveria bassiana ARSEF 2860_	OTHER	1.000000	0.000000	0.000000	0.000000	0.000000	0.000000	
XP_008593440.1 transmembrane and coiled-coil domain-containing protein _Beauveria bassiana ARSEF 2860_	OTHER	1.000000	0.000000	0.000000	0.000000	0.000000	0.000000	
XP_008593441.1 rRNA-processing protein UTP23 _Beauveria bassiana ARSEF 2860_	OTHER	1.000000	0.000000	0.000000	0.000000	0.000000	0.000000	
XP_008593442.1 geranylgeranyl pyrophosphate synthetase _Beauveria bassiana ARSEF 2860_	OTHER	1.000000	0.000002	0.000000	0.000000	0.000000	0.000000	
XP_008593443.1 rRNA-processing protein UTP23 _Beauveria bassiana ARSEF 2860_	OTHER	1.000000	0.000002	0.000000	0.000000	0.000000	0.000000	
XP_008593444.1 PH domain-containing protein _Beauveria bassiana ARSEF 2860_	OTHER	1.000000	0.000000	0.000000	0.000000	0.000000	0.000000	
XP_008593445.1 protein kinase, putative _Beauveria bassiana ARSEF 2860_	OTHER	1.000000	0.000000	0.000000	0.000000	0.000000	0.000000	
XP_008593446.1 uncharacterized protein BBA_00127 _Beauveria bassiana ARSEF 2860_	OTHER	1.000000	0.000000	0.000000	0.000000	0.000000	0.000000	
XP_008593448.1 ATP synthase subunit E _Beauveria bassiana ARSEF 2860_	OTHER	0.902387	0.096111	0.000691	0.000326	0.000174	0.000311	
XP_008593449.1 WD domain-containing protein _Beauveria bassiana ARSEF 2860_	OTHER	1.000000	0.000000	0.000000	0.000000	0.000000	0.000000	
XP_008593450.1 RNA recognition domain-containing protein _Beauveria bassiana ARSEF 2860_	OTHER	1.000000	0.000000	0.000000	0.000000	0.000000	0.000000	
XP_008593451.1 uncharacterized protein BBA_00132 _Beauveria bassiana ARSEF 2860_	OTHER	1.000000	0.000002	0.000000	0.000000	0.000000	0.000000	
XP_008593452.1 DEAD_DEAH box helicase _Beauveria bassiana ARSEF 2860_	OTHER	1.000000	0.000000	0.000000	0.000000	0.000000	0.000000	
XP_008593454.1 CSL zinc finger protein _Beauveria bassiana ARSEF 2860_	OTHER	1.000000	0.000001	0.000000	0.000000	0.000000	0.000000	
XP_008593459.1 eukaryotic translation initiation factor 2 subunit gamma _Beauveria bassiana ARSEF 2860_	OTHER	1.000000	0.000000	0.000000	0.000000	0.000000	0.000000	
XP_008593461.1 glycosyltransferase family 62 _Beauveria bassiana ARSEF 2860_	OTHER	1.000000	0.000002	0.000000	0.000000	0.000000	0.000000	
XP_008593464.1 prenylated Rab acceptor 1 _Beauveria bassiana ARSEF 2860_	OTHER	1.000000	0.000000	0.000000	0.000000	0.000000	0.000000	
XP_008593467.1 homeobox domain-containing protein _Beauveria bassiana ARSEF 2860_	OTHER	1.000000	0.000000	0.000000	0.000000	0.000000	0.000000	
XP_008593469.1 exosome complex subunit Rrp46 _Beauveria bassiana ARSEF 2860_	OTHER	1.000000	0.000032	0.000000	0.000000	0.000000	0.000000	
XP_008593470.1 phosphotyrosyl phosphate activator protein _Beauveria bassiana ARSEF 2860_	OTHER	1.000000	0.000000	0.000000	0.000000	0.000000	0.000000	
XP_008593471.1 uncharacterized protein BBA_00152 _Beauveria bassiana ARSEF 2860_	OTHER	1.000000	0.000000	0.000000	0.000000	0.000000	0.000000	
XP_008593475.1 LSM domain-containing protein _Beauveria bassiana ARSEF 2860_	OTHER	1.000000	0.000000	0.000000	0.000000	0.000000	0.000000	
XP_008593481.1 C6 transcription factor _Beauveria bassiana ARSEF 2860_	OTHER	1.000000	0.000000	0.000000	0.000000	0.000000	0.000000	
XP_008593482.1 uncharacterized protein BBA_00163 _Beauveria bassiana ARSEF 2860_	OTHER	1.000000	0.000000	0.000000	0.000000	0.000000	0.000000	
XP_008593483.1 WLM domain-containing protein _Beauveria bassiana ARSEF 2860_	OTHER	1.000000	0.000000	0.000000	0.000000	0.000000	0.000000	
XP_008593485.1 TBC domain-containing protein _Beauveria bassiana ARSEF 2860_	OTHER	1.000000	0.000000	0.000000	0.000000	0.000000	0.000000	
XP_008593486.1 hemolysin-III family protein _Beauveria bassiana ARSEF 2860_	OTHER	1.000000	0.000002	0.000000	0.000000	0.000000	0.000000	
XP_008593488.1 FKBP-type peptidyl-prolyl cis-trans isomerase _Beauveria bassiana ARSEF 2860_	OTHER	1.000000	0.000000	0.000000	0.000000	0.000000	0.000000	
XP_008593491.1 glycoside hydrolase family 38 _Beauveria bassiana ARSEF 2860_	OTHER	1.000000	0.000000	0.000000	0.000000	0.000000	0.000000	
XP_008593492.1 MutS domain V _Beauveria bassiana ARSEF 2860_	OTHER	1.000000	0.000000	0.000000	0.000000	0.000000	0.000000	
XP_008593493.1 60S acidic ribosomal protein P0 _Beauveria bassiana ARSEF 2860_	OTHER	1.000000	0.000000	0.000000	0.000000	0.000000	0.000000	
XP_008593494.1 WD repeat domain-containing protein _Beauveria bassiana ARSEF 2860_	OTHER	1.000000	0.000000	0.000000	0.000000	0.000000	0.000000	
XP_008593496.1 CAP-Gly domain-containing protein _Beauveria bassiana ARSEF 2860_	OTHER	1.000000	0.000000	0.000000	0.000000	0.000000	0.000000	
XP_008593498.1 uncharacterized protein BBA_00179 _Beauveria bassiana ARSEF 2860_	OTHER	1.000000	0.000000	0.000000	0.000000	0.000000	0.000000	
XP_008593499.1 DEAD_DEAH box helicase _Beauveria bassiana ARSEF 2860_	OTHER	1.000000	0.000000	0.000000	0.000000	0.000000	0.000000	
XP_008593501.1 uncharacterized protein BBA_00182 _Beauveria bassiana ARSEF 2860_	OTHER	1.000000	0.000019	0.000000	0.000000	0.000000	0.000000	
XP_008593502.1 major facilitator superfamily transporter _Beauveria bassiana ARSEF 2860_	OTHER	1.000000	0.000003	0.000000	0.000000	0.000000	0.000000	
XP_008593504.1 arsenite resistance protein Ars2 _Beauveria bassiana ARSEF 2860_	OTHER	1.000000	0.000000	0.000000	0.000000	0.000000	0.000000	
XP_008593505.1 uncharacterized protein BBA_00186 _Beauveria bassiana ARSEF 2860_	OTHER	1.000000	0.000000	0.000000	0.000000	0.000000	0.000000	
XP_008593512.1 galactose oxidase precursor _Beauveria bassiana ARSEF 2860_	SP	0.000360	0.998964	0.000175	0.000168	0.000161	0.000151	CS pos: 21-22. Pr: 0.9720
XP_008593518.1 uncharacterized protein BBA_00199 _Beauveria bassiana ARSEF 2860_	OTHER	1.000000	0.000000	0.000000	0.000000	0.000000	0.000000	
XP_008593523.1 cyclin domain-containing protein _Beauveria bassiana ARSEF 2860_	OTHER	1.000000	0.000000	0.000000	0.000000	0.000000	0.000000	
XP_008593525.1 uncharacterized protein BBA_00206 _Beauveria bassiana ARSEF 2860_	OTHER	1.000000	0.000001	0.000000	0.000000	0.000000	0.000000	
XP_008593529.1 anaphase-promoting complex subunit 11 _Beauveria bassiana ARSEF 2860_	OTHER	1.000000	0.000000	0.000000	0.000000	0.000000	0.000000	
XP_008593530.1 integral membrane protein, putative _Beauveria bassiana ARSEF 2860_	OTHER	1.000000	0.000000	0.000000	0.000000	0.000000	0.000000	
XP_008593531.1 proline dehydrogenase _Beauveria bassiana ARSEF 2860_	OTHER	0.999978	0.000043	0.000003	0.000000	0.000000	0.000001	
XP_008593532.1 nitrilotriacetate monooxygenase component B _Beauveria bassiana ARSEF 2860_	OTHER	1.000000	0.000000	0.000000	0.000000	0.000000	0.000000	
XP_008593534.1 serine_threonine-protein kinase chk1 _Beauveria bassiana ARSEF 2860_	OTHER	1.000000	0.000000	0.000000	0.000000	0.000000	0.000000	
XP_008593539.1 CLAP1-like protein _Beauveria bassiana ARSEF 2860_	OTHER	0.999356	0.000649	0.000001	0.000001	0.000001	0.000001	
XP_008593541.1 uncharacterized protein BBA_00222 _Beauveria bassiana ARSEF 2860_	OTHER	1.000000	0.000000	0.000000	0.000000	0.000000	0.000000	
XP_008593553.1 alpha_beta hydrolase _Beauveria bassiana ARSEF 2860_	SP	0.000239	0.999146	0.000176	0.000153	0.000134	0.000128	CS pos: 21-22. Pr: 0.9754
XP_008593555.1 uncharacterized protein BBA_00236 _Beauveria bassiana ARSEF 2860_	OTHER	1.000000	0.000024	0.000000	0.000000	0.000000	0.000000	
XP_008593557.1 chaperone protein hchA _Beauveria bassiana ARSEF 2860_	OTHER	1.000000	0.000000	0.000000	0.000000	0.000000	0.000000	
XP_008593559.1 Spa2-like protein _Beauveria bassiana ARSEF 2860_	OTHER	1.000000	0.000011	0.000000	0.000000	0.000000	0.000000	
XP_008593562.1 metallo-beta-lactamase domain protein _Beauveria bassiana ARSEF 2860_	OTHER	1.000000	0.000000	0.000000	0.000000	0.000000	0.000000	
XP_008593566.1 uncharacterized protein BBA_00247 _Beauveria bassiana ARSEF 2860_	OTHER	0.982910	0.017030	0.000034	0.000033	0.000015	0.000027	
XP_008593567.1 uncharacterized protein BBA_00248 _Beauveria bassiana ARSEF 2860_	OTHER	1.000000	0.000002	0.000000	0.000000	0.000000	0.000000	
XP_008593568.1 PA domain-containing protein _Beauveria bassiana ARSEF 2860_	OTHER	0.999956	0.000045	0.000000	0.000000	0.000000	0.000000	
XP_008593569.1 major facilitator superfamily transporter _Beauveria bassiana ARSEF 2860_	OTHER	1.000000	0.000010	0.000000	0.000000	0.000000	0.000000	
XP_008593573.1 uncharacterized protein BBA_00254 _Beauveria bassiana ARSEF 2860_	SP	0.000623	0.998517	0.000201	0.000248	0.000209	0.000193	CS pos: 18-19. Pr: 0.8344
XP_008593578.1 uncharacterized protein BBA_00259 _Beauveria bassiana ARSEF 2860_	OTHER	1.000000	0.000000	0.000000	0.000000	0.000000	0.000000	
XP_008593579.1 RNA polymerase Rpb1 _Beauveria bassiana ARSEF 2860_	OTHER	1.000000	0.000000	0.000000	0.000000	0.000000	0.000000	
XP_008593581.1 tRNA_His_ guanylyltransferase _Beauveria bassiana ARSEF 2860_	OTHER	1.000000	0.000000	0.000000	0.000000	0.000000	0.000000	
XP_008593583.1 YSIRK family gram-positive signal peptide _Beauveria bassiana ARSEF 2860_	OTHER	1.000000	0.000000	0.000000	0.000000	0.000000	0.000000	
XP_008593584.1 morphogenesis protein _Beauveria bassiana ARSEF 2860_	OTHER	1.000000	0.000000	0.000000	0.000000	0.000000	0.000000	
XP_008593585.1 uracil-DNA glycosylase _Beauveria bassiana ARSEF 2860_	OTHER	1.000000	0.000000	0.000000	0.000000	0.000000	0.000000	
XP_008593587.1 uncharacterized protein BBA_00268 _Beauveria bassiana ARSEF 2860_	OTHER	1.000000	0.000008	0.000000	0.000000	0.000000	0.000000	
XP_008593591.1 cysteine synthase 2 _Beauveria bassiana ARSEF 2860_	OTHER	1.000000	0.000001	0.000000	0.000000	0.000000	0.000000	
XP_008593594.1 LSM domain-containing protein _Beauveria bassiana ARSEF 2860_	OTHER	1.000000	0.000000	0.000000	0.000000	0.000000	0.000000	
XP_008593597.1 endoplasmic reticulum transmembrane protein _Beauveria bassiana ARSEF 2860_	OTHER	1.000000	0.000000	0.000000	0.000000	0.000000	0.000000	
XP_008593598.1 uncharacterized protein BBA_00279 _Beauveria bassiana ARSEF 2860_	OTHER	1.000000	0.000000	0.000000	0.000000	0.000000	0.000000	
XP_008593601.1 MFS allantoate transporter, putative _Beauveria bassiana ARSEF 2860_	OTHER	1.000000	0.000014	0.000000	0.000000	0.000000	0.000000	
XP_008593604.1 uncharacterized protein BBA_00285 _Beauveria bassiana ARSEF 2860_	OTHER	1.000000	0.000004	0.000001	0.000000	0.000000	0.000000	
XP_008593605.1 2OG-Fe_II_ oxygenase superfamily protein _Beauveria bassiana ARSEF 2860_	OTHER	1.000000	0.000000	0.000000	0.000000	0.000000	0.000000	
XP_008593609.1 uncharacterized protein BBA_00290 _Beauveria bassiana ARSEF 2860_	OTHER	1.000000	0.000000	0.000000	0.000000	0.000000	0.000000	
XP_008593611.1 WD domain-containing protein _Beauveria bassiana ARSEF 2860_	OTHER	1.000000	0.000000	0.000000	0.000000	0.000000	0.000000	
XP_008593612.1 PIG-P domain-containing protein _Beauveria bassiana ARSEF 2860_	OTHER	1.000000	0.000000	0.000000	0.000000	0.000000	0.000000	
XP_008593613.1 vacuolar assembly_sorting protein VPS8 _Beauveria bassiana ARSEF 2860_	OTHER	1.000000	0.000043	0.000000	0.000000	0.000000	0.000000	
XP_008593615.1 RING-8 protein _Beauveria bassiana ARSEF 2860_	OTHER	0.996814	0.003116	0.000029	0.000008	0.000005	0.000029	
XP_008593616.1 class V chitinase, putative _Beauveria bassiana ARSEF 2860_	OTHER	0.922687	0.076906	0.000112	0.000116	0.000066	0.000116	
XP_008593618.1 uncharacterized protein BBA_00299 _Beauveria bassiana ARSEF 2860_	SP	0.000851	0.998162	0.000264	0.000256	0.000231	0.000213	CS pos: 24-25. Pr: 0.9728
XP_008593620.1 RNA recognition domain-containing protein _Beauveria bassiana ARSEF 2860_	OTHER	1.000000	0.000000	0.000000	0.000000	0.000000	0.000000	
XP_008593621.1 glycosyltransferase family 2 _Beauveria bassiana ARSEF 2860_	OTHER	1.000000	0.000000	0.000000	0.000000	0.000000	0.000000	
XP_008593623.1 dynein light chain type 1 _Beauveria bassiana ARSEF 2860_	OTHER	1.000000	0.000000	0.000000	0.000000	0.000000	0.000000	
XP_008593625.1 DEAD_DEAH box helicase _Beauveria bassiana ARSEF 2860_	OTHER	1.000000	0.000000	0.000000	0.000000	0.000000	0.000000	
XP_008593629.1 mismatch-specific thymine-DNA glycosylate _Beauveria bassiana ARSEF 2860_	OTHER	1.000000	0.000000	0.000000	0.000000	0.000000	0.000000	
XP_008593632.1 mitochondrial-processing peptidase subunit beta _Beauveria bassiana ARSEF 2860_	OTHER	1.000000	0.000000	0.000000	0.000000	0.000000	0.000000	
XP_008593633.1 fibronectin type III domain-containing protein _Beauveria bassiana ARSEF 2860_	OTHER	1.000000	0.000000	0.000000	0.000000	0.000000	0.000000	
XP_008593635.1 histidinol dehydrogenase _Beauveria bassiana ARSEF 2860_	OTHER	1.000000	0.000000	0.000000	0.000000	0.000000	0.000000	
XP_008593637.1 AMP-binding enzyme, putative _Beauveria bassiana ARSEF 2860_	OTHER	1.000000	0.000000	0.000000	0.000000	0.000000	0.000000	
XP_008593638.1 Peptidase S8 _Beauveria bassiana ARSEF 2860_	SP	0.000221	0.999204	0.000141	0.000146	0.000134	0.000126	CS pos: 20-21. Pr: 0.9407
XP_008593641.1 metalloprotease-like protein _Beauveria bassiana ARSEF 2860_	OTHER	0.999534	0.000465	0.000024	0.000001	0.000001	0.000002	
XP_008593642.1 inosine-5_-monophosphate dehydrogenase _Beauveria bassiana ARSEF 2860_	OTHER	1.000000	0.000000	0.000000	0.000000	0.000000	0.000000	
XP_008593786.1 major facilitator superfamily transporter _Beauveria bassiana ARSEF 2860_	OTHER	0.999764	0.000231	0.000008	0.000000	0.000000	0.000008	
XP_008593788.1 major facilitator superfamily transporter _Beauveria bassiana ARSEF 2860_	OTHER	1.000000	0.000000	0.000000	0.000000	0.000000	0.000000	
XP_008593791.1 3-dehydroquinate synthase _Beauveria bassiana ARSEF 2860_	OTHER	1.000000	0.000000	0.000000	0.000000	0.000000	0.000000	
XP_008593792.1 hexokinase-like protein _Beauveria bassiana ARSEF 2860_	OTHER	1.000000	0.000000	0.000000	0.000000	0.000000	0.000000	
XP_008593795.1 SH3 domain-containing protein _Beauveria bassiana ARSEF 2860_	OTHER	1.000000	0.000005	0.000000	0.000000	0.000000	0.000000	
XP_008593803.1 sulfite transporter Ssu2 _Beauveria bassiana ARSEF 2860_	OTHER	1.000000	0.000013	0.000000	0.000000	0.000000	0.000000	
XP_008593806.1 pterin 4 alpha carbinolamine dehydratase _Beauveria bassiana ARSEF 2860_	OTHER	1.000000	0.000005	0.000000	0.000000	0.000000	0.000000	
XP_008593808.1 Actin-like protein, ARP5 class _Beauveria bassiana ARSEF 2860_	OTHER	1.000000	0.000001	0.000000	0.000000	0.000000	0.000000	
XP_008593810.1 chromatin-remodeling complex subunit ies6 _Beauveria bassiana ARSEF 2860_	OTHER	1.000000	0.000000	0.000000	0.000000	0.000000	0.000000	
XP_008593812.1 profilin-like protein _Beauveria bassiana ARSEF 2860_	OTHER	1.000000	0.000040	0.000001	0.000000	0.000000	0.000000	
XP_008593813.1 uncharacterized protein BBA_00494 _Beauveria bassiana ARSEF 2860_	OTHER	1.000000	0.000000	0.000000	0.000000	0.000000	0.000000	
XP_008593814.1 SNARE protein, putative _Beauveria bassiana ARSEF 2860_	OTHER	1.000000	0.000000	0.000000	0.000000	0.000000	0.000000	
XP_008593818.1 C6 finger domain protein _Beauveria bassiana ARSEF 2860_	OTHER	1.000000	0.000001	0.000000	0.000000	0.000000	0.000000	
XP_008593819.1 calcineurin-like phosphoesterase _Beauveria bassiana ARSEF 2860_	OTHER	0.999781	0.000238	0.000001	0.000000	0.000000	0.000000	
XP_008593823.1 Serine hydroxymethyltransferase _Beauveria bassiana ARSEF 2860_	OTHER	1.000000	0.000000	0.000000	0.000000	0.000000	0.000000	
XP_008593824.1 ferric reductase like transmembrane component _Beauveria bassiana ARSEF 2860_	OTHER	1.000000	0.000008	0.000000	0.000000	0.000000	0.000000	
XP_008593825.1 RNA recognition domain-containing protein _Beauveria bassiana ARSEF 2860_	OTHER	1.000000	0.000001	0.000000	0.000000	0.000000	0.000000	
XP_008593826.1 peptidyl-tRNA hydrolase domain-containing protein _Beauveria bassiana ARSEF 2860_	OTHER	1.000000	0.000000	0.000000	0.000000	0.000000	0.000000	
XP_008593827.1 putative calcium_calmodulin-dependent protein kinase type I _Beauveria bassiana ARSEF 2860_	OTHER	1.000000	0.000000	0.000000	0.000000	0.000000	0.000000	
XP_008593828.1 PAP2 superfamily protein _Beauveria bassiana ARSEF 2860_	OTHER	1.000000	0.000000	0.000000	0.000000	0.000000	0.000000	
XP_008593830.1 GRC3 protein _Beauveria bassiana ARSEF 2860_	OTHER	1.000000	0.000000	0.000000	0.000000	0.000000	0.000000	
XP_008593831.1 trascription factor _Beauveria bassiana ARSEF 2860_	OTHER	0.999843	0.000127	0.000028	0.000002	0.000001	0.000007	
XP_008593832.1 uncharacterized protein BBA_00513 _Beauveria bassiana ARSEF 2860_	OTHER	1.000000	0.000002	0.000000	0.000000	0.000000	0.000000	
