XP_008598899.1 uncharacterized protein BBA_05580 _Beauveria bassiana ARSEF 2860_	OTHER	1.000000	0.000000	0.000000	0.000000	0.000000	0.000000	
XP_008598902.1 dienelactone hydrolase _Beauveria bassiana ARSEF 2860_	OTHER	1.000000	0.000007	0.000000	0.000000	0.000000	0.000000	
XP_008598903.1 Mitochondrial escape protein 2 _Beauveria bassiana ARSEF 2860_	OTHER	1.000000	0.000001	0.000000	0.000000	0.000000	0.000000	
XP_008598904.1 Protein of unknown function DUF3128 _Beauveria bassiana ARSEF 2860_	OTHER	1.000000	0.000000	0.000000	0.000000	0.000000	0.000000	
XP_008598907.1 MAP kinase kinase skh1_pek1 _Beauveria bassiana ARSEF 2860_	OTHER	1.000000	0.000001	0.000000	0.000000	0.000000	0.000000	
XP_008598908.1 cupin domain-containing protein _Beauveria bassiana ARSEF 2860_	OTHER	1.000000	0.000001	0.000000	0.000000	0.000000	0.000000	
XP_008598909.1 ribonuclease HII _Beauveria bassiana ARSEF 2860_	OTHER	1.000000	0.000000	0.000000	0.000000	0.000000	0.000000	
XP_008598910.1 root hair defective 3 GTP-binding protein _Beauveria bassiana ARSEF 2860_	OTHER	1.000000	0.000027	0.000001	0.000000	0.000000	0.000000	
XP_008598912.1 small s protein _Beauveria bassiana ARSEF 2860_	OTHER	1.000000	0.000002	0.000000	0.000000	0.000000	0.000000	
XP_008598913.1 pumilio domain-containing protein _Beauveria bassiana ARSEF 2860_	OTHER	1.000000	0.000000	0.000000	0.000000	0.000000	0.000000	
XP_008598914.1 RNA polymerase Rpb2 _Beauveria bassiana ARSEF 2860_	OTHER	1.000000	0.000000	0.000000	0.000000	0.000000	0.000000	
XP_008598918.1 uncharacterized protein BBA_05599 _Beauveria bassiana ARSEF 2860_	OTHER	0.999971	0.000076	0.000000	0.000000	0.000000	0.000001	
XP_008598922.1 Catalase-like domain, heme-dependent _Beauveria bassiana ARSEF 2860_	SP	0.000320	0.999031	0.000187	0.000151	0.000144	0.000133	CS pos: 19-20. Pr: 0.9682
XP_008598923.1 uncharacterized protein BBA_05604 _Beauveria bassiana ARSEF 2860_	OTHER	1.000000	0.000015	0.000001	0.000000	0.000000	0.000000	
XP_008598924.1 formyl transferase domain-containing protein _Beauveria bassiana ARSEF 2860_	OTHER	1.000000	0.000005	0.000000	0.000000	0.000000	0.000000	
XP_008598928.1 mitochondrial genome maintenance protein Mgr2 _Beauveria bassiana ARSEF 2860_	OTHER	1.000000	0.000002	0.000000	0.000000	0.000000	0.000000	
XP_008598929.1 Sir2 family protein _Beauveria bassiana ARSEF 2860_	OTHER	1.000000	0.000000	0.000000	0.000000	0.000000	0.000000	
XP_008598930.1 copper-transporting ATPase _Beauveria bassiana ARSEF 2860_	OTHER	0.997847	0.002191	0.000003	0.000003	0.000002	0.000002	
XP_008598932.1 uncharacterized protein BBA_05613 _Beauveria bassiana ARSEF 2860_	OTHER	0.999412	0.000577	0.000001	0.000000	0.000000	0.000001	
XP_008598935.1 major facilitator superfamily transporter _Beauveria bassiana ARSEF 2860_	OTHER	1.000000	0.000000	0.000000	0.000000	0.000000	0.000000	
XP_008598937.1 transaldolase-like protein _Beauveria bassiana ARSEF 2860_	OTHER	1.000000	0.000001	0.000000	0.000000	0.000000	0.000000	
XP_008598939.1 cytochrome b5 _Beauveria bassiana ARSEF 2860_	OTHER	1.000000	0.000000	0.000000	0.000000	0.000000	0.000000	
XP_008598940.1 transcription initiation factor IIE subunit beta _Beauveria bassiana ARSEF 2860_	OTHER	1.000000	0.000000	0.000000	0.000000	0.000000	0.000000	
XP_008598941.1 DSBA-like thioredoxin domain-containing protein _Beauveria bassiana ARSEF 2860_	OTHER	1.000000	0.000008	0.000000	0.000000	0.000000	0.000000	
XP_008598942.1 zinc finger protein _Beauveria bassiana ARSEF 2860_	OTHER	1.000000	0.000000	0.000000	0.000000	0.000000	0.000000	
XP_008598943.1 VHS domain-containing protein _Beauveria bassiana ARSEF 2860_	OTHER	1.000000	0.000005	0.000000	0.000000	0.000000	0.000000	
XP_008598944.1 metal ion transporter metal ion transporter _Beauveria bassiana ARSEF 2860_	OTHER	0.999973	0.000067	0.000001	0.000000	0.000000	0.000000	
XP_008598947.1 glycoside hydrolase family 3 _Beauveria bassiana ARSEF 2860_	OTHER	1.000000	0.000000	0.000000	0.000000	0.000000	0.000000	
XP_008598948.1 carbohydrate esterase family 9 _Beauveria bassiana ARSEF 2860_	OTHER	1.000000	0.000001	0.000000	0.000000	0.000000	0.000000	
XP_008598949.1 NDT80_PhoG like DNA-binding family protein _Beauveria bassiana ARSEF 2860_	OTHER	0.999881	0.000162	0.000001	0.000000	0.000000	0.000000	
XP_008598950.1 glucosamine-6-phosphate isomerase _Beauveria bassiana ARSEF 2860_	OTHER	1.000000	0.000000	0.000000	0.000000	0.000000	0.000000	
XP_008598952.1 BRCA1 C Terminus domain-containing protein _Beauveria bassiana ARSEF 2860_	OTHER	1.000000	0.000000	0.000000	0.000000	0.000000	0.000000	
XP_008598953.1 ESCRT-II complex subunit _Beauveria bassiana ARSEF 2860_	OTHER	1.000000	0.000002	0.000000	0.000000	0.000000	0.000000	
XP_008598954.1 nitrite reductase _Beauveria bassiana ARSEF 2860_	OTHER	0.999798	0.000185	0.000040	0.000001	0.000000	0.000000	
XP_008598955.1 helix-loop-helix DNA-binding domain-containing protein _Beauveria bassiana ARSEF 2860_	OTHER	1.000000	0.000000	0.000000	0.000000	0.000000	0.000000	
XP_008598957.1 ATP-dependent DNA helicase srs2 _Beauveria bassiana ARSEF 2860_	OTHER	1.000000	0.000000	0.000000	0.000000	0.000000	0.000000	
XP_008598958.1 neutral_alkaline non-lysosomal ceramidase _Beauveria bassiana ARSEF 2860_	OTHER	0.998654	0.001320	0.000008	0.000006	0.000003	0.000037	
XP_008598959.1 30S ribosomal protein S7 _Beauveria bassiana ARSEF 2860_	OTHER	1.000000	0.000000	0.000000	0.000000	0.000000	0.000000	
XP_008598960.1 universal stress protein family _Beauveria bassiana ARSEF 2860_	OTHER	1.000000	0.000000	0.000000	0.000000	0.000000	0.000000	
XP_008598961.1 uncharacterized protein BBA_05642 _Beauveria bassiana ARSEF 2860_	OTHER	1.000000	0.000002	0.000000	0.000000	0.000000	0.000000	
XP_008598964.1 DUF1237 domain-containing protein _Beauveria bassiana ARSEF 2860_	SP	0.016282	0.982448	0.000323	0.000328	0.000306	0.000287	CS pos: 18-19. Pr: 0.8570
XP_008598966.1 NAD_FAD-binding protein _Beauveria bassiana ARSEF 2860_	OTHER	0.995465	0.003201	0.001293	0.000010	0.000006	0.000022	
XP_008598967.1 glutathione S-transferase _Beauveria bassiana ARSEF 2860_	OTHER	1.000000	0.000000	0.000000	0.000000	0.000000	0.000000	
XP_008598976.1 Yip1 domain-containing protein _Beauveria bassiana ARSEF 2860_	OTHER	1.000000	0.000001	0.000000	0.000000	0.000000	0.000000	
XP_008598978.1 Poly_A_ RNA polymerase cid14 _Beauveria bassiana ARSEF 2860_	OTHER	1.000000	0.000003	0.000000	0.000000	0.000000	0.000000	
XP_008598979.1 C2H2 type zinc finger domain protein _Beauveria bassiana ARSEF 2860_	OTHER	1.000000	0.000000	0.000000	0.000000	0.000000	0.000000	
XP_008598980.1 ferulic acid esterase _FaeA_, putative _Beauveria bassiana ARSEF 2860_	SP	0.000255	0.999109	0.000164	0.000158	0.000149	0.000142	CS pos: 19-20. Pr: 0.9803
XP_008598981.1 Alpha_beta hydrolase fold-3 _Beauveria bassiana ARSEF 2860_	OTHER	1.000000	0.000000	0.000000	0.000000	0.000000	0.000000	
XP_008598983.1 dihydrodipicolinate synthetase _Beauveria bassiana ARSEF 2860_	OTHER	1.000000	0.000001	0.000000	0.000000	0.000000	0.000000	
XP_008598984.1 L-PSP endoribonuclease family protein Brt1 _Beauveria bassiana ARSEF 2860_	OTHER	1.000000	0.000001	0.000000	0.000000	0.000000	0.000000	
XP_008598986.1 uncharacterized protein BBA_05667 _Beauveria bassiana ARSEF 2860_	OTHER	1.000000	0.000000	0.000000	0.000000	0.000000	0.000000	
XP_008598987.1 Zn_II_2Cys6 transcription factor _Beauveria bassiana ARSEF 2860_	OTHER	1.000000	0.000000	0.000000	0.000000	0.000000	0.000000	
XP_008598989.1 GPI anchored protein, putative _Beauveria bassiana ARSEF 2860_	OTHER	1.000000	0.000006	0.000000	0.000000	0.000000	0.000000	
XP_008598993.1 hexose transporter _Beauveria bassiana ARSEF 2860_	OTHER	1.000000	0.000002	0.000000	0.000000	0.000000	0.000000	
XP_008598996.1 uncharacterized protein BBA_05677 _Beauveria bassiana ARSEF 2860_	OTHER	1.000000	0.000001	0.000000	0.000000	0.000000	0.000000	
XP_008598997.1 nitrogen assimilation transcription factor nirA _Beauveria bassiana ARSEF 2860_	OTHER	0.900077	0.098091	0.000866	0.000449	0.000197	0.000334	
XP_008598999.1 uncharacterized protein BBA_05680 _Beauveria bassiana ARSEF 2860_	OTHER	1.000000	0.000000	0.000000	0.000000	0.000000	0.000000	
XP_008599000.1 oxidoreductase-like protein _Beauveria bassiana ARSEF 2860_	OTHER	1.000000	0.000001	0.000000	0.000000	0.000000	0.000000	
XP_008599001.1 hypoxanthine guanine phosphoribosyltransferase _Beauveria bassiana ARSEF 2860_	OTHER	1.000000	0.000000	0.000000	0.000000	0.000000	0.000000	
XP_008599004.1 Cytochrome P450 CYP584D4 _Beauveria bassiana ARSEF 2860_	OTHER	0.999329	0.000701	0.000002	0.000002	0.000002	0.000003	
XP_008599005.1 AMP-binding enzyme _Beauveria bassiana ARSEF 2860_	OTHER	1.000000	0.000009	0.000000	0.000000	0.000000	0.000000	
XP_008599006.1 integral peroxisomal membrane peroxin _Beauveria bassiana ARSEF 2860_	OTHER	1.000000	0.000001	0.000000	0.000000	0.000000	0.000000	
XP_008599007.1 Arylsulfotransferase-like protein _Beauveria bassiana ARSEF 2860_	OTHER	1.000000	0.000000	0.000000	0.000000	0.000000	0.000000	
XP_008599008.1 extracellular dioxygenase _Beauveria bassiana ARSEF 2860_	SP	0.000346	0.999070	0.000142	0.000153	0.000137	0.000132	CS pos: 20-21. Pr: 0.9696
XP_008599009.1 uncharacterized protein BBA_05690 _Beauveria bassiana ARSEF 2860_	OTHER	1.000000	0.000000	0.000000	0.000000	0.000000	0.000000	
XP_008599014.1 GTP binding protein _Beauveria bassiana ARSEF 2860_	OTHER	1.000000	0.000000	0.000000	0.000000	0.000000	0.000000	
XP_008599016.1 biotin-protein ligase _Beauveria bassiana ARSEF 2860_	OTHER	1.000000	0.000000	0.000000	0.000000	0.000000	0.000000	
XP_008599020.1 5-methyltetrahydropteroyltriglutamate-homocysteine methyltransferase _Beauveria bassiana ARSEF 2860_	OTHER	1.000000	0.000000	0.000000	0.000000	0.000000	0.000000	
XP_008599021.1 WSC domain-containing protein _Beauveria bassiana ARSEF 2860_	SP	0.127974	0.870929	0.000283	0.000310	0.000237	0.000263	CS pos: 17-18. Pr: 0.7196
XP_008599022.1 methyltransferase domain-containing protein _Beauveria bassiana ARSEF 2860_	OTHER	1.000000	0.000006	0.000000	0.000000	0.000000	0.000000	
XP_008599023.1 vegetative cell wall protein gp1 _Beauveria bassiana ARSEF 2860_	OTHER	1.000000	0.000000	0.000000	0.000000	0.000000	0.000000	
XP_008599024.1 metalloproteinase, putative _Beauveria bassiana ARSEF 2860_	SP	0.172132	0.826786	0.000305	0.000276	0.000234	0.000238	CS pos: 16-17. Pr: 0.7701
XP_008599025.1 uncharacterized protein BBA_05706 _Beauveria bassiana ARSEF 2860_	OTHER	1.000000	0.000024	0.000000	0.000000	0.000000	0.000000	
XP_008599026.1 UPF0665 family protein c _Beauveria bassiana ARSEF 2860_	OTHER	1.000000	0.000027	0.000000	0.000000	0.000000	0.000000	
XP_008599028.1 uncharacterized protein BBA_05709 _Beauveria bassiana ARSEF 2860_	OTHER	1.000000	0.000001	0.000000	0.000000	0.000000	0.000000	
XP_008599031.1 uncharacterized protein BBA_05712 _Beauveria bassiana ARSEF 2860_	OTHER	1.000000	0.000000	0.000000	0.000000	0.000000	0.000000	
XP_008599032.1 LSM domain-containing protein _Beauveria bassiana ARSEF 2860_	OTHER	1.000000	0.000002	0.000000	0.000000	0.000000	0.000000	
XP_008599035.1 rRNA processing protein _Beauveria bassiana ARSEF 2860_	OTHER	1.000000	0.000000	0.000000	0.000000	0.000000	0.000000	
XP_008599038.1 ATPase protein _Beauveria bassiana ARSEF 2860_	OTHER	1.000000	0.000000	0.000000	0.000000	0.000000	0.000000	
XP_008599039.1 tetracenomycin polyketide synthesis O-methyltransferase _Beauveria bassiana ARSEF 2860_	OTHER	0.999947	0.000104	0.000007	0.000001	0.000000	0.000003	
XP_008599042.1 fructosamine-3-kinase _Beauveria bassiana ARSEF 2860_	OTHER	1.000000	0.000000	0.000000	0.000000	0.000000	0.000000	
XP_008599043.1 methyltransferase domain-containing protein _Beauveria bassiana ARSEF 2860_	OTHER	1.000000	0.000000	0.000000	0.000000	0.000000	0.000000	
XP_008599044.1 phosphatidylinositol 3 _Beauveria bassiana ARSEF 2860_	OTHER	1.000000	0.000000	0.000000	0.000000	0.000000	0.000000	
XP_008599048.1 FunK1 protein kinase _Beauveria bassiana ARSEF 2860_	OTHER	1.000000	0.000000	0.000000	0.000000	0.000000	0.000000	
XP_008599049.1 putative cyanate lyase _Beauveria bassiana ARSEF 2860_	OTHER	1.000000	0.000060	0.000000	0.000000	0.000000	0.000000	
XP_008599052.1 succinate dehydrogenase _Beauveria bassiana ARSEF 2860_	OTHER	1.000000	0.000000	0.000000	0.000000	0.000000	0.000000	
XP_008599053.1 uncharacterized protein BBA_05734 _Beauveria bassiana ARSEF 2860_	OTHER	1.000000	0.000000	0.000000	0.000000	0.000000	0.000000	
XP_008599058.1 dibenzothiophene desulfurization enzyme A _Beauveria bassiana ARSEF 2860_	OTHER	1.000000	0.000000	0.000000	0.000000	0.000000	0.000000	
XP_008599059.1 major facilitator superfamily transporter _Beauveria bassiana ARSEF 2860_	OTHER	1.000000	0.000000	0.000000	0.000000	0.000000	0.000000	
XP_008599060.1 4-hydroxyacetophenone monooxygenase _Beauveria bassiana ARSEF 2860_	OTHER	1.000000	0.000001	0.000000	0.000000	0.000000	0.000000	
XP_008599063.1 CFEM domain-containing protein _Beauveria bassiana ARSEF 2860_	OTHER	1.000000	0.000000	0.000000	0.000000	0.000000	0.000000	
XP_008599066.1 ser_Thr-rich protein T10 in DGCR region _Beauveria bassiana ARSEF 2860_	OTHER	0.999768	0.000274	0.000003	0.000000	0.000000	0.000000	
XP_008599068.1 RNA polymerase II transcription factor B subunit 2 _Beauveria bassiana ARSEF 2860_	OTHER	1.000000	0.000000	0.000000	0.000000	0.000000	0.000000	
XP_008599069.1 thioesterase superfamily protein _Beauveria bassiana ARSEF 2860_	OTHER	1.000000	0.000000	0.000000	0.000000	0.000000	0.000000	
XP_008599079.1 uncharacterized protein BBA_05760 _Beauveria bassiana ARSEF 2860_	OTHER	0.999779	0.000195	0.000039	0.000001	0.000000	0.000015	
XP_008599080.1 phosphate permease _Beauveria bassiana ARSEF 2860_	OTHER	0.999947	0.000042	0.000006	0.000000	0.000000	0.000003	
XP_008599082.1 C6 transcription factor _Beauveria bassiana ARSEF 2860_	OTHER	1.000000	0.000000	0.000000	0.000000	0.000000	0.000000	
XP_008599083.1 Major facilitator superfamily, general substrate transporter _Beauveria bassiana ARSEF 2860_	OTHER	0.999983	0.000011	0.000000	0.000000	0.000000	0.000000	
XP_008599085.1 hexose transporter _Beauveria bassiana ARSEF 2860_	OTHER	1.000000	0.000000	0.000000	0.000000	0.000000	0.000000	
XP_008599087.1 cysteine synthase _Beauveria bassiana ARSEF 2860_	OTHER	1.000000	0.000000	0.000000	0.000000	0.000000	0.000000	
XP_008599088.1 fatty acid desaturase _Beauveria bassiana ARSEF 2860_	OTHER	1.000000	0.000000	0.000000	0.000000	0.000000	0.000000	
XP_008599089.1 serine_threonine kinase IREI _Beauveria bassiana ARSEF 2860_	SP	0.000263	0.999094	0.000181	0.000165	0.000145	0.000130	CS pos: 35-36. Pr: 0.9753
XP_008599092.1 uncharacterized protein BBA_05773 _Beauveria bassiana ARSEF 2860_	OTHER	1.000000	0.000000	0.000000	0.000000	0.000000	0.000000	
XP_008599093.1 TBC domain-containing protein _Beauveria bassiana ARSEF 2860_	OTHER	1.000000	0.000000	0.000000	0.000000	0.000000	0.000000	
XP_008599094.1 DEK C terminal domain-containing protein _Beauveria bassiana ARSEF 2860_	OTHER	1.000000	0.000000	0.000000	0.000000	0.000000	0.000000	
XP_008599095.1 zinc finger protein _Beauveria bassiana ARSEF 2860_	OTHER	1.000000	0.000060	0.000000	0.000000	0.000000	0.000000	
XP_008599096.1 putative HRQ family protein 2 _Beauveria bassiana ARSEF 2860_	OTHER	1.000000	0.000003	0.000000	0.000000	0.000000	0.000000	
XP_008599098.1 short chain dehydrogenase _Beauveria bassiana ARSEF 2860_	OTHER	1.000000	0.000000	0.000000	0.000000	0.000000	0.000000	
XP_008599099.1 N-acetyltransferase B complex non catalytic subunit _Beauveria bassiana ARSEF 2860_	OTHER	0.994566	0.005333	0.000040	0.000015	0.000015	0.000015	
XP_008599110.1 adenosine_AMP deaminase _Beauveria bassiana ARSEF 2860_	OTHER	1.000000	0.000000	0.000000	0.000000	0.000000	0.000000	
XP_008599112.1 uncharacterized protein BBA_05793 _Beauveria bassiana ARSEF 2860_	OTHER	1.000000	0.000000	0.000000	0.000000	0.000000	0.000000	
XP_008599114.1 PHD-finger domain-containing protein _Beauveria bassiana ARSEF 2860_	OTHER	1.000000	0.000000	0.000000	0.000000	0.000000	0.000000	
XP_008599115.1 Mni1p protein _Beauveria bassiana ARSEF 2860_	OTHER	1.000000	0.000003	0.000000	0.000000	0.000000	0.000000	
XP_008599117.1 helicase associated domain-containing protein _Beauveria bassiana ARSEF 2860_	OTHER	1.000000	0.000000	0.000000	0.000000	0.000000	0.000000	
XP_008599119.1 choline_ethanolamine kinase _Beauveria bassiana ARSEF 2860_	OTHER	1.000000	0.000000	0.000000	0.000000	0.000000	0.000000	
XP_008599120.1 CPSF A subunit region _Beauveria bassiana ARSEF 2860_	OTHER	1.000000	0.000000	0.000000	0.000000	0.000000	0.000000	
XP_008599123.1 uncharacterized protein BBA_05804 _Beauveria bassiana ARSEF 2860_	OTHER	0.761817	0.233079	0.003976	0.000451	0.000209	0.000466	
XP_008599126.1 uncharacterized protein BBA_05807 _Beauveria bassiana ARSEF 2860_	OTHER	1.000000	0.000000	0.000000	0.000000	0.000000	0.000000	
XP_008599127.1 cell wall protein _Beauveria bassiana ARSEF 2860_	SP	0.000227	0.999113	0.000152	0.000167	0.000157	0.000145	CS pos: 20-21. Pr: 0.9468
XP_008599129.1 uncharacterized protein BBA_05810 _Beauveria bassiana ARSEF 2860_	OTHER	1.000000	0.000003	0.000000	0.000000	0.000000	0.000000	
XP_008599130.1 TATA-binding protein interacting _Beauveria bassiana ARSEF 2860_	OTHER	1.000000	0.000000	0.000000	0.000000	0.000000	0.000000	
XP_008599131.1 hexose transporter _Beauveria bassiana ARSEF 2860_	OTHER	1.000000	0.000000	0.000000	0.000000	0.000000	0.000000	
XP_008599134.1 O-methyltransferase-like protein _Beauveria bassiana ARSEF 2860_	OTHER	1.000000	0.000000	0.000000	0.000000	0.000000	0.000000	
XP_008599135.1 siderochrome-iron transporter MirC _Beauveria bassiana ARSEF 2860_	OTHER	1.000000	0.000000	0.000000	0.000000	0.000000	0.000000	
XP_008599137.1 Sodium_neurotransmitter symporter family protein _Beauveria bassiana ARSEF 2860_	OTHER	1.000000	0.000007	0.000000	0.000000	0.000000	0.000000	
XP_008599138.1 iron-sulfur cluster assembly accessory protein _Beauveria bassiana ARSEF 2860_	OTHER	1.000000	0.000000	0.000000	0.000000	0.000000	0.000000	
XP_008599139.1 C6 transcription factor, putative _Beauveria bassiana ARSEF 2860_	OTHER	0.999531	0.000502	0.000003	0.000002	0.000000	0.000001	
XP_008599140.1 oxidoreductase family protein _Beauveria bassiana ARSEF 2860_	OTHER	1.000000	0.000000	0.000000	0.000000	0.000000	0.000000	
XP_008599141.1 major facilitator superfamily transporter _Beauveria bassiana ARSEF 2860_	OTHER	1.000000	0.000001	0.000000	0.000000	0.000000	0.000000	
XP_008599142.1 NAD-dependent epimerase_dehydratase _Beauveria bassiana ARSEF 2860_	OTHER	1.000000	0.000000	0.000000	0.000000	0.000000	0.000000	
XP_008599146.1 siderophore iron transporter _Beauveria bassiana ARSEF 2860_	OTHER	0.999398	0.000556	0.000030	0.000002	0.000001	0.000013	
XP_008599148.1 uncharacterized protein BBA_05829 _Beauveria bassiana ARSEF 2860_	OTHER	1.000000	0.000000	0.000000	0.000000	0.000000	0.000000	
XP_008599149.1 CHCH domain-containing protein _Beauveria bassiana ARSEF 2860_	OTHER	1.000000	0.000002	0.000000	0.000000	0.000000	0.000000	
XP_008599151.1 vesicle transport V-SNARE protein _Beauveria bassiana ARSEF 2860_	OTHER	1.000000	0.000000	0.000000	0.000000	0.000000	0.000000	
XP_008599152.1 major facilitator superfamily transporter _Beauveria bassiana ARSEF 2860_	OTHER	0.985004	0.013020	0.000540	0.000987	0.000259	0.000188	
XP_008599153.1 Cytochrome P450 CYP528A4 _Beauveria bassiana ARSEF 2860_	OTHER	1.000000	0.000000	0.000000	0.000000	0.000000	0.000000	
XP_008599154.1 putative peptide transporter _Beauveria bassiana ARSEF 2860_	OTHER	1.000000	0.000001	0.000000	0.000000	0.000000	0.000000	
XP_008599155.1 dihydrofolate reductase-thymidylate synthase _Beauveria bassiana ARSEF 2860_	OTHER	1.000000	0.000000	0.000000	0.000000	0.000000	0.000000	
XP_008599156.1 WD domain-containing protein _Beauveria bassiana ARSEF 2860_	OTHER	1.000000	0.000035	0.000000	0.000000	0.000000	0.000000	
XP_008599157.1 glycosyl hydrolase family 2 _Beauveria bassiana ARSEF 2860_	OTHER	1.000000	0.000003	0.000000	0.000000	0.000000	0.000000	
XP_008599159.1 transposase-like protein _Beauveria bassiana ARSEF 2860_	OTHER	1.000000	0.000000	0.000000	0.000000	0.000000	0.000000	
XP_008599160.1 ABC transporter, putative _Beauveria bassiana ARSEF 2860_	OTHER	1.000000	0.000000	0.000000	0.000000	0.000000	0.000000	
XP_008599161.1 uncharacterized protein BBA_05842 _Beauveria bassiana ARSEF 2860_	OTHER	1.000000	0.000000	0.000000	0.000000	0.000000	0.000000	
XP_008599165.1 fungal specific transcription factor _Beauveria bassiana ARSEF 2860_	OTHER	0.999964	0.000047	0.000000	0.000000	0.000000	0.000000	
XP_008599166.1 putative glycosyl hydrolase _Beauveria bassiana ARSEF 2860_	OTHER	1.000000	0.000042	0.000000	0.000000	0.000000	0.000000	
XP_008599167.1 covalently-linked cell wall protein _Beauveria bassiana ARSEF 2860_	OTHER	1.000000	0.000008	0.000000	0.000000	0.000000	0.000000	
XP_008599168.1 U1 zinc finger protein _Beauveria bassiana ARSEF 2860_	OTHER	1.000000	0.000000	0.000000	0.000000	0.000000	0.000000	
XP_008599170.1 transmembrane anterior posterior transformation 1 _Beauveria bassiana ARSEF 2860_	OTHER	1.000000	0.000007	0.000000	0.000000	0.000000	0.000000	
XP_008599171.1 karyopherin Kap123 _Beauveria bassiana ARSEF 2860_	OTHER	1.000000	0.000000	0.000000	0.000000	0.000000	0.000000	
XP_008599173.1 putative phospholipase _Beauveria bassiana ARSEF 2860_	OTHER	1.000000	0.000001	0.000000	0.000000	0.000000	0.000000	
XP_008599175.1 uncharacterized protein BBA_05856 _Beauveria bassiana ARSEF 2860_	OTHER	0.999719	0.000294	0.000000	0.000000	0.000000	0.000000	
XP_008599176.1 short chain dehydrogenase _Beauveria bassiana ARSEF 2860_	OTHER	0.999841	0.000146	0.000000	0.000000	0.000000	0.000000	
XP_008599177.1 glycosyl hydrolase family 47 protein _Beauveria bassiana ARSEF 2860_	OTHER	1.000000	0.000002	0.000000	0.000000	0.000000	0.000000	
XP_008599178.1 uncharacterized protein BBA_05859 _Beauveria bassiana ARSEF 2860_	SP	0.000265	0.999103	0.000149	0.000163	0.000142	0.000140	CS pos: 28-29. Pr: 0.9769
XP_008599179.1 putative exported protein _Beauveria bassiana ARSEF 2860_	SP	0.005369	0.993576	0.000288	0.000269	0.000230	0.000222	CS pos: 19-20. Pr: 0.9321
XP_008599180.1 zinc finger protein Yan _Beauveria bassiana ARSEF 2860_	OTHER	1.000000	0.000001	0.000000	0.000000	0.000000	0.000000	
XP_008599182.1 alkylated DNA repair protein AlkB _Beauveria bassiana ARSEF 2860_	OTHER	1.000000	0.000003	0.000000	0.000000	0.000000	0.000000	
XP_008599185.1 SRP40 domain-containing protein _Beauveria bassiana ARSEF 2860_	OTHER	1.000000	0.000000	0.000000	0.000000	0.000000	0.000000	
XP_008599189.1 uncharacterized protein BBA_05870 _Beauveria bassiana ARSEF 2860_	OTHER	1.000000	0.000001	0.000000	0.000000	0.000000	0.000000	
XP_008599191.1 BZIP family transcription factor _Beauveria bassiana ARSEF 2860_	OTHER	1.000000	0.000000	0.000000	0.000000	0.000000	0.000000	
XP_008599192.1 asparaginase-like protein _Beauveria bassiana ARSEF 2860_	OTHER	1.000000	0.000000	0.000000	0.000000	0.000000	0.000000	
XP_008599193.1 Acyl-CoA N-acyltransferase _Beauveria bassiana ARSEF 2860_	OTHER	1.000000	0.000000	0.000000	0.000000	0.000000	0.000000	
XP_008599196.1 2-nitropropane dioxygenase _Beauveria bassiana ARSEF 2860_	OTHER	1.000000	0.000001	0.000000	0.000000	0.000000	0.000000	
XP_008599199.1 chitosanase-like protein _Beauveria bassiana ARSEF 2860_	SP	0.009329	0.926718	0.063097	0.000315	0.000254	0.000262	CS pos: 18-19. Pr: 0.8351
XP_008599200.1 MFS transporter _Beauveria bassiana ARSEF 2860_	OTHER	0.999983	0.000042	0.000000	0.000000	0.000000	0.000000	
XP_008599201.1 uncharacterized protein BBA_05882 _Beauveria bassiana ARSEF 2860_	SP	0.001262	0.997839	0.000239	0.000256	0.000188	0.000183	CS pos: 27-28. Pr: 0.8721
XP_008599205.1 uncharacterized protein BBA_05886 _Beauveria bassiana ARSEF 2860_	OTHER	0.999994	0.000019	0.000000	0.000000	0.000000	0.000000	
XP_008599206.1 gamma-glutamyltranspeptidase _Beauveria bassiana ARSEF 2860_	OTHER	1.000000	0.000002	0.000000	0.000000	0.000000	0.000000	
XP_008599207.1 monothiol glutaredoxin-5 _Beauveria bassiana ARSEF 2860_	OTHER	1.000000	0.000000	0.000000	0.000000	0.000000	0.000000	
XP_008599210.1 uncharacterized protein BBA_05891 _Beauveria bassiana ARSEF 2860_	OTHER	0.870781	0.128842	0.000121	0.000109	0.000091	0.000096	
XP_008599211.1 Small GTPase, Rho type _Beauveria bassiana ARSEF 2860_	OTHER	1.000000	0.000000	0.000000	0.000000	0.000000	0.000000	
XP_008599214.1 uncharacterized protein BBA_05895 _Beauveria bassiana ARSEF 2860_	OTHER	1.000000	0.000000	0.000000	0.000000	0.000000	0.000000	
XP_008599215.1 CHD5 domain-containing protein _Beauveria bassiana ARSEF 2860_	OTHER	0.977859	0.021769	0.000141	0.000070	0.000041	0.000147	
XP_008599218.1 carbohydrate esterase family 9 _Beauveria bassiana ARSEF 2860_	OTHER	1.000000	0.000004	0.000000	0.000000	0.000000	0.000000	
XP_008599219.1 enoyl-CoA hydratase_isomerase family protein _Beauveria bassiana ARSEF 2860_	OTHER	1.000000	0.000000	0.000000	0.000000	0.000000	0.000000	
XP_008599221.1 uncharacterized protein BBA_05902 _Beauveria bassiana ARSEF 2860_	OTHER	1.000000	0.000000	0.000000	0.000000	0.000000	0.000000	
XP_008599222.1 Golgi matrix protein, putative _Beauveria bassiana ARSEF 2860_	OTHER	1.000000	0.000001	0.000000	0.000000	0.000000	0.000000	
XP_008599227.1 uncharacterized protein BBA_05908 _Beauveria bassiana ARSEF 2860_	OTHER	1.000000	0.000001	0.000000	0.000000	0.000000	0.000000	
XP_008599229.1 isoprenylcysteine carboxyl methyltransferase _Beauveria bassiana ARSEF 2860_	OTHER	0.999972	0.000000	0.000000	0.000000	0.000000	0.000000	
XP_008599230.1 ATPase protein _Beauveria bassiana ARSEF 2860_	OTHER	1.000000	0.000001	0.000000	0.000000	0.000000	0.000000	
XP_008599231.1 DNA repair endonuclease rad2 _Beauveria bassiana ARSEF 2860_	OTHER	0.999955	0.000038	0.000009	0.000000	0.000000	0.000010	
XP_008599232.1 actin-related protein RO7 _Beauveria bassiana ARSEF 2860_	OTHER	1.000000	0.000032	0.000000	0.000000	0.000000	0.000000	
XP_008599233.1 seryl-tRNA synthetase _Beauveria bassiana ARSEF 2860_	OTHER	1.000000	0.000000	0.000000	0.000000	0.000000	0.000000	
